0 blue jeans,Shopping - Apparel
1 2 3 vetements accessoires,Shopping - Apparel
10 is enfant chaussures,Shopping - Apparel
10 Jupes,Shopping - Apparel
100% cotton jeans,Shopping - Apparel
11 Ensemble pantalon mousseline,Shopping - Apparel
1122 chaussures,Shopping - Apparel
12 accessoires chouettes,Shopping - Apparel
123 magasin prêt a porter femme,Shopping - Apparel
123 vetements nouvelle collection,Shopping - Apparel
2016 mode femme rouge noir,Shopping - Apparel
accessoires sous vetements,Shopping - Apparel
achat de vetement de sport,Shopping - Apparel
amiens la halle aux chaussures p r,Shopping - Apparel
amiens shopping mode cadeaux galerie art,Shopping - Apparel
amo chemise de nuit d allaitement lace azur,Shopping - Apparel
anais lingerie,Shopping - Apparel
anciens cols de chemises,Shopping - Apparel
andrew mc allister chemise femme et taille,Shopping - Apparel
anne weyburn nouvelle collection,Shopping - Apparel
article le on n trace de la combinaison pantalon de base,Shopping - Apparel
article le pantalon a manches courtes cadeau,Shopping - Apparel
article le pantalon etroit type,Shopping - Apparel
article le pantalon jupe,Shopping - Apparel
article le pouvoir de la jupe courte,Shopping - Apparel
article lenseigne francaise de jeans teddy smith lance une nouvelle chaine de magasins,Shopping - Apparel
article leoparden jeans selbst machen,Shopping - Apparel
article les accessoires de mode les gants,Shopping - Apparel
article les bonnes chaussures,Shopping - Apparel
article les chemises de qualite,Shopping - Apparel
article les jeans de grossesse,Shopping - Apparel
article mode beaute algerie mango collection femmes,Shopping - Apparel
bien choisir chemise carreaux,Shopping - Apparel
bien choisir sa robe de soiree,Shopping - Apparel
bien choisir ses accessoires cheveux de mariage,Shopping - Apparel
bien choisir ses chaussures et ses batons,Shopping - Apparel
bien choisir son pantalon d hiver,Shopping - Apparel
bien choisir un pantalon homme,Shopping - Apparel
bien etre pantalons qui affinent vraiment les jambes,Shopping - Apparel
bien porter des talons haut,Shopping - Apparel
big star hommes shorts jeans et pantalons,Shopping - Apparel
bigood combinaison résillesexy lingerie imprimé,Shopping - Apparel
bijou bracelet femme guess bijoux mode color chic ubs p,Shopping - Apparel
bijoux blancs bijoux noirs la nouvelle collection charlotte martyr,Shopping - Apparel
bijoux vetements chemises,Shopping - Apparel
billieblush vetements marque fille,Shopping - Apparel
ce fr product pantalon millium taille l molinel bleu gris beton,Shopping - Apparel
ceintre pour pantalon,Shopping - Apparel
ceinture cuir largeur 4 cm pour jeans homme,Shopping - Apparel
ceinture cuir largeur 4 cm pour jeans homme avec boucle demontable,Shopping - Apparel
ceinture de hanches feerique sur jupe rose dentelles et perles,Shopping - Apparel
ceinture elastique pantalon jeans taille elastiquee adquat jeans,Shopping - Apparel
ceinture en forme pour jupe ou,Shopping - Apparel
ceinture femme pour jeans,Shopping - Apparel
ceinture femme ralph lauren mode cheval,Shopping - Apparel
Ceinture hammond pepe jeans,Shopping - Apparel
ceinture homme armani jeans,Shopping - Apparel
ceinture très large mode femme,Shopping - Apparel
chaussettes homme hautes sans talon,Shopping - Apparel
concevoir votre propre chemise sur mesure chemise manche extra longue it,Shopping - Apparel
concordance pointure chaussures femmes,Shopping - Apparel
confectionner pots a fleurs avec de vieux jeans,Shopping - Apparel
confectionner une jupe,Shopping - Apparel
conseil et vente prêt à porter,Shopping - Apparel
conseil look mode femme ans,Shopping - Apparel
detail pantalon gregoire,Shopping - Apparel
detail promotions chaussures bateau,Shopping - Apparel
detail promotions chaussures confort femme,Shopping - Apparel
detail promotions chaussures femme,Shopping - Apparel
detail promotions chemise en denim sans manches,Shopping - Apparel
detail promotions chemise garcon,Shopping - Apparel
detail promotions pantalon fluide imprime,Shopping - Apparel
details buste femme lingerie blanc,Shopping - Apparel
details chemise femme nouvelle collection printemps ete,Shopping - Apparel
details ensemble nouvelle collection printemps ete,Shopping - Apparel
details gilet grande taille nouvelle collection automne hiver,Shopping - Apparel
details impers nouvelle collection automne hiver lauren vidal,Shopping - Apparel
details jupe multicolore savage culture,Shopping - Apparel
enfant 2 ans taille chaussures,Shopping - Apparel
enfant adidas chaussures a lacets pointure,Shopping - Apparel
enfant ans fille la nuit chemise de nuit ecru ganodette,Shopping - Apparel
enfant ans fille les robes et jupes,Shopping - Apparel
enfant ans garcon les pantalons et salopettes jeans bleu gabyage,Shopping - Apparel
enfant ans garcon les tee shirts et chemises sous pull bleu canard giwangage,Shopping - Apparel
enfant nouvelle collection fille n rayons~vetements,Shopping - Apparel
enfant nouvelle collection garcon n rayons~lingerie,Shopping - Apparel
enfants lingerie pyjama peignoir xsl,Shopping - Apparel
f mode femme petite taille,Shopping - Apparel
firminy vetements chaussures,Shopping - Apparel
fit up costumes et chemises sur mesure a angers,Shopping - Apparel
fitflop b femme chaussures page,Shopping - Apparel
fitness femmes collants shorts et pantalons,Shopping - Apparel
fr costume gris h m complet costard aspx,Shopping - Apparel
fr fr avant premiere femme chaussures iso,Shopping - Apparel
fr fr badminton chaussures femme,Shopping - Apparel
fr fr bébé ans pantalons jeans,Shopping - Apparel
fr fr campaign femme nouvelle collection lingerie,Shopping - Apparel
fr fr categories de produits cintres pour lingeries bikinis et maillots de bai,Shopping - Apparel
fr fr collection lingerie tanga dentelle bordeaux,Shopping - Apparel
fr fr femme catalogue par produit lingerie corsets,Shopping - Apparel
fr fr femme nouvelle collection accessoires,Shopping - Apparel
fr france robe fleurs frf,Shopping - Apparel
H et M robes nouvelle collection,Shopping - Apparel
haut porter jupe on ronde,Shopping - Apparel
haut pour pantalon rose corail,Shopping - Apparel
hauteur en centimètres de jupe fille,Shopping - Apparel
hautmont la halle aux chaussures,Shopping - Apparel
hautmont vetements chaussures,Shopping - Apparel
hauts chemise carreaux fille,Shopping - Apparel
hauts chemises chemise formelle,Shopping - Apparel
hauts chemises chemise oxford,Shopping - Apparel
hauts chemises et tuniques,Shopping - Apparel
hauts pantalons,Shopping - Apparel
hauts talons c beige p,Shopping - Apparel
helline vêtements les soldes,Shopping - Apparel
itm mini robe jupe lingerie nuisette decolletee dos nu leopard sexy femme,Shopping - Apparel
itm miss captain tortue superbe jupe t paillettes,Shopping - Apparel
itm mocassins bi matieres chaussures femme agathe t,Shopping - Apparel
itm mode a manches longues femmes tricot tunique loose hauts mini robe chemise,Shopping - Apparel
itm mode adolescente bebe fille enfants robe en jeans ensemble jupe ete vetements,Shopping - Apparel
itm mode d homme shorts coton culotte calecon boxer slip lingerie brief jeans l xl,Shopping - Apparel
itm mode enfants bebe fille tout petit lapin robe chemise legging set vetements,Shopping - Apparel
itm mode feminine sexy summer slim jupe party cocktail soiree mini robe de coupe,Shopping - Apparel
itm mode femme vintage jeans trou shorts denim dechire blue pantalons pants punk,Shopping - Apparel
itm mode retro femme decontracte chemisier bleu jeans chemise manches longues haut,Shopping - Apparel
itm nouvelle collection maje ete jupe jeko,Shopping - Apparel
le petit atelier de bea sac a partir d un jeans,Shopping - Apparel
le petit nicolas les chaussures vertes,Shopping - Apparel
le polo piqué col chemise rayé homme fp,Shopping - Apparel
le prix d un jeans levis,Shopping - Apparel
le prix d une chemise,Shopping - Apparel
le prix de lingeries barbarra,Shopping - Apparel
les 1er marque de sous vetement,Shopping - Apparel
les 3 suisse chemise lin homme,Shopping - Apparel
les 3 suisses chemise,Shopping - Apparel
les basiques de la mode femme,Shopping - Apparel
les boutiques mode femme,Shopping - Apparel
les costards tendance 2016,Shopping - Apparel
maison marque de chaussures sub,Shopping - Apparel
maison scotch jeans,Shopping - Apparel
nana collant mini jupe photo,Shopping - Apparel
nancy blue jeans,Shopping - Apparel
nancyhoudemont tous les rayons textile et chaussures femme chaussant,Shopping - Apparel
nancyhoudemont tous les rayons textile et chaussures femme sous vetements,Shopping - Apparel
narbonne rayons habillement mode femme,Shopping - Apparel
nav mode accessoire mode christian dior femme foulard,Shopping - Apparel
pas cher accessoires pour cheveux,Shopping - Apparel
pas cher femme accessoires ceintures bretelles,Shopping - Apparel
pas cher femme accessoires echarpes foulards,Shopping - Apparel
pas cher lingerie,Shopping - Apparel
pascher accessoires de mariage,Shopping - Apparel
pascucci jeans,Shopping - Apparel
pasqualine accessoires et fantaisies,Shopping - Apparel
pasteur rayons habillement mode femme,Shopping - Apparel
pataugas lance sa nouvelle collection pour lhiver,Shopping - Apparel
patrons et modele de blouses femme facile,Shopping - Apparel
portal ventes privees adidas chaussures femme,Shopping - Apparel
portal ventes privees hugo boss chemises pulls,Shopping - Apparel
portal ventes privees hugo boss prod chemise marine,Shopping - Apparel
portal ventes privees jeans homme,Shopping - Apparel
portal ventes privees paul stragas pantalons jeans,Shopping - Apparel
porte jarretelle jupe,Shopping - Apparel
pret a porter r vetements sport enfant,Shopping - Apparel
quantité tissu chemise,Shopping - Apparel
Quebec jeans,Shopping - Apparel
quel collier avec une chemise,Shopping - Apparel
quel couleur de chemise qui va bien avec veste noir,Shopping - Apparel
quel cravate pour quel chemise,Shopping - Apparel
quel haut avec jupe taille haute,Shopping - Apparel
quelle chemise avec cravate rose,Shopping - Apparel
quelle couleur de lingerie,Shopping - Apparel
quelle mode porter c ete por femme de 65 ans,Shopping - Apparel
quiksilver combinaison surf costard,Shopping - Apparel
ray ban nouvelle collection 2016 homme,Shopping - Apparel
recherche casque et talons hauts,Shopping - Apparel
recherche nouvelle collection zapa chaussure femme,Shopping - Apparel
rester femme mode,Shopping - Apparel
resultat recherche chaussures sport femme,Shopping - Apparel
resultats bonneterie lingerie et sous vetements,Shopping - Apparel
resultats chaussures et articles chaussants,Shopping - Apparel
resultats lingerie de peau st laurent,Shopping - Apparel
resultats recherche chaussures,Shopping - Apparel
retourner un col de chemise,Shopping - Apparel
ses jupes moulantes,Shopping - Apparel
sessun chaussures femme,Shopping - Apparel
set lingerie erotique,Shopping - Apparel
sets de sous vetements,Shopping - Apparel
t une veste et pantalon hbt,Shopping - Apparel
tableau des pointures de chaussures,Shopping - Apparel
tableau taille homme pantalon,Shopping - Apparel
tabliers faient avec des vieux jeans,Shopping - Apparel
tag nouvelle collection accessoire de mode en tissu,Shopping - Apparel
tulle la halle chaussures et maroquinerie tulle quai continsouza,Shopping - Apparel
tumi sacs accessoires m c,Shopping - Apparel
tunique beige en avec voile double en haut mode femme product,Shopping - Apparel
tunique chemise blanch,Shopping - Apparel
tunique en rose et dore avec sky sur les cotes mode femme product,Shopping - Apparel
tunique et pantalon,Shopping - Apparel
tunique femme enceinte a la mode pas cher,Shopping - Apparel
tunique lingerie grande taile,Shopping - Apparel
1 enchere auto rouen,Shopping - Auctions
1001 trouvailles vide grenier,Shopping - Auctions
4 Ventes aux enchères à venir chez Osenat,Shopping - Auctions
a antiquite broc troc narbonne,Shopping - Auctions
a michel lebel les nouvelles encheres de la defense,Shopping - Auctions
achat vente ligne montee peche au coup pas cher water queen sensas pince a plombs,Shopping - Auctions
activites themes le marche aux puces,Shopping - Auctions
actualites iphone contrefacon marche puces france,Shopping - Auctions
anaf auto encheres par internet,Shopping - Auctions
annecy shopping mode cadeaux bons plans salle des ventes ventes aux encheres hotel des ventes,Shopping - Auctions
annonce detail effffa site de ventes aux encheres,Shopping - Auctions
annonce marche aux puces,Shopping - Auctions
article le pied de la revolution aux encheres,Shopping - Auctions
article le retour des brocantes et vide greniers,Shopping - Auctions
article le troc d avril,Shopping - Auctions
article les barriques d or aux encheres,Shopping - Auctions
article les doudous enchantes expo livre et vente aux encheres,Shopping - Auctions
article les marches aux puces de perpignan,Shopping - Auctions
article les tresors d ebay,Shopping - Auctions
article les ventes aux encheres,Shopping - Auctions
article marche aux puces de clignancourt saint ouen,Shopping - Auctions
article marche aux puces saint michel,Shopping - Auctions
article mes trouvailles ebay,Shopping - Auctions
article reservation groupon,Shopping - Auctions
article sacs a main de luxe de marque louis vuitton en ligne groupon,Shopping - Auctions
article sotheby s organise mercredi ses premieres ventes sur ebay,Shopping - Auctions
article vente louis vuitton la croix rouge chez sotheby s,Shopping - Auctions
articles gagner voyage de reve groupon,Shopping - Auctions
arts une statue khmere vendue par sotheby s va etre rendue au cambodge,Shopping - Auctions
auctions fr calendrier ventes aux encheres art,Shopping - Auctions
baby bretton sprint cal canon de cm mise a prix un euro sans prix de reserve item,Shopping - Auctions
bien non vendus aux encheres,Shopping - Auctions
bien vendu aux enchères prix faible,Shopping - Auctions
bientot aux encheres,Shopping - Auctions
bientot un nouveau troc de livres,Shopping - Auctions
biget vente aux enchères,Shopping - Auctions
bijoux aux encheres,Shopping - Auctions
bilans gratuits parisud encheres,Shopping - Auctions
billet d'avion ventes aux encheres,Shopping - Auctions
bipied neuf marque swissarms pas prix reserve item,Shopping - Auctions
biscarrosse vide greniers de la plage,Shopping - Auctions
biz marché aux puces marseille,Shopping - Auctions
calendrier des ventes a drouot,Shopping - Auctions
calendrier des ventes aux encheres bayeux,Shopping - Auctions
catalogue sothebye s vente de voitures de collection,Shopping - Auctions
celui qui fait les vente au encheres,Shopping - Auctions
centre de ventes aux encheres 113,Shopping - Auctions
chabeuil vide grenier centre ancien h,Shopping - Auctions
charente avril vide greniers et marches puces,Shopping - Auctions
condition de vente encheres,Shopping - Auctions
condition sur groupon,Shopping - Auctions
condition vente enchere auto,Shopping - Auctions
conditions de ventes aux encheres,Shopping - Auctions
conditions de ventes ebay,Shopping - Auctions
conditions generales de vente ebay,Shopping - Auctions
conditions generales encheres le figaro,Shopping - Auctions
connaitre deguster cote vins o ventes aux encheres etablir une gestion dynamique de sa cave,Shopping - Auctions
conseils vide grenier,Shopping - Auctions
content troc de vetements,Shopping - Auctions
cote or agencourt octobre vide greniers et marches puces,Shopping - Auctions
couteau pliant cerf euro sans prix de reserve item,Shopping - Auctions
dans l intimite de la famille d orleans reponse chez sotheby s paris,Shopping - Auctions
details vente de maisons de prestige a lyon sotheby s,Shopping - Auctions
details vente enchere vente aux encheres des actifs de chaudronnerie industrielle,Shopping - Auctions
details vide grenier brocante foire au tout,Shopping - Auctions
deux sevres melle vide greniers et marches puces,Shopping - Auctions
en evenement vide grenier,Shopping - Auctions
en images une vente aux encheres prestigieuse a agen,Shopping - Auctions
en islam est il permis d acheter au enchere,Shopping - Auctions
en materiels professionnels calendrier ventes aux encheres,Shopping - Auctions
enseignes troc com,Shopping - Auctions
essonne athis mons juin vide greniers et marches puces,Shopping - Auctions
f marche aux puces,Shopping - Auctions
felix marcilhac collection privee vente sotheby s,Shopping - Auctions
firminy vide grenier du centre social soleil levant,Shopping - Auctions
five auction vente aux enchères béthune,Shopping - Auctions
flash actualite culture diamants les records de ventes aux encheres,Shopping - Auctions
flers vide grenier eme edition,Shopping - Auctions
fleury vide grenier,Shopping - Auctions
foire au troc bazainville,Shopping - Auctions
fr fr enchere chez amazon fr aspx,Shopping - Auctions
fr guide achat et vente aux encheres,Shopping - Auctions
fr immobilier belgique agence brussels sotheby s international realty a vendre,Shopping - Auctions
fr immobilier immobilier ventes appel d'offres aspx,Shopping - Auctions
fr information commission appel offre ouverture plis,Shopping - Auctions
fr informations ventes aux encheres mode d emploi,Shopping - Auctions
fr italie un village mis aux encheres sur le site ebay,Shopping - Auctions
fr la mairie vente aux encheres,Shopping - Auctions
fr materiels professionnels calendrier ventes aux encheres,Shopping - Auctions
fr news story l ei vend des antiquites de syrie et d irak sur ebay,Shopping - Auctions
fr page ebay auctions,Shopping - Auctions
fr reservation sejour groupon,Shopping - Auctions
fridays french vide greniers vide armoires brocante,Shopping - Auctions
futurs christie s et sotheby s achetent la paix,Shopping - Auctions
haute savoie combloux vide grenier,Shopping - Auctions
haute savoie saint pierre faucigny vide greniers et marches puces,Shopping - Auctions
haute savoie une exceptionnelle bibliotheque aux encheres,Shopping - Auctions
haute vienne shopping mode cadeaux bons plans salle des ventes ventes aux encheres,Shopping - Auctions
haute-savoie.fr vente aux encheres,Shopping - Auctions
hauts de seine la porcelaine a fait monter les encheres,Shopping - Auctions
hd vente aux encheres,Shopping - Auctions
horaire ouverture depot ventes les montées orleans,Shopping - Auctions
hotel des ventes calendrier des ventes vente,Shopping - Auctions
itm monnaie de paris jeton semeuse ere fois en vente sur ebay depuis,Shopping - Auctions
itm poele a petrole sans prix de reserve,Shopping - Auctions
itm rahan cheret catalogue ere vente mondiale aux encheres luxueux,Shopping - Auctions
itm rare rapport vente aux encheres non autorise commissaire priseur bayon,Shopping - Auctions
ivoire encheres chartres,Shopping - Auctions
ivoire encheres lyon,Shopping - Auctions
j bourse brocante vide greniers,Shopping - Auctions
jahia annonces immobilieres bretagne guisseny vente aux encheres,Shopping - Auctions
jai teste les deals coiffure via groupon et bon prive,Shopping - Auctions
jard sur mer vide greniers,Shopping - Auctions
jarville la malgrange vide greniers enfants,Shopping - Auctions
jours de marché aux puces montreuil,Shopping - Auctions
l art contemporain victor ganz et ses celebres ventes chez sotheby s,Shopping - Auctions
la collection privee de felix marcilhac vendue chez sotheby s a paris,Shopping - Auctions
le guide sotheby s de la peche a la mouche pour la truite prd,Shopping - Auctions
le petit vide greniers de quitteur,Shopping - Auctions
le plus gros oeuf du monde aux encheres,Shopping - Auctions
le prix de choupette senvole aux encheres,Shopping - Auctions
le prix des voitures d occasion peugeot en turquie,Shopping - Auctions
le prochain encheres de corbeil,Shopping - Auctions
le salon archives vente aux encheres artcurial motorcars le graal automobile,Shopping - Auctions
les affaires comment rédiger un appel d’offres,Shopping - Auctions
les appels d offres d acquisition,Shopping - Auctions
les dates de ventes aux encheres de voiture dans le 76,Shopping - Auctions
les differents marches des puces,Shopping - Auctions
lesechos ech encheres art paris le trio christie sotheby et artcurial conforte ses positions,Shopping - Auctions
ma mairie marches publics appels offre,Shopping - Auctions
maison rambouillet encheres,Shopping - Auctions
maison vente aux encheres pas de calais,Shopping - Auctions
maison ventes encheres montevrain,Shopping - Auctions
maisons enchères Nantes,Shopping - Auctions
malemort sur correze agenda brocante vide grenier,Shopping - Auctions
manche avranches vide greniers,Shopping - Auctions
manche juillet vide greniers et marches puces,Shopping - Auctions
marché online appel d'offre,Shopping - Auctions
mfp le prix des choses sotheby s livre,Shopping - Auctions
nancy enchere auto,Shopping - Auctions
nancy vente aux encheres fac de droit,Shopping - Auctions
nantes voiture occasion ford focus,Shopping - Auctions
narbonne salle des ventes ventes aux encheres page,Shopping - Auctions
narbonne ventes encheres auto,Shopping - Auctions
neuville aux bois agenda brocante vide grenier,Shopping - Auctions
outils calendrier ventes,Shopping - Auctions
pages calendrier lavent ventes flash cest parti,Shopping - Auctions
pas d'acquéreur a une vente aux enchères de maison,Shopping - Auctions
pas de calais ventes encheres auto,Shopping - Auctions
pays de la loire la roche sur yon les ventes aux encheres tissent leur toile,Shopping - Auctions
paysage avec étang entouré de bois ventes aux enchères,Shopping - Auctions
petites annonces (categorie) appel d offre adjudications,Shopping - Auctions
portail sncf appel d'offre,Shopping - Auctions
porteur enchères,Shopping - Auctions
portrait dede le crieur de la vente aux encheres,Shopping - Auctions
post la vente aux enchères de loiselet c est le avril,Shopping - Auctions
post le slave est vendu aux enchères,Shopping - Auctions
produit calendrier des ventes,Shopping - Auctions
que demander quand on achete une voiture d'occasion,Shopping - Auctions
que faire quand on vend une voiture d'occasion,Shopping - Auctions
quel avenir pour les maisons de ventes la reponse de maitre francis dupuy honfleur encheres honfleur,Shopping - Auctions
quel demarche pour vendre au encheres,Shopping - Auctions
quel droit de retraction sur le site internet de vente aux encheres ebay,Shopping - Auctions
quel montant de frais il faut ajouter a une vente aux encheres immobiliére,Shopping - Auctions
quel moyen de paiement pour une vente aux encheres,Shopping - Auctions
quel sont les recours pour faire annuler la vente d'un bien immobilier vendu aux enchéres par le tgi,Shopping - Auctions
quelles taxes pour le vendeur sur une vente aux encheres ?,Shopping - Auctions
question argent bonjour jai achete chez groupon un deal pour un q,Shopping - Auctions
resultat de la vente aux encheres a laventure peugeot,Shopping - Auctions
resultat de vente aux encheres hoeroa maori,Shopping - Auctions
résultat de votre recherche en vente aux encheres publiques,Shopping - Auctions
resultat des prix de depart des derniere enchere a nimes,Shopping - Auctions
résultats adjudication aux ventes aux enchéres,Shopping - Auctions
résultats appel d'offres,Shopping - Auctions
resultats encheres gromaire marcel sotheby s,Shopping - Auctions
retirer enchere ebay acheteur,Shopping - Auctions
s groupon comment ça marche,Shopping - Auctions
services et demarches ventes aux encheres,Shopping - Auctions
services les ventes aux encheres,Shopping - Auctions
services les ventes aux encheres comment acheter,Shopping - Auctions
services les ventes aux encheres comment vendre,Shopping - Auctions
similaires appels offres privatisation partielle a roports nice lyon,Shopping - Auctions
site archives docs article christie s et sotheby s detiennent maintenant etnbsp des encheres d art en france,Shopping - Auctions
sub Calendrier des ventes aux enchères de véhicules,Shopping - Auctions
sub Dépôt Vente Les Montées Orléans,Shopping - Auctions
t une arme de doigt en vente aux encheres,Shopping - Auctions
t vente aux encheres,Shopping - Auctions
t vente aux encheres a scaer,Shopping - Auctions
tableaux a vendre aux enchere,Shopping - Auctions
tableaux anciens vente aux encheres,Shopping - Auctions
tulle ventes encheres auto,Shopping - Auctions
un appel d'offres public,Shopping - Auctions
v l aigle c vente aux encheres publiques,Shopping - Auctions
v la chapelle des fougeretz c shopping mode cadeaux c bons plans c salle des ventes ventes aux encheres,Shopping - Auctions
v la rochelle c shopping mode cadeaux c bons plans c salle des ventes ventes aux encheres,Shopping - Auctions
ventes aux encheres calendrier puy de dome,Shopping - Auctions
vitry en perthois Objets de collection Vente aux enchères boutiques,Shopping - Auctions
voir voiture d occasion,Shopping - Auctions
10 pires annonces leboncoin,Shopping - Classifieds
3 le bon coin petites annonces gratuites,Shopping - Classifieds
611 327 petites annonces de particuliers et professionnels,Shopping - Classifieds
a annonceurs mags offres,Shopping - Classifieds
abritel déposer une annonce,Shopping - Classifieds
aliexpress trier par prix a l unite,Shopping - Classifieds
altamigo le site d annonce de services pour les particuliers et les professionnels,Shopping - Classifieds
amix petites annonces,Shopping - Classifieds
ancv.com bonne affaire,Shopping - Classifieds
andorre les bonnes affaires adresse,Shopping - Classifieds
anibis ch petites annonces gratuites,Shopping - Classifieds
annonce inscription annonceur,Shopping - Classifieds
annonces cherche vivastreet escort girl blois,Shopping - Classifieds
annonces confirmation deposer annonce,Shopping - Classifieds
annonces de particuliers et professionnels,Shopping - Classifieds
annonces deposer,Shopping - Classifieds
annuaire des particuliers et professionnels,Shopping - Classifieds
article les arnaques sur leboncoin fr,Shopping - Classifieds
article les bonnes affaires de ben,Shopping - Classifieds
article les bonnes affaires de janvier,Shopping - Classifieds
article les perles des petites annonces,Shopping - Classifieds
