2 droit de la propriété intellectuelle,Illegal - Copyright Infringement
fr il deterre un cercueil et tente de violer le cadavre de la jeune fille,Illegal - Crime
fr le monde nest pas sorti de lere des genocides,Illegal - Crime
fr news rwanda la justice apres le genocide ans plus tard,Illegal - Crime
gérer l'agonie d'un proche,Illegal - Crime
haute savoie deux cadavres carbonises decouverts dans une fourgonnette,Illegal - Crime
haute savoie un cadavre decouvert dans un ruisseau,Illegal - Crime
hauts de seine accuse d avoir assassine sa concubine,Illegal - Crime
hauts de seine assassine pour une gifle,Illegal - Crime
hauts de seine des crimes similaires,Illegal - Crime
hauts de seine l accuse refute le crime crapuleux,Illegal - Crime
hauts de seine le genocide armenien commemore,Illegal - Crime
hda la description de l'oeuvre genocide juifs,Illegal - Crime
hebdo histoire la france impose le silence sur le genocide algerien,Illegal - Crime
hem lenglet un cadavre dans l etang d une propriete privee,Illegal - Crime
henryrenoul genocide vendeen toujours dactualite,Illegal - Crime
herve gourdel enleve et assassine en,Illegal - Crime
hervecheuzeville genocide rwandais la ville de paris a choisi son camp,Illegal - Crime
hespress un jeune marocain assassiné en ukraine,Illegal - Crime
hindi kouch le genocide de millions dindiens par lislam nest pas un mythe,Illegal - Crime
il faut abattre merkel une juppe bis inconsciente en matiere d immigration,Illegal - Crime
il faut tuer abattre un europeen,Illegal - Crime
infos locales autres regions aniche la fillette de ans hospitalisee pratiquement a l agonie son pere et sa belle mere mis en examen pour violences habituelles et privations de soins sur un mineur,Illegal - Crime
itm mordecai moreh gravure originale oiseau assassine estampe eau forte,Illegal - Crime
itm paul doumer assassine president de la republique autographe,Illegal - Crime
itm tres rare et enorme medaille de victoir noir journaliste assassine,Illegal - Crime
j accuse l occident de complicite avec l islam du genocide des chretiens d orient,Illegal - Crime
j ai une seule resolution pour battre sans dans la genocide route,Illegal - Crime
jacques chirac la phrase assassine et humiliante de bernadette en plein repas au restaurant,Illegal - Crime
jai assassine pierre goldman un ancien tueur se confie,Illegal - Crime
jai vecu un drame « jaccuse ma belle fille et son amant davoir assassine mon fils »,Illegal - Crime
jai vecu un drame « ma fille a ete assassinee deux fois »,Illegal - Crime
jamal herfoufi retrouve assassine dans un appartement le locataire soupconne,Illegal - Crime
jean pierre chretien le genocide,Illegal - Crime
le petit frere de dion waiters assassine,Illegal - Crime
le phenomene criminel crimes et proces celebres christine de suede,Illegal - Crime
le phenomene criminel crimes et proces celebres jehanne d arc,Illegal - Crime
le phenomene criminel crimes et proces celebres mme roland,Illegal - Crime
le phenomene criminel crimes et proces celebres proces bazaine,Illegal - Crime
le plan coudenhove kalergi le genocide,Illegal - Crime
le plan de l arabie du mossad et de la cia pour assassiner hassan nasrallah irib,Illegal - Crime
le plan kalergi de genocide des europeens,Illegal - Crime
le poete david diop a t il ete assassine,Illegal - Crime
le president francais francois hollande rend hommage aux tirailleurs senegalais lachement assassines a thiaroye,Illegal - Crime
le president kennedy et son frere robert kennedy ont ete assassines par le complexe militaro securite,Illegal - Crime
le president marien n gouabi un brave type assassine par ses freres d,Illegal - Crime
le progres du jour couple assassiné à craponne 69290,Illegal - Crime
le proprietaire de lhotel jardins sur mer assassine par des individus non identifies,Illegal - Crime
le témoin à abattre,Illegal - Crime
les attentats en europe sont le revelateur de sa lente agonie,Illegal - Crime
m ali ss punchline assassine en mode the punisher pour defendre alia insultee sur twitter,Illegal - Crime
ma mere sest fait assassiner alors que javais ans le journal de quebec septembre,Illegal - Crime
mai un crime de guerre oublie,Illegal - Crime
maison rouge debordee par ses chats elle brulait les cadavres,Illegal - Crime
mali ras bath des verites assassines,Illegal - Crime
mali une jeune femme assassinee par son valentin,Illegal - Crime
marat assassine par jacques louis david,Illegal - Crime
marche en hommage a sakine cansiz fidan dogan et leyla saylemez militantes kurdes assassinees a paris le janvier,Illegal - Crime
Mari de Marie Stuart assassiné,Illegal - Crime
martinique le genocide par substitution,Illegal - Crime
mecontente de sa coupe une femme tente d abattre son coiffeur,Illegal - Crime
melenchon est il devenu lhomme a abattre,Illegal - Crime
michael jackson aurait il donne l ordre d abattre son frere,Illegal - Crime
nantes un cadavre carbonise dans un jardin,Illegal - Crime
nasser a t il ete assassiné,Illegal - Crime
nds forums sherlock holmes le secret de la reine a quelles sont les bonnes reponses dans l hypothese assassiner la reine d angleterre,Illegal - Crime
nestor burma t m as tu vu en cadavre avis,Illegal - Crime
noisy le grand noisy le grand la lente agonie du fort de villiers,Illegal - Crime
pas de prison pour gaetan et les autres tudiants leur crime avoir manifeste les manifestant ne sont pas de terroriste,Illegal - Crime
passage des abbesses montmartre crimes et faits divers,Illegal - Crime
passeport pour le crime a miami avec carole rousseau,Illegal - Crime
paul craig roberts le president kennedy et son frere robert kennedy ont ete assassines par le complexe militaro securite a,Illegal - Crime
pays bas ans de prison pour un marocain qui assassine son pere pendant sa priere a,Illegal - Crime
peine mort etats unis agonie condamne n,Illegal - Crime
port une equipe de la mbc decouvre un cadavre,Illegal - Crime
pourquoi abattre le poulet fermier en 81 jours,Illegal - Crime
pourquoi césar a t'il été assassiné,Illegal - Crime
pourquoi fria agonise première partie d’une agonie lente et douloureuse,Illegal - Crime
pourquoi israel a assassine arafat,Illegal - Crime
quand un fils ne peut admettre les crimes de son pere,Illegal - Crime
quatre missionnaires de la charite assassinees au yemen par qui,Illegal - Crime
quatre religieuses assassinees yemen,Illegal - Crime
quatre religieuses de l ordre de mere teresa assassinees au yemen,Illegal - Crime
quatre religieuses de la congregation de mere teresa assassinees,Illegal - Crime
quatre s urs lordre mère teresa assassinées au,Illegal - Crime
Quatre Sœurs de la Charité assassinées au Yémen,Illegal - Crime
que sont devenus les parents de philippe bertrand assassiné,Illegal - Crime
quel est le nom du president americain assassine a dallas le novembre,Illegal - Crime
quels risques d abattre un chien,Illegal - Crime
resume crime des justes,Illegal - Crime
retour sur le genocide juif,Illegal - Crime
royaume uni il faudrait abattre les enfants handicapes qui nous coutent trop d argent,Illegal - Crime
s fr especes menacees article detail pourquoi les riches aiment abattre les animaux en voie de disparition dhtml,Illegal - Crime
s fr monde article detail un belge rescape de grand bassam je l ai vu abattre froidement une femme dhtml,Illegal - Crime
sidi bel abbes un jeune homme assassine a l interieur d un centre de sante a coups de sabre a ras el ma,Illegal - Crime
similaires mecontente coupe cheveux californienne tente abattre coiffeur,Illegal - Crime
tag genocide et crime de guerre,Illegal - Crime
tchad yacoub adam yacoub assassine devant sa boutique,Illegal - Crime
tunisie neuf soldats assassines par des terroristes,Illegal - Crime
tunisie sfax arrestation dune femme qui a tue et jete le cadavre de son nouveau ne,Illegal - Crime
tunisie un mandat judiciaire pour examiner des cadavres des terroristes,Illegal - Crime
un chien se fait abattre par la police en pleine rue en californie,Illegal - Crime
0 hour contract illegal,Illegal - Illegal Content
123 Movies Illegal,Illegal - Illegal Content
13 ans droguée prostituée,Illegal - Illegal Content
a ans cauchemar de pedophiles cette video va glacer sang,Illegal - Illegal Content
abonnes sfr soyez prudents phishing sfr en cours vol de donnees chez sfr,Illegal - Illegal Content
accueil articles tabid articletype articleview articleid diffamation conditions de lexception de bonne foi et mention de la decision dacquittement de la personne diffamee aspx,Illegal - Illegal Content
accueil detail actualite article le president burundais a porte plainte pour diffamation apres un reportage sur france,Illegal - Illegal Content
accusation mensongeres et diffamation,Illegal - Illegal Content
accusations mensongères diffamation calomnie,Illegal - Illegal Content
accusé davoir couvert actes pédophiles cardinal barbarin exclut,Illegal - Illegal Content
achat anti nuisibles,Illegal - Illegal Content
achat en ligne anti nuisibles,Illegal - Illegal Content
activer desactiver anti phishing dans les navigateurs,Illegal - Illegal Content
actualite limpact dun jeu video violent immoral,Illegal - Illegal Content
actualites arnaques sur internet attention au phishing a,Illegal - Illegal Content
actualites conseils espace client arnaque et phishing,Illegal - Illegal Content
actualites deux millions victimes phishing,Illegal - Illegal Content
actualites dossiers cybercrime prevention contre le phishing,Illegal - Illegal Content
actualites economie article l impot est il immoral,Illegal - Illegal Content
actualites enregistrement la tentative de phishing microsoft finit en insultes,Illegal - Illegal Content
actualites le gouvernement ouvre son portail de signalement des contenus illicites,Illegal - Illegal Content
actualites le gouvernement ouvre un portail anti contenus illicites,Illegal - Illegal Content
actualites lire contenus web illicites retires en an le monde informatique,Illegal - Illegal Content
amidlisa le scandale des reseaux pedophiles en france,Illegal - Illegal Content
amour interdit telechargement gratuit,Illegal - Illegal Content
amy colle fait un torrent de pluie dinsultes a sa belle famille contenu tres choquant,Illegal - Illegal Content
android tv boxes illegal,Illegal - Illegal Content
anglais francais illegal labor practice,Illegal - Illegal Content
anonymous et liste elite belge pedophile HS,Illegal - Illegal Content
antisemitisme juif accuse d antisemitisme sine attaque bhl en diffamation,Illegal - Illegal Content
appel a mobilisation faire annuler evenement immoral,Illegal - Illegal Content
apple id rescue email address phishing,Illegal - Illegal Content
apres le phishing voici le vishing,Illegal - Illegal Content
arcueil arcueil le conseiller fn condamne pour diffamation,Illegal - Illegal Content
arnaque phishing clients banque cic actualite,Illegal - Illegal Content
arnaque phishing clients banque societe generale actualite,Illegal - Illegal Content
arnaque phishing soit disant paypal fs,Illegal - Illegal Content
article completement immoral,Illegal - Illegal Content
article de la religion dieu est il immoral de mark twain,Illegal - Illegal Content
article dette immorale l equateur ne paye plus,Illegal - Illegal Content
article incitation a la haine et harcelement,Illegal - Illegal Content
article l empoisonnement illegal de ce qu il reste d eau en californie,Illegal - Illegal Content
article l enfer de la violence,Illegal - Illegal Content
article l enquete sur le reseau pedophile de stan maillaud classee sans suite,Illegal - Illegal Content
article l enseignant qui detenait dans son ordinateur images pedophiles a ete ecroue,Illegal - Illegal Content
article l ex producteur de johnny hallyday juge pour diffamation envers le dr stephane delajoux,Illegal - Illegal Content
article le journal minute condamne pour incitation a la haine homophobe,Illegal - Illegal Content
article le pedophile d elne est mort en prison,Illegal - Illegal Content
article le pedophile du cnes trahi par internet,Illegal - Illegal Content
article le pédophile est un handicapé mental,Illegal - Illegal Content
article le point condamne pour diffamation envers l ex commissaire a la diversite yazid sabeg,Illegal - Illegal Content
article le prefet du var cogne sur les constructions illegales,Illegal - Illegal Content
article le president du siahvy et condamne pour prise illegale d interets et favoritisme,Illegal - Illegal Content
article le probleme de la violence a l ecole ne peut etre resolu qu avec les parents,Illegal - Illegal Content
article les avantages du telechargement illegal pour les consomateurs,Illegal - Illegal Content
article les causes d un trafic illegal,Illegal - Illegal Content
article les escort girls sur internet c est illegal a priori,Illegal - Illegal Content
article les illegales decisions du maire de pelissanne,Illegal - Illegal Content
article les lois contre le telechargement illegal,Illegal - Illegal Content
article loi diffamation reseau sociaux,Illegal - Illegal Content
article phishing attention aux courriels douteux,Illegal - Illegal Content
article se proteger contre le phishing,Illegal - Illegal Content
article un meilleur controle des contenus illicites vehicules par internet,Illegal - Illegal Content
articles are liberals immoral,Illegal - Illegal Content
articles management immoral,Illegal - Illegal Content
articles un contenu choquant ou illicite sur internet signalez le sur le site pointdecontactnet,Illegal - Illegal Content
bien etre comment faire face aux violences conjugales,Illegal - Illegal Content
bis comment identifier un pedophile,Illegal - Illegal Content
blague pédophile,Illegal - Illegal Content
blog arnaque de type phishing vos droits de paiements caf,Illegal - Illegal Content
blog le voile leve diffamation extreme,Illegal - Illegal Content
blog maitre haddad sabine delit diffamation publique definition sanction,Illegal - Illegal Content
blog non respect des regles quelle est la norme,Illegal - Illegal Content
blogs anti pédophiles,Illegal - Illegal Content
bnp paribas arnaque phishing email fraduleux code acces actualite,Illegal - Illegal Content
bnpparibas net comptes probleme acces bnp mon compte suite phishing,Illegal - Illegal Content
bornage non respecté,Illegal - Illegal Content
célébrité détruit par la drogue,Illegal - Illegal Content
certaines indemnités parlementaires étaient illégales,Illegal - Illegal Content
ces choses quon croit illegales mais qui ne le sont pas,Illegal - Illegal Content
ces robes devraient etre illegales,Illegal - Illegal Content
cest que fait ce mec est illegal,Illegal - Illegal Content
changer mot de passe apres phishing,Illegal - Illegal Content
charlie hebdo attentat contre charlie le qatar poursuit philippot pour diffamation,Illegal - Illegal Content
citation directe pour diffamation,Illegal - Illegal Content
clients prives phishing emails,Illegal - Illegal Content
concurrence illegale de netflix,Illegal - Illegal Content
condamnation d'élu pour prise illégale d'intérêt,Illegal - Illegal Content
condamnation du maire de compans pour prise illegale dinterets,Illegal - Illegal Content
condamnation exercice illegal expert comptable,Illegal - Illegal Content
condamnation pour trafic de drogue,Illegal - Illegal Content
condamnation trafic de drogue soissons,Illegal - Illegal Content
condamné à ans prison parrains drogue,Illegal - Illegal Content
condamne a mort en indonesie pour crime de drogue le nigerian se fait passer pour un senegalais,Illegal - Illegal Content
condamné pour drogue,Illegal - Illegal Content
condamner une banque pour saisie illégales,Illegal - Illegal Content
configurer antivirus adresse internet phishing,Illegal - Illegal Content
conjoncture artfig l europe accuse la belgique de favoriser les multinationales par un regime fiscal illegal,Illegal - Illegal Content
conseil municipal ou commence la diffamation et combien ca coute,Illegal - Illegal Content
conseils utiles fraudes et phishing mz home aspx,Illegal - Illegal Content
consommation demarches droits nuisances que faire face un voisin qui vous accuse injustement de faire du bruit,Illegal - Illegal Content
contact signalement de contenu illicite,Illegal - Illegal Content
contenus choquants accessibles aux mineurs,Illegal - Illegal Content
convocation suite à plainte pour diffamation,Illegal - Illegal Content
detecteur anti radar illegal,Illegal - Illegal Content
détention illégale,Illegal - Illegal Content
détention illégale d'arme code pénal,Illegal - Illegal Content
deux adolescents meurent d une overdose de drogue,Illegal - Illegal Content
deux mamans piegent un pedophile sur internet,Illegal - Illegal Content
deux sevres actualite politique n contenus articles vous savez mon attachement a la liberte d expression et a mon refus de principe de toute censure mais je note une evolution negative de l expression politique,Illegal - Illegal Content
dictionnaire expression diffamation,Illegal - Illegal Content
diffamation au travail,Illegal - Illegal Content
diffamation au travail contre un responsable,Illegal - Illegal Content
diffamation au travail et dénigrement,Illegal - Illegal Content
difference entre pédophile et délinquants sexuels,Illegal - Illegal Content
directeur d'école pédophile à grenoble,Illegal - Illegal Content
dossier signaler les contenus illicites sur internet,Illegal - Illegal Content
dossiers attaque phishing,Illegal - Illegal Content
dossiers phishing comment reconnaitre une arnaque a email,Illegal - Illegal Content
dossiers phishing comment signaler un mail frauduleux,Illegal - Illegal Content
dossiers phishing url masquee,Illegal - Illegal Content
droits du consommateur phishing comment reagir,Illegal - Illegal Content
e carte bleue phishing,Illegal - Illegal Content
en moldavie il est desormais illegal d etre prorusse,Illegal - Illegal Content
entreprises alerte e mails frauduleux phishing par emails frauduleux pour recuperer des donnees,Illegal - Illegal Content
espace premium actu a l elysee des derives de comportement bien plus graves prise illegale d interets blanchi par la justice l affaire les traitres le pardon hollande l elysee le livre,Illegal - Illegal Content
faq id internet regles suivre eviter vol donnees phishing mot passe,Illegal - Illegal Content
faq que faire face a un contenu illegal pedophile raciste etc,Illegal - Illegal Content
figaro video phishing microsoft une arnaque au succes improbable,Illegal - Illegal Content
flash actu filwww le djihadiste fabien clain a poursuivi france en diffamation,Illegal - Illegal Content
flash actualite culture apres la france d autres pays veulent s attaquer au telechargement illegal,Illegal - Illegal Content
flash actualite culture expo our body l exposition de cadavres est illegale en france,Illegal - Illegal Content
flash actualite culture le site contre le telechargement illegal j aime les artistes pirate,Illegal - Illegal Content
flash actualite culture vieilles charrues viagogo fr condamne pour revente illegale de billets,Illegal - Illegal Content
flash actualite economie accusations de travail force au qatar vinci attaque sherpa en diffamation,Illegal - Illegal Content
flash actualite economie alcool et drogues franchissent les portes des entreprises un phenomene tabou,Illegal - Illegal Content
flash actualite economie etats unis ups poursuivi en justice pour livraison illegale de tabac,Illegal - Illegal Content
flash actualite economie les malheurs du merbau bois chic victime des tronconneuses illegales,Illegal - Illegal Content
flash actualite economie medicaments en ligne fedex poursuivi pour des ventes illegales,Illegal - Illegal Content
flash actualite economie pacifique la peche illegale au thon represente jusqu a millions d euros,Illegal - Illegal Content
flash actualite economie travail illegal la liste noire des entreprises condamnees bientot sur internet,Illegal - Illegal Content
forum affich est ce une tentative de phishing,Illegal - Illegal Content
forum affich fenetres de phishing s ouvrant sans arret,Illegal - Illegal Content
forums topic a supprimer contenu hors charte et choquant,Illegal - Illegal Content
fr fr tuneup illegal,Illegal - Illegal Content
fr fr video actualite parlement des indemnités illégales versées aux élus vi bbsyb,Illegal - Illegal Content
gmail des photos de celebrites nues obtenues grace a du phishing,Illegal - Illegal Content
gmail protection menaces phishing,Illegal - Illegal Content
google chrome une extension pour lutter contre le phishing,Illegal - Illegal Content
groupe facebook escroquerie phishing vol mot passe actualite,Illegal - Illegal Content
hauts de seine floues par l agence de voyages illegale,Illegal - Illegal Content
hentai illegal en france,Illegal - Illegal Content
high tech telechargement illegal plus millions francais piratent contenu,Illegal - Illegal Content
Identifier les arnaques et les emails de phishing,Illegal - Illegal Content
itunes affaire redigi la revente de mp jugee illegale aux etats unis,Illegal - Illegal Content
itunes uk illegal,Illegal - Illegal Content
itunes windows media player illegaux illegal copie privee interdite actualite,Illegal - Illegal Content
ivry sur seine ivry un marche du travail illegal a la porte du magasin de bricolage,Illegal - Illegal Content
j'ai cliqué sur un lien phishing,Illegal - Illegal Content
j'ai été victime de phishing yahoo,Illegal - Illegal Content
jeux poker paris sportifs phishing mails spam webcam sur skype t,Illegal - Illegal Content
la page facebook de lhumoriste marseillais bengous suspendue pour cause de contenu pas assez choquant,Illegal - Illegal Content
le perou sevit contre les mines illegales,Illegal - Illegal Content
Le Premier ministre britannique David Cameron a admis jeudi soir qu'il détenait jusqu'en 2010 des parts dans le fonds fiduciaire de son père immatriculé aux Bahamas après,Illegal - Illegal Content
magazine bruxelles veut un blocage et filtrage pro actif des contenus illicites,Illegal - Illegal Content
magazine les signalements de contenus illicites augmentent a tort,Illegal - Illegal Content
maladie dependance drogues traitement de la dependance a la drogue,Illegal - Illegal Content
maladie psychiatrique apres abus de drogue,Illegal - Illegal Content
management pratique divers le travail illegal,Illegal - Illegal Content
management ressources humaines questions illegales en entretien d embauche,Illegal - Illegal Content
management ressources humaines questions illegales en entretien d embauche politique shtml,Illegal - Illegal Content
management ressources humaines questions illegales en entretien d embauche syndicat shtml,Illegal - Illegal Content
marque vetement non respect condition travail,Illegal - Illegal Content
membre forum general sujet non respect,Illegal - Illegal Content
ne pas respecter clause de non concurrence,Illegal - Illegal Content
pédophilie pape condamne prêtres dépouillent innocents dignité,Illegal - Illegal Content
peines perpetuelles dignite reinsertion sociale,Illegal - Illegal Content
penalité non respect entretien professionnel,Illegal - Illegal Content
pepites pape francois condamne pedophilie et ceux qui depouillent innocents dignite,Illegal - Illegal Content
port d'arme illegal,Illegal - Illegal Content
port illégal d'uniforme,Illegal - Illegal Content
porter plainte pour non respect de contrat,Illegal - Illegal Content
porter plainte pour prise illégale d'interet,Illegal - Illegal Content
porterplainte pour atteinte a la dignite,Illegal - Illegal Content
poste de travailleur handicapé non respecter,Illegal - Illegal Content
poste de travailleur handicapé non respecter que risque l employeur,Illegal - Illegal Content
preavis de fin de bail non respecte,Illegal - Illegal Content
Puis-je mettre sur un site internet des photographies représentant des enfants de l école primaire Est-ce que je peux mettre sur mon site personnel des images et photos que j ai trouvé sur le,Illegal - Illegal Content
quatre ans de prison pour trafic de drogue,Illegal - Illegal Content
questionnaire telechargement illegal,Illegal - Illegal Content
reponse conso telephonie internet facebook avertissements contenus choquants a,Illegal - Illegal Content
risque en cas de non respect du permis de construire,Illegal - Illegal Content
secteur high tech pratique artfig comment signaler les contenus choquants sur internet,Illegal - Illegal Content
sexe illégal,Illegal - Illegal Content
signalement des contenus illicites sur internet le risque dinconstitutionnalite,Illegal - Illegal Content
sub des sites illégales du contenu pornographique,Illegal - Illegal Content
t activites illegales,Illegal - Illegal Content
telecharger liaisons immorales episode vf,Illegal - Illegal Content
vivre sa sexualite victime de violences sexuelles que faire,Illegal - Illegal Content
1 etablissement et association d'aide arret cannabis,Illegal - Illegal Drugs
12 stars francaises drogue,Illegal - Illegal Drugs
15 cannabis plants,Illegal - Illegal Drugs
2 test depistage canabis,Illegal - Illegal Drugs
achat amphétamines en ligne,Illegal - Illegal Drugs
achat ecstasy liquide,Illegal - Illegal Drugs
acheter amphétamines sur internet,Illegal - Illegal Drugs
actualite societe sante cannabis ecstasy cocaine l usage de drogues progresse en france,Illegal - Illegal Drugs
actualite societe sante cocaine cannabis ecstasy qui sont les plus gros consommateurs du monde,Illegal - Illegal Drugs
amour et sexe news articles les reseaux sociaux nouvel acces aux drogues,Illegal - Illegal Drugs
amphetamines dans quels aliments,Illegal - Illegal Drugs
article c est la saison des champignons hallucinogenes,Illegal - Illegal Drugs
article le new york times appelle a la legalisation du cannabis,Illegal - Illegal Drugs
article le port de la drogue streaming vf,Illegal - Illegal Drugs
article le retour en grace de l heroine,Illegal - Illegal Drugs
article le soda et les drogues illegales causent des dommages similaires aux dents,Illegal - Illegal Drugs
