autorisations magasin ou commerce de detail,Food & Drink - Grocery & Food Retailers
Autres commerces de détail spécialisés divers,Food & Drink - Grocery & Food Retailers
bien etre epicerie peruvienne,Food & Drink - Grocery & Food Retailers
bientot une epicerie,Food & Drink - Grocery & Food Retailers
bientot une nouvelle grande epicerie a paris,Food & Drink - Grocery & Food Retailers
bienvenu a mon epicerie,Food & Drink - Grocery & Food Retailers
bilan comptable d un commerce de detail,Food & Drink - Grocery & Food Retailers
boucherie en ligne epicerie,Food & Drink - Grocery & Food Retailers
boutique en ligne epicerie bio,Food & Drink - Grocery & Food Retailers
boutique en ligne epicerie fine,Food & Drink - Grocery & Food Retailers
boutique epicerie en ligne accessoires de cuisine et filtres,Food & Drink - Grocery & Food Retailers
boutique epicerie en ligne beurres de noix tartinades et desserts,Food & Drink - Grocery & Food Retailers
boutique epicerie en ligne conserves et condiments,Food & Drink - Grocery & Food Retailers
boutique epicerie en ligne epices assaisonnements,Food & Drink - Grocery & Food Retailers
c epicerie alimentation au detail,Food & Drink - Grocery & Food Retailers
c epicerie fine pates,Food & Drink - Grocery & Food Retailers
c epicerie sucree,Food & Drink - Grocery & Food Retailers
celeriac boulangere,Food & Drink - Grocery & Food Retailers
chiffre d'affaires commerce de détail france,Food & Drink - Grocery & Food Retailers
chiffres commerce de detail independant,Food & Drink - Grocery & Food Retailers
cid commerce de detail alimentaire,Food & Drink - Grocery & Food Retailers
commander en ligne epicerie fine,Food & Drink - Grocery & Food Retailers
concour meilleur boulanger de france,Food & Drink - Grocery & Food Retailers
confitures artisanales douceurs epicerie fine,Food & Drink - Grocery & Food Retailers
Congelateur professionnel EPICERIE,Food & Drink - Grocery & Food Retailers
conserverie conserves epicerie fine aperitifs entrees boudins a tartiner,Food & Drink - Grocery & Food Retailers
conserves epicerie,Food & Drink - Grocery & Food Retailers
conserves magasin polonais artisanat polonais epicerie polonaise,Food & Drink - Grocery & Food Retailers
content epicerie americaine en ligne,Food & Drink - Grocery & Food Retailers
content gourmandises de camille l epicerie fine en ligne,Food & Drink - Grocery & Food Retailers
content programme de fidelite epicerie italienne en ligne,Food & Drink - Grocery & Food Retailers
convention ape b autres commerces detail en magasin non specialise,Food & Drink - Grocery & Food Retailers
convention collective brochure actualite commerce alimentaire commerce de detail et de gros a predominance alimentaire,Food & Drink - Grocery & Food Retailers
creation epicerie en ligne s,Food & Drink - Grocery & Food Retailers
creer epicerie en ligne,Food & Drink - Grocery & Food Retailers
detail publication vente concours meilleur ouvrier de france boulanger,Food & Drink - Grocery & Food Retailers
detail publication vente devenir boulanger,Food & Drink - Grocery & Food Retailers
details boucherie gms,Food & Drink - Grocery & Food Retailers
details le pain du boulanger,Food & Drink - Grocery & Food Retailers
details offre d emploi autres boucher bouchere paris,Food & Drink - Grocery & Food Retailers
details rap epicerie italienne a paris,Food & Drink - Grocery & Food Retailers
developpement de l epicerie solidaire d endoume,Food & Drink - Grocery & Food Retailers
en magasin la boucherie,Food & Drink - Grocery & Food Retailers
enfield local index restaurants pubs and cafes cafes,Food & Drink - Grocery & Food Retailers
enfield local index restaurants pubs and cafes family pubs,Food & Drink - Grocery & Food Retailers
enfield local index restaurants pubs and cafes grown up restaurants,Food & Drink - Grocery & Food Retailers
enfield local view restaurants pubs and cafes cafes bretts,Food & Drink - Grocery & Food Retailers
enfin ouverture dune boucherie en,Food & Drink - Grocery & Food Retailers
enfin une boulangerie patisserie chocolaterie pour gourmands et diabetiques soucieux de leur equilibre la patisserie eugene,Food & Drink - Grocery & Food Retailers
engagements boulangerie ange agri ethique,Food & Drink - Grocery & Food Retailers
engraissement veau de boucherie conbien de temps,Food & Drink - Grocery & Food Retailers
entreprendre commerces et entreprises a reprendre details reprise annonce reprise ancien hotel restaurant,Food & Drink - Grocery & Food Retailers
entreprendre commerces et entreprises a reprendre details reprise annonce reprise atelier et maison attenants,Food & Drink - Grocery & Food Retailers
entreprendre commerces et entreprises a reprendre details reprise annonce reprise auberge,Food & Drink - Grocery & Food Retailers
environnement epicerie fine,Food & Drink - Grocery & Food Retailers
epicerie arabe plaisir,Food & Drink - Grocery & Food Retailers
epicerie asiatique en lignes,Food & Drink - Grocery & Food Retailers
épicerie bio en ligne,Food & Drink - Grocery & Food Retailers
épicerie chinoise,Food & Drink - Grocery & Food Retailers
epicerie chinoise en ligne,Food & Drink - Grocery & Food Retailers
épicerie commande en ligne,Food & Drink - Grocery & Food Retailers
epicerie en ligne jus de pomme bio,Food & Drink - Grocery & Food Retailers
épicerie en ligne la hongrie,Food & Drink - Grocery & Food Retailers
flash actualite culture a paris une boucherie vegetarienne pour seduire les flexitariens,Food & Drink - Grocery & Food Retailers
flers tous les rayons boutiques bio epicerie sucree,Food & Drink - Grocery & Food Retailers
flers tous les rayons epicerie salee aides culinaires sel et epices aides culinaires,Food & Drink - Grocery & Food Retailers
flers tous les rayons epicerie salee aides culinaires sel et epices epices article sachet poivre noir entier g,Food & Drink - Grocery & Food Retailers
flers tous les rayons epicerie salee bio,Food & Drink - Grocery & Food Retailers
forum affich ebp point de vente commerce de detail,Food & Drink - Grocery & Food Retailers
epicerie en ligne fruits et legumes,Food & Drink - Grocery & Food Retailers
epicerie en ligne parcourir boissons alcoolisées bière,Food & Drink - Grocery & Food Retailers
epicerie en ligne parcourir charcuterie,Food & Drink - Grocery & Food Retailers
boutique epicerie fine biscuits meringues fours secs assortis,Food & Drink - Grocery & Food Retailers
boutique epicerie fine confitures miels,Food & Drink - Grocery & Food Retailers
boutique epicerie fine guimauves confiseries,Food & Drink - Grocery & Food Retailers
boutique epicerie fine toute,Food & Drink - Grocery & Food Retailers
epicerie en ligne parcourir fruits et légumes produits réfrigérés produits végétariens,Food & Drink - Grocery & Food Retailers
epicerie en ligne parcourir viande agneau agneau surgelé,Food & Drink - Grocery & Food Retailers
levures de boulangerie,Food & Drink - Grocery & Food Retailers
s bitche c epicerie salee pates riz puree pates,Food & Drink - Grocery & Food Retailers
france reichstett restaurant cafe hotel restaurant de paris,Food & Drink - Grocery & Food Retailers
france riverie restaurant cafe les archers de la table ronde,Food & Drink - Grocery & Food Retailers
france royat restaurant cafe burgers bagels,Food & Drink - Grocery & Food Retailers
francais epicerie en ligne,Food & Drink - Grocery & Food Retailers
franchise casino supermarches et hypermarches,Food & Drink - Grocery & Food Retailers
Grands magasins et hypermarchés,Food & Drink - Grocery & Food Retailers
hautmont alimentation boulangerie patisserie,Food & Drink - Grocery & Food Retailers
itm paris une boulangerie parisienne petrissage a bras petrin fours image print,Food & Drink - Grocery & Food Retailers
l epicerie amboise menu,Food & Drink - Grocery & Food Retailers
le perreux sur marne boulangerie garochau rue de la station,Food & Drink - Grocery & Food Retailers
le petit boulanger film,Food & Drink - Grocery & Food Retailers
le petit cafe du matin,Food & Drink - Grocery & Food Retailers
le plessis bouchard boucherie charcuterie boucherie du village,Food & Drink - Grocery & Food Retailers
le relais du boucher,Food & Drink - Grocery & Food Retailers
les bons plans supermarches,Food & Drink - Grocery & Food Retailers
livraison épicerie commande en ligne,Food & Drink - Grocery & Food Retailers
marché epicerie en ligne,Food & Drink - Grocery & Food Retailers
nord commerce de detail de fruits et legumes a wattrelos a,Food & Drink - Grocery & Food Retailers
page thematique catalogue vente internet en ligne epicerie anglaise ecossaise irlandaise americaine,Food & Drink - Grocery & Food Retailers
port la nouvelle alimentation epicerie,Food & Drink - Grocery & Food Retailers
portal j blogspot com cafe,Food & Drink - Grocery & Food Retailers
pour ouvrire un epicerie,Food & Drink - Grocery & Food Retailers
pour vendre du tabac une epicerie,Food & Drink - Grocery & Food Retailers
produit epicerie portugaise en ligne,Food & Drink - Grocery & Food Retailers
quatite levure boulangere et chimique,Food & Drink - Grocery & Food Retailers
quebec epicerie ou depanneur ou a ou vendre bgkr jsa,Food & Drink - Grocery & Food Retailers
quebec epiceries de quartier et depanneurs,Food & Drink - Grocery & Food Retailers
recherche commerce détail,Food & Drink - Grocery & Food Retailers
restaurant details restaurant hotel du commerce,Food & Drink - Grocery & Food Retailers
restauration boulangere,Food & Drink - Grocery & Food Retailers
résumé du métier boulanger pour enfant,Food & Drink - Grocery & Food Retailers
retailer boulanger com,Food & Drink - Grocery & Food Retailers
service traiteur de la boucherie anzelin,Food & Drink - Grocery & Food Retailers
Services en brasserie-café,Food & Drink - Grocery & Food Retailers
services epicerie depot de pain,Food & Drink - Grocery & Food Retailers
services epicerie pour vous simplifier les vacances,Food & Drink - Grocery & Food Retailers
services l epicerie le depot de pains,Food & Drink - Grocery & Food Retailers
services restaurant epicerie du camping,Food & Drink - Grocery & Food Retailers
services se restaurer sur le camping snack bar et epicerie,Food & Drink - Grocery & Food Retailers
seurre alimentation boulangerie patisserie,Food & Drink - Grocery & Food Retailers
table boucherie,Food & Drink - Grocery & Food Retailers
tableau de bord boulangerie,Food & Drink - Grocery & Food Retailers
tables dhotes notre epicerie,Food & Drink - Grocery & Food Retailers
tag commerce de detail alimentaire,Food & Drink - Grocery & Food Retailers
tag épicerie,Food & Drink - Grocery & Food Retailers
tag epicerie anglaise,Food & Drink - Grocery & Food Retailers
tag epicerie en ligne,Food & Drink - Grocery & Food Retailers
toul tous les rayons epicerie salee conserves de legumes legumes pour salade,Food & Drink - Grocery & Food Retailers
uber lance corner store une epicerie ambulante avec livraison gratuite,Food & Drink - Grocery & Food Retailers
var commerce de detail de fruits et legumes ca,Food & Drink - Grocery & Food Retailers
vente de produits de la provence epicerie fine en ligne trouver des idees de cadeaux pas chers en provence vers var,Food & Drink - Grocery & Food Retailers
vente de produits de la provence epicerie fine en ligne vente de fruits secs et fruits confits pas chers vers var,Food & Drink - Grocery & Food Retailers
vente en ligne de produit epicerie italien les boissons vins et alcools,Food & Drink - Grocery & Food Retailers
vente en ligne de produit epicerie italien les boissons vins et alcools vins pates casareccia de cetto,Food & Drink - Grocery & Food Retailers
vente en ligne de produit epicerie italien les cafes italiens,Food & Drink - Grocery & Food Retailers
vitrine a viande de boucherie,Food & Drink - Grocery & Food Retailers
vivre dune épicerie sociale,Food & Drink - Grocery & Food Retailers
wp content uploads commerce de détail de fruits et légumes pdf,Food & Drink - Grocery & Food Retailers
1 sirops bio,Food & Drink - Non-Alcoholic Beverages
1 Tisane fenouil,Food & Drink - Non-Alcoholic Beverages
20 façons d’utiliser le Coca Cola,Food & Drink - Non-Alcoholic Beverages
a michel bontemps mes secrets de sante par les plantes tisanes et medecines naturelles,Food & Drink - Non-Alcoholic Beverages
a propos jus de legumes jus de fruits,Food & Drink - Non-Alcoholic Beverages
A quelle heure boire des jus de légumes ?,Food & Drink - Non-Alcoholic Beverages
abstinence alcool et basophiles 0 0,Food & Drink - Non-Alcoholic Beverages
achat en ligne jus de fruits frais,Food & Drink - Non-Alcoholic Beverages
acheter c lipton ice tea ml,Food & Drink - Non-Alcoholic Beverages
acheter jus de legumes boissons alimentation,Food & Drink - Non-Alcoholic Beverages
actualites campagne nestea dans metro parisien article,Food & Drink - Non-Alcoholic Beverages
actus le mocktail le nouveau cocktail sain et ultra bon,Food & Drink - Non-Alcoholic Beverages
adapté pour tout personne powerade,Food & Drink - Non-Alcoholic Beverages
alimentation boissons boisson non alcoolisee cafe maison du cafe l or,Food & Drink - Non-Alcoholic Beverages
amnesty cafés thés tisanes,Food & Drink - Non-Alcoholic Beverages
amnesty home les tisanes à la menthe en distributeur bois,Food & Drink - Non-Alcoholic Beverages
amnesty home service à tisanes hildegarde de bingen,Food & Drink - Non-Alcoholic Beverages
analyse sirop avec carbocisteine,Food & Drink - Non-Alcoholic Beverages
ananas au sirop,Food & Drink - Non-Alcoholic Beverages
annonce alimentation bio superbe coffret infusion tisane bio quot plus de tasses quot,Food & Drink - Non-Alcoholic Beverages
annonce distributeur bonbons coca cola vintage,Food & Drink - Non-Alcoholic Beverages
apéritifs infusion,Food & Drink - Non-Alcoholic Beverages
appareil pour faire des jus de légumes,Food & Drink - Non-Alcoholic Beverages
archives boissons alcoolisees ou non index,Food & Drink - Non-Alcoholic Beverages
article aliments par propoints boissons alcoolisees et non alcoolisees,Food & Drink - Non-Alcoholic Beverages
article bienfaits de la biere sans alcool,Food & Drink - Non-Alcoholic Beverages
article le mocktail ou quand le sans alcool envahit les bars a,Food & Drink - Non-Alcoholic Beverages
article le sirop de bleuet,Food & Drink - Non-Alcoholic Beverages
article le top des tisanes minceur,Food & Drink - Non-Alcoholic Beverages
article les bienfaits des thes et tisanes,Food & Drink - Non-Alcoholic Beverages
article les infusions contre la constipation,Food & Drink - Non-Alcoholic Beverages
article les infusions contre le rhume,Food & Drink - Non-Alcoholic Beverages
article les infusions et leurs bienfaits,Food & Drink - Non-Alcoholic Beverages
article les infusions un plaisir au naturel,Food & Drink - Non-Alcoholic Beverages
article les jus de fruits,Food & Drink - Non-Alcoholic Beverages
article les meilleures infusions antioxydantes,Food & Drink - Non-Alcoholic Beverages
article les meilleures infusions contre la gastrite,Food & Drink - Non-Alcoholic Beverages
article les meilleures infusions contre la retention d eau,Food & Drink - Non-Alcoholic Beverages
article les meilleures tisanes pour reduire la cellulite,Food & Drink - Non-Alcoholic Beverages
article les tisanes de grand mere toujours aussi efficaces,Food & Drink - Non-Alcoholic Beverages
article les tisanes de monsieur hiver,Food & Drink - Non-Alcoholic Beverages
article les tisanes depuratives a,Food & Drink - Non-Alcoholic Beverages
article les tisanes infusions et autres plantes medicinales chinoises,Food & Drink - Non-Alcoholic Beverages
article les tisanes infusions pour mon enfant,Food & Drink - Non-Alcoholic Beverages
article les tisanes pour l enfant,Food & Drink - Non-Alcoholic Beverages
article mocktail de mangue ou cocktail sans alcool,Food & Drink - Non-Alcoholic Beverages
article paris des agriculteurs vont vendre tonnes de fruits et legumes au juste prix,Food & Drink - Non-Alcoholic Beverages
article top cher les boissons non alcoolisees,Food & Drink - Non-Alcoholic Beverages
articles recettes jus de legumes,Food & Drink - Non-Alcoholic Beverages
associations de legumes ne pas faire dans les jus,Food & Drink - Non-Alcoholic Beverages
atout sante de jus de legumes et fruits,Food & Drink - Non-Alcoholic Beverages
avis powerade sport,Food & Drink - Non-Alcoholic Beverages
avis sans alcool bieres biere blonde sans alcool,Food & Drink - Non-Alcoholic Beverages
Best juice mocktails,Food & Drink - Non-Alcoholic Beverages
best mocktail recepies,Food & Drink - Non-Alcoholic Beverages
beverage solutions nestea premium selection,Food & Drink - Non-Alcoholic Beverages
bien boire de l'eau,Food & Drink - Non-Alcoholic Beverages
bien etre cinq tisanes pour remplacer le cafe et se donner un coup de fouet,Food & Drink - Non-Alcoholic Beverages
bien etre medecines douces se soigner autrement articles et dossiers faites une pause tisane,Food & Drink - Non-Alcoholic Beverages
bien etre medecines douces se soigner autrement articles et dossiers la verite sur les bienfaits des tisanes,Food & Drink - Non-Alcoholic Beverages
bien etre medecines douces se soigner autrement articles et dossiers la verite sur les bienfaits des tisanes infusion tisane decoction c est la meme chose,Food & Drink - Non-Alcoholic Beverages
bien etre prevention hygiene de vie articles et dossiers les vertus des tisanes detox,Food & Drink - Non-Alcoholic Beverages
bien manger alimentation jus de legumes tres bons pour la sante,Food & Drink - Non-Alcoholic Beverages
bienfait de la bière sans alcool,Food & Drink - Non-Alcoholic Beverages
bienfait des jus de fruits frais,Food & Drink - Non-Alcoholic Beverages
bienfaits des jus de legumes et fruits,Food & Drink - Non-Alcoholic Beverages
bienfaits jus de fruits preferes,Food & Drink - Non-Alcoholic Beverages
biere blanche sans alcool,Food & Drink - Non-Alcoholic Beverages
Biere forte sans alcool,Food & Drink - Non-Alcoholic Beverages
bière krombacher sans alcool,Food & Drink - Non-Alcoholic Beverages
biere sans alcool,Food & Drink - Non-Alcoholic Beverages
bière sans alcool avis,Food & Drink - Non-Alcoholic Beverages
bière sans alcool bienfaits,Food & Drink - Non-Alcoholic Beverages
biere sans alcool calories,Food & Drink - Non-Alcoholic Beverages
Biere sans alcool damm,Food & Drink - Non-Alcoholic Beverages
bière sans alcool enceinte,Food & Drink - Non-Alcoholic Beverages
blog alimentation les jus de legumes bio,Food & Drink - Non-Alcoholic Beverages
boire powerade avant marathon,Food & Drink - Non-Alcoholic Beverages
Boisson lactée,Food & Drink - Non-Alcoholic Beverages
boissons ameres non alcoolisées,Food & Drink - Non-Alcoholic Beverages
boissons boissons froides nestea lemon,Food & Drink - Non-Alcoholic Beverages
boissons boissons froides nestea the glace peche,Food & Drink - Non-Alcoholic Beverages
boissons energisante powerade,Food & Drink - Non-Alcoholic Beverages
boissons non alcoolisees les jus de fruits,Food & Drink - Non-Alcoholic Beverages
boissons non alcoolisees les sirops,Food & Drink - Non-Alcoholic Beverages
c cocktails mocktails,Food & Drink - Non-Alcoholic Beverages
c epices tisanes compotes,Food & Drink - Non-Alcoholic Beverages
c jus de fruits et legumes frais,Food & Drink - Non-Alcoholic Beverages
c photo easter cocktails and mocktails,Food & Drink - Non-Alcoholic Beverages
calories sodas et boissons non alcoolisees,Food & Drink - Non-Alcoholic Beverages
categorie boissons non alcoolisees,Food & Drink - Non-Alcoholic Beverages
ce qui se passe dans votre corps coca cola,Food & Drink - Non-Alcoholic Beverages
changez d habitudes alimentaires jus de legumes sante,Food & Drink - Non-Alcoholic Beverages
cocktail de jus de legumes,Food & Drink - Non-Alcoholic Beverages
Cocktail redbull couleur ice tea,Food & Drink - Non-Alcoholic Beverages
cocktails et boissons jus de fruits legumes cocktails vitamines,Food & Drink - Non-Alcoholic Beverages
combien coute une licence de debit de boisson non alcoolisée,Food & Drink - Non-Alcoholic Beverages
combien peut on boire du jus de legumes par jour,Food & Drink - Non-Alcoholic Beverages
comment utiliser une décoction,Food & Drink - Non-Alcoholic Beverages
composition nutritionnelle biere sans alcool,Food & Drink - Non-Alcoholic Beverages
conseil tisanes vrac specificites,Food & Drink - Non-Alcoholic Beverages
conseiller machine jus de fruits et légumes,Food & Drink - Non-Alcoholic Beverages
conseils decoction infusion queues cerises,Food & Drink - Non-Alcoholic Beverages
conseils minceur tisanes qui font maigrir,Food & Drink - Non-Alcoholic Beverages
conseils tisanes,Food & Drink - Non-Alcoholic Beverages
conséquence de la consommation de jus de fruits,Food & Drink - Non-Alcoholic Beverages
conservateur naturel pour jus de fruits,Food & Drink - Non-Alcoholic Beverages
conserves de fruits et sirops jus de citron,Food & Drink - Non-Alcoholic Beverages
consommation de jus de fruits,Food & Drink - Non-Alcoholic Beverages
coupon powerade,Food & Drink - Non-Alcoholic Beverages
danger bière sans alcool,Food & Drink - Non-Alcoholic Beverages
economie comment la biere sans alcool est elle produite,Food & Drink - Non-Alcoholic Beverages
en quelle annee a ete invente le coca cola en France,Food & Drink - Non-Alcoholic Beverages
en route pour rio avec powerade,Food & Drink - Non-Alcoholic Beverages
enfants de sucre smoothies jus de fruits,Food & Drink - Non-Alcoholic Beverages
entreprises infusions et tisanes,Food & Drink - Non-Alcoholic Beverages
epicerie fine boissons thes infusions,Food & Drink - Non-Alcoholic Beverages
exercice de probabilité il est interdit de conduire avec un aux d'alcool égal ou supérieur à 0 5,Food & Drink - Non-Alcoholic Beverages
extracteur de jus de fruits et légumes,Food & Drink - Non-Alcoholic Beverages
flash actualite economie coca cola redressement fiscal de plus de milliards de dollars aux etats unis,Food & Drink - Non-Alcoholic Beverages
flash actualite economie mexique coca cola retire definitivement une pub jugee raciste,Food & Drink - Non-Alcoholic Beverages
fleur de framboisier infusion,Food & Drink - Non-Alcoholic Beverages
forum biere sans alcool avec alcool attention danger fd,Food & Drink - Non-Alcoholic Beverages
forum biere sans alcool on peut,Food & Drink - Non-Alcoholic Beverages
aliments boissons non alcoolisees,Food & Drink - Non-Alcoholic Beverages
cuisine et vins foodtips recettes express de jus et tartinades pour lapéro ar bbrfgcq,Food & Drink - Non-Alcoholic Beverages
partenaire powerade,Food & Drink - Non-Alcoholic Beverages
powerade choisir sa boisson,Food & Drink - Non-Alcoholic Beverages
powerade produits,Food & Drink - Non-Alcoholic Beverages
recette jus de legumes centrifuges pour le matin,Food & Drink - Non-Alcoholic Beverages
recherche bière sans alcool en fut,Food & Drink - Non-Alcoholic Beverages
frage lipton vs nestea,Food & Drink - Non-Alcoholic Beverages
fren bière sans alcool,Food & Drink - Non-Alcoholic Beverages
ice lemon tea,Food & Drink - Non-Alcoholic Beverages
industrie services services conseils pour les jo de rio powerade soutient les sportifs par le financement participatif,Food & Drink - Non-Alcoholic Beverages
journal lec industrie et services pour rio powerade soutient les sportifs par le financement participatif,Food & Drink - Non-Alcoholic Beverages
la boisson isotonique powerade disponible en version poudre,Food & Drink - Non-Alcoholic Beverages
la boisson powerade est elle bonne pour la sante,Food & Drink - Non-Alcoholic Beverages
le petit cycle de l'eau épuration,Food & Drink - Non-Alcoholic Beverages
le petit jus du jour,Food & Drink - Non-Alcoholic Beverages
legends fruit ice tea recipe,Food & Drink - Non-Alcoholic Beverages
lemon balm ice tea,Food & Drink - Non-Alcoholic Beverages
lemon fiber ice tea mix,Food & Drink - Non-Alcoholic Beverages
lemon grass apricot ice tea,Food & Drink - Non-Alcoholic Beverages
les alcools bieres et cidres bieres sans alcool,Food & Drink - Non-Alcoholic Beverages
les astuces de grand mere infusion miel et citron,Food & Drink - Non-Alcoholic Beverages
les bien fait des infusion,Food & Drink - Non-Alcoholic Beverages
les boissons bieres sans alcool,Food & Drink - Non-Alcoholic Beverages
les boissons boissons non alcoolisees,Food & Drink - Non-Alcoholic Beverages
les boissons sirop de gingembre,Food & Drink - Non-Alcoholic Beverages
les news la biere sans alcool on l aime sans moderation,Food & Drink - Non-Alcoholic Beverages
lipton ice tea framboise,Food & Drink - Non-Alcoholic Beverages
manger trop de oranges jus de fruits,Food & Drink - Non-Alcoholic Beverages
marques biere sans alcool,Food & Drink - Non-Alcoholic Beverages
meilleurs jus de légumes bon pour la santé,Food & Drink - Non-Alcoholic Beverages
memorable mocktail,Food & Drink - Non-Alcoholic Beverages
n boissons jus softs t jus de fruits legumes,Food & Drink - Non-Alcoholic Beverages
n boissons jus softs t jus de fruits legumes b bio frutti a jus de fruits,Food & Drink - Non-Alcoholic Beverages
nestea gazeux ou pas,Food & Drink - Non-Alcoholic Beverages
nestea prix,Food & Drink - Non-Alcoholic Beverages
passionnade jus de fruits de la passion maison,Food & Drink - Non-Alcoholic Beverages
perdre du poids avec des jus de fruits et de légumes,Food & Drink - Non-Alcoholic Beverages
petit dejeuner recettes de jus de fruits de saison,Food & Drink - Non-Alcoholic Beverages
pourcentage alcool biere sans alcool,Food & Drink - Non-Alcoholic Beverages
powerade bienfait,Food & Drink - Non-Alcoholic Beverages
préparation des jus de fruits,Food & Drink - Non-Alcoholic Beverages
quantite de jus dans un citron,Food & Drink - Non-Alcoholic Beverages
que faire avec le jus des fruits au sirop,Food & Drink - Non-Alcoholic Beverages
quel appareil choisir pour des jus de fruits frais maison,Food & Drink - Non-Alcoholic Beverages
quel jus de fruit et legume pour la sante,Food & Drink - Non-Alcoholic Beverages
quel jus de fruits pour energie,Food & Drink - Non-Alcoholic Beverages
quelle est la composition secrete du coca cola,Food & Drink - Non-Alcoholic Beverages
