0 blue jeans,Shopping - Apparel
shopping produit brother max scoop siege pour chaise haute bleu,Shopping - Parenting Products
shopping produit friedola baignoire de douche gonflable pour bebe x x cm,Shopping - Parenting Products
shopping produit motorola babyphone video avec ecran mbp blanc noir,Shopping - Parenting Products
shopping produit pomfitis batya bebe coussin baignoire baigneuse et siege de bain vert,Shopping - Parenting Products
shopping produit pomfitis papillon bebe siege de bain pour baignoire anneau rose,Shopping - Parenting Products
shopping produit pomfitis shibaba siege de bain rembourre baignoire baigneuse pour bebe toddler rose,Shopping - Parenting Products
shopping produit summer infant baignoire spa pour bebe lil luxuries whirlpool,Shopping - Parenting Products
smartphone aide devoirs scolaires cahier de vacances eme soutien scolaire mathematiques,Shopping - Parenting Products
table a changer bebe bon coin dans 37,Shopping - Parenting Products
table a langer amplitude bebe confort,Shopping - Parenting Products
table a langer avec baignoire bebe 9,Shopping - Parenting Products
table activité bébé gonflable,Shopping - Parenting Products
table activités bébé,Shopping - Parenting Products
table chaise bar table haute,Shopping - Parenting Products
vente flash video babyphone motorola a euros livraison gratuite au lieu de plus de euros,Shopping - Parenting Products
vitrine poussettes de marche,Shopping - Parenting Products
vitrine poussettes de marche p prods,Shopping - Parenting Products
vitrine poussettes p prods,Shopping - Parenting Products
vitrine poussettes prods mark cabriole bebe,Shopping - Parenting Products
1 gode ceinture,Shopping - Sex Toys
2 lubrifiant vaginaux,Shopping - Sex Toys
2 masturbateur,Shopping - Sex Toys
4 gel et lubrifiant,Shopping - Sex Toys
5 lubrifiant à base d'eau vendu en pharmacie,Shopping - Sex Toys
a quoi servent boules geisha,Shopping - Sex Toys
accessoires bondage en general barre decartement menottes p,Shopping - Sex Toys
accessoires bondage en general menottes suspension cuir p,Shopping - Sex Toys
accessoires coquins et bdsm menottes volupte,Shopping - Sex Toys
accessoires de boudoir menottes colliers,Shopping - Sex Toys
accessoires erotiques et sextoys de zaza,Shopping - Sex Toys
accessoires érotiques sextoys,Shopping - Sex Toys
accessoires masturbateur masturbateur penis p,Shopping - Sex Toys
accessoires stimulateur c,Shopping - Sex Toys
accueil masturbateurs vagin artificiel,Shopping - Sex Toys
achat jouet coquins gadget sexuel sextoys,Shopping - Sex Toys
af jouet sexuel couple,Shopping - Sex Toys
af jouet sexuel vibrant pour homme,Shopping - Sex Toys
af jouets sexuel gay,Shopping - Sex Toys
af jouets sexuel pour couple,Shopping - Sex Toys
af jouets sexuel pour couple exciter,Shopping - Sex Toys
af jouets sexuels pour adultes,Shopping - Sex Toys
anal lubrifiants et sprays xsl,Shopping - Sex Toys
anneau masturbateur,Shopping - Sex Toys
anneau sexe masturbateur homme,Shopping - Sex Toys
anneaux vibrants sextoy durex play vibrations,Shopping - Sex Toys
apparel jouet sexuel,Shopping - Sex Toys
article les sextoys anaux,Shopping - Sex Toys
article les sextoys pour femme,Shopping - Sex Toys
article lubrifiant energisant superher,Shopping - Sex Toys
article lubrifiant intime mangeable,Shopping - Sex Toys
article lubrifiant pjur we vibe,Shopping - Sex Toys
article masturbateur fessier en,Shopping - Sex Toys
article masturbateur le vagin vibrant,Shopping - Sex Toys
article masturbateur vaginal yasmine,Shopping - Sex Toys
article pour pedaler pour le plaisir le dildo bike ou velo godemiche,Shopping - Sex Toys
articles bdsm cravache fouet c,Shopping - Sex Toys
articles erotiques~pn~gode ceintures harnais doubles~affid~~catid~~pg~,Shopping - Sex Toys
articles gode ceinture,Shopping - Sex Toys
Autres jouets sexuel,Shopping - Sex Toys
bien etre huiles de massage lubrifiants,Shopping - Sex Toys
bien etre lubrifiant anal,Shopping - Sex Toys
bien etre lubrifiant comestible,Shopping - Sex Toys
bien etre lubrifiant lubrifiant en,Shopping - Sex Toys
bien etre lubrifiant lubrifiant pour femme,Shopping - Sex Toys
bienetre sextoys xsl,Shopping - Sex Toys
bientot les sextoys arrivent sur la boutique diffusion,Shopping - Sex Toys
boite masturbateurs tenga surfer,Shopping - Sex Toys
boutique adameteve fr nav mode sex toys f masturbateur,Shopping - Sex Toys
boutique categories masturbateurs,Shopping - Sex Toys
boutique la selection masturbateur pour homme egg stepper,Shopping - Sex Toys
boutique sex toys fetish soft fouets soft cravache,Shopping - Sex Toys
boutique sex toys sex toy femme chapelet chaine anale,Shopping - Sex Toys
boutique sexy categories fouets cravaches,Shopping - Sex Toys
catalogue livres litterature litterature erotique j etais devenue le jouet sexuel de ma bonne,Shopping - Sex Toys
categorie jouet sexuel dvd,Shopping - Sex Toys
ce gode black propose cm d erection pour de jubilatoires instants de plaisir,Shopping - Sex Toys
ce gode black tres realiste vous procurera beaucoup d orgasmes grace a ses cm d erection,Shopping - Sex Toys
ce gode ceinture a ete concu pour les relations sexuelles entre femmes,Shopping - Sex Toys
choisir boules geisha pas simple quil ny parait,Shopping - Sex Toys
coffret masturbateurs travel trio p,Shopping - Sex Toys
comment ce servir des boules de geisha,Shopping - Sex Toys
comment choisir des boules de geisha,Shopping - Sex Toys
conseil sur achat sextoys,Shopping - Sex Toys
conseils connaitre les lubrifiants,Shopping - Sex Toys
conseils lubrifiants et gels intimes,Shopping - Sex Toys
conseils parapharmacie sexualite quel lubrifiant pour plus de confort,Shopping - Sex Toys
conseils technicite des lubrifiants,Shopping - Sex Toys
destockage sextoys masturbateurs,Shopping - Sex Toys
dexeryl comme lubrifiant pour penetration,Shopping - Sex Toys
dexeryl comme lubrifiant vaginal,Shopping - Sex Toys
différence entre lubrifiant et vaseline,Shopping - Sex Toys
different masturbateur pour homme,Shopping - Sex Toys
en sextoys selection pour lui masturbateurs,Shopping - Sex Toys
fouet cravache martinet menottes cravache montpellier,Shopping - Sex Toys
fr accessoires boutique erotique masturbateurs,Shopping - Sex Toys
fr accessoires magnet dali le grand masturbateur,Shopping - Sex Toys
fr gode ceinture,Shopping - Sex Toys
fr gode ceinture anal,Shopping - Sex Toys
fr gode ceinture anal vibrant cm,Shopping - Sex Toys
fr gode ceinture coeur,Shopping - Sex Toys
fr gode ceinture creux extra long fetish fantasy,Shopping - Sex Toys
fr gode ceinture creux extra long vibrant,Shopping - Sex Toys
fr gode ceinture creux hollow strap on flesh,Shopping - Sex Toys
fr gode ceinture creux latex cm,Shopping - Sex Toys
fr gode ceinture creux noir limited edition,Shopping - Sex Toys
fr gode ceinture creux spoody,Shopping - Sex Toys
fr godes jet dildo x cm,Shopping - Sex Toys
fr jouet sexuel,Shopping - Sex Toys
fr jouet sexuel love dice kama sutra,Shopping - Sex Toys
fr jouets intimes masturbateurs stimulateur de penis travel pussy,Shopping - Sex Toys
fr jouets olga double dildo,Shopping - Sex Toys
fr jouets pour la satisfaction sexuelle,Shopping - Sex Toys
fr lovense max masturbateur connecte,Shopping - Sex Toys
fr marketing promotions boules de geisha glee mauve,Shopping - Sex Toys
fr masturbateur,Shopping - Sex Toys
fr produit chaine anale bubble hook malesation,Shopping - Sex Toys
fr sextoys nos sextoys les rabbits gaine rabbit fantasy x tension vibrante pipedream,Shopping - Sex Toys
fr sextoys nos sextoys les rabbits vibromasseur dorcel orgasmic rabbit,Shopping - Sex Toys
fr sextoys nos sextoys les rabbits vibromasseur rabbit brad rose,Shopping - Sex Toys
fr sextoys nos sextoys les rabbits vibromasseur rabbit lady bi violet,Shopping - Sex Toys
fr sextoys nos sextoys les rabbits vibromasseur rabbit silicone tulipe noir,Shopping - Sex Toys
fr sexualite sextoys article les boules de geisha,Shopping - Sex Toys
galerie boules de geisha,Shopping - Sex Toys
grossiste les rabbits,Shopping - Sex Toys
homme preservatifs lubrifiants,Shopping - Sex Toys
itm vagin masturbateur homme,Shopping - Sex Toys
le plaisir des sex toys,Shopping - Sex Toys
les bon lubrifiant intime naturel,Shopping - Sex Toys
les menottes de l amour,Shopping - Sex Toys
loveshop chaine anale chaine anale mauve mc,Shopping - Sex Toys
male sex toy,Shopping - Sex Toys
manix gel lubrifiant avis,Shopping - Sex Toys
manix gel lubrifiant pure ml,Shopping - Sex Toys
manix gel lubrifiant sachets,Shopping - Sex Toys
manix lubrifiant p,Shopping - Sex Toys
masturbateur anal,Shopping - Sex Toys
nav mode sex toys f durex,Shopping - Sex Toys
nav mode sex toys f ensemble lingerie sexy,Shopping - Sex Toys
nav mode sex toys f lingerie coquine,Shopping - Sex Toys
nav mode sex toys f poppers,Shopping - Sex Toys
new index php sextoys stimulateurs prostate private dancer,Shopping - Sex Toys
news sextoys masturbateur a ventouse,Shopping - Sex Toys
news sextoys masturbateur vagin vibrant,Shopping - Sex Toys
p durex gel play hot lubrifiant ml,Shopping - Sex Toys
p durex play gel lubrifiant hot effet chauffant ml,Shopping - Sex Toys
p durex play gel lubrifiant sensations extra doux ml,Shopping - Sex Toys
p durex sensilube fluide lubrifiant intime ml,Shopping - Sex Toys
pas cher menottes patere,Shopping - Sex Toys
petit masturbateur de poche pas cher,Shopping - Sex Toys
petit masturbateur pas cher,Shopping - Sex Toys
pharmacie sexe aphrodisiaques stimulants sexuels femme homme stimulateur sexuel extreme p,Shopping - Sex Toys
portal ventes privees durex lubrifiants durex,Shopping - Sex Toys
portal ventes privees durex lubrifiants durex prod durex pack lubrifiants,Shopping - Sex Toys
poupee gonflable beyonce masturbateur,Shopping - Sex Toys
poupee gonflable mayumi masturbateur,Shopping - Sex Toys
pour elle vibromasseur flexible,Shopping - Sex Toys
pour elle vibromasseur push it,Shopping - Sex Toys
premier gode ceinture,Shopping - Sex Toys
preservatif lubrifiant plaisir hygiene intime sexualite hygiene p,Shopping - Sex Toys
Preservatif sans latex avec lubrifiant,Shopping - Sex Toys
préservatif sans lubrifiant,Shopping - Sex Toys
preservatifs compatibles avec lubrifiants a base siliicones,Shopping - Sex Toys
pret a porter boutique erotique demarkt bondage au lit jeux erotique jouet sexuel f auc,Shopping - Sex Toys
pret a porter boutique erotique dildo etanche vibromasseur pour point g stimulateu f xcs,Shopping - Sex Toys
pret a porter boutique erotique double butt lady masturbateur dildo penis plug ana f auc,Shopping - Sex Toys
pret a porter boutique erotique femme frequence g spot vibrant jouet sexuel ros f eth,Shopping - Sex Toys
pret a porter boutique erotique sextoys les rabbits l,Shopping - Sex Toys
pret a porter boutique erotique yonger oeuf masturbateur egg tenga jouet sexuel f auc,Shopping - Sex Toys
produit les reves d anais gigoteuse evolutive chaude manches amovibles rabbits a cm aaf,Shopping - Sex Toys
que choisir comme sextoys,Shopping - Sex Toys
quel est la meilleure attache godet minipelle,Shopping - Sex Toys
quel est le meilleur gel lubrifiant plaisir,Shopping - Sex Toys
quel est le meilleur sextoy de lannee,Shopping - Sex Toys
quel est le plus vigoureux en geranium le jeune plant ou le godet,Shopping - Sex Toys
quel gode utiliser pendant grossesse ds,Shopping - Sex Toys
quel lubrifiant acheter pendant grossesse,Shopping - Sex Toys
quel lubrifiant vaseline s,Shopping - Sex Toys
quel lubrifiants vaginal choisir,Shopping - Sex Toys
quelle lubrifiant il faut utiliser pour une penetration anal,Shopping - Sex Toys
rabbit vibromasseur rotatif,Shopping - Sex Toys
recherche ceinture double gode ceinture latex,Shopping - Sex Toys
recherche ceinture gode ceinture creux vibrant,Shopping - Sex Toys
recherche ceinture gode ceinture magic flesh,Shopping - Sex Toys
rmc mini vibromasseur pur plaisir,Shopping - Sex Toys
rmc sextoys selection pour lui masturbateurs,Shopping - Sex Toys
rmc sextoys selection pour lui masturbateurs masturbateur anal yasmine,Shopping - Sex Toys
rmc sextoys selection pour lui masturbateurs masturbateur hydro apollo,Shopping - Sex Toys
rubrique cravaches matraques,Shopping - Sex Toys
s boules de geisha pour muscler le perinee,Shopping - Sex Toys
sex shop categories masturbateurs,Shopping - Sex Toys
sex shop gay accessoires masturbateur c,Shopping - Sex Toys
sex shop produit menottes cuir cuisses poignets,Shopping - Sex Toys
sex shop produit menottes cuir extremeline,Shopping - Sex Toys
sex shop produit menottes de chevilles cuir divinity,Shopping - Sex Toys
sex shop produit menottes de chevilles metal spartacus,Shopping - Sex Toys
sex shop produit menottes de pouces spartacus,Shopping - Sex Toys
sex toy definition jouet sexuel fr,Shopping - Sex Toys
sexe shop les menottes,Shopping - Sex Toys
sexe toy comment se servir,Shopping - Sex Toys
sexe toye a vitrine magique,Shopping - Sex Toys
sexeshop speak pussy masturbateur vocal,Shopping - Sex Toys
sexo sexualite bien choisir son lubrifiant,Shopping - Sex Toys
sexo sexualite bien choisir son sex toy les vibromasseurs,Shopping - Sex Toys
sexo sexualite faut il oser les jouets sexuels,Shopping - Sex Toys
sexshop coquin  cravache fouet cuir,Shopping - Sex Toys
sextoys femme jouet sexuel pas cher sex toys vibromasseur coussin vibro,Shopping - Sex Toys
sextoys femme jouet sexuel pas cher sextoys masturbation femme,Shopping - Sex Toys
sextoys homme jouet sexuel masculin,Shopping - Sex Toys
tag boutique sextoy,Shopping - Sex Toys
tag gode ceinture page,Shopping - Sex Toys
tags gode ceinture,Shopping - Sex Toys
test de jouet sexuel,Shopping - Sex Toys
vente coquin~pn~boules de geisha cherry love~affid~~prodid~,Shopping - Sex Toys
voir les gode ceinture anal,Shopping - Sex Toys
voir les gode ceinture anal vibrant,Shopping - Sex Toys
web jouet sexuel,Shopping - Sex Toys
web jouet sexuel chez les transexuel,Shopping - Sex Toys
web jouet sexuel pour trans,Shopping - Sex Toys
web jouet sexuel trans trio,Shopping - Sex Toys
1 brocante nord pas de calais aujourdhui,Shopping - Swap Meets & Outdoor Markets
16 avril Moissac brocante,Shopping - Swap Meets & Outdoor Markets
2016 brocante choisy le roi,Shopping - Swap Meets & Outdoor Markets
a corse du sud ajaccio vide greniers et marches puces,Shopping - Swap Meets & Outdoor Markets
ab depot vente,Shopping - Swap Meets & Outdoor Markets
accessible depot vente,Shopping - Swap Meets & Outdoor Markets
accueil bazar chaussures,Shopping - Swap Meets & Outdoor Markets
achat et debarras,Shopping - Swap Meets & Outdoor Markets
acheter vendre debarras de maison,Shopping - Swap Meets & Outdoor Markets
amf prime de risque du marché,Shopping - Swap Meets & Outdoor Markets
amiens rc marché brocante,Shopping - Swap Meets & Outdoor Markets
angers dépôt -vente vêtements adultes,Shopping - Swap Meets & Outdoor Markets
angers depots vente meubles,Shopping - Swap Meets & Outdoor Markets
angers rc marché brocante,Shopping - Swap Meets & Outdoor Markets
angluzelles et courcelles brocante,Shopping - Swap Meets & Outdoor Markets
angouleme agenda brocante vide grenier,Shopping - Swap Meets & Outdoor Markets
ann big bazar croc affaires,Shopping - Swap Meets & Outdoor Markets
ann depot vente du pont dunant,Shopping - Swap Meets & Outdoor Markets
annonce art antiquites autres debarrasse tout,Shopping - Swap Meets & Outdoor Markets
annonce au bon coin mon debarras,Shopping - Swap Meets & Outdoor Markets
article les brocantes et vide greniers reprennent,Shopping - Swap Meets & Outdoor Markets
article les delerm vont a la brocante,Shopping - Swap Meets & Outdoor Markets
article les depots ventes un autre mode d achat,Shopping - Swap Meets & Outdoor Markets
article les prochaines brocantes au vesinet,Shopping - Swap Meets & Outdoor Markets
article maison pratique depot vente,Shopping - Swap Meets & Outdoor Markets
article marche aux puces vide grenier,Shopping - Swap Meets & Outdoor Markets
article succes pour le marche du debarras des fees,Shopping - Swap Meets & Outdoor Markets
bien faire son stand de brocante,Shopping - Swap Meets & Outdoor Markets
big bazar saint gervais,Shopping - Swap Meets & Outdoor Markets
billere services depot vente,Shopping - Swap Meets & Outdoor Markets
biz brocante café marseille,Shopping - Swap Meets & Outdoor Markets
biz dépôt vente du ème paris,Shopping - Swap Meets & Outdoor Markets
biz flash dépôt vente bordeaux,Shopping - Swap Meets & Outdoor Markets
blog association debarras gratuit bourgogne index,Shopping - Swap Meets & Outdoor Markets
blog association debarras gratuit centre loiret montargis,Shopping - Swap Meets & Outdoor Markets
centre brocantes,Shopping - Swap Meets & Outdoor Markets
centre brocantes antiquaire,Shopping - Swap Meets & Outdoor Markets
cerdon du loiret brocante,Shopping - Swap Meets & Outdoor Markets
cerences services depot vente,Shopping - Swap Meets & Outdoor Markets
cession bazar cadeaux a bordeaux c,Shopping - Swap Meets & Outdoor Markets
cesson sevigne bazar et déstockage,Shopping - Swap Meets & Outdoor Markets
chaine depot vente ebay,Shopping - Swap Meets & Outdoor Markets
conclusion espace et echanges,Shopping - Swap Meets & Outdoor Markets
conde folie la brocante du bricoleur,Shopping - Swap Meets & Outdoor Markets
condition depot vente,Shopping - Swap Meets & Outdoor Markets
confier depot vente,Shopping - Swap Meets & Outdoor Markets
connection brocantez,Shopping - Swap Meets & Outdoor Markets
conseil pour une brocante,Shopping - Swap Meets & Outdoor Markets
conseils marches aux puces quebec,Shopping - Swap Meets & Outdoor Markets
contact brocanteur,Shopping - Swap Meets & Outdoor Markets
contact debarras maison pas cher le molay littry,Shopping - Swap Meets & Outdoor Markets
contacter brocante du marais,Shopping - Swap Meets & Outdoor Markets
content depots vente,Shopping - Swap Meets & Outdoor Markets
correze mars vide greniers et marches puces,Shopping - Swap Meets & Outdoor Markets
corse vide greniers et marches puces,Shopping - Swap Meets & Outdoor Markets
detail mairie marches publics,Shopping - Swap Meets & Outdoor Markets
detail marches a la brocante allees jules guesde,Shopping - Swap Meets & Outdoor Markets
details debarras de la cave au grenier depot vente meuble,Shopping - Swap Meets & Outdoor Markets
details depot vente pour mobilier et electromenager sur pertuis abc depot vente,Shopping - Swap Meets & Outdoor Markets
details entreprise de debarras a marseille,Shopping - Swap Meets & Outdoor Markets
details vendre votre bateau en depot vente,Shopping - Swap Meets & Outdoor Markets
details vendredi bazar records,Shopping - Swap Meets & Outdoor Markets
deux sevres nanteuil aout vide greniers et marches puces,Shopping - Swap Meets & Outdoor Markets
deux sevres sainte ouenne vide greniers et marches puces,Shopping - Swap Meets & Outdoor Markets
devanture de bazar de plage en photo,Shopping - Swap Meets & Outdoor Markets
dhtml spe depot vente,Shopping - Swap Meets & Outdoor Markets
en evenement brocante,Shopping - Swap Meets & Outdoor Markets
en evenement brocante vide grenier,Shopping - Swap Meets & Outdoor Markets
en evenement marche noel,Shopping - Swap Meets & Outdoor Markets
en images thoire en images brocante,Shopping - Swap Meets & Outdoor Markets
enseignes bazar avenue,Shopping - Swap Meets & Outdoor Markets
entrains sur nohain depot vente de l etang route sainpuits,Shopping - Swap Meets & Outdoor Markets
entreprise au grand bazar fouine bazar,Shopping - Swap Meets & Outdoor Markets
entreprise de debarras deux sevres,Shopping - Swap Meets & Outdoor Markets
epagny services depot vente,Shopping - Swap Meets & Outdoor Markets
epernon services depot vente,Shopping - Swap Meets & Outdoor Markets
ermont services depot vente,Shopping - Swap Meets & Outdoor Markets
essonne juillet vide greniers et marches puces,Shopping - Swap Meets & Outdoor Markets
essonne tigery vide greniers et marches puces,Shopping - Swap Meets & Outdoor Markets
f je vends je cherche j echange,Shopping - Swap Meets & Outdoor Markets
f la brocante vos trouvailles vos merveilles,Shopping - Swap Meets & Outdoor Markets
f le bazar aux astuces,Shopping - Swap Meets & Outdoor Markets
f le bazar hasardeux,Shopping - Swap Meets & Outdoor Markets
f les collections brocantes et divers,Shopping - Swap Meets & Outdoor Markets
f mandat de depot vente,Shopping - Swap Meets & Outdoor Markets
fiscalité du marché de l'art,Shopping - Swap Meets & Outdoor Markets
flandre occidentale neuve eglise aout vide greniers et marches puces,Shopping - Swap Meets & Outdoor Markets
flers en escrebieux braderie brocante,Shopping - Swap Meets & Outdoor Markets
flins inscription brocante,Shopping - Swap Meets & Outdoor Markets
flins sur seine agenda brocante vide grenier,Shopping - Swap Meets & Outdoor Markets
flixecourt bazar destockage p c,Shopping - Swap Meets & Outdoor Markets
florent doucenet debarras maison,Shopping - Swap Meets & Outdoor Markets
fonctionnement depot vente,Shopping - Swap Meets & Outdoor Markets
fr grand debarras a palaiseau,Shopping - Swap Meets & Outdoor Markets
fr istanbul attractions le grand bazar d a,Shopping - Swap Meets & Outdoor Markets
haute savoie doussard juin brocantes,Shopping - Swap Meets & Outdoor Markets
haute savoie draillant brocantes,Shopping - Swap Meets & Outdoor Markets
haute savoie megeve mai vide greniers et marches puces,Shopping - Swap Meets & Outdoor Markets
haute savoie services depot vente,Shopping - Swap Meets & Outdoor Markets
haute savoie seyssel septembre vide greniers et marches puces,Shopping - Swap Meets & Outdoor Markets
henin beaumont bazar et déstockage,Shopping - Swap Meets & Outdoor Markets
itm paris e c antiquaire brocante div,Shopping - Swap Meets & Outdoor Markets
itm petits objets lot de brocante divers,Shopping - Swap Meets & Outdoor Markets
itm prix choc destockage lot revendeur articles de bazar en tous genres,Shopping - Swap Meets & Outdoor Markets
jai teste les depots ventes,Shopping - Swap Meets & Outdoor Markets
jardinière en osier dépot vente,Shopping - Swap Meets & Outdoor Markets
jeans diesel depot vente,Shopping - Swap Meets & Outdoor Markets
jura champagnole marche puces,Shopping - Swap Meets & Outdoor Markets
jura mars vide greniers et marches puces,Shopping - Swap Meets & Outdoor Markets
le p'tit bazar,Shopping - Swap Meets & Outdoor Markets
le petit bazar du canal,Shopping - Swap Meets & Outdoor Markets
le petit bazar miffy,Shopping - Swap Meets & Outdoor Markets
le petit capri bazar paris,Shopping - Swap Meets & Outdoor Markets
le petit marché,Shopping - Swap Meets & Outdoor Markets
Le plaisir d'échanger,Shopping - Swap Meets & Outdoor Markets
le premier marche aux puces des amis de la fosse,Shopping - Swap Meets & Outdoor Markets
le prtit bazard belge,Shopping - Swap Meets & Outdoor Markets
les angles depots vente meubles,Shopping - Swap Meets & Outdoor Markets
les depots vente de luxe pour enfant,Shopping - Swap Meets & Outdoor Markets
les marches aux puces,Shopping - Swap Meets & Outdoor Markets
les tarifs dun debarras,Shopping - Swap Meets & Outdoor Markets
maison jardin cuisine brocante,Shopping - Swap Meets & Outdoor Markets
mananjary les flammes devastent le bazar be,Shopping - Swap Meets & Outdoor Markets
manche aout vide greniers et marches puces,Shopping - Swap Meets & Outdoor Markets
manche moyon avril vide greniers et marches puces,Shopping - Swap Meets & Outdoor Markets
manche vetements femme depot vente,Shopping - Swap Meets & Outdoor Markets
mandat dépot vente,Shopping - Swap Meets & Outdoor Markets
manger et sortir dans le vieux bazar,Shopping - Swap Meets & Outdoor Markets
manteaux christian lacroix bazar,Shopping - Swap Meets & Outdoor Markets
mantes la jolie bazar et déstockage,Shopping - Swap Meets & Outdoor Markets
nancy bazar et destockage,Shopping - Swap Meets & Outdoor Markets
nancy marche aux puces brocante vieille ville grande rue planning,Shopping - Swap Meets & Outdoor Markets
nancy services depot vente,Shopping - Swap Meets & Outdoor Markets
nancy vetements femme american bazar,Shopping - Swap Meets & Outdoor Markets
nancyhoudemont tous les rayons le marche boucherie volaille,Shopping - Swap Meets & Outdoor Markets
nanou quelle brocante faite vous,Shopping - Swap Meets & Outdoor Markets
nantes depots vente de vetement,Shopping - Swap Meets & Outdoor Markets
nantes nord marche de la brocante et de l antiquite,Shopping - Swap Meets & Outdoor Markets
nanteuil les meaux bazar destockage p c,Shopping - Swap Meets & Outdoor Markets
narbonne depots vente meubles,Shopping - Swap Meets & Outdoor Markets
navenne services depot vente,Shopping - Swap Meets & Outdoor Markets
neuilly sur seine agenda brocante vide grenier,Shopping - Swap Meets & Outdoor Markets
neuville sur saone agenda brocante vide grenier,Shopping - Swap Meets & Outdoor Markets
news bazar du grenier eme chaine du joueur du grenier,Shopping - Swap Meets & Outdoor Markets
nievre annay juillet vide greniers et marches puces,Shopping - Swap Meets & Outdoor Markets
pas de calais a aire sur la lys juin dimanche brocante,Shopping - Swap Meets & Outdoor Markets
pas de calais a angres avril dimanche marche aux puces,Shopping - Swap Meets & Outdoor Markets
pas de calais a arques mai dimanche brocante,Shopping - Swap Meets & Outdoor Markets
pas de calais bazar aux bonnes affaires f,Shopping - Swap Meets & Outdoor Markets
pas de calais bazar et destockage page,Shopping - Swap Meets & Outdoor Markets
passage du livre le grand bazar,Shopping - Swap Meets & Outdoor Markets
passins services depot vente,Shopping - Swap Meets & Outdoor Markets
porta portese marché aux puces,Shopping - Swap Meets & Outdoor Markets
portes les valence bazar destockage p c,Shopping - Swap Meets & Outdoor Markets
que faire a chambord brocante,Shopping - Swap Meets & Outdoor Markets
quoi vendre marché aux puces,Shopping - Swap Meets & Outdoor Markets
rajasthan marchés et bazars,Shopping - Swap Meets & Outdoor Markets
rajasthan marchés et bazars à jodhpur,Shopping - Swap Meets & Outdoor Markets
rajasthan marchés et bazars à udaipur,Shopping - Swap Meets & Outdoor Markets
