2 droit de la propriété intellectuelle,Illegal - Copyright Infringement
a nicolas binctin droit de la propriete intellectuelle,Illegal - Copyright Infringement
a propos d avis informations legales,Illegal - Copyright Infringement
a propos d avis informations legales politique de confidentialite,Illegal - Copyright Infringement
a propos d avis informations legales politique des cookies,Illegal - Copyright Infringement
a quoi sert la mention copyright ©,Illegal - Copyright Infringement
accueil entrepreneurs tpe start up mazars ecosysteme les partenaires de l ecosysteme propriete intellectuelle ip trust,Illegal - Copyright Infringement
acheter ou pirater telle est la question,Illegal - Copyright Infringement
act inpi commission nationale inventions salaries propriete industrielle intellectuelle tableau resultat,Illegal - Copyright Infringement
action en contrefaçon droit d'auteur,Illegal - Copyright Infringement
actions actualites news hybrigenics renforce la propriete intellectuelle de l inecalcitol aux etats unis,Illegal - Copyright Infringement
activation droits d'auteurs,Illegal - Copyright Infringement
activite avocat carole moulin calmes avocat propriete intellectuelle,Illegal - Copyright Infringement
activite propriete intellectuelle propriete industrielle ile de france,Illegal - Copyright Infringement
actu actudet multimedia quels sont les droits d auteur sur internet fil actu,Illegal - Copyright Infringement
actualite dropbox dection censure copyright,Illegal - Copyright Infringement
actualite face au droit propriete intellectuelle vente logiciels,Illegal - Copyright Infringement
actualité juridique sur la propriété intellectuelle,Illegal - Copyright Infringement
actualites gsk ne déposera brevets pays pauvres,Illegal - Copyright Infringement
administratifs copyright et mentions legales,Illegal - Copyright Infringement
anglais francais peer to peer,Illegal - Copyright Infringement
annexes mentions legales en savoir plus sur les cookies,Illegal - Copyright Infringement
annexes mentions legales erreur cookies,Illegal - Copyright Infringement
annexes mentions legales mentions legales,Illegal - Copyright Infringement
annonces avocats juristes autres emploi droit de la propriete intellectuelle et tic,Illegal - Copyright Infringement
annonces collaborateur en droit de la propriété intellectuelle et droit du numérique offres,Illegal - Copyright Infringement
annonces juriste h f spécialisé e en propriété intellectuelle à shanghai offres,Illegal - Copyright Infringement
annonces logiciels internet c pirater decodeur numericable q,Illegal - Copyright Infringement
antivirus securite informatique virus hacker piratage hackers actualite hackers devoilent systeme permettant pirater serrures electroniques hotels,Illegal - Copyright Infringement
aplications pour pirater le wifi,Illegal - Copyright Infringement
app store livre apple nouveau condamnee en chine pour violation du droit d auteur,Illegal - Copyright Infringement
apprentissage automatique et droit d'auteur,Illegal - Copyright Infringement
article avril journee mondiale du livre et du droit d auteur,Illegal - Copyright Infringement
article droit copyright france qu il faut connaitre,Illegal - Copyright Infringement
article fonctionnement du depot de copyright,Illegal - Copyright Infringement
article l humaniste blog respectueux des droits d auteur,Illegal - Copyright Infringement
article le roi du polar james ellroy partage ses droits d auteur avec les victimes des a,Illegal - Copyright Infringement
article le site de telechargement t bloque chez free et les autres fai des internautes proposent des solutions de contournement,Illegal - Copyright Infringement
article logiciel pour pirater mots de passe wifi,Illegal - Copyright Infringement
article medias sociaux et droit d auteur,Illegal - Copyright Infringement
article propriete intellectuelle,Illegal - Copyright Infringement
article sharewatcher surveiller et alerter les utilisateurs quelqu un accede a des fichiers et des dossiers partages,Illegal - Copyright Infringement
articles legislation code de la propriete intellectuelle et code civil,Illegal - Copyright Infringement
Assistant e juridique en Propriété Intellectuelle,Illegal - Copyright Infringement
assistant propriété intellectuelle,Illegal - Copyright Infringement
association mentions legales,Illegal - Copyright Infringement
assurances en ligne infos legales informations legales aspx,Illegal - Copyright Infringement
astuce voir droits de la propriete intellectuelle et artistique imposables a l isf,Illegal - Copyright Infringement
astuce voir huissier et propriete intellectuelle,Illegal - Copyright Infringement
astuce voir imprimante d et propriete intellectuelle,Illegal - Copyright Infringement
billet d humeur la propriété intellectuelle,Illegal - Copyright Infringement
bittorrent client bittorrent partage fichiers telecharger telechargement,Illegal - Copyright Infringement
bittorrent lance shoot pour partager des fichiers entre smartphones sans limitation,Illegal - Copyright Infringement
blog droit des biens et des propriétés intellectuelles,Illegal - Copyright Infringement
blog la sodrac le droit d auteur au quebec,Illegal - Copyright Infringement
blog laboratoire print propriete intellectuelle droit fondamental,Illegal - Copyright Infringement
blog liberte dexpression propriete intellectuelle et droit dauteur quelles tendances,Illegal - Copyright Infringement
blog maitre anthony bem droit auteur salarie remuneration exploitation,Illegal - Copyright Infringement
blog maitre anthony bem irrecevabilite action contrefacon droits auteur,Illegal - Copyright Infringement
blog maitre anthony bem recours violation droits auteur action,Illegal - Copyright Infringement
blog maitre anthony bem remuneration cession droits auteur dans,Illegal - Copyright Infringement
blog maitre anthony bem remuneration cession droits auteurs fonctionnaires,Illegal - Copyright Infringement
blog pirater un compte facebook,Illegal - Copyright Infringement
brevet invention avant de deposer un brevet prototype divulgation secret,Illegal - Copyright Infringement
business salaire juriste propriete intellectuelle services,Illegal - Copyright Infringement
cabinet avocats propriete intellectuelle notre histoire,Illegal - Copyright Infringement
cabinet avocats propriete intellectuelle notre metier,Illegal - Copyright Infringement
cabinet de conseil en propriété intellectuelle,Illegal - Copyright Infringement
cassette VHS avec copyright comment l'enregistrer,Illegal - Copyright Infringement
cession de droit d'auteur logo,Illegal - Copyright Infringement
cession de droit propriété intellectuelle,Illegal - Copyright Infringement
cession droit d'auteur en suisse rémunération,Illegal - Copyright Infringement
cession droits propriété intellectuelle brevet partielle,Illegal - Copyright Infringement
cession globale des droits d auteur des journalistes non c est non,Illegal - Copyright Infringement
Cette vidéo contenait une piste audio protégée par des droits d'auteur. Le son de cette piste a été coupé suite à la réclamation d'un titulaire des droits d'auteur.,Illegal - Copyright Infringement
chronique jurisprudence droit propriete intellectuelle,Illegal - Copyright Infringement
cloud suite stockage cloud logiciel synchronisation et partage de fichier,Illegal - Copyright Infringement
comment à poser un copyright sur son logo,Illegal - Copyright Infringement
comment deposer un brevet,Illegal - Copyright Infringement
comment déposer un brevet dintention,Illegal - Copyright Infringement
comment déposer un brevet en france,Illegal - Copyright Infringement
comment déposer un brevet mondial,Illegal - Copyright Infringement
comment deposer un brevet sur un personnage,Illegal - Copyright Infringement
comment faire ce petit signe © du copyright,Illegal - Copyright Infringement
conjoncture artfig l auteur de jesuischarlie peut il invoquer un droit d auteur,Illegal - Copyright Infringement
conseil en propriété intellectuelle,Illegal - Copyright Infringement
conseil pour le partage de fichiers en entreprise dropbox ou box,Illegal - Copyright Infringement
conseils en ligne termes et conditions,Illegal - Copyright Infringement
Conservation et partage de fichiers en ligne,Illegal - Copyright Infringement
contact et informations legales contact information devis,Illegal - Copyright Infringement
conte indécent conseillé par la fnac comment récupérer les droits d'auteur que peut exiger de son éditeur,Illegal - Copyright Infringement
content droits d auteurs et propriete intellectuelle,Illegal - Copyright Infringement
content propriété intellectuelle et valorisation,Illegal - Copyright Infringement
contents informations de copyright,Illegal - Copyright Infringement
contents le droit auteur copyright,Illegal - Copyright Infringement
contrat fdc propriete intellectuelle,Illegal - Copyright Infringement
contrat fdc propriete intellectuelle brevets,Illegal - Copyright Infringement
contrat fdc propriete intellectuelle droits d auteur,Illegal - Copyright Infringement
copie simple de cd avec copyright evidement t,Illegal - Copyright Infringement
copier un cd protégé par copyright,Illegal - Copyright Infringement
deposer un brevet pour invention,Illegal - Copyright Infringement
deposer un brevet pour un concept,Illegal - Copyright Infringement
details definition de l originalite de l oeuvre en droit d auteur,Illegal - Copyright Infringement
difference entre copyright et dépot légal,Illegal - Copyright Infringement
Directeur propriete intellectuelle,Illegal - Copyright Infringement
discussions t copyright madness une semaine de propriete intellectuelle en delire,Illegal - Copyright Infringement
documentaires copyright ou le droit de copier,Illegal - Copyright Infringement
documentation propriete intellectuelle la cession des droits d auteur au profit des personnes morales,Illegal - Copyright Infringement
droit d auteur et copyright,Illegal - Copyright Infringement
En raison du fait que Facebook a choisi d'impliquer un logiciel qui permettra le vol de mes renseignements personnels je déclare ce qui suit À cette date du 14 avril 2016 en réponse aux nouvelles lignes directrices,Illegal - Copyright Infringement
enigme sur la piraterie,Illegal - Copyright Infringement
enregistrer un copyright,Illegal - Copyright Infringement
estimation cotisation sur droits d'auteurs,Illegal - Copyright Infringement
fiche pratique genie industriel th deployer l innovation dt comment deposer un brevet d invention preparation execution suivi,Illegal - Copyright Infringement
flash actualite culture droits auteur frapper au portefeuille les sites postant des contenus illegaux,Illegal - Copyright Infringement
flash actualite culture la musique s inquiete des projets de l union europeenne sur le droit d auteur,Illegal - Copyright Infringement
flash actualite culture musique les deputes allongent de a ans la duree de protection des droits d auteur,Illegal - Copyright Infringement
flash actualite economie a l office europeen des brevets ambiance deletere et president conteste,Illegal - Copyright Infringement
flash actualite economie apple condamne au texas pour violation de brevets,Illegal - Copyright Infringement
flash actualite economie bataille de brevets autour de l edition du genome,Illegal - Copyright Infringement
flash actualite economie brevets tarkett obtient millions de dollars de dedommagement aux etats unis,Illegal - Copyright Infringement
flash actualite economie etats unis marvell condamne a milliard de dollars pour violation de brevets,Illegal - Copyright Infringement
flash actualite economie pfizer rachete wyeth pour devancer la perte de brevets,Illegal - Copyright Infringement
flash actualite monde des hackers ont aide le fbi a debloquer l iphone de san bernardino,Illegal - Copyright Infringement
flash actualite monde le pentagone invite des hackers et recrute le president d alphabet google,Illegal - Copyright Infringement
formation les bases de la propriété intellectuelle,Illegal - Copyright Infringement
formations accueil un site web boosteur de reservations module un redactionnel construit pour declencher les emotions j ajoutez facilement vos mentions legales et votre copyright,Illegal - Copyright Infringement
forum affich comment proteger ses photos par copyright,Illegal - Copyright Infringement
fr comprendre la propriete intellectuelle le brevet quand deposer mon brevet,Illegal - Copyright Infringement
fr comprendre la propriete intellectuelle le brevet qui peut deposer,Illegal - Copyright Infringement
fr fr politiques sur la propriete intellectuelle,Illegal - Copyright Infringement
fr infos juridiques droit dauteur la cession du droit d auteur,Illegal - Copyright Infringement
fr infos juridiques droit dauteur violation du droit d auteur,Illegal - Copyright Infringement
fr le brevet ou deposer mon dossier,Illegal - Copyright Infringement
fr nationales guide pratique sur la propriete intellectuelle et l entrepreneur,Illegal - Copyright Infringement
fr nos competences id propriete intellectuelle,Illegal - Copyright Infringement
fr services droits d auteur copyright un vaste domaine,Illegal - Copyright Infringement
fr services droits d auteur copyright un vaste domaine atteinte aux droits d auteur,Illegal - Copyright Infringement
fr services droits d auteur copyright un vaste domaine exemples de droits d auteurs,Illegal - Copyright Infringement
fr services droits d auteur copyright un vaste domaine qu est ce que les droits d auteur,Illegal - Copyright Infringement
hfr videoson traitement audio proteger fichier copyright sujet,Illegal - Copyright Infringement
high tech usa grooveshark streaming ferme a cause de litiges sur les droits d auteur,Illegal - Copyright Infringement
histoire de la propriete intellectuelle,Illegal - Copyright Infringement
honoraires moyens avocat propriété intellectuelle,Illegal - Copyright Infringement
hypertext code de la propriete intellectuelle,Illegal - Copyright Infringement
hypertext propriete intellectuelle,Illegal - Copyright Infringement
idees debats cercle cercle une reforme europeenne du copyright au pas a pas,Illegal - Copyright Infringement
image de code barre d'un livre droit d'auteur,Illegal - Copyright Infringement
je suis ecoeurée mon éditeur ne m'a jamais payé mes droits d'auteur,Illegal - Copyright Infringement
jeu de societe copyright,Illegal - Copyright Infringement
jolie histoire de copyright,Illegal - Copyright Infringement
journals jour copyright,Illegal - Copyright Infringement
jurist de la propriété intellectuelle,Illegal - Copyright Infringement
kudoz french to english law patents trademarks copyright dont acte sous toutes réserves,Illegal - Copyright Infringement
la protection des fichiers clients,Illegal - Copyright Infringement
le plaidoyer anti brevets delon musk le patron de tesla,Illegal - Copyright Infringement
Le site est-il protégé par un copyright droit d'auteur,Illegal - Copyright Infringement
les contrats de la propriété intellectuelle,Illegal - Copyright Infringement
les contrats spéciaux en propriété intellectuelle,Illegal - Copyright Infringement
les deux stratégies pour déposer un brevet,Illegal - Copyright Infringement
les meilleures chaines youtube proposant de la musique non copyright,Illegal - Copyright Infringement
les proprietes d une video auteur titre copyright regle t,Illegal - Copyright Infringement
les street artistes reagissent aux attentats de paris copyright goin art,Illegal - Copyright Infringement
lesechos ech l etat cree un fonds souverain de la propriete intellectuelle,Illegal - Copyright Infringement
lesechos ech le management strategique de la propriete intellectuelle,Illegal - Copyright Infringement
lesechos fr impression d une menace pour la propriete intellectuelle,Illegal - Copyright Infringement
let copyright go disney plus tolerant vis a vis des creations par les fans mais il y a une raison,Illegal - Copyright Infringement
list consequences violations copyright laws,Illegal - Copyright Infringement
master droit de la propriété intellectuelle,Illegal - Copyright Infringement
master propriété intellectuelle sorbonne,Illegal - Copyright Infringement
mentions legales copyright,Illegal - Copyright Infringement
netflix droit d'auteur,Illegal - Copyright Infringement
newsletter mentions legales et bonnes pratiques,Illegal - Copyright Infringement
nos produits copyright licence droit,Illegal - Copyright Infringement
nous contacter copie photocopie impression copyright rennes,Illegal - Copyright Infringement
offre commerciale depot copyright,Illegal - Copyright Infringement
patrimoine pratique copyright,Illegal - Copyright Infringement
personnaliser le template de zen cart puis je supprimer le copyright powered by zen cart en bas,Illegal - Copyright Infringement
piratage le blocage du site de partage de fichiers t ne sert deja plus a rien,Illegal - Copyright Infringement
post news dropbox soctroie le droit dutiliser diffuser et partager vos fichiers,Illegal - Copyright Infringement
post news itunes supporte le partage de fichiers,Illegal - Copyright Infringement
probleme partage de fichiers reseau local fs,Illegal - Copyright Infringement
problemes de partage de fichiers dans un sens fs,Illegal - Copyright Infringement
problèmes partage fichier excel,Illegal - Copyright Infringement
produits offres informations legales avertissements,Illegal - Copyright Infringement
produits offres informations legales conditions utilisations,Illegal - Copyright Infringement
produits offres informations legales donnees personnelles,Illegal - Copyright Infringement
produits offres informations legales obligations responsabilites,Illegal - Copyright Infringement
questions frequentes la protection des logiciels les logiciels sont il proteges par le droit d auteur,Illegal - Copyright Infringement
questions frequentes le droit d auteur en general comment assurer l integrite et la securite des preuves de la,Illegal - Copyright Infringement
qui sommes nous informations legales mentions legales,Illegal - Copyright Infringement
qui sommes nous informations legales protection des donnees,Illegal - Copyright Infringement
quotidien gestion des comptes releves documents en ligne informations legales,Illegal - Copyright Infringement
t de l impotrance des copyrights mais non pas encore,Illegal - Copyright Infringement
vivre argent telechargement illegal que risque t on,Illegal - Copyright Infringement
wordpress wp content uploads feuillet franchir une porte sainte copyright appelduciel jpg,Illegal - Copyright Infringement
12 portugais décédé article,Illegal - Crime
3 enfants assassinés Dunkerque,Illegal - Crime
3 officiers assassinés à Lubumbashi RDC youtube,Illegal - Crime
4soeur de la charite assassinee au yemen,Illegal - Crime
54 cadavre retrouvé pres de brabois 2016,Illegal - Crime
à abattre,Illegal - Crime
abo oise cadavre dans la foret le meurtrier presume ecroue,Illegal - Crime
abraham lincoln a ete assassine il y a ans n,Illegal - Crime
accueil detail actualite article il tue sa mere et viole son cadavre,Illegal - Crime
actualite faits divers a l agonie apres une violente bagarre,Illegal - Crime
actualite monde amerique nord etats unis la lente agonie d un condamne a mort fait polemique,Illegal - Crime
amiens un cadavre decouvert chez un ancien meurtrier,Illegal - Crime
amiens un cadavre decouvert dans un canal,Illegal - Crime
amis de la terre militant assassiné,Illegal - Crime
amnesty la mort de kadhafi est un crime de guerre,Illegal - Crime
anaïs marcelli assassinee en de nouveaux elements pourraient relancer l enquete,Illegal - Crime
andré verdet poèmes génocide camp de concentration,Illegal - Crime
angélique assassinée en 1996,Illegal - Crime
angouleme deux ans de prison ferme pour l agression a l oph,Illegal - Crime
anne frank fausse preuve du genocide des juifs,Illegal - Crime
annecy un cadavre decouvert pres dune voiture en feu,Illegal - Crime
années 1960 -1974 daniel bogia truand assassiné a lyon,Illegal - Crime
anneli marie ans retrouvee morte assassinee apres avoir ete kidnappee,Illegal - Crime
anneyron un cadavre eventre decouvert dans les bois,Illegal - Crime
arc pour abattre chevreuil,Illegal - Crime
article le nazi sandor kepiro juge en hongrie pour crimes de guerre,Illegal - Crime
article le pape a t il ete assassine,Illegal - Crime
article le passage a l acte et le crime passionnel,Illegal - Crime
article le petit fils de l activiste americain malcolm x assassine a mexico,Illegal - Crime
article le pire est arrive a charles massi bozize l a fait assassiner famille,Illegal - Crime
article le plan kalergi genocide des peuples europeens,Illegal - Crime
article le plus celebre humoriste somalien assassine pour s etre moque des islamistes,Illegal - Crime
article le plus grand crime contre l humanite,Illegal - Crime
article le pourvoyeur de cadavres,Illegal - Crime
article les bas fonds de londres crime et prostitution,Illegal - Crime
article les fran ais ont ils vraiment assassine le sultan moulay hafid,Illegal - Crime
article les galgos ne sont pas assassines que dans le sud,Illegal - Crime
bienvenue au camping jean pierre yves assassinent monique samuel,Illegal - Crime
bilan du génocide juif,Illegal - Crime
bitry le pere de famille assassine par les amants diaboliques,Illegal - Crime
blog actualites antsiranana un francais et son epouse assassines,Illegal - Crime
blog actualites francaise assassinee un crime passionnel privilegie,Illegal - Crime
ce jeune homme a ete assassine par un magistrat voici lidentite du tueur et ce quil dit,Illegal - Crime
célébrité assassiné,Illegal - Crime
cent pense que diddy a fait assassiner tupac,Illegal - Crime
centrafrique un genocide oublie,Illegal - Crime
centrafrique une ong humanitaire se preoccupe des cadavres enterres a proximite des domiciles,Illegal - Crime
centre cadavres dans une camionnette les deux hommes ont ete assassines,Illegal - Crime
centre indre et loire un cadavre dans un puits plusieurs suspects en garde a vue,Illegal - Crime
centre un imam retrouve assassine,Illegal - Crime
cerbere un cadavre decouvert dans la rue,Illegal - Crime
ces paysans quon assassine,Illegal - Crime
condamnation de jean pierre chevallier le crime de lese banque peut vous couter cher,Illegal - Crime
condamnation pour crime,Illegal - Crime
conde sur escaut cadavres decouverts en dix jours,Illegal - Crime
conde sur l escaut un cadavre repeche dans un etang,Illegal - Crime
content le genocide des juifs et des tziganes,Illegal - Crime
contribution gerant d une auto ecole je gagne moins qu un coiffeur cette reforme va nous assassiner,Illegal - Crime
contribution liberation assassine lou doillon pourquoi c est injuste et mechant,Illegal - Crime
contribution sarkozy est mis en examen juppe fait tweets et assassine en hypocrisies,Illegal - Crime
coolspot coolspot fr pere dun terroriste rejette cadavre de fils sexcuse aupres peuple tunisien,Illegal - Crime
coptes assassines union de priere,Illegal - Crime
corbeil essonnes un cadavre decouvert sur les voies du rer d,Illegal - Crime
détective conan la scène de crime est un restaurant étroit,Illegal - Crime
détruire arméniens histoire dun génocide dp,Illegal - Crime
deux cadavre dans l'orne,Illegal - Crime
deux hommes juges en appel pour avoir tente d assassiner l avocat karim achoui,Illegal - Crime
deux poids deux mesures enfants arabes assassines par des juifs et enfants juifs assassines par des arabes,Illegal - Crime
deux sevres un cadavre decouvert dans le coffre dune voiture,Illegal - Crime
devant le cadavre d'un cerf manifestement tout,Illegal - Crime
devoir sur le génocide juifs,Illegal - Crime
devorent les cadavres des cimetieres,Illegal - Crime
dix hommes à abattre,Illegal - Crime
en france la prison a remplacé la guillotine elle tue parfois elle assassine,Illegal - Crime
En juin 1968 au lendemain de son succès aux élections primaires de Californie il est assassiné.,Illegal - Crime
en quoi le genocide juif est un crime contre l'humanité,Illegal - Crime
enfance assassinée martyr petite france product reviews ref=dpx acr txt,Illegal - Crime
enfant assassiné et enlever,Illegal - Crime
enfant assassinée a bras panon 974,Illegal - Crime
enfants chretiens assassines en syrie,Illegal - Crime
enfumage des masses sur le dos du cadavre de ce petit garcon,Illegal - Crime
enlever odeur cadavre animal,Illegal - Crime
ensevelissement des cadavres marocains tues aux combats de beni ouzien,Illegal - Crime
enterre un cadavre dessin,Illegal - Crime
equipe temoin a abattre tt,Illegal - Crime
flash actualite culture les etats unis rendent hommage a abraham lincoln assassine il y a ans,Illegal - Crime
flash actualite monde algerie le chef de la police ali tounsi assassine dans son bureau,Illegal - Crime
flash actualite monde fidel castro l homme qu on a le plus souvent tente d assassiner,Illegal - Crime
flash actualite monde honduras des milliers de personnes a l enterrement de la militante ecologiste assassinee,Illegal - Crime
flash actualite monde hongrie personnes aux funerailles de deux roms assassines,Illegal - Crime
flash actualite monde il y a ans rabin etait assassine en public par un extremiste,Illegal - Crime
flash actualite monde l imam libanais disparu en libye en a ete assassine,Illegal - Crime
flash actualite monde maurice le corps d une touriste irlandaise assassinee rapatrie jeudi soir,Illegal - Crime
flash actualite monde yemen religieuses de la congregation de mere teresa assassinees,Illegal - Crime
fr fr divertissement celebrites brigitte bardot les troublantes accusations d’un acteur de sous le soleil elle a tenté de m’assassiner video vp bbqoxbp,Illegal - Crime
fr fr ebook un cadavre sur le campus,Illegal - Crime
fr fr video actualite video clients pénalisés putes assassinées des prostitués refusent la pénalisation de leurs clients vi bbrrpxv,Illegal - Crime
fr genocide comparaison,Illegal - Crime
