10 chapitre anglais6eme lecon,Books & Literature
10 contes pour enfants,Books & Literature
10 derniers chapitre de candide resume,Books & Literature
112 contes pour enfants,Books & Literature
112 contes pour enfants video,Books & Literature
12 ème chapitre de Révélation de Saint Jean,Books & Literature
16 m c3 a9tamorphoses d'ovide r c3 a9sum c3 a9 chapitre OS,Books & Literature
16 m%c3%a9tamorphoses d'ovide r%c3%a9sum%c3%a9 chapitre,Books & Literature
16 métamorphoses d'ovide résumé chapitre,Books & Literature
1984 1949 partie 1 chapitre 6 george orwell en frnaçais c'était il y a trois ans,Books & Literature
1984 george orwell résumé par chapitre,Books & Literature
1984 r c3 a9sum c3 a9 chapitre par chapitre OS,Books & Literature
1984 r c3 a9sum c3 a9 par chapitre OS,Books & Literature
1984 résumé chapitre,Books & Literature
1984 résumé chapitre par chapitre,Books & Literature
1984 résumé chapitre par chapitre detaillé,Books & Literature
2 contes pour enfants,Books & Literature
3 contes pour enfants,Books & Literature
34 Contes pour enfants Audiobook,Books & Literature
4 contes pour enfants,Books & Literature
5 contes pour enfants,Books & Literature
6 contes pour enfants,Books & Literature
7 contes pour enfants,Books & Literature
8 contes pour enfants,Books & Literature
9 contes pour enfants,Books & Literature
a jacob grimm les plus beaux contes pour enfants,Books & Literature
actualite secteurs activites papetrie et graphisme article le furet du nord a inaugure ce mardi son premier shtml,Books & Literature
actualites bidules trucs contes théâtraux pour enfants mais pas seulement,Books & Literature
am i meaningless for him chapitre repartir ou le laisser venir i,Books & Literature
amis et ennemis chapitre,Books & Literature
amitie mise a l epreuve chapitre,Books & Literature
amitié vs amour chapitre page,Books & Literature
amities entre un loup et un chat chapitre,Books & Literature
amnesie chapitre,Books & Literature
amour a bras le corps chapitre,Books & Literature
amour a deux visages chapitre,Books & Literature
amour a distance chapitre saison,Books & Literature
amour a la francaise chapitre,Books & Literature
amour amitie et jalousie chapitre le defi,Books & Literature
amour aveugle chapitre,Books & Literature
amour d ado chapitre lemon,Books & Literature
animations contes pour enfants saint jean de touslas,Books & Literature
annonceur furet du nord bethune bethune librairies et maisons d edition,Books & Literature
annonceur furet du nord englos englos lecture librairies et magasins de livres,Books & Literature
arcueil le furet du nord a ouvert,Books & Literature
arcueil le furet du nord seduit les clients de la vache noire,Books & Literature
arras furet du nord p r,Books & Literature
arras le furet du nord rue gambetta ,Books & Literature
article adeline blondieau et sa fille wilona gros calins et jolis contes pour enfants,Books & Literature
article apprendre anglais en amusant contes et histoires pour enfants,Books & Literature
article carnavals gourmands et contes pour enfants,Books & Literature
article categories contes et quiz pour les petits enfants,Books & Literature
article contes africains que pour les enfants,Books & Literature
article contes de lumiere pour enfants de la terre,Books & Literature
article contes pour enfants anti sexistes et vegan,Books & Literature
article dedicaces de mon livre samedi au furet du nord de lille,Books & Literature
article l empire socialiste des inka chapitre les sources,Books & Literature
article l envol du gerfaut chapitres et,Books & Literature
article l epreuve d interview a l oral de l em grenoble chapitre,Books & Literature
article le mystere du karn chapitre,Books & Literature
article le papier timbre un cafe librairie a rennes,Books & Literature
article le parler du perigord en librairies,Books & Literature
article le petit prince resume bref par chapitre,Books & Literature
article le portrait de dorian gray resume detaille par chapitre,Books & Literature
article le prince chapitre,Books & Literature
article le regard du prince muichkine andrei makine a la grande librairie,Books & Literature
article le retour chapitre ii retour a une vie normale,Books & Literature
article le retour chapitre iii retrouvailles,Books & Literature
article le retour chapitre ix jalousie,Books & Literature
article le rideau rouge la librairie de la rue riquet,Books & Literature
article les coulisses de la grande librairie,Books & Literature
article les deblogueurs tv le nouveau blog de la librairie la griffe noire,Books & Literature
Article Les Echos librairies,Books & Literature
article les editions dagan et la librairie panafricaine tamery accueillent bwemba bong,Books & Literature
article les fous de vierzon en librairie,Books & Literature
article monde edition le furet du nord et chapitre com travaillent les livres d occasion,Books & Literature
attraction review g d reviews librairie furet du nord lille nord nord pas de calais,Books & Literature
bethune furet du nord p r,Books & Literature
bethune le furet du nord place clemenceau ,Books & Literature
bien ou mal chapitre eme fiction,Books & Literature
bien plus qu une application chapitre,Books & Literature
bien s organiser chapitre,Books & Literature
bien s organiser chapitre objectif smart,Books & Literature
bien s organiser chapitre tableau organisation,Books & Literature
bientot les nouveaux chapitres a venir,Books & Literature
bienvenu au camp crystal lake chapitre les dix commendements de,Books & Literature
bienvenue a fairy school chapitre,Books & Literature
bienvenue a fairy school chapitre la revelation de natsu les,Books & Literature
bienvenue a fairy school chapitre mirajane et luxus un depart s,Books & Literature
bienvenue a fairy town chapitre la classe des secondes f,Books & Literature
bienvenue a fairy town chapitre le lycee,Books & Literature
biz furet du nord lille,Books & Literature
boulogne sur mer le furet du nord grand rue ,Books & Literature
cambrai le furet du nord mail saint martin ,Books & Literature
carte de fidelité furet du nord,Books & Literature
catalog furet du nord jeux video,Books & Literature
ce jour la chapitre alma,Books & Literature
ce jour la chapitre aplanissez le chemin,Books & Literature
ce jour la chapitre arbeit macht frei,Books & Literature
ce jour la chapitre dieu n a pas cree il cree,Books & Literature
ce jour la chapitre el judio de lola,Books & Literature
ce jour la chapitre faire retour,Books & Literature
ce jour la chapitre ich bin eine rufende stimme,Books & Literature
ce jour la chapitre juillet,Books & Literature
ce jour la chapitre la rubia,Books & Literature
ce jour la chapitre la vie est une danse,Books & Literature
ce jour la chapitre le craquage de l eau,Books & Literature
ce jour la chapitre les indes,Books & Literature
ce jour la chapitre nous sommes des manieres d etre,Books & Literature
centre commercial auchan englos enseigne furet du nord,Books & Literature
cheque cadeau furet du nord,Books & Literature
conclusion chapitre 6 de candide commentaire,Books & Literature
conclusion du chapitre 2 du dernier jour d'un condamné,Books & Literature
conclusion du chapitre ville et développement durable,Books & Literature
conclusion du premier chapitre La Mouche et la glu de OKOUMBA NKOGHE,Books & Literature
concours brickpirate moc story chapitre,Books & Literature
concours concours twilight chapitre revelation ere partie participez pour gagner une invitation au fan event du octobre,Books & Literature
concours de circonstances chapitre,Books & Literature
concours gratuits concours culturels places pour le film twilight chapitre,Books & Literature
concours pandora hearts chapitre ai,Books & Literature
condamné à mort analyse chapitre 39,Books & Literature
condamné a mort chapitre 6 registre,Books & Literature
condamné a mort chapitre 9,Books & Literature
confession masseuse conclusion trilogie fiction ebook dp bccbhm ref=pd rhf schuc p img,Books & Literature
coquelles furet du nord coquelles cite europe boulevard du kent ,Books & Literature
coquelles librairie le furet du nord,Books & Literature
de troublantes révélations héritage promotion ebook dp bhpkx ref=pd rhf se p img,Books & Literature
details cours pratique de solfège volume pierre boutin french ebook pdf,Books & Literature
details ebooks entertainment yuu abiru love poison,Books & Literature
details poker ebook collection torrent,Books & Literature
déteste tellement taimer anna premoli ebook dp bjwkavdu ref=pd cp,Books & Literature
deuils miel franck thilliez ebook dp btnbnq ref=pd sim,Books & Literature
deux annonces pour coeur justine ebook dp bckaiele ref=pd rhf se s cp,Books & Literature
deux annonces pour coeur justine ebook product reviews bckaiele ref=dpx acr txt,Books & Literature
deux aventures carole héroïne érotique ebook dp bhik,Books & Literature
deux coeurs au fil leau ebook dp bibejiq ref=pd sim,Books & Literature
deux femmes comédie pierre launay ebook dp bghnde,Books & Literature
deuxième chance hqn rose morvan ebook dp bkvg ref=pd sim,Books & Literature
deuxième commence quand comprends quune ebook dp bgegmc ref=zg bs,Books & Literature
deuxième vu ramón díaz eterovic ebook dp bbuldvm ref=asap bc,Books & Literature
douai le furet du nord rue de la madeleine ,Books & Literature
en excel core part i ebook,Books & Literature
en excel introduction part i ebook,Books & Literature
enfant des dieux ebook gratuit,Books & Literature
enfant lumière fabrice galonnier ebook dp bckoq,Books & Literature
enfant secret ebook,Books & Literature
enfant secret harlequin edition spéciale ebook dp bogwx ref=pd sim,Books & Literature
enfants des dieux tome 2 ebook gratuit,Books & Literature
enfants dimension manipule plusieurs millénaires ebook dp bnwss ref=pd sim,Books & Literature
enfants ebook jeux pour apprendre,Books & Literature
enfants fées épisode finn ebook dp bkxuoxe ref=pd sim,Books & Literature
enfants fées épisode pacte sang ebook dp bkdlscfg ref=pd sim,Books & Literature
enfants nazis essai français crasnianski ebook dp bcrheoc ref=sr twi kin,Books & Literature
enfin maigris déclic lauto hypnose exercices ebook dp boqdcj ref=pd rhf cr s ts,Books & Literature
enfin maigris déclic lauto hypnose exercices ebook product reviews boqdcj ref=dpx acr txt,Books & Literature
enseignes furet du nord,Books & Literature
entreprises le furet du nord,Books & Literature
espace premium actu le furet du nord en ile de france,Books & Literature
espace premium essonne parashop et le furet du nord arrivent,Books & Literature
espace premium hauts de seine la librairie le furet du nord s installe au kremlin bicetre,Books & Literature
espace premium hauts de seine le furet du nord a ouvert,Books & Literature
espace premium oise pourquoi le furet du nord arrive en ville,Books & Literature
espace premium seine et marne le furet du nord cartonne a carre senart,Books & Literature
espace premium seine et marne le furet du nord ouvre au carre senart,Books & Literature
first communion preparation and printable patterns ebook,Books & Literature
fiscalité ebook,Books & Literature
flagrantes perversions soumission première nouvelle ebook dp bbpirss ref=pd sim,Books & Literature
flagrantes soumission première nouvelle erotique ebook dp bchkeu ref=pd sim,Books & Literature
flash actualite culture ebooks les restrictions imposees a apple tres critiques,Books & Literature
flash ou le grand voyage ebook gratuit,Books & Literature
fleur australe géraldine danon ebook dp bxdudcw ref=cm cr arp d product top,Books & Literature
fleur australe géraldine danon ebook dp bxdudcw ref=pd sim,Books & Literature
fleur australe géraldine danon ebook product reviews bxdudcw ref=dpx acr txt,Books & Literature
flic jour flic toujours heure ebook dp birxjku,Books & Literature
florilege ebook la fabrication de linformation les journalistes et,Books & Literature
fnac ebook gratuit titres pour euro,Books & Literature
fnac supprimer drm ebook,Books & Literature
foire aux cochons lectures amoureuses ebook dp buypqd ref=pd sim,Books & Literature
fr fr anglais gratuit ebook pour parler anglais,Books & Literature
fr fr anglais gratuit ebook pour parler anglais anglais pour les vacances,Books & Literature
fr fr anglais gratuit ebook pour parler anglais anglais professionnel,Books & Literature
fr fr anglais gratuit ebook pour parler anglais entretien en anglais conseils,Books & Literature
fr fr anglais gratuit ebook pour parler anglais la grammaire anglaise,Books & Literature
fr fr anglais gratuit ebook pour parler anglais phrases en anglais pour les recontres,Books & Literature
fr fr anglais gratuit ebook pour parler anglais vocabulaire anglais conseils,Books & Literature
fr fr article ebook catecheses du pape francois sur la famille volume ii,Books & Literature
fr fr article ebook catecheses sur la famille,Books & Literature
fr fr browse dr cgocable ca livre livres epub à johanne patricia cornwell ebooks en epub patricia cornwell kay scarpetta havre des morts epub,Books & Literature
fr fr ebook a corps defendant l integrale saison zugxevvkg dprvbza,Books & Literature
fr fr ebook a la merci des rois,Books & Literature
fr fr ebook a la merci du cheikh,Books & Literature
fr fr ebook a la recherche du temps perdu i,Books & Literature
fr survey furet du nord,Books & Literature
groupe prisma media femmes actuelles,Books & Literature
h e d l assassinat du miroir parution de l ebook pdf,Books & Literature
havre des morts ebook,Books & Literature
havre des morts ebook gratuit,Books & Literature
hc fr community posts titre de mon ebook,Books & Literature
héloïse ouille jean teulé ebook dp bslargcq,Books & Literature
héloïse révolution marie hélène texier ebook dp bzdty,Books & Literature
help fr fr article acheter des ebooks et emagazines sur kobo com,Books & Literature
help fr fr article obtenir des ebooks gratuits aupres de kobo,Books & Literature
help fr fr article obtenir des ebooks kobo sur votre liseuse sony,Books & Literature
help fr fr article transferer des ebooks sur une nouvelle liseuse kobo,Books & Literature
jeu mots fleches gratuits femmes actuelles,Books & Literature
les medias en parlent mode femmes actuelles,Books & Literature
mari charlene monaco victime dune couvade selon closer,Books & Literature
marie drucker amoureuse fougueuse selon closer,Books & Literature
marie drucker mathias vicherat couple tres heureux closer,Books & Literature
marie parmentier topless dans closer et public photos,Books & Literature
marley conservation verge closer,Books & Literature
mots coupes femmes actuelles,Books & Literature
n closer n avec jenifer a la une,Books & Literature
n closer n sorti dans les kiosques,Books & Literature
natalie portman nue dans closer la scene non censuree,Books & Literature
nathalie pechalat et jean dujardin dans closer photos,Books & Literature
psp forums harry potter et l ordre du phoenix a comment prendre le livre qui est dans la bibliotheque,Books & Literature
psp forums harry potter et l ordre du phoenix a le monstrueux livre des monstres psp,Books & Literature
quammen arts selection natural entertainment charles books kiwis darwin egg david,Books & Literature
quien es charles darwin,Books & Literature
quiz spe svt charles darwin et la theorie de levolution,Books & Literature
recherche niort l’acclameur rue charles darwin,Books & Literature
rosier anglais charles darwin ou rose anglaise jaune double charles darwin pot litres,Books & Literature
rosiers rosiers david austin rosier david austin charles darwin auspeet,Books & Literature
saint martin d heres espace montagne rue charles darwin ,Books & Literature
saint martin d heres l entrepot du bricolage saint martin d heres rue charles darwin ,Books & Literature
saint martin d heres lapeyre grenoble rue charles darwin ,Books & Literature
saint martin d heres naturhouse saint martin d heres rue charles darwin ,Books & Literature
"SeriesTitle:""Bibliothèque verte ;""",Books & Literature
services groupe france loisirs,Books & Literature
site de la bibliothèque verte,Books & Literature
slugterra le monde souterrain collection bibliothèque verte,Books & Literature
sr bibliotheque verte foot deux rue tome,Books & Literature
src bibliothèque verte hachette,Books & Literature
t collection bibliotheque verte hachette,Books & Literature
t foot rue extreme tomes a la bibliotheque verte,Books & Literature
t recherches de bibliotheque rose et bibliotheque verte,Books & Literature
tapis rouge decaux alain france loisirs bd,Books & Literature
telechargez serie le monde perdu de sir arthur conan doyle,Books & Literature
thouars france loisirs thouars avenue victor leclerc ,Books & Literature
trois aventures de sherlock holmes arthur conan doyle,Books & Literature
un scandale en boheme arthur conan doyle livre audio,Books & Literature
une etude en rouge de sherlock holmes arthur conan doyle,Books & Literature
une etude en rouge sir arthur conan doyle,Books & Literature
univers avantages rubrique abonnements magazines theme sports et loisirs evenement france football,Books & Literature
v lorient c shopping mode cadeaux c librairie france loisirs,Books & Literature
v marseille c shopping mode cadeaux c librairie c specialiste c bouquiniste france loisirs,Books & Literature
valence france loisirs valence rue emile augier ,Books & Literature
vannes france loisirs vannes rue jospeh le brix ,Books & Literature
voudrais savoir si livres bibliotheque verte ont valeur,Books & Literature
