flan au citron jamie oliver,Food & Drink - Cooking & Recipes
flan aux champignons marmiton,Food & Drink - Cooking & Recipes
Flour Tortilla Recipe Jamie Oliver,Food & Drink - Cooking & Recipes
fondant potatoes jamie oliver,Food & Drink - Cooking & Recipes
food la veritable recette du cordon bleu est ici plus d excuse pour cuisiner,Food & Drink - Cooking & Recipes
forum affich comment faire du bon pain maison facilement,Food & Drink - Cooking & Recipes
forum affich comment faire un pain avec une croute moins dure,Food & Drink - Cooking & Recipes
forum cuisine f cuisine pour une debutante peut on faire du pain avec la levure chimique,Food & Drink - Cooking & Recipes
forum faire du sandwich sans pain t,Food & Drink - Cooking & Recipes
forum les meilleures recettes de base du net le pain,Food & Drink - Cooking & Recipes
recettes avocat marmiton,Food & Drink - Cooking & Recipes
galeries la cuisine de mercotte,Food & Drink - Cooking & Recipes
galette de pain pour kebab de jamie oliver,Food & Drink - Cooking & Recipes
gambas croustillantes et parfumees de jamie oliver,Food & Drink - Cooking & Recipes
games babymonkee jamie olivers lasagne recipe,Food & Drink - Cooking & Recipes
gammon in cider jamie oliver,Food & Drink - Cooking & Recipes
gateau la cuisine de mercotte,Food & Drink - Cooking & Recipes
gourmets la cuisine de mercotte,Food & Drink - Cooking & Recipes
jai just appri a cuisiner grace a mccain,Food & Drink - Cooking & Recipes
jarret d'agneau marmiton,Food & Drink - Cooking & Recipes
jarret de boeuf confit caramélisé marmiton,Food & Drink - Cooking & Recipes
la cuisine de bernard avoine,Food & Drink - Cooking & Recipes
la cuisine de bernard beignet de crevette,Food & Drink - Cooking & Recipes
la cuisine de bernard bellvaire,Food & Drink - Cooking & Recipes
la cuisine de bernard biscuit aux flocons avoine,Food & Drink - Cooking & Recipes
la cuisine de bernard blanquette,Food & Drink - Cooking & Recipes
la cuisine de bernard blanquette de veau,Food & Drink - Cooking & Recipes
la cuisine de bernard boeuf bourguignon,Food & Drink - Cooking & Recipes
la cuisine de bernard bourdaloue,Food & Drink - Cooking & Recipes
la cuisine de mercotte dessert,Food & Drink - Cooking & Recipes
la cuisine de mercotte gateau de savoie,Food & Drink - Cooking & Recipes
La cuisine de Mercotte poulet au vin jaune,Food & Drink - Cooking & Recipes
le blog de mes meilleures recettes,Food & Drink - Cooking & Recipes
les aliments qu'on peut pas cuisiner ensemble,Food & Drink - Cooking & Recipes
les appareil les plus pratiquenpour cuisiner,Food & Drink - Cooking & Recipes
les avantage et inconvenient du metiers de cuisiner,Food & Drink - Cooking & Recipes
les avantages de cuisiner a la plancha,Food & Drink - Cooking & Recipes
les bons plans de jamie oliver,Food & Drink - Cooking & Recipes
les cookies de jamie oliver,Food & Drink - Cooking & Recipes
les meilleures idees recettes couscous marocain poulet,Food & Drink - Cooking & Recipes
les meilleures recettes a la courgette,Food & Drink - Cooking & Recipes
les meilleures recettes asiatiques,Food & Drink - Cooking & Recipes
les meilleures recettes au barbecue,Food & Drink - Cooking & Recipes
les meilleures sites de cuisinel,Food & Drink - Cooking & Recipes
les meilleurs site de recette de cuisine italiene,Food & Drink - Cooking & Recipes
maison bricolage plein air cuisiner,Food & Drink - Cooking & Recipes
mamans manger en famille cuisiner avec les enfants,Food & Drink - Cooking & Recipes
mamans manger en famille cuisiner avec les enfants alimentation des etudiants de la planification et des legumes a,Food & Drink - Cooking & Recipes
mayonnaise recipe jamie oliver,Food & Drink - Cooking & Recipes
meilleures recettes à base de cardes,Food & Drink - Cooking & Recipes
meilleures recettes a base de pate feuilleté ds,Food & Drink - Cooking & Recipes
meilleures recettes apéro,Food & Drink - Cooking & Recipes
meilleures recettes aubergines,Food & Drink - Cooking & Recipes
pâte a beignet marmiton,Food & Drink - Cooking & Recipes
peut on faire des pain au chocolat avec du chocolat au lait,Food & Drink - Cooking & Recipes
philadelphia les meilleures recettes idee pour cuisiner le cream cheese le plus celebre de new york,Food & Drink - Cooking & Recipes
photos les meilleures recettes aux crevettes,Food & Drink - Cooking & Recipes
photos les meilleures recettes de mousses,Food & Drink - Cooking & Recipes
poudre pour cuisiner,Food & Drink - Cooking & Recipes
quatre quart pur beurre recette marmiton,Food & Drink - Cooking & Recipes
que cuisiner au barbecue sur une plage,Food & Drink - Cooking & Recipes
que cuisiner au repas du soir,Food & Drink - Cooking & Recipes
que cuisiner aujourdhui,Food & Drink - Cooking & Recipes
que cuisiner avce de la farine de chataigne,Food & Drink - Cooking & Recipes
que cuisiner avec boutons de roses,Food & Drink - Cooking & Recipes
que cuisiner avec couenne de porc,Food & Drink - Cooking & Recipes
que cuisiner ce soir rapidement,Food & Drink - Cooking & Recipes
que faire avec un reste depaté marmiton,Food & Drink - Cooking & Recipes
que manger avec un saint emilion,Food & Drink - Cooking & Recipes
recette puree de feves courgette et tomate aux saveurs marocaines,Food & Drink - Cooking & Recipes
recettes a cuisiner chocolat chaud noir maison,Food & Drink - Cooking & Recipes
recettes a cuisiner vege pate maison,Food & Drink - Cooking & Recipes
recettes cuisiner chocolats maison,Food & Drink - Cooking & Recipes
revendiquer la créativité de cuisiner,Food & Drink - Cooking & Recipes
revendre des plats cuisiner sur les marcher,Food & Drink - Cooking & Recipes
rever de cuisiner,Food & Drink - Cooking & Recipes
smoothie cuisine de bernard,Food & Drink - Cooking & Recipes
soupe de courgettes cuisine de bernard,Food & Drink - Cooking & Recipes
soupe potiron cuisine de bernard,Food & Drink - Cooking & Recipes
taboulé marmiton,Food & Drink - Cooking & Recipes
Tartare Sauce Recipe Jamie Oliver,Food & Drink - Cooking & Recipes
tuto comment faire un bon cuny,Food & Drink - Cooking & Recipes
un bon riz presque comme une paella,Food & Drink - Cooking & Recipes
video comment faire du pain,Food & Drink - Cooking & Recipes
video comment faire du pain maison facilement,Food & Drink - Cooking & Recipes
190 cours illustrés à l'Ecole de Cuisine,Food & Drink - Culinary Training
a atelier des chefs maki et sushi,Food & Drink - Culinary Training
a propos de l art culinaire,Food & Drink - Culinary Training
accueil de l etablissement les formations proposees apprentissage mention complementaire cuisinier en desserts de restaurant par apprentissage,Food & Drink - Culinary Training
accueil ecoles stages externes cuisine,Food & Drink - Culinary Training
activite enfant lyon feter son anniversaire anniversaire l atelier des chefs,Food & Drink - Culinary Training
activite enfant paris ateliers gourmands les coulisses des p tits chefs,Food & Drink - Culinary Training
activity ecole de cuisine detail,Food & Drink - Culinary Training
actualite formation culinaire et promotion des arts culinaires en vue de creer de la cohesion sociale en milieu defavorise,Food & Drink - Culinary Training
actualite l academie culinaire mandar un nouveau lieu evenementiel sur le min de rungis dedie a l art culinaire,Food & Drink - Culinary Training
actualites cook art l art culinaire,Food & Drink - Culinary Training
animations ateliers cuisine,Food & Drink - Culinary Training
annonce sorties spectacles voyages cours de cuisine actifs avec un chef a h de paris,Food & Drink - Culinary Training
apprendre a cuisiner les bases,Food & Drink - Culinary Training
apprenti assistant chef de produit,Food & Drink - Culinary Training
apprenti chef de produit,Food & Drink - Culinary Training
Apprentice chef jobs,Food & Drink - Culinary Training
Apprentie chef de projet informatique,Food & Drink - Culinary Training
apres le lycee école de cuisine,Food & Drink - Culinary Training
art culinaire,Food & Drink - Culinary Training
art culinaire à montréal,Food & Drink - Culinary Training
art culinaire de la table et du service,Food & Drink - Culinary Training
art culinaire deco,Food & Drink - Culinary Training
art culinaire des gateaux danniversaire uniques trop cool pour etre manger,Food & Drink - Culinary Training
art culinaire design,Food & Drink - Culinary Training
art culinaire desserts de fete a,Food & Drink - Culinary Training
art culinaire du monde creole,Food & Drink - Culinary Training
art culinaire et mode,Food & Drink - Culinary Training
art culinaire floral,Food & Drink - Culinary Training
article ateliers de cuisine adulte et enfant,Food & Drink - Culinary Training
article cours de cuisine illustres a l ecole de cuisine alain ducasse,Food & Drink - Culinary Training
article l atelier des chefs le cours,Food & Drink - Culinary Training
article on teste en famille l atelier des chefs,Food & Drink - Culinary Training
article presentation des ateliers pratiques de cuisine,Food & Drink - Culinary Training
article recette facile rapide economique pour cuisiner naturel,Food & Drink - Culinary Training
article reprise des ateliers cuisine pour les enfants,Food & Drink - Culinary Training
article un festival pour celebrer l art culinaire,Food & Drink - Culinary Training
atelier cuisine dans les ecoles sodexo,Food & Drink - Culinary Training
bon plan paris cours de cuisine,Food & Drink - Culinary Training
boulangerie voyeur top classe,Food & Drink - Culinary Training
bretagne carantec carantec steven apprenti cuisinier releve le defi des chefs en or,Food & Drink - Culinary Training
bts hotellerie art culinaire art de la table,Food & Drink - Culinary Training
c maison cuisine et arts de la table culinaire,Food & Drink - Culinary Training
cadeau cours de cuisine Paris,Food & Drink - Culinary Training
campus article la generation top chef debarque dans les ecoles de cuisine,Food & Drink - Culinary Training
carcassonne le concours apprenti show s en sort comme un chef,Food & Drink - Culinary Training
carcassonne un apprenti en finale des chefs en or aujourd hui,Food & Drink - Culinary Training
chefs école de cuisine alain ducasse,Food & Drink - Culinary Training
chefs livres pratiques cours illustres a l ecole alain ducasse sold,Food & Drink - Culinary Training
code promotion atelier des chefs,Food & Drink - Culinary Training
comment cuisiner les épinards facile,Food & Drink - Culinary Training
comment etudier france dans ecole cuisine,Food & Drink - Culinary Training
commis apprentice chef,Food & Drink - Culinary Training
content cuisiner poisson recettes faciles rapides,Food & Drink - Culinary Training
contrat d apprentissage cuisinier,Food & Drink - Culinary Training
cooking par l atelier des chefs,Food & Drink - Culinary Training
cordon bleu ecole de cuisine,Food & Drink - Culinary Training
cours adultes cuisine par la mairie de paris,Food & Drink - Culinary Training
cours cuisine celibataires paris,Food & Drink - Culinary Training
cours cuisine indienne paris,Food & Drink - Culinary Training
cours cuisine moleculaire paris,Food & Drink - Culinary Training
cours cuisine parent enfant paris,Food & Drink - Culinary Training
cours de cuisine a domicile paris,Food & Drink - Culinary Training
cours de cuisine aphrodisiaque paris,Food & Drink - Culinary Training
cours de cuisine ateliers stages,Food & Drink - Culinary Training
cours et ateliers de cuisine,Food & Drink - Culinary Training
cuisine pratique recettes recette chefs apprenti cuisinier,Food & Drink - Culinary Training
cuisine recettes enfants recettes de chef pour votre apprenti cuistot,Food & Drink - Culinary Training
cuisiner facile,Food & Drink - Culinary Training
deals l atelier des chefs,Food & Drink - Culinary Training
deguster art culinaire,Food & Drink - Culinary Training
diots aux lentilles marmiton,Food & Drink - Culinary Training
dossier art culinaire,Food & Drink - Culinary Training
dossiers tendance interet des ateliers cuisine,Food & Drink - Culinary Training
du poisson facile à cuisiner,Food & Drink - Culinary Training
ecole cuisine calendrier des stages,Food & Drink - Culinary Training
ecole ritz escoffier paris cours cuisine,Food & Drink - Culinary Training
emission ateliers cuisine monde,Food & Drink - Culinary Training
espace premium essonne une classe d exception dediee aux apprentis chefs d orchestres,Food & Drink - Culinary Training
etablissements ecoles hotelieres en contrat de professionnalisation,Food & Drink - Culinary Training
etudes annuaire alternance formation scolarite contrat d apprentissage contrat de professionnalisation critere bts hôtellerie restauration option art culinaire art de la table et du service,Food & Drink - Culinary Training
etudes annuaire enseignement superieur formation formation bts hotellerie restauration option art culinaire art de la table et du service,Food & Drink - Culinary Training
etudes annuaire enseignement superieur formation formation licence pro metiers des arts culinaires et des arts de la table,Food & Drink - Culinary Training
etudes bts bts hotellerie restauration option art culinaire art de la table et du service,Food & Drink - Culinary Training
etudes ecoles specialisees formation hoteliere leshotel,Food & Drink - Culinary Training
etudes international ma vie d etudiant a shanghai romain en bachelor arts culinaires et management de la restauration a l institut paul bocuse,Food & Drink - Culinary Training
etudiant formations ecole hoteliere,Food & Drink - Culinary Training
etudiant orientation formation cfa hotelier public belliard bts hotellerie restauration option b art culinaire art de la table et du service,Food & Drink - Culinary Training
evaluer des ateliers cuisine,Food & Drink - Culinary Training
événements ateliers cuisine tiramisu,Food & Drink - Culinary Training
formation bts hotellerie restauration option art culinaire art de la table et du service fc a f d cbfdff,Food & Drink - Culinary Training
formation ecoles ferrandi paris bac pro cuisine ans formation,Food & Drink - Culinary Training
formation ecoles hotelieres,Food & Drink - Culinary Training
formation initiale catalogue bts hotellerie restauration option b art culinaire art de la table et du service,Food & Drink - Culinary Training
formations apprentissage bts hotellerie restauration option b art culinaire art de la table et du service,Food & Drink - Culinary Training
formations diplomes bts hr arts culinaires de la table,Food & Drink - Culinary Training
formations et diplomes bts art culinaire de la table et du service,Food & Drink - Culinary Training
cours de cuisine a l atelier des chefs,Food & Drink - Culinary Training
cours de cuisine vegan a paris tarifs,Food & Drink - Culinary Training
gateau creation art culinaire noel,Food & Drink - Culinary Training
les cours cuisine alain ducasse a paris,Food & Drink - Culinary Training
master classe en arts culinaires,Food & Drink - Culinary Training
gastronomie recettes faciles pour cuisiner les restes,Food & Drink - Culinary Training
gourmets l atelier des chefs,Food & Drink - Culinary Training
groupes paris activites atelier des chefs,Food & Drink - Culinary Training
groupes paris activites cours de cuisine degustation,Food & Drink - Culinary Training
groupes paris activites cours de cuisine degustation a l ateliers des chefs,Food & Drink - Culinary Training
ile maurice divine ile maurice art culinaire ile maurice,Food & Drink - Culinary Training
jeu beignets ecole de cuisine de sara,Food & Drink - Culinary Training
jeu de societe l atelier des chefs,Food & Drink - Culinary Training
job apprentice chef,Food & Drink - Culinary Training
l art culinaire,Food & Drink - Culinary Training
l art culinaire japonais,Food & Drink - Culinary Training
L'hôtelerie et la restauration,Food & Drink - Culinary Training
la decoration culinaire tout un art,Food & Drink - Culinary Training
laparisienne cuisine genevieve lethu se specialise dans l art culinaire,Food & Drink - Culinary Training
le cordon bleu formation paris,Food & Drink - Culinary Training
le cordon bleu paris cuisine tarif,Food & Drink - Culinary Training
Le Cordon Bleu Paris Paris France,Food & Drink - Culinary Training
les academiciens de l'art culinaire francais,Food & Drink - Culinary Training
les ateliers cuisine atelier cuisine faire ses laits vegetaux,Food & Drink - Culinary Training
les ateliers cuisine cuisine classique,Food & Drink - Culinary Training
les ateliers cuisine cuisine du monde,Food & Drink - Culinary Training
les beaux arts culinaires,Food & Drink - Culinary Training
les chefs de l association tunisienne des professionnels de l art culinaire se reunissent pour signer la charte de fraternite avec l,Food & Drink - Culinary Training
les cours de cuisine sur les marches de paris reprennent,Food & Drink - Culinary Training
les ecoles cuisine patisserie adultes,Food & Drink - Culinary Training
les meilleurs cours et ateliers de cuisine a paris,Food & Drink - Culinary Training
les repas stique humour anniversaire ans vingtaine vingt femme plats repas cuistot cuisiniere cordon bleu restaurant gastronomie art culinaire popote marmiton motif,Food & Drink - Culinary Training
lesechos ech comment tefal a transforme l art culinaire,Food & Drink - Culinary Training
lesechos ech guy demarle veut surfer sur engouement pour art culinaire,Food & Drink - Culinary Training
licence arts culinaires et management de la restauration,Food & Drink - Culinary Training
licence développement en art culinaire,Food & Drink - Culinary Training
Licence pro hôtellerie et tourisme spécialité métiers des arts culinaires et des arts de la table,Food & Drink - Culinary Training
licence pro metiers des arts culinaires,Food & Drink - Culinary Training
lifestyle culinaire comment preparer le the dans les regles de l art article normal,Food & Drink - Culinary Training
liste des ecoles hotelieres patisserie,Food & Drink - Culinary Training
liste ecole de cuisine france,Food & Drink - Culinary Training
livre cuisine ecole hoteliere,Food & Drink - Culinary Training
livres cours illustres a l ecole de cuisine,Food & Drink - Culinary Training
livres modernist cuisine art et science culinaires,Food & Drink - Culinary Training
loir et cher actualite education n contenus articles le top chef des apprentis,Food & Drink - Culinary Training
loisirs articles l ecole alain ducasse,Food & Drink - Culinary Training
marche de nuit arts culinaires de,Food & Drink - Culinary Training
meilleur ecole cuisine france,Food & Drink - Culinary Training
mfp l art culinaire francais par nos grands maitres de la cuisine collectif,Food & Drink - Culinary Training
mp gastronomie du monde entier le monde complet de l art culinaire la cuisine de grand mere,Food & Drink - Culinary Training
ne manquez pas le rendez vous des arts culinaires,Food & Drink - Culinary Training
nos ateliers cuisines paris atelier cuisine orientale,Food & Drink - Culinary Training
objectif top chef nouveau concours tv pour les apprentis en cuisine a,Food & Drink - Culinary Training
offre apprenti e assistant chef de produit,Food & Drink - Culinary Training
offre apprentissage cap cuisinier epreuve,Food & Drink - Culinary Training
ou manger a paris les ecoles de cuisine,Food & Drink - Culinary Training
ouverture cuisines ecole valentin,Food & Drink - Culinary Training
ouvrir une ecole de cuisine en algerie,Food & Drink - Culinary Training
p chef de partie jobs apprentice chef de partie for michelin star restaurant in petersfield,Food & Drink - Culinary Training
p commis chef jobs apprentice chef,Food & Drink - Culinary Training
pages art culinaire sequence pedagogique tice dp,Food & Drink - Culinary Training
pages ecoles ecoles hotelieres,Food & Drink - Culinary Training
petit menager arts culinaires accessoires petit menager,Food & Drink - Culinary Training
petit menager arts culinaires accessoires petit menager accessoires cafetieres,Food & Drink - Culinary Training
petit menager arts culinaires accessoires petit menager accessoires repassage,Food & Drink - Culinary Training
petit menager arts culinaires arts de la table,Food & Drink - Culinary Training
petit menager arts culinaires arts de la table ustensiles et accessoires de cuisine,Food & Drink - Culinary Training
petit menager arts culinaires boissons,Food & Drink - Culinary Training
plat a cuisiner facile,Food & Drink - Culinary Training
post gastronomie art culinaire rue,Food & Drink - Culinary Training
prestige l ecole de cuisine alain ducasse,Food & Drink - Culinary Training
programme des conferences ateliers cuisine ateliers cuisine vins bio,Food & Drink - Culinary Training
Que cuisiner à mes parents Quelque chose de facile,Food & Drink - Culinary Training
recette cours de cuisine atelier des chefs lyon,Food & Drink - Culinary Training
recherche departement drome ecole hoteliere,Food & Drink - Culinary Training
recherche toulon apprentissage cuisinier patissier,Food & Drink - Culinary Training
ressources univers formation formations post bac bts hotellerie restauration option art culinaire art de la table et du service,Food & Drink - Culinary Training
ressources univers formation formations post bac licence pro hotellerie et tourisme specialite metiers des arts culinaires et des arts de la table,Food & Drink - Culinary Training
ressources univers formation formations post bac licence pro metiers des arts culinaires et des arts de la table,Food & Drink - Culinary Training
ressources univers postbac postbac rhone alpes rhone institut paul bocuse ecole de management hotellerie restauration arts culinaires,Food & Drink - Culinary Training
restaurant gastronomique les grands chefs et les apprentis,Food & Drink - Culinary Training
resultat bts resultat bts hotellerie restauration art culinaire strasbourg,Food & Drink - Culinary Training
resultats bts nice bts art culinaire,Food & Drink - Culinary Training
salon de la gastronomie et des arts culinaires,Food & Drink - Culinary Training
salon des arts culinaires paris,Food & Drink - Culinary Training
similaires quot recevoir monet quot arts culinaires croisent arts peinture,Food & Drink - Culinary Training
stickers cuisine art culinaire,Food & Drink - Culinary Training
sujets corrigé d une étude de cas bts hôtellerie restauration option b art culinaire art de la table et du service session sciences appliquées,Food & Drink - Culinary Training
sushi sushi burger la tendance culinaire qui affole instagram art,Food & Drink - Culinary Training
t art culinaire art de la table,Food & Drink - Culinary Training
t cuisine recettes et art culinaire,Food & Drink - Culinary Training
tag ateliers cuisine enfants,Food & Drink - Culinary Training
tag metiers des arts culinaires et des arts de la table,Food & Drink - Culinary Training
université angers art culinaire,Food & Drink - Culinary Training
videos cuisine cuisine algerienne art culinaire algerien,Food & Drink - Culinary Training
videos cuisine videos cuisine tunisienne art culinaire tunisien,Food & Drink - Culinary Training
vivre a istanbul art de vivre cuisine turque specialites culinaires,Food & Drink - Culinary Training
votre bistroy ateliers de cuisine,Food & Drink - Culinary Training
wiki apprendre à cuisiner les bases d'une bonne alimentation,Food & Drink - Culinary Training
wiki histoire de l'art culinaire,Food & Drink - Culinary Training
a midi on a trouve une petite boulangere,Food & Drink - Grocery & Food Retailers
accord branche forfait jour commerce de detail,Food & Drink - Grocery & Food Retailers
accueil produits notre offre epicerie fonio,Food & Drink - Grocery & Food Retailers
achat epicerie fine en ligne,Food & Drink - Grocery & Food Retailers
activite epiceries fines paris,Food & Drink - Grocery & Food Retailers
alimentation bio epicerie fine boutique bio en ligne biocenter,Food & Drink - Grocery & Food Retailers
amicale des anciens boulangers et boulangers patissiers de creuse bourbonnais evaux les bains creuse,Food & Drink - Grocery & Food Retailers
amiens salon de the et cafe,Food & Drink - Grocery & Food Retailers
amphion tous les rayons epicerie salee aides culinaires sel et epices sel,Food & Drink - Grocery & Food Retailers
amphion tous les rayons epicerie salee condiments huile et vinaigre huile,Food & Drink - Grocery & Food Retailers
amphion tous les rayons epicerie salee conserves de legumes champignons tomates marrons,Food & Drink - Grocery & Food Retailers
amphion tous les rayons epicerie salee conserves de legumes haricots verts et beurre,Food & Drink - Grocery & Food Retailers
amphion tous les rayons epicerie salee legumes secs cereales et bles cereales bles,Food & Drink - Grocery & Food Retailers
amphion tous les rayons epicerie salee pates terrines et foie gras foie gras,Food & Drink - Grocery & Food Retailers
amphion tous les rayons epicerie salee plats cuisines paella couscous chili,Food & Drink - Grocery & Food Retailers
amphion tous les rayons epicerie salee plats cuisines taboule,Food & Drink - Grocery & Food Retailers
amphion tous les rayons epicerie salee produits aperitifs chips biscuits sales,Food & Drink - Grocery & Food Retailers
amphion tous les rayons epicerie salee produits aperitifs chips saucisses cocktail,Food & Drink - Grocery & Food Retailers
amphion tous les rayons epicerie salee produits du monde asie,Food & Drink - Grocery & Food Retailers
amphion tous les rayons epicerie salee produits du monde portugal,Food & Drink - Grocery & Food Retailers
amphion tous les rayons epicerie salee produits du monde tex mex,Food & Drink - Grocery & Food Retailers
article l epicerie des allergiques,Food & Drink - Grocery & Food Retailers
article le moulin a cafe,Food & Drink - Grocery & Food Retailers
article le patissier,Food & Drink - Grocery & Food Retailers
article le petit sale chaud du matin des bouchers,Food & Drink - Grocery & Food Retailers
article les boulangers dans illegalite du congele,Food & Drink - Grocery & Food Retailers
article les degustateurs ont plutot apprecie le flan patissier,Food & Drink - Grocery & Food Retailers
assistant détail du commerce,Food & Drink - Grocery & Food Retailers
