2 droit de la propriété intellectuelle,Illegal - Copyright Infringement
article leonce le cannabis et le petard,Illegal - Illegal Drugs
article les anti rhumes des amphetamines cachees en vente libre,Illegal - Illegal Drugs
article les dangers du cannabis,Illegal - Illegal Drugs
article les gendarmes saisissent pieds de cannabis,Illegal - Illegal Drugs
article les infiltres sur france cocaine les ados accros,Illegal - Illegal Drugs
article les policiers decouvrent deux chambres de culture de cannabis,Illegal - Illegal Drugs
article les raideurs musculaires et le cannabis,Illegal - Illegal Drugs
article lexique ii les drogues hallucinogenes,Illegal - Illegal Drugs
article pilules d ecstasy retrouvees au domicile d un dealer presume a saint gilles,Illegal - Illegal Drugs
barquette champignons hallucinogènes,Illegal - Illegal Drugs
bienfait du cannabis,Illegal - Illegal Drugs
bienfait économique du cannabis,Illegal - Illegal Drugs
bill cosby fatigue de l islam de ceux qui profitent de l aide sociale des drogues,Illegal - Illegal Drugs
bio effets durables drogues organisme,Illegal - Illegal Drugs
biotic neuro drogues html serotonine,Illegal - Illegal Drugs
c'est quoi des champignons hallucinogènes,Illegal - Illegal Drugs
célèbre drogue colombie,Illegal - Illegal Drugs
celebrités et drogue,Illegal - Illegal Drugs
célébrités ravagées par la drogue,Illegal - Illegal Drugs
censored lse dles ecstasy,Illegal - Illegal Drugs
champignons hallucinogenes acheter des champignons,Illegal - Illegal Drugs
champignons hallucinogenes besoin daide culture champis psilocybe cubensis b,Illegal - Illegal Drugs
champignons hallucinogènes effets et conséquences,Illegal - Illegal Drugs
chupa chups ecstasy,Illegal - Illegal Drugs
Cocaine,Illegal - Illegal Drugs
comprendre les produits amphetamines,Illegal - Illegal Drugs
conclusion exposé drogue et jeunes,Illegal - Illegal Drugs
condamnation a beauvais pour trafic drogues quartier argentine,Illegal - Illegal Drugs
condamnation pour 1 kg de cannabis en 2016,Illegal - Illegal Drugs
condamnation pour conduite sous cannabis,Illegal - Illegal Drugs
conduite sans permis consommation cocaïne,Illegal - Illegal Drugs
conduite sous cannabis sanction,Illegal - Illegal Drugs
conseils pour diminuer les risques lors de la prise de cocaine,Illegal - Illegal Drugs
consequence de l'ecstasy sur la société,Illegal - Illegal Drugs
consommation heroine echelle,Illegal - Illegal Drugs
consommation heroine sanctions,Illegal - Illegal Drugs
content cannabis cocaïne ecstasy quand la chimie lutte contre les trafics de drogue,Illegal - Illegal Drugs
controles en possession de rivotril de zamal et d ecstasy,Illegal - Illegal Drugs
cours ndeg addiction au cannabis la cocaine aux amphetamines aux opiaces aux drogues de synthese,Illegal - Illegal Drugs
critique concert b side duchess says lesbians on ecstasy b side,Illegal - Illegal Drugs
detail photo d'actualité man is photographed snorting cocaine april photo dactualité,Illegal - Illegal Drugs
détection cannabis pécresse,Illegal - Illegal Drugs
detection cocaine dans la salive,Illegal - Illegal Drugs
detection de consommation de drogue,Illegal - Illegal Drugs
detection de drogue,Illegal - Illegal Drugs
detention et usage de drogue aida patra devant le procureur ce jeudi a,Illegal - Illegal Drugs
deux infraction dont une avec cannabis,Illegal - Illegal Drugs
deux kilo de cocaine saisie a sevran,Illegal - Illegal Drugs
deux kilos de cannabis dans la smart,Illegal - Illegal Drugs
documents obs johnny rotten je doute que les amphetamines m aient beaucoup aide,Illegal - Illegal Drugs
drogues illégale,Illegal - Illegal Drugs
durée effet champignon hallucinogène,Illegal - Illegal Drugs
effet hallucinogène du LSD,Illegal - Illegal Drugs
en etat vegetatif a cause de la drogue,Illegal - Illegal Drugs
en fr accueil info drogue aid,Illegal - Illegal Drugs
en france il est préférable de prohiber le cannabis,Illegal - Illegal Drugs
enfants drogues dnas le metro,Illegal - Illegal Drugs
engrais cannabis,Illegal - Illegal Drugs
engrais cannabis automatique,Illegal - Illegal Drugs
enquete d action cannabis cocaine l espagne au coeur des trafics,Illegal - Illegal Drugs
Enquete d'action cannabis cocaine espagne streaming,Illegal - Illegal Drugs
faire un hallucinogène maison,Illegal - Illegal Drugs
first time cocaine dosage,Illegal - Illegal Drugs
flakka la nouvelle drogue qui affole la presse,Illegal - Illegal Drugs
flash actualite culture delit de fuite cocaine et sans permis benoit magimel devant les juges,Illegal - Illegal Drugs
flash actualite economie le marche des drogues en france estime a milliards d euros,Illegal - Illegal Drugs
flash actualite insolite bresil la camionnette se renverse et deverse plus d une tonne de cannabis,Illegal - Illegal Drugs
flash actualite monde a expogrow le cannabis tient salon et attire les consommateurs francais,Illegal - Illegal Drugs
flash actualite monde air cocaine il existe un risque serieux de fuite de naudin,Illegal - Illegal Drugs
flash actualite monde air cocaine l audience de naudin devant un juge reportee,Illegal - Illegal Drugs
flash actualite monde air cocaine mandat d arret dominicain contre trois francais dont aymeric chauprade,Illegal - Illegal Drugs
flash actualite monde aux pays bas doede un cultivateur hippie de cannabis gracie par la justice,Illegal - Illegal Drugs
flash actualite monde israel prend tres au serieux le cannabis therapeutique,Illegal - Illegal Drugs
flash actualite monde le cannabis synthetique de plus en plus utilise aux etats unis,Illegal - Illegal Drugs
forum t p amphetamines smart drug pour etudier,Illegal - Illegal Drugs
fr fr divertissement story culture and loisirs lactrice whoopi goldberg se lance dans le cannabis à usage médicinal ar bbrdoj,Illegal - Illegal Drugs
fr fr divertissement story michel drucker toxicomane il révèle à quelle drogue dure il est accro vi bbqbyyk,Illegal - Illegal Drugs
fr fr divertissement videos le guen pour la légalisation du cannabis cest pas encore au programme vp bbrfce,Illegal - Illegal Drugs
fr fr video actualite cannabis le débat sur la dépénalisation relancé vi bbrelgc,Illegal - Illegal Drugs
fr fr video actualite le guen le ps doit réfléchir à la fin de la prohibition du cannabis vp bbrdd,Illegal - Illegal Drugs
fr guides pratiques hepatitec detaille prevention reduction mefaits fumer crack facon plus securitaire,Illegal - Illegal Drugs
hallucinogène psychédélique,Illegal - Illegal Drugs
hallucinogene synthetique,Illegal - Illegal Drugs
hallucinogénes et enthéogénes,Illegal - Illegal Drugs
haut parleur guitare eminence patriot cannabis rex,Illegal - Illegal Drugs
haute savoie demantelement d un trafic de cocaine et d heroine,Illegal - Illegal Drugs
haute savoie deux dealers d heroine condamnes a un an,Illegal - Illegal Drugs
haute savoie lancer de cannabis,Illegal - Illegal Drugs
hauts de seine assassine pour une dette de drogue,Illegal - Illegal Drugs
hauts de seine les dealers de crack pouvaient vendre jusqu a cent doses par jour,Illegal - Illegal Drugs
ibuprofene amphétamines,Illegal - Illegal Drugs
insolite une americaine cachait une arme dans son vagin et des amphetamines dans son porte feuille,Illegal - Illegal Drugs
Ivre et drogue cambrai,Illegal - Illegal Drugs
j'ai fumer de la résine de cannabis toute ma grossesse,Illegal - Illegal Drugs
jager liquid cocaine,Illegal - Illegal Drugs
le pib de litalie bientot dope par la drogue et la prostitution,Illegal - Illegal Drugs
le piege du cannabis,Illegal - Illegal Drugs
le plus grand trafiquant de drogue,Illegal - Illegal Drugs
le plus gros trafiquand de drogue des etat unis,Illegal - Illegal Drugs
Le point sur l’addiction à la cocaïne et au crack,Illegal - Illegal Drugs
législation champignons hallucinogènes france,Illegal - Illegal Drugs
les champignons hallucinogenes,Illegal - Illegal Drugs
les dangers de l ecstasy a,Illegal - Illegal Drugs
les differentes plantes hallucinogenes,Illegal - Illegal Drugs
Les drogues hallucinogènes,Illegal - Illegal Drugs
les ecstasy mdma,Illegal - Illegal Drugs
les ecstasy prix,Illegal - Illegal Drugs
les melanges ecstasy,Illegal - Illegal Drugs
livre drogues amphetamines,Illegal - Illegal Drugs
maison saisie sur les trafiquants de drogue,Illegal - Illegal Drugs
nancy nancy peines de prison pour un trafic de cocaine entre la france et saint domingue,Illegal - Illegal Drugs
nanterre le couple passeur de drogue condamne,Illegal - Illegal Drugs
nantes nantes quatre kilos drogue retrouves cave ado ans garde vue,Illegal - Illegal Drugs
opiaces amphetamines et autres joyeusetes drogues faire soi meme,Illegal - Illegal Drugs
opiaces amphetamines et autres joyeusetes fausse ordonnance chope,Illegal - Illegal Drugs
opiaces amphetamines et autres joyeusetes jen peux plus de cette codeine de merde,Illegal - Illegal Drugs
opiaces amphetamines et autres joyeusetes seroquel xanax triapridal des informations,Illegal - Illegal Drugs
opiaces amphetamines et autres joyeusetes trucs et astuces pour se deboucher les narines,Illegal - Illegal Drugs
opiaces amphetamines et autres joyeusetes tryptophane la molecule du bonheur,Illegal - Illegal Drugs
opiaces amphetamines et autres joyeusetes yohimbine houde,Illegal - Illegal Drugs
pas de narine pas de cocaine,Illegal - Illegal Drugs
passion spirit of ecstasy,Illegal - Illegal Drugs
plante antilles hallucinogène,Illegal - Illegal Drugs
possession cocaine,Illegal - Illegal Drugs
pourquoi les drogues sont elles illégales,Illegal - Illegal Drugs
prevention drogues les taz ecstasy,Illegal - Illegal Drugs
quartiers de la drogue a charleroi,Illegal - Illegal Drugs
quatre morts dans un accident a rouen le conducteur sous l emprise de l alcool et du cannabis,Illegal - Illegal Drugs
que faire avec un enfant qui se drogue,Illegal - Illegal Drugs
quel comportement a une personne qui fume de la cocaïne,Illegal - Illegal Drugs
quel drogue est la plus dangereuse,Illegal - Illegal Drugs
quelle cantite de cocaine peut tre dangereux,Illegal - Illegal Drugs
quelle différence entre héroïne et cocaïne,Illegal - Illegal Drugs
rave ecstasy,Illegal - Illegal Drugs
recette ecstasy,Illegal - Illegal Drugs
retour en image sur la journee tous ensemble contre les drogues,Illegal - Illegal Drugs
reunion drogué haut rhin,Illegal - Illegal Drugs
sante a z ecstasy et musique un cocktail explosif o,Illegal - Illegal Drugs
sante alcool tabac drogues ecstasy levre gonflee sujet,Illegal - Illegal Drugs
sevrage drogue,Illegal - Illegal Drugs
sexe contestation drogue et rock n roll,Illegal - Illegal Drugs
societe l inquietant essor des champignons hallucinogenes,Illegal - Illegal Drugs
t acheter de haute qualite mephedrone la ketamine flephedrone pentylone amphetamines etc douglaswattgmail com,Illegal - Illegal Drugs
tableau d elimination des drogues,Illegal - Illegal Drugs
tableau des drogues et leurs effets,Illegal - Illegal Drugs
toxicomanie dangers lies a lusage des drogues cannabis ecstasy mdma poppers l s d acide trip cocainecrack ketamine amphetamines speed crystal,Illegal - Illegal Drugs
traces amphétamines sur test salivaire,Illegal - Illegal Drugs
tunisie et consommation de drogues,Illegal - Illegal Drugs
une adolescente defiguree et en chaise roulante apres avoir consomme de l ecstasy,Illegal - Illegal Drugs
urgence amphetamines,Illegal - Illegal Drugs
vivre au milieu du trafic de drogue,Illegal - Illegal Drugs
voici les effets cocaine corps attachment,Illegal - Illegal Drugs
voici les effets de la cocaine sur votre corps,Illegal - Illegal Drugs
voix cassée cocaïne,Illegal - Illegal Drugs
vos questions nos reponses dangers de l ecstasy,Illegal - Illegal Drugs
vos questions nos reponses pourquoi les drogues sont illegales,Illegal - Illegal Drugs
weed dealer etiquette,Illegal - Illegal Drugs
a qui demander pour savoir si un logiciel espion est installé sur tel,Illegal - Spyware/Malware
acheter logiciel espion pour espionner ordinateur,Illegal - Spyware/Malware
actualite android faille malware,Illegal - Spyware/Malware
actualite antivirus malware linux,Illegal - Spyware/Malware
actualite casse du siecle malware,Illegal - Spyware/Malware
actualite etude mac malware,Illegal - Spyware/Malware
actualite logiciels espions nsa ecoute,Illegal - Spyware/Malware
actualite placeraider android malware,Illegal - Spyware/Malware
actualites le generateur de mots cles de google propose maintenant des donnees chiffrees,Illegal - Spyware/Malware
actualites logiciels windows windows vous avez peur que microsoft vous espionne voici windows tracking disable tool,Illegal - Spyware/Malware
actualites un nouveau logiciel espion sur internet,Illegal - Spyware/Malware
actus qu est ce qu un logiciel espion,Illegal - Spyware/Malware
actus qu est ce qu un logiciel espion adsite under,Illegal - Spyware/Malware
amnesty international propose detekt un outil pour detecter les logiciels espions,Illegal - Spyware/Malware
amnesty lance un logiciel pour savoir si le gouvernement vous espionne,Illegal - Spyware/Malware
android applications des applications malveillantes sont americaines,Illegal - Spyware/Malware
android applications hacked jeu programmation mobile ceux aiment coder,Illegal - Spyware/Malware
android applications jeux android applications dungeon hunter le nouveau hack slash de gameloft est disponible sur le play store,Illegal - Spyware/Malware
android attention antivirus qui cache malware actualite,Illegal - Spyware/Malware
android attention au malware mazar bot nuisible pour votre telephone,Illegal - Spyware/Malware
android cracké site,Illegal - Spyware/Malware
android millions smartphones infectes logiciels malveillants,Illegal - Spyware/Malware
android mise à jour codec video,Illegal - Spyware/Malware
android moins de des terminaux android infectes par une app malveillante,Illegal - Spyware/Malware
android une application malveillante sur le play store aurait installe un adware sur des millions de smartphones android,Illegal - Spyware/Malware
android utilitaires logiciel espion,Illegal - Spyware/Malware
anit logiciels espions,Illegal - Spyware/Malware
anti chevaux de troie,Illegal - Spyware/Malware
Anti logiciels espion 12714j8674538j22,Illegal - Spyware/Malware
anti malware anti malware comparatif des antimalwares pour proteger votre pc des logiciels espion malwarebytes spybot avast art,Illegal - Spyware/Malware
anti virus firewall recherche de virus et logiciels espions erreur de fonctionnement,Illegal - Spyware/Malware
antivirus malveillant,Illegal - Spyware/Malware
antivirus malveillant gratuit,Illegal - Spyware/Malware
antivirus securite informatique virus hacker piratage malware logiciel malveillant actualite client ftp filezilla touchee malware circule,Illegal - Spyware/Malware
antivirus securite informatique virus hacker piratage malware logiciel malveillant actualite serveurs utorrent pirates application remplacee malware,Illegal - Spyware/Malware
antivirus securite informatique virus hacker piratage malware logiciel malveillant actualite synolocker nas synology vises ransomware,Illegal - Spyware/Malware
article a distance des logiciels espions et les logiciels de piratage pc,Illegal - Spyware/Malware
article appel a la prudence de la police federale concernant des logiciels espions dans,Illegal - Spyware/Malware
article castres le patron piege son employe avec une camera et un logiciel espion albi,Illegal - Spyware/Malware
article le site internet d aix les bains toujours classe malveillant par google,Illegal - Spyware/Malware
article le site internet officiel de la presidence du tchad hacke,Illegal - Spyware/Malware
article mac defender malware a survival guide for os x users,Illegal - Spyware/Malware
article mackeeper est un malware ne plus telecharger,Illegal - Spyware/Malware
article pas de surveillance malveillante a charly sur marne,Illegal - Spyware/Malware
article pascal marlin l expert qui conseille face aux actes malveillants,Illegal - Spyware/Malware
article rapport onu rdc malveillant choquant et ridicule selon le rwanda,Illegal - Spyware/Malware
article reportages de a ce janvier logiciel espion diamants en inde fait divers,Illegal - Spyware/Malware
article surveiller mon salarie un nouveau logiciel espion pour les patrons,Illegal - Spyware/Malware
article worldissmall mobipast logiciel espion gratuit pour iphone et ipad,Illegal - Spyware/Malware
article worldissmall spy logiciel espion gratuit pour telephone portable,Illegal - Spyware/Malware
articles comment supprimer un logiciel espion de son ordinateur,Illegal - Spyware/Malware
articles runpe detector la chasse aux logiciels espions est ouverte,Illegal - Spyware/Malware
avis sur les logiciel espion pour les mobile,Illegal - Spyware/Malware
avis sur logiciel espion spyfer,Illegal - Spyware/Malware
base numetlet let e espiogiciel,Illegal - Spyware/Malware
bilan de la cyber attaque sites internet francais ont ete hackes par les islamistes,Illegal - Spyware/Malware
birmanie accuse de soutenir les musulmans le blog est hacke,Illegal - Spyware/Malware
bitdefender adware removal tool nettoyer logiciels malveillants supprimer nettoyage telecharger telechargement,Illegal - Spyware/Malware
blocage des appels malveillants,Illegal - Spyware/Malware
blocage numéro malveillant,Illegal - Spyware/Malware
blocagede mon ordinateur suite telechargement google virus chevaux dd troie etc,Illegal - Spyware/Malware
blog business questions celebrity icloud hack,Illegal - Spyware/Malware
blog du bon usage des logiciels espions au travail,Illegal - Spyware/Malware
blog hack ds mise au point nouveau firmware,Illegal - Spyware/Malware
blog hack wii u lancer des iso a partir dune carte sd,Illegal - Spyware/Malware
blog maitre haddad sabine harcelement telephonique appels malveillants reiteres,Illegal - Spyware/Malware
bluesoleil telechargement gratuit crack incl keygen plus et patch avec la cle de serie,Illegal - Spyware/Malware
business plan pro incl keygen all sample plans exclusive torrent,Illegal - Spyware/Malware
c quoi un malware,Illegal - Spyware/Malware
ce fr product capteur couranttension hacker jeti duplex mu,Illegal - Spyware/Malware
code malveillant dans la gestion des hotel hyatt,Illegal - Spyware/Malware
code malveillant html qui change ordinaire t,Illegal - Spyware/Malware
code malveillant pour plusieurs hotel trump,Illegal - Spyware/Malware
comment cache un logiciel espion sur un tel,Illegal - Spyware/Malware
comment creer une bombe virus ou bombe logique,Illegal - Spyware/Malware
convertisseur codec plugin xld decodeur lossless mac,Illegal - Spyware/Malware
détecter logiciel espion android,Illegal - Spyware/Malware
detecter logiciel espion au boulot,Illegal - Spyware/Malware
détecter logiciel espion iphone,Illegal - Spyware/Malware
détecter logiciel espion samsung,Illegal - Spyware/Malware
detecter logiciel espion sur mon mac,Illegal - Spyware/Malware
detecter logiciel espion sur tablette,Illegal - Spyware/Malware
detecter logiciel mouchard sur pc,Illegal - Spyware/Malware
detecter mouchard sur iphone,Illegal - Spyware/Malware
détecter un logiciel espion dans smartphone,Illegal - Spyware/Malware
detecter un logiciel espion sur mon portable,Illegal - Spyware/Malware
discussions t un nouveau malware sattaque aux smartphones android,Illegal - Spyware/Malware
dl torrent logiciels antivirus securite malwarebytes anti malware premium v,Illegal - Spyware/Malware
enfant qui hack,Illegal - Spyware/Malware
enregistrer les messages whatsapp avec un logiciel espion whatsapp pour iphone,Illegal - Spyware/Malware
entraide recherche bitdefender alerte generateur de cles sites adultes trojan troyen cheval troie,Illegal - Spyware/Malware
entraide recherche codec panneau configuration,Illegal - Spyware/Malware
entrepreneurs web smartphones des virus aux logiciels espions,Illegal - Spyware/Malware
envoyé un logiciel espion sur l adresse ip,Illegal - Spyware/Malware
espionner votre conjoint grace a un logiciel espion pc a distance gratuit,Illegal - Spyware/Malware
faits divers logiciel espion sous android quatre utilisateurs arretes en france,Illegal - Spyware/Malware
faq utiliser le generateur de mots cles de google pour son site web pro,Illegal - Spyware/Malware
file keygen x force autodesk mac os x rar,Illegal - Spyware/Malware
fin du generateur de mots cles de google les autres outils,Illegal - Spyware/Malware
forum affich comment savoir s il y a des logiciels espions,Illegal - Spyware/Malware
forum affich comment se debarrasser d un logiciel espion,Illegal - Spyware/Malware
forum affich logiciel espion arnaque ou pas,Illegal - Spyware/Malware
forum affich logiciel espion sur mon telephone,Illegal - Spyware/Malware
forum affich logiciel pour espionner telephone portable detecter espion sms,Illegal - Spyware/Malware
fr gmail compte gratuit hacker mot de passe,Illegal - Spyware/Malware
fr google recompense un hacker davoir pirate chrome en lui offrant,Illegal - Spyware/Malware
fr jeux vidéo consoles nintendo ds hack jailbreak de ds ds et ds xl new ou old aspx,Illegal - Spyware/Malware
fr le hacker le plus recherche du japon nargue la police avec un jeu de piste,Illegal - Spyware/Malware
fr logiciel espion gratuit pour telephone portable,Illegal - Spyware/Malware
fr logiciel espion gratuit sms messages telephone portable,Illegal - Spyware/Malware
fr mobile phone spy software t ce qui est gratuit logiciel espion pour nokia lumia windows phone,Illegal - Spyware/Malware
fr mobile phone spy software t est il gratuit logiciel espion mobile pour lg g,Illegal - Spyware/Malware
fr mobile phone spy software t j ai un nokia lumia et j ai besoin de logiciel espion,Illegal - Spyware/Malware
fr mobile phone spy software t logiciel espion pour surveiller sms de sms en ligne,Illegal - Spyware/Malware
generateur qui permet de calculer les cles,Illegal - Spyware/Malware
generateurs de mots cles gratuits,Illegal - Spyware/Malware
hfr hardware materiels problemes divers comment cracker logiciel sujet,Illegal - Spyware/Malware
high tech alerte au logiciel espion sous ios,Illegal - Spyware/Malware
high tech application mapmymobile le logiciel espion pour surveiller sa femme ou ses employes,Illegal - Spyware/Malware
high tech cha le lecteur biometrique touch id de l iphone s d apple deja hacke,Illegal - Spyware/Malware
high tech etats unis un pakistanais inculpe pour vente d un logiciel espion sur portable,Illegal - Spyware/Malware
high tech hacker ouvert obs cyberdefense les programmes secrets de la france,Illegal - Spyware/Malware
high tech hacker ouvert obs j avais le temps j ai clique chronique d un phishing ordinaire,Illegal - Spyware/Malware
high tech hacker ouvert obs les telephones samsung victimes d une importante faille de securite,Illegal - Spyware/Malware
high tech hacker ouvert obs n importe quelle clef usb peut pirater un ordinateur,Illegal - Spyware/Malware
i trackr fr article infoidevice le hacker enmtw veux vendre ses exploits a la chine en echange d un jailbreak ios public,Illegal - Spyware/Malware
i trackr fr article infoidevice le hacker qwertyoruiop pretend avoir plusieurs solutions pour le jailbreak ios,Illegal - Spyware/Malware
informatique logiciels informatique micro espion gsm multiprises f auc,Illegal - Spyware/Malware
itunes us des comptes itunes lies paypal hackes,Illegal - Spyware/Malware
j'ai telecharger le logiciel logiciel-espion.fr comment l'enlever de mon ordinateur,Illegal - Spyware/Malware
jailbreaik pangu ios pangu hacker iphone ipad actualite,Illegal - Spyware/Malware
je suis envahie par des logiciels espion fs,Illegal - Spyware/Malware
l agence internationale de l énergie atomique infectée par un malware,Illegal - Spyware/Malware
la nsa a mis au point un logiciel espion d une dangerosite jamais vue,Illegal - Spyware/Malware
le logiciel de la nsa qui espionne la terre entiere n,Illegal - Spyware/Malware
les codes pour cracker les wifi,Illegal - Spyware/Malware
Les fonctionnalités de notre logiciel espion pour espionner un portable,Illegal - Spyware/Malware
les logiciels espions du renseignement allemand,Illegal - Spyware/Malware
les logiciels espions gratuits,Illegal - Spyware/Malware
lesechos fr casper le petit dernier des logiciels espions pour surveiller la syrie,Illegal - Spyware/Malware
logiciels microsoft telecharger sage apinegoce caisse version avec keygen,Illegal - Spyware/Malware
malwarebyte anti exploit premium crack,Illegal - Spyware/Malware
malwarebytes anti exploit crack,Illegal - Spyware/Malware
malwarebytes anti exploit crack comment page,Illegal - Spyware/Malware
malwarebytes anti malware premium crack comment page,Illegal - Spyware/Malware
meilleur logiciel espion francais,Illegal - Spyware/Malware
meilleur logiciel espion mobile,Illegal - Spyware/Malware
meilleur logiciel espion pour cell,Illegal - Spyware/Malware
mettre un logiciel espion sur un telephone,Illegal - Spyware/Malware
mise a jour pour logiciel espion,Illegal - Spyware/Malware
nettoyer les logiciels espions SC,Illegal - Spyware/Malware
neutraliser les logiciels espions sur windows 10,Illegal - Spyware/Malware
peut on telecharger a distance un logiciel espion,Illegal - Spyware/Malware
pixels article le vendeur de logiciels espions hacking team victime d un piratage massif,Illegal - Spyware/Malware
pixels article les logiciels espions sont ils des armes,Illegal - Spyware/Malware
post news mobile spy le premier logiciel espion sur ipad,Illegal - Spyware/Malware
protection contre logiciel espion pour android,Illegal - Spyware/Malware
psychologie jalousie logiciel espion sujet,Illegal - Spyware/Malware
quand un bug fait apparaitre un logiciel espion,Illegal - Spyware/Malware
quel est le programme qui crack une ps3,Illegal - Spyware/Malware
quel format de jeux pour wii cracké,Illegal - Spyware/Malware
quelle application faut t'il mettre dans ma ps3 cracker,Illegal - Spyware/Malware
quels sont les logiciels espions,Illegal - Spyware/Malware
r comment cache un logiciel espion sur un tel,Illegal - Spyware/Malware
