2 droit de la propriété intellectuelle,Illegal - Copyright Infringement
r comment detecter logiciel espion dans telephone portable,Illegal - Spyware/Malware
r comment detecter un logiciel espion sur android,Illegal - Spyware/Malware
r comment savoir si on a un logiciel espion,Illegal - Spyware/Malware
r comment savoir si un logiciel espion dans mon mobile,Illegal - Spyware/Malware
r logiciel espion pour ma galaxie note,Illegal - Spyware/Malware
r suppression d'un logiciel espion sur un telephone,Illegal - Spyware/Malware
r supprimer logiciel espion sur portable,Illegal - Spyware/Malware
retirer un logiciel espion sur un portable,Illegal - Spyware/Malware
s logiciel anti espion gratuit en français,Illegal - Spyware/Malware
savoir si j ai un logiciel espion sur mon iphone,Illegal - Spyware/Malware
setup du logiciel crack pour windows 7 32 bits 7653j4090117j18,Illegal - Spyware/Malware
simcity crack keygen telecharger gratuitement cles dactivation gratuits,Illegal - Spyware/Malware
teecharger logiciel espion pour geolocaliser une personne,Illegal - Spyware/Malware
telechargement efd logiciel espion facile,Illegal - Spyware/Malware
telechargement MobiPast logiciel espion gratuit pour android,Illegal - Spyware/Malware
telecharger gratuit un logiciel espion pour telephone portable,Illegal - Spyware/Malware
telecharger un antivirus gratuit contre le chevaux troie,Illegal - Spyware/Malware
un logiciel espion passant par itunes propose a des gouvernements,Illegal - Spyware/Malware
un logiciel espion pour telephone portable gratuit par une groupe d etudiants,Illegal - Spyware/Malware
un voleur retrouvé grâce au logiciel espion,Illegal - Spyware/Malware
volkswagen les questions autour de laffaire du logiciel espion,Illegal - Spyware/Malware
wiki générateur de clés,Illegal - Spyware/Malware
14 histoires d'agression qui vont beaucoup vous choquer,Illegal - Threats
15 histoire agression de célébrité,Illegal - Threats
15 histoires d'agressions de stars,Illegal - Threats
18 mois de prison a digoin pour agression sexuelle,Illegal - Threats
a ans il menace une assistante sociale avec un couteau,Illegal - Threats
a ans il vole une trottinette sous la menace pres de rouen,Illegal - Threats
amfreville la campagne il menace les convives avec une arme de poing,Illegal - Threats
amiens agression agent,Illegal - Threats
amiens agression sur des agents municipaux,Illegal - Threats
amiens amiens menaces au couteau au poste de police municipale detouvie courrier picard,Illegal - Threats
amiens menaces au couteau au poste de police municipale detouvie,Illegal - Threats
amina sboui explication de sa fausse agression a,Illegal - Threats
aminata toure aux avocats de lamine diack si ce sont des menaces je ne suis pas de nature a me laisser impressionner,Illegal - Threats
amines dangers pour la santé,Illegal - Threats
amos yadlin la menace syrienne contre israel est largement reduite,Illegal - Threats
anais ss elle avoue avoir menace un policier,Illegal - Threats
anais ss elle risque la prison pour menaces de mort,Illegal - Threats
analyse judasme sondage musulmans agressions,Illegal - Threats
article fait divers il sort concomitamment avec deux s oelig urs jumelles et se fait tabasser par celles ci,Illegal - Threats
article jeudi mai fenmore se fait tabasser a cause d une meprise,Illegal - Threats
article le pacte de non agression,Illegal - Threats
article le pretre condamne pour agressions sexuelles a rodez mis en retrait a lyon region,Illegal - Threats
article le prof de judo de fontenay au tribunal pour avoir commis plusieurs agressions sexuelles sur eleves,Illegal - Threats
article le ravisseur de berenyss condamne pour agressions sexuelles sur trois fillettes,Illegal - Threats
article le rolling stone ronnie wood essuie un avertissement pour agression,Illegal - Threats
articles tabasser un musulman pas important prison fresnes,Illegal - Threats
bienvenue dans les aeroports americains agression ou dose de radiation a,Illegal - Threats
bill clinton accuse de terribles agressions sexuelles,Illegal - Threats
bip sonore pour se defendre contre une agression,Illegal - Threats
birmanie dalai lama condamne nouvelle agression moine,Illegal - Threats
birmingham sauvage agression groupe de non blancs,Illegal - Threats
biscarrosse plainte pour agression sexuelle au centre d accueil des refugies,Illegal - Threats
bisexual bissex agressions,Illegal - Threats
blog actualites agression a maharidaza la presse accusee de tous les abus,Illegal - Threats
blog lesoir be frontstage la fouine « degoute que les jeunes se soient fait tabasser »,Illegal - Threats
blonde mature a gros seins se fait tabasser le minou,Illegal - Threats
buzz russie un automobiliste vient en aide a un gamin entrain de se faire tabasser par un groupe d individus choc,Illegal - Threats
c enquetes secours agressions soirees extremes les sports d hiver sous haute tension,Illegal - Threats
celebrites bertrand chameroy fait dincroyables confidences menaces intimidation,Illegal - Threats
celebrites booba menaces discotheque saccagee concert annule rival youtubeur exulte video,Illegal - Threats
celebrites george clonney femme menacee de mort,Illegal - Threats
celebrites iggy azalea menace de sen prendre aux parties genitales de son compagnon,Illegal - Threats
centrafrique la minusca salue la signature du pacte de non agression et de reconciliation entre les communautes musulmane et chretienne du k,Illegal - Threats
centrafrique les forces vives de la nation ont realise le pacte de non agression entre les ex seleka et les antibalaka,Illegal - Threats
conclusion d une etude sur les soignants victimes d agression sur le lieu de travail,Illegal - Threats
condamanee pour menace de mort reiteree,Illegal - Threats
condamnation pour agression physique,Illegal - Threats
condamne pour agressions sexuelles un pretre promu doyen par le cardinal barbarin,Illegal - Threats
condamne pour avoir menace de bruler le coran une justice de plus en plus politisee,Illegal - Threats
condamne pour avoir menace une automobiliste avec une arme,Illegal - Threats
conditions d'annulation d'une reconnaissance de dette faite sous menace,Illegal - Threats
condor mais l oiseau doit faire face a plusieurs menaces et notamment celle de l intoxication au plomb provenant des balles des chasseurs credits jim bahn flickr pic,Illegal - Threats
conduite à tenir devant une menace terroriste dans les hotels,Illegal - Threats
conflans sainte honorine conflans sainte honorine violente agression a la gare,Illegal - Threats
conflits litiges delits a quel tribunal s adresser agressions et delits a quel tribunal s adresser,Illegal - Threats
conséquence agression physique,Illegal - Threats
content comment choisir bombe lacrymogene anti agression,Illegal - Threats
content france trois hommes inculpes pour agression contre des migrants a calais,Illegal - Threats
deux adolescentes mises examen après menaces d attentat,Illegal - Threats
deux adolescentes presentees a un juge pour avoir profere des menaces d attentats sur facebook,Illegal - Threats
deux ados mises en examen pour des menaces d attentat a paris,Illegal - Threats
deux comoriens interpeles pour agression sexuelle a abu dhabi,Illegal - Threats
deux enseignantes canadiennes se plaignent dune agression dans un gogo bar de pattaya,Illegal - Threats
deux interpellations suite a la violente agression dun jeune homme a vitry,Illegal - Threats
deux nouvelles tactiques d agression,Illegal - Threats
en irak les yezidis appeles a tort adorateurs du diable sont menaces de genocide,Illegal - Threats
en irak un barrage menace de rupture complique loffensive vers mossoul,Illegal - Threats
enfance en danger,Illegal - Threats
enfance en danger les mineurs,Illegal - Threats
enfant 8 ans menace de se suicider,Illegal - Threats
enfant a ans jeux activites et sports sports l inactivite physique menace nos adolescents thtml,Illegal - Threats
enfants victimes d'agressions sexuelles dans foyers,Illegal - Threats
enghien les bains enghien psychose a l ecole apres des craintes d agressions sexuelles,Illegal - Threats
enisa rapport des menaces informatiques en,Illegal - Threats
enlevement du petit rifki son ravisseur etait connu pour agression sexuelle sur mineur,Illegal - Threats
enquete pour non denonciation d agressions sexuelles barbarin prend acte avec gravite,Illegal - Threats
enqueter sur une agression,Illegal - Threats
fi subtitles dennis the menace fi,Illegal - Threats
firminy arme dune kalachnikov un jeune de ans menace de tuer tout le monde dans un commissariat,Illegal - Threats
fissures immeubles effondrement menace,Illegal - Threats
flagrant delit de menace depuis matignon,Illegal - Threats
flambi menace poutine il sagit de lultime negociation sinon ce sera la guerre comment page,Illegal - Threats
flandre menace sur l avenir de la fete de la moto a bourbourg iabn,Illegal - Threats
flandre musulmans menacent ministre interdit degorger halal,Illegal - Threats
flash actualite culture l artiste de rue combo soutenu par l ima apres une agression,Illegal - Threats
flash actualite economie le drh air france la chemise arrachee raconte son agression,Illegal - Threats
flash actualite monde berlin condamne une vague d agressions sexuelles lors du nouvel an,Illegal - Threats
flash actualite monde la maire de cologne moquee pour ses conseils aux femmes apres une vague d agressions,Illegal - Threats
flash actualite politique agressions sexuelles sur des scouts jego udi favorable au retrait du cardinal barbarin,Illegal - Threats
flash actualite politique seine et marne un ex fn en garde a vue pour incendie de voitures et agression imaginaire,Illegal - Threats
flash actualite sports agression d un controleur sncf la star du volley earvin ngapeth condamne a trois mois avec sursis,Illegal - Threats
fr fr divertissement actualite après julien cazarre cyril hanouna aurait menacé un autre journaliste sportif ar bbpveq,Illegal - Threats
fr fr divertissement celebrites charlie sheen suspect dans une enquête pour menace de meurtre vi bbrtqrf,Illegal - Threats
fr fr finance actualite allemagne les négociations salariales dans limpasse ig metall menace dune grève ar bbrwvyr,Illegal - Threats
fr fr finance actualite ces bulles financières américaines qui menacent léconomie ar bbqtuen,Illegal - Threats
fr fr sport actualite ngapeth fait appel de sa condamnation pour une agression ar bbrudzi,Illegal - Threats
fr fr sport football messi victime dune terrible agression ar bbounh,Illegal - Threats
fr fr video actualite il invoque donald trump pour une agression raciste vp bbqaeo,Illegal - Threats
fr fr video actualite loi travail des incidents et deux agressions vi bbrltc,Illegal - Threats
fr fr video actualite pédophilie le cardinal barbarin soupçonné davoir caché des agressions sexuelles vi bbqosjs,Illegal - Threats
fr fr video regarder agressions à domicile une hausse de percent en vi bbrrkg,Illegal - Threats
fr france un pretre mis en examen pour agression sexuelle,Illegal - Threats
haute savoie il avait menace de tuer un senateur six mois de prison ferme,Illegal - Threats
haute savoie il menace de mort le chauffeur de bus avec une matraque,Illegal - Threats
haute savoie le directeur de la mairie mis a pied pour menace de mort,Illegal - Threats
haute savoie menace avec arme et perquisition stupefiante,Illegal - Threats
haute savoie thones agression sexuelle sur mineurs un pompier volontaire en detention,Illegal - Threats
haute savoie un homme arme menace la vendeuse,Illegal - Threats
haute savoie une manifestation ce matin pour soutenir un pere de famille menace d expulsion,Illegal - Threats
hauts de seine agression antisemite a la patinoire,Illegal - Threats
hauts de seine clichy la garenne un elu condamne a ans de prison pour agressions sexuelles,Illegal - Threats
hauts de seine clichy le forcene soupconne d une precedente agression a paris,Illegal - Threats
hauts de seine colombes un homme en garde a vue apres l agression de deux femmes,Illegal - Threats
hauts de seine des habitants mobilises apres l agression,Illegal - Threats
hauts de seine double agression dans la nuit,Illegal - Threats
hauts de seine enquete sur l agression raciste du rer,Illegal - Threats
itm porte cle defense alarme anti agression voleur agresseur protection neuf,Illegal - Threats
itm porte cles siffleur avec alarme anti agression,Illegal - Threats
ivre il urine dans le bus montre son sexe aux voyageuses et menace de mort le controleur,Illegal - Threats
ivres et accidentes ils menacent les gendarmes quatre interpellations dans l eure,Illegal - Threats
ivry l appel a l aide des profs apres l agression a l acide,Illegal - Threats
ivry sur seine ivry agent de surveillance toujours dans le coma apres agression,Illegal - Threats
ivry sur seine ivry agression a l acide au college romain rolland,Illegal - Threats
ivry sur seine ivry un agent de securite dans le coma apres une violente agression,Illegal - Threats
jacquesflinois agressions de masse se serait passe presence de dissidence europeenne,Illegal - Threats
le plan b americain pour la syrie et la menace d une guerre mondiale wsws,Illegal - Threats
le plan b americain pour la syrie et la menace dune guerre mondiale par bill van auken,Illegal - Threats
m aliciadurand s exprime et donne sa version de l agression j ai voulu qu elle comprenne ce que cela faisait,Illegal - Threats
ma ndiaye le fils d ousmane seck victime d une agression plus d millions de francs a,Illegal - Threats
maisons laffitte maisons laffitte il avait menace la juge de mort,Illegal - Threats
maisons laffitte maisons laffitte il avait menace sa petite amie avec un revolver,Illegal - Threats
maisons laffitte nicolas canteloup menace de mort,Illegal - Threats
maitre jerome triomphe obtient la condamnation dun militant lgbt auteur dune menace dattentat contre civitas,Illegal - Threats
Maladie caractérisée par une agression de l'organisme par son propre système immunitaire,Illegal - Threats
maman agresse un enseignant puis l'accuse d'agression,Illegal - Threats
mandrin bandit de grand chemin agression à la campagne autrefois,Illegal - Threats
manifestation de ras le bol a marseille apres une agression homophobe,Illegal - Threats
manifestations loi du travail vidéo agression,Illegal - Threats
nancy a nancy le routard du viol juge pour viols et tentatives d agressions,Illegal - Threats
nancy a nancy un jeune de ans condamne pour une agression sexuelle en plein jour,Illegal - Threats
nancy lorraine un professeur mis en examen pour agression sexuelle sur un eleve,Illegal - Threats
nancy nancy un homme menace de faire sauter le tram a l explosif,Illegal - Threats
nancy un etudiant interpelle apres plusieurs agressions sexuelles,Illegal - Threats
nanterre agressions de gardiens en serie a la prison,Illegal - Threats
nantes nantes il menace sa famille avec un fusil puis finit par sendormir minutes fr,Illegal - Threats
porter plainte pour agression ou insulte homophobe,Illegal - Threats
porter plainte pour agression sans temoin,Illegal - Threats
porter plainte pour insultes et menaces,Illegal - Threats
porter plainte pour menace avec arme,Illegal - Threats
porter plainte pour menace de mort par sms engendre casier judiciaire,Illegal - Threats
post elton john poursuivi pour harcèlement et agression,Illegal - Threats
quand un youtubeur star joue avec des agressions sexuelles violences sexes femmes,Illegal - Threats
quatre adolescentes arrêtées après avoir menacé commettre attentats,Illegal - Threats
Quatre adolescentes arrêtées après avoir proféré des menaces d'attentat,Illegal - Threats
quatre ans de prison pour l agression sexuelle de ses belles filles,Illegal - Threats
que faire en cas d agression physique orale ou écrite,Illegal - Threats
que faire en cas d'agression a son domicile,Illegal - Threats
que faire en cas de discrimination ou d’agression homophobe lintegralite du chat avec me geoffroy du ravad,Illegal - Threats
que faire lors d'une agression au supermarché,Illegal - Threats
Quelle différence entre bombe anti agression gel et gaz,Illegal - Threats
quelles agressions observe t on le plus chez un enfant de 2 ans,Illegal - Threats
retirer plainte agression,Illegal - Threats
retirer sa plainte sous la menace,Illegal - Threats
retirer une plainte pour menace de mort,Illegal - Threats
se soigner violences viol agression sexuelle un manifeste contre le viol,Illegal - Threats
se soigner violences viol agression sexuelle viol encore trop d idees recues,Illegal - Threats
se soigner violences viol agression sexuelle violences sexuelles comment reagir,Illegal - Threats
seta se remet peu a peu de son agression,Illegal - Threats
severine porn avec orties et masturbation pussy rasage chatte severine porn avec sextube agression hijabsexporno,Illegal - Threats
sevres une arrestation apres la violente agression d un ouvrier a sevres,Illegal - Threats
sexe sous la menace,Illegal - Threats
sexe sous la menace violent,Illegal - Threats
sexe une femme mise a lamende et menacee dexpulsion,Illegal - Threats
t actes desesperes suicides agressions menaces,Illegal - Threats
t un religieux mis en examen pour agression sexuelle sur mineur a eveux dns le rhone,Illegal - Threats
tabou les agressions denfants par des,Illegal - Threats
tafta menace de mort pour les eleveurs europeens,Illegal - Threats
tag agression d'enfants,Illegal - Threats
tag agression sexuelle,Illegal - Threats
tag agressions sexuelles page,Illegal - Threats
tag autour du jeu menacee viol journaliste australienne bon reflexe actu,Illegal - Threats
tag catherine menace les ministres incapablees,Illegal - Threats
tag fait divers agression securite,Illegal - Threats
tag magnanville le militaire filme pendant son agression,Illegal - Threats
tunisie agression de larbitre du derby,Illegal - Threats
tunisie agression raciste d un etudiant camerounais afrik,Illegal - Threats
tunisie agression raciste dun etudiant camerounais,Illegal - Threats
tunisie daech menace neji jalloul et deux eleves de ben guerdene,Illegal - Threats
tunisie geopolitique de la menace terroriste,Illegal - Threats
tunisie houcine abassi recoit des menaces de mort,Illegal - Threats
tunisie tunis encore une agression policiere contre un citoyen,Illegal - Threats
turquie basaksehir istanbul gulay bursali viol defenestration immeuble mort agression sexuelle,Illegal - Threats
tv libertes la verite sur les agressions sexuelles en allemagne au nouvel an,Illegal - Threats
vitry pillages agression des salaries du centre commercial a bout,Illegal - Threats
vitry sur seine pillages et agression au centre commercial des salaries de vitry a bout,Illegal - Threats
vitry sur seine vitry portes closes a l office hlm apres l agression d un agent,Illegal - Threats
vivre avec la menace terroriste,Illegal - Threats
vivre avec la menace terroriste linterview europe,Illegal - Threats
vivre menace terroriste journée spéciale monde fr,Illegal - Threats
voir agression au couteau a vernon,Illegal - Threats
10 hackers les plus recherché par le fbi,Illegal - Warez
6 comment pirater un mot de passe avec l'identifiant,Illegal - Warez
accueil detail actualite article internet et cybercriminalite on apprend le mal plus vite en afrique que dans le reste du monde africa camerbe,Illegal - Warez
accueil news publications enquetes et etudes la cybercriminalite dans les medias,Illegal - Warez
acheter des codes psn,Illegal - Warez
actions actualites news thales s associe a allianz contre la cybercriminalite,Illegal - Warez
actu actudet le hacker se faisait livrer des pizzas gratuites actu,Illegal - Warez
actu microsoft pourrait verifier automatiquement et empecher l utilisation de logiciels pirates en deployant certaines mises a jour etes vous consentant,Illegal - Warez
actualite articles dropbox est la derniere victime des hackers avec millions de comptes pirates,Illegal - Warez
actualite cybercriminalite la france dans le top mondial,Illegal - Warez
actualite depeche afp des hackers ont aide le fbi a debloquer l iphone de san bernardino shtml,Illegal - Warez
actualite europe cybercriminalite,Illegal - Warez
actualite france artfig telephone internet l etat pourra bientot tout espionner,Illegal - Warez
actualite livre blanc cybercriminalite avez vous le profil dune victime,Illegal - Warez
actualite skype cheval troie,Illegal - Warez
actualites comment fonctionnent les logiciels permettant d espionner les mobiles,Illegal - Warez
actualites cybercriminalite france symantec monde ransomware arnaque reseau,Illegal - Warez
actualites cybercriminalite la france de plus en plus visee par les hackers,Illegal - Warez
actualites de faux logiciels de securite utilises par les pirates informatiques,Illegal - Warez
actualites generales un cheval de troie menace tous les androphones,Illegal - Warez
actualites generales un cheval de troie menace tous les androphones attachment cheval de troie,Illegal - Warez
actualites lire crisis le cheval de troie pret a s attaquer aux mac,Illegal - Warez
actualites lire des chercheurs vont devoiler un logiciel pour pirater une prius,Illegal - Warez
actualites lire l integrateur cirruseo cheval de troie de google for work dans les entreprises,Illegal - Warez
actualites lire rsa des trojans pour espionner les smartphones,Illegal - Warez
actualites lire twitter accuse d espionner ses utilisateurs,Illegal - Warez
actualites logiciels windows windows attention aux jeux pirates et au materiel non autorise,Illegal - Warez
actualites logiciels windows windows les copies pirates de windows et pourront profiter de la mise a jour gratuite mais,Illegal - Warez
actualites windows microsoft peut bloquer logiciels pirates pas vraiment non,Illegal - Warez
analyse du tableau le cheval de troie de tiepolo r,Illegal - Warez
android apps games app spotify quality hacker extreme t,Illegal - Warez
android developpement google play services cheval troie google,Illegal - Warez
android passcode cracker,Illegal - Warez
anonymous cheval de troie,Illegal - Warez
anti cheval de troie gratuit en ligne AS,Illegal - Warez
antivirus cheval de troie gratuit,Illegal - Warez
antivirus cheval de troie pour mac,Illegal - Warez
antivirus contre cheval de troie,Illegal - Warez
antivirus securite informatique virus hacker piratage cybercriminalite actualite daesh disposerait centre aide contourner surveillance ligne,Illegal - Warez
antivirus securite informatique virus hacker piratage trojan cheval de troie,Illegal - Warez
aplication pour espionner des sms,Illegal - Warez
apple bloque le dernier cheval de troie connu,Illegal - Warez
appli google play pour espionner,Illegal - Warez
application Android pour espionner son conjoint à son insu,Illegal - Warez
apres la rupture espionner son ex sur facebook,Illegal - Warez
archive cybercriminalite l etau se referme lentement sur les brouteu,Illegal - Warez
arnaque par internet la côte d ivoire l’eldorado de la cybercriminalité papier d’angle,Illegal - Warez
article actualites pres de la moitie des francais confrontes la cybercriminalite,Illegal - Warez
article combien coute la cybercriminalite,Illegal - Warez
article corse cybercriminalite les mineurs vulnerables pieges par le reseau,Illegal - Warez
article cours pour lutter contre la cybercriminalite,Illegal - Warez
article les mineurs et la cybercriminalite au maroc,Illegal - Warez
article les numeriques le fbi aurait finalement paye des hackers pour craquer l iphone,Illegal - Warez
article les reseaux sociaux une cible facile pour la cybercriminalite,Illegal - Warez
article macbidouille un cheval de troie capable de contourner les protections d ios,Illegal - Warez
article macbidouille windows un nouveau cheval de troie tres malin,Illegal - Warez
article paradis fiscaux et piraterie,Illegal - Warez
article polliat societe informatique cybercriminalite collegien intrusion informatique college notes modifiees,Illegal - Warez
article pour commencer quelques informations sur l origine de la cybercriminalite,Illegal - Warez
articles comment supprimer un cheval de troie,Illegal - Warez
articles firewall pare feu securite,Illegal - Warez
avoir codes psn gratuit gratuit codes psn psn codes gratuit,Illegal - Warez
bienvenu au monde du hacker le hacking de quoi ca retourne,Illegal - Warez
bienvenue sur hacker compte facebook,Illegal - Warez
bitdefender alerte generateur de cles sites adultes trojan troyen cheval troie actualite,Illegal - Warez
blocage internet et pare-feu Windows,Illegal - Warez
blog actualites lutte contre la cybercriminalite photos exigees a lachat de cartes sim,Illegal - Warez
blog espionner un iphone sans jailbreak cest possible,Illegal - Warez
blog espionner un portable,Illegal - Warez
blog grace cette plateforme trouver un hacker devient un jeu denfants,Illegal - Warez
blog index php post cinq étapes pour créer un cheval de troie sous gnu linux,Illegal - Warez
blog le cheval de troie du prelevement a la source,Illegal - Warez
blog quel corporate hacker etes vous,Illegal - Warez
blog tag comment pirater clash royale,Illegal - Warez
bloquer acces internet application pare feu,Illegal - Warez
blue water parts joue la carte du controle cybercriminalite,Illegal - Warez
cameroun cybercriminalite croisade contre les fraudeurs a la simbox,Illegal - Warez
cause de la cybercriminalité,Illegal - Warez
cd keys generateur cles cle activation securisee telecharger telechargement,Illegal - Warez
certain editeur bloque logiciel pirate,Illegal - Warez
comment espionner avec sa webcam,Illegal - Warez
comment espionner avec son mobile,Illegal - Warez
comment espionner avec une la tablette Windows,Illegal - Warez
comment faire face a la cybercriminalite,Illegal - Warez
comment lutter contre la cybercriminalité,Illegal - Warez
comment lutter efficacement contre la cybercriminalité,Illegal - Warez
comment pirater des logiciels,Illegal - Warez
comment pirater un code wifi sans logiciel,Illegal - Warez
comment pirater un compte bancaire sans logiciel,Illegal - Warez
