10 best tequilas,Food & Drink - Alcoholic Beverages
1001cocktails alcool avec boissons cocktails com de découvrez et les meilleures ou recettes sans su,Food & Drink - Alcoholic Beverages
1800 tequilla. shot,Food & Drink - Alcoholic Beverages
3 litre de rhum,Food & Drink - Alcoholic Beverages
a mise en bouteille de vin,Food & Drink - Alcoholic Beverages
accessoire pour faire sa biere artisanale,Food & Drink - Alcoholic Beverages
achat alcool spiritueux sake liqueur shochu japonais,Food & Drink - Alcoholic Beverages
achat alcool spiritueux sake liqueur shochu japonais sake nihonshu,Food & Drink - Alcoholic Beverages
achat alcool spiritueux sake liqueur shochu japonais sake nihonshu junmai dai ginjo,Food & Drink - Alcoholic Beverages
acheter le gout du sake,Food & Drink - Alcoholic Beverages
apéritif tequila,Food & Drink - Alcoholic Beverages
article dans le secret de la biere artisanale,Food & Drink - Alcoholic Beverages
article le patrimoine de la champagne,Food & Drink - Alcoholic Beverages
article le rhum antillais o,Food & Drink - Alcoholic Beverages
article le soufflet de la biere artisanale gonfle,Food & Drink - Alcoholic Beverages
article le vin du monde deguste aujourd hui domaine oud kapp chenin blanc afrique du sud,Food & Drink - Alcoholic Beverages
article le vin rose boisson de l ete,Food & Drink - Alcoholic Beverages
article les etapes clefs de la fabrication du sake,Food & Drink - Alcoholic Beverages
article mexique pulque mezcal et tequila,Food & Drink - Alcoholic Beverages
article notre selection vin rose,Food & Drink - Alcoholic Beverages
article nuit rose le vin rose de cet ete,Food & Drink - Alcoholic Beverages
bien choisir son champagne pour les fetes,Food & Drink - Alcoholic Beverages
bien dans son assiette aliments l alcool,Food & Drink - Alcoholic Beverages
bien dans son assiette aliments l alcool alcool et sante cardiovasculaire une question de dose,Food & Drink - Alcoholic Beverages
bien dans son assiette aliments l alcool apres ans un peu d alcool serait bon pour la memoire,Food & Drink - Alcoholic Beverages
bien dans son assiette aliments l alcool offrez un verre de vin aux patients alzheimer c est mieux qu un medicament,Food & Drink - Alcoholic Beverages
bien dans son assiette aliments l alcool vin bonnes raisons de boire du vin,Food & Drink - Alcoholic Beverages
bien dans son assiette aliments l alcool vin conseils pour boire mieux,Food & Drink - Alcoholic Beverages
bien dans son assiette aliments l alcool vin les meilleurs vins francais pour la sante,Food & Drink - Alcoholic Beverages
bienfait du vin rouge pour la santé,Food & Drink - Alcoholic Beverages
bienfaits vin blanc sec,Food & Drink - Alcoholic Beverages
bière artisanale,Food & Drink - Alcoholic Beverages
bière tequila OS,Food & Drink - Alcoholic Beverages
big rouge roses vin de france,Food & Drink - Alcoholic Beverages
bio boissons vin blanc,Food & Drink - Alcoholic Beverages
blog recettes boissons liqueurs digestifs volcano liqueur de tsan,Food & Drink - Alcoholic Beverages
boisson ete au vin rose,Food & Drink - Alcoholic Beverages
cepage vin blanc nantes,Food & Drink - Alcoholic Beverages
cepage vin rose de bordeaux,Food & Drink - Alcoholic Beverages
cépages vin rouge,Food & Drink - Alcoholic Beverages
cepages vins alsace pinot blanc dalsace,Food & Drink - Alcoholic Beverages
ces bieres quon aime locales et artisanales,Food & Drink - Alcoholic Beverages
champagne and tequila cocktail,Food & Drink - Alcoholic Beverages
champagne ardenne gin pamp photos gin pamp vendredi septembre,Food & Drink - Alcoholic Beverages
coctail au schnaps,Food & Drink - Alcoholic Beverages
concours des bières au salon de l'agriculture,Food & Drink - Alcoholic Beverages
confiture d'ananas au rhum,Food & Drink - Alcoholic Beverages
confiture dabricots au rhum,Food & Drink - Alcoholic Beverages
confiture de vin rouge,Food & Drink - Alcoholic Beverages
consommation bière artisanale,Food & Drink - Alcoholic Beverages
courrieres tous les rayons boissons alcools modernes et cocktails vodka tequila gin,Food & Drink - Alcoholic Beverages
creil tous les rayons boissons alcools modernes et cocktails vodka tequila gin,Food & Drink - Alcoholic Beverages
creil tous les rayons boissons bieres et cidres bieres de specialite article desperados biere aromatisee a la tequila fut pression l vol,Food & Drink - Alcoholic Beverages
de vins rouges,Food & Drink - Alcoholic Beverages
detail promotions biere guinness,Food & Drink - Alcoholic Beverages
detail promotions champagne,Food & Drink - Alcoholic Beverages
details vieux rhums cognacs et bas armagnacs,Food & Drink - Alcoholic Beverages
différents types de cépage pour le vin blanc,Food & Drink - Alcoholic Beverages
differents types de vins blancs,Food & Drink - Alcoholic Beverages
en furniture and art grands vins champagnes et alcools ie v,Food & Drink - Alcoholic Beverages
epicerie fine vins les roses d ete,Food & Drink - Alcoholic Beverages
étiquette de vin rosé et législation,Food & Drink - Alcoholic Beverages
etre saoul effet,Food & Drink - Alcoholic Beverages
first bar cocktail reims,Food & Drink - Alcoholic Beverages
fish and chips sans bière,Food & Drink - Alcoholic Beverages
flambage sans alcool,Food & Drink - Alcoholic Beverages
flamber un alcool et l'ajouter à une sauce,Food & Drink - Alcoholic Beverages
flan au rhum et à la vanille,Food & Drink - Alcoholic Beverages
flash actualite culture tendance le retour des bieres a papa brassees a la maison,Food & Drink - Alcoholic Beverages
flash actualite culture tendance le succes de la biere en version artisanale,Food & Drink - Alcoholic Beverages
flash actualite culture tourisme le nord pas de calais trace ses routes de la biere,Food & Drink - Alcoholic Beverages
flash actualite economie a cote de la biere les africains prets a consommer plus de vin,Food & Drink - Alcoholic Beverages
flash iaa le geant heineken se lance dans les bieres artisanales et regionales,Food & Drink - Alcoholic Beverages
boissons spiritueux schnaps,Food & Drink - Alcoholic Beverages
gastrosuisse politique media positions alcool et age minimum,Food & Drink - Alcoholic Beverages
la tequila une tradition du guanajuato,Food & Drink - Alcoholic Beverages
produits deguisement tequila shooter,Food & Drink - Alcoholic Beverages
profil tequila,Food & Drink - Alcoholic Beverages
frozen tequila detroit rocks cocktails maps margaritas,Food & Drink - Alcoholic Beverages
fut biere artisanale,Food & Drink - Alcoholic Beverages
hermitage aop rouge terres d arce domaine michelas bouteille de vin,Food & Drink - Alcoholic Beverages
hermitage rouge monier de la sizeranne vin,Food & Drink - Alcoholic Beverages
jager vs tequila,Food & Drink - Alcoholic Beverages
japanese liquor sake,Food & Drink - Alcoholic Beverages
jello shot tequila,Food & Drink - Alcoholic Beverages
Jello shots tequila cointreau,Food & Drink - Alcoholic Beverages
jus orange vin rosé,Food & Drink - Alcoholic Beverages
le petit futé bière belge,Food & Drink - Alcoholic Beverages
le petit fute champagne,Food & Drink - Alcoholic Beverages
le pinot noir est-il un vin rouge,Food & Drink - Alcoholic Beverages
le plus haut taux d alcool pour une biere,Food & Drink - Alcoholic Beverages
le point commun entre une pizza une biere congelee et une femme enceinte,Food & Drink - Alcoholic Beverages
le premier pays consommateur d'alcool,Food & Drink - Alcoholic Beverages
le prix d'une bouteille de rhum,Food & Drink - Alcoholic Beverages
les alcools vins vins roses,Food & Drink - Alcoholic Beverages
les avantages du vin rouge,Food & Drink - Alcoholic Beverages
les bieres artisanales,Food & Drink - Alcoholic Beverages
les bons vins rouges,Food & Drink - Alcoholic Beverages
lesechos ech la budweiser bousculee par les bieres artisanales,Food & Drink - Alcoholic Beverages
maison jardin recettes menage astuces utiliser vinaigre d alcool blanc quotidien,Food & Drink - Alcoholic Beverages
Makes Best Tequila,Food & Drink - Alcoholic Beverages
malibu and tequila cocktail,Food & Drink - Alcoholic Beverages
Malibu rum tequila triple sec,Food & Drink - Alcoholic Beverages
marcillac vin rouge,Food & Drink - Alcoholic Beverages
margarita fruit salad with tequila lime simple syrup,Food & Drink - Alcoholic Beverages
margarita fruit salad with tequila lime simple syrup margarita fruit salad with tequila lime simple syrup flavorthemoments com,Food & Drink - Alcoholic Beverages
margarita recipes agave lime juice orange liqueur tequila,Food & Drink - Alcoholic Beverages
margarita triple sec tequila lime,Food & Drink - Alcoholic Beverages
margaritas orange juice triple sec tequila no lime juice,Food & Drink - Alcoholic Beverages
meilleurs vin rosé,Food & Drink - Alcoholic Beverages
meilleurs vin rose du monde,Food & Drink - Alcoholic Beverages
meilleurs vins rose provence,Food & Drink - Alcoholic Beverages
n boissons aperitifs digestifs,Food & Drink - Alcoholic Beverages
n boissons aperitifs digestifs b aberlour distillerie warenghem cora,Food & Drink - Alcoholic Beverages
n boissons aperitifs digestifs b benedictine henri bardouin auchan,Food & Drink - Alcoholic Beverages
n boissons aperitifs digestifs b d artigny talisker sauce madere,Food & Drink - Alcoholic Beverages
n boissons aperitifs digestifs b eristoff intermarche,Food & Drink - Alcoholic Beverages
n boissons aperitifs digestifs b jack daniel s intermarche,Food & Drink - Alcoholic Beverages
n boissons aperitifs digestifs b lejay lagoute jura guignolet,Food & Drink - Alcoholic Beverages
n boissons aperitifs digestifs b loch castle izarra verte auchan,Food & Drink - Alcoholic Beverages
n boissons aperitifs digestifs b pastis pousse rapiere italie,Food & Drink - Alcoholic Beverages
n boissons aperitifs digestifs b pineau des charentes mescalito rhum charrette,Food & Drink - Alcoholic Beverages
n boissons aperitifs digestifs b vin sans alcool woodford reserve auchan,Food & Drink - Alcoholic Beverages
n boissons aperitifs digestifs b zubrowka henri bardouin intermarche,Food & Drink - Alcoholic Beverages
nantes produits gourmands vins vins alcools caviste cave de longchamp,Food & Drink - Alcoholic Beverages
nappes et serviettes serviettes cocktail en intisse pois,Food & Drink - Alcoholic Beverages
nos bouteilles vin rose,Food & Drink - Alcoholic Beverages
p belgique c produits gourmands vins c vins alcools c biere brasserie c brasserie artisanale et micro brasserie,Food & Drink - Alcoholic Beverages
pate a beignet a la biere,Food & Drink - Alcoholic Beverages
pate a beignet biere pour pommes,Food & Drink - Alcoholic Beverages
pate a crepe à la biere,Food & Drink - Alcoholic Beverages
pâte a crêpe a la bière et au lait,Food & Drink - Alcoholic Beverages
pate a crepe avec biere,Food & Drink - Alcoholic Beverages
patron tequila,Food & Drink - Alcoholic Beverages
patron tequila shots,Food & Drink - Alcoholic Beverages
plum sake sauce recipe,Food & Drink - Alcoholic Beverages
post coconut kaffiritas tequila lime,Food & Drink - Alcoholic Beverages
poulet sauce rosée et vin,Food & Drink - Alcoholic Beverages
pourquoi le rose est un grand vin a,Food & Drink - Alcoholic Beverages
prix du litre de schnaps,Food & Drink - Alcoholic Beverages
quantité bière vin d'honneur,Food & Drink - Alcoholic Beverages
quantité champagne pour cocktail,Food & Drink - Alcoholic Beverages
quantité pinte de bière,Food & Drink - Alcoholic Beverages
quantité rhum pour 40 litres de punch,Food & Drink - Alcoholic Beverages
quatre bouteilles vin rouge,Food & Drink - Alcoholic Beverages
quatre quarts a l ananas flambe au rhum a la plancha,Food & Drink - Alcoholic Beverages
quatre quarts au rhum,Food & Drink - Alcoholic Beverages
que cuisiner avec du gin,Food & Drink - Alcoholic Beverages
que faire avec de la bière périmée,Food & Drink - Alcoholic Beverages
que faire avec de la levure de bière,Food & Drink - Alcoholic Beverages
que faire avec les canettes de bieres et coca,Food & Drink - Alcoholic Beverages
quel est le meilleur vin rouge,Food & Drink - Alcoholic Beverages
quote about tequila sunrise,Food & Drink - Alcoholic Beverages
recette boeuf saute au sake,Food & Drink - Alcoholic Beverages
restauration hotellerie offres champagne ardenne,Food & Drink - Alcoholic Beverages
reste de fromage a l alcool,Food & Drink - Alcoholic Beverages
résultats concours bière salon de l'agriculture 2016,Food & Drink - Alcoholic Beverages
rose d anjou vin,Food & Drink - Alcoholic Beverages
rose pamplemousse b aromatisee a b vin ml,Food & Drink - Alcoholic Beverages
saké biologique,Food & Drink - Alcoholic Beverages
schnaps degré d'alcool,Food & Drink - Alcoholic Beverages
service traiteur cocktail et reception,Food & Drink - Alcoholic Beverages
service traiteur cocktails a la carte,Food & Drink - Alcoholic Beverages
service traiteur cocktails aperitifs,Food & Drink - Alcoholic Beverages
service traiteur mariage cocktail,Food & Drink - Alcoholic Beverages
services location tireuse a biere,Food & Drink - Alcoholic Beverages
serviettes fete de la biere,Food & Drink - Alcoholic Beverages
servir et boire le saké,Food & Drink - Alcoholic Beverages
set de mesure bière,Food & Drink - Alcoholic Beverages
sirop avec vin rose,Food & Drink - Alcoholic Beverages
t une biere sinon rien,Food & Drink - Alcoholic Beverages
t vin blanc au miel et a la sauge recette medievale,Food & Drink - Alcoholic Beverages
tablatures le petit vin blanc gif,Food & Drink - Alcoholic Beverages
table bouchon de champagne,Food & Drink - Alcoholic Beverages
tableau cocktails,Food & Drink - Alcoholic Beverages
tag cocktails a la tequila t,Food & Drink - Alcoholic Beverages
tag cocktails au gin t,Food & Drink - Alcoholic Beverages
tag coconut tequila,Food & Drink - Alcoholic Beverages
tag degustation vins blancs,Food & Drink - Alcoholic Beverages
tag sour patch tequila shots,Food & Drink - Alcoholic Beverages
tag tequila page,Food & Drink - Alcoholic Beverages
tag tequila sunrise,Food & Drink - Alcoholic Beverages
tag tequila sunrise shot,Food & Drink - Alcoholic Beverages
tendances vin et alcool sake tout sur l alcool de riz japonais,Food & Drink - Alcoholic Beverages
turbo tequila cocktail,Food & Drink - Alcoholic Beverages
un bon vin rosé de provence pas trop cher,Food & Drink - Alcoholic Beverages
un bon vin rouge,Food & Drink - Alcoholic Beverages
un bon vin rouge moelleux,Food & Drink - Alcoholic Beverages
un bon vin rouge pour l'apéritif,Food & Drink - Alcoholic Beverages
v mahon mao c produits gourmands vins c vins alcools c alcool distillerie de gin xoriguer,Food & Drink - Alcoholic Beverages
v mahon mao c shopping mode cadeaux distillerie de gin xoriguer,Food & Drink - Alcoholic Beverages
v monaco c s amuser sortir c bar cafe c bar lounge blue gin,Food & Drink - Alcoholic Beverages
v nos vins nos vins rouges,Food & Drink - Alcoholic Beverages
verre à saké,Food & Drink - Alcoholic Beverages
vitre a poele a bois chalons en champagne en decoupe,Food & Drink - Alcoholic Beverages
vitrine bouteille vin,Food & Drink - Alcoholic Beverages
vn blanc ou vin rouge avec escargots,Food & Drink - Alcoholic Beverages
vodka jello shots recipes,Food & Drink - Alcoholic Beverages
Vodka sunrise jello shot,Food & Drink - Alcoholic Beverages
1 bonbon,Food & Drink - Candy & Sweets
a comment se rafraichir l haleine quand on n a ni brosse a dent ni chewing gum,Food & Drink - Candy & Sweets
accessoires alimentation confiseries halal bonbons halal bebeto dents vampire g bebeto p,Food & Drink - Candy & Sweets
achat de nougat en ligne,Food & Drink - Candy & Sweets
achat nougat de montelimard,Food & Drink - Candy & Sweets
acheter des bonbons haribo,Food & Drink - Candy & Sweets
acheter sucette chupa chups,Food & Drink - Candy & Sweets
actualite ferrero france plus que jamais leader sur la confiserie de chocolat et,Food & Drink - Candy & Sweets
actualite le chewing gum boude le bonbon tient bon,Food & Drink - Candy & Sweets
actualite politique meilleur maire de france monique ferrero monteils ville,Food & Drink - Candy & Sweets
actualites chupa chups donne couleur beton article,Food & Drink - Candy & Sweets
actualites chupa chups sauve votre valentin article,Food & Drink - Candy & Sweets
actualites chupa chups social game fond manettes article,Food & Drink - Candy & Sweets
amour confiseries bouquet bonbons clea,Food & Drink - Candy & Sweets
analyse marché de la confiserie,Food & Drink - Candy & Sweets
annonces acheter malabar q,Food & Drink - Candy & Sweets
apres le chocolat ferrero attaque sur les fruits,Food & Drink - Candy & Sweets
arreter une dependance au chewing gum,Food & Drink - Candy & Sweets
article boite ferrero et pochette carte cadeau,Food & Drink - Candy & Sweets
article boules coco fa on ferrero,Food & Drink - Candy & Sweets
article brownie aux ferrero rocher,Food & Drink - Candy & Sweets
article chupa chups a la noix de coco,Food & Drink - Candy & Sweets
article la double sucette chupa chups pour les amoureux,Food & Drink - Candy & Sweets
article la petite histoire de la chupa chups,Food & Drink - Candy & Sweets
article la sucette chupa chups une oeuvre de salvator dali,Food & Drink - Candy & Sweets
article le sachet a bonbons personnalise,Food & Drink - Candy & Sweets
article les deux gateaux au chocolat,Food & Drink - Candy & Sweets
article macarons au ferrero rocher,Food & Drink - Candy & Sweets
article macarons au kinder bueno,Food & Drink - Candy & Sweets
article macarons aux malabar,Food & Drink - Candy & Sweets
article mes moelleux surprise au ferrero rocher allez vous resister,Food & Drink - Candy & Sweets
article minis croissants rochers ferrero,Food & Drink - Candy & Sweets
article mousse au chocolat et au ferrero,Food & Drink - Candy & Sweets
article muffins au couer de ferrero rochers,Food & Drink - Candy & Sweets
article presentation de l entreprise haribo,Food & Drink - Candy & Sweets
article pub de la semaine chupa chups colors,Food & Drink - Candy & Sweets
article viens sucer la chupa chups,Food & Drink - Candy & Sweets
avis menthos pure fresh,Food & Drink - Candy & Sweets
bien choisir ses chocolats de paques bio sans fourrage sans huile de palme ou autres graisses ajoutees,Food & Drink - Candy & Sweets
bien choisir son chocolat pour paques,Food & Drink - Candy & Sweets
bien etre du chocolat,Food & Drink - Candy & Sweets
bien etre du chocolat au petit dejeuner stimule le cerveau,Food & Drink - Candy & Sweets
bilan de la derniere vente de gateaux,Food & Drink - Candy & Sweets
biscuit au nougat dur ou mou,Food & Drink - Candy & Sweets
biscuiterie confiserie,Food & Drink - Candy & Sweets
biscuiterie confiserie petit dejeuner biscuits,Food & Drink - Candy & Sweets
biscuits aux smarties,Food & Drink - Candy & Sweets
biscuits aux smarties chocolat et caramel au beurre sale,Food & Drink - Candy & Sweets
biscuits chocolat au lait caramel sale entre confiserie et mignardise,Food & Drink - Candy & Sweets
biscuits confiserie,Food & Drink - Candy & Sweets
biscuits confiseries gateau de soja g,Food & Drink - Candy & Sweets
biscuits corse confiserie canistrelli nougats,Food & Drink - Candy & Sweets
biscuits nougats et confiseries biscuits,Food & Drink - Candy & Sweets
biscuits nougats et confiseries croquants amaretti,Food & Drink - Candy & Sweets
boisson chaude au ferrero rocher,Food & Drink - Candy & Sweets
bon de reduction ferrero rocher,Food & Drink - Candy & Sweets
celebrations bonbons chocolat au lait,Food & Drink - Candy & Sweets
cercle emporte piece cercles et cadres a gateaux ou entremets,Food & Drink - Candy & Sweets
chasse aux oeufs kinder paques,Food & Drink - Candy & Sweets
chausson chocolat nougat,Food & Drink - Candy & Sweets
chiffre clé de chupa chups,Food & Drink - Candy & Sweets
chupa chups acheter,Food & Drink - Candy & Sweets
chupa chups banana jellys,Food & Drink - Candy & Sweets
concours chocolats milka daim oreo bonbons,Food & Drink - Candy & Sweets
concours de gateaux,Food & Drink - Candy & Sweets
concours de gateaux à la fraises,Food & Drink - Candy & Sweets
concours de gateauxet jeu de societ,Food & Drink - Candy & Sweets
concours de paque ferrero 2016,Food & Drink - Candy & Sweets
concours ferrero rochers a gagner,Food & Drink - Candy & Sweets
concours gagner chocolats kinder gratuits,Food & Drink - Candy & Sweets
concours gagner chocolats kinder mars twix kinder surprise,Food & Drink - Candy & Sweets
concours gagner gateaux nutella,Food & Drink - Candy & Sweets
concours gateaux paques,Food & Drink - Candy & Sweets
concours gratuits concours alimentation an de kinder bueno a gagner,Food & Drink - Candy & Sweets
concours gratuits concours alimentation boites de bonbons haribo a gagner,Food & Drink - Candy & Sweets
concours gratuits concours alimentation box bonbons haribo chupa chups carambar a gagner,Food & Drink - Candy & Sweets
concours gratuits concours alimentation box de bonbons gagner,Food & Drink - Candy & Sweets
concours gratuits concours alimentation des assortiments de bonbons chamallows haribo a gagner,Food & Drink - Candy & Sweets
concours gratuits concours alimentation des gammes completes de bonbons lutti a gagner,Food & Drink - Candy & Sweets
concours gratuits concours alimentation friandiz kilos de bonbons et friandises chaque mois,Food & Drink - Candy & Sweets
confiserie à certeil solein,Food & Drink - Candy & Sweets
confiserie au nougat,Food & Drink - Candy & Sweets
confiserie confiserie evenements nougats,Food & Drink - Candy & Sweets
confiserie hussel sahne nougat riegel test,Food & Drink - Candy & Sweets
confiserie nougats pate de fruits corse,Food & Drink - Candy & Sweets
confiseries bio nougat aux amandes c,Food & Drink - Candy & Sweets
confiseries friandises nougat brun aux graines de sesame,Food & Drink - Candy & Sweets
confiseries nougat amandes noisettes,Food & Drink - Candy & Sweets
confiseries provencale cabanons nougat tendre caramel au beurre sale,Food & Drink - Candy & Sweets
conseils decoration ferrero rocher,Food & Drink - Candy & Sweets
content decouvrez notre chocolaterie,Food & Drink - Candy & Sweets
detail promotions bonbons au miel,Food & Drink - Candy & Sweets
detail recette gateaux,Food & Drink - Candy & Sweets
details accueil de camping car au palais des bonbons et du nougat,Food & Drink - Candy & Sweets
details acheter des bonbons au miel,Food & Drink - Candy & Sweets
details acheter des bonbons pas chers,Food & Drink - Candy & Sweets
details barre nougat tendre g fabrication artisanale,Food & Drink - Candy & Sweets
details bonbon en vente a l unite,Food & Drink - Candy & Sweets
details bonbons cappuccino kopiko,Food & Drink - Candy & Sweets
details boutique en ligne de noel bonbons et chocolats de noel,Food & Drink - Candy & Sweets
details nougat noir de provence tendre,Food & Drink - Candy & Sweets
en lollipop chupa chups,Food & Drink - Candy & Sweets
enfant ans alimentation le sucre et les bonbons pourquoi on evite,Food & Drink - Candy & Sweets
enfants choco bonbons,Food & Drink - Candy & Sweets
enfants panier de bonbon,Food & Drink - Candy & Sweets
enfants video une degustation de bonbons acidules,Food & Drink - Candy & Sweets
ensemble de bonbons chupa chups,Food & Drink - Candy & Sweets
espagnol francais chupa chups,Food & Drink - Candy & Sweets
fizzy les bonbons fizzy b,Food & Drink - Candy & Sweets
fizzy prix des bonbon,Food & Drink - Candy & Sweets
fondant au chocolat avec confiserie,Food & Drink - Candy & Sweets
fondant au kinder,Food & Drink - Candy & Sweets
fondants confiserie pate d amandes,Food & Drink - Candy & Sweets
forum malabar sans sucres autorises,Food & Drink - Candy & Sweets
chocolat marques chocolat smarties,Food & Drink - Candy & Sweets
boutique chocolats,Food & Drink - Candy & Sweets
friandises bonbon friandise sucrerie,Food & Drink - Candy & Sweets
friandises bonbon friandise sucrerie berlingots aux fruits bonbons,Food & Drink - Candy & Sweets
friandises bonbon friandise sucrerie bonbons aux fruits godaille du pecheur,Food & Drink - Candy & Sweets
iles flottantes nougat pistache,Food & Drink - Candy & Sweets
sucettes chupa chups colis sucettes chupa chups,Food & Drink - Candy & Sweets
fruittella expresso,Food & Drink - Candy & Sweets
grocery sucette chupa chups,Food & Drink - Candy & Sweets
hazelnut and chocolate mousse,Food & Drink - Candy & Sweets
hazelnut praline bonbons,Food & Drink - Candy & Sweets
hd gateau de bonbons,Food & Drink - Candy & Sweets
histoire du nougat,Food & Drink - Candy & Sweets
images de chupa chups,Food & Drink - Candy & Sweets
instant gagnant lots chupa chups a gagner,Food & Drink - Candy & Sweets
le petit gateau au chocolat comme un oreo,Food & Drink - Candy & Sweets
le phare en bonbon haribo,Food & Drink - Candy & Sweets
le plus gros bonbon haribo du monde,Food & Drink - Candy & Sweets
le plus gros vert en bonbons,Food & Drink - Candy & Sweets
le poids d'un bonbon au caramel,Food & Drink - Candy & Sweets
le quatre quart gateaux,Food & Drink - Candy & Sweets
les bonbons haribo,Food & Drink - Candy & Sweets
les confiseries,Food & Drink - Candy & Sweets
les croissants au kinder,Food & Drink - Candy & Sweets
les meilleurs nougats à Paris,Food & Drink - Candy & Sweets
lesechos ech avec kinder et nutella ferrero renforce sa position de leader en france,Food & Drink - Candy & Sweets
malabar a la fraise,Food & Drink - Candy & Sweets
marketing marketing produit etude de cas analyse strategique produit kinder bueno,Food & Drink - Candy & Sweets
marketing marketing produit etude de marche entreprise ferrero kinder bueno,Food & Drink - Candy & Sweets
p recettes chocolaterie,Food & Drink - Candy & Sweets
passion fruit bonbon,Food & Drink - Candy & Sweets
patafruit confiserie gourmande,Food & Drink - Candy & Sweets
pate a tartiner au kinder,Food & Drink - Candy & Sweets
pate de confiseries,Food & Drink - Candy & Sweets
pâte de nougat,Food & Drink - Candy & Sweets
pate de nougat à tartiner chef,Food & Drink - Candy & Sweets
patisserie confiserie,Food & Drink - Candy & Sweets
patisserie emballage chocolat confiserie fine boites a macarons,Food & Drink - Candy & Sweets
