patisserie emballage chocolat confiserie fine boites a macarons bandeau carton blanc brillant pour boite a macarons,Food & Drink - Candy & Sweets
patisserie emballage chocolat confiserie fine boites a macarons boite a biscuits ou macarons a fenetre,Food & Drink - Candy & Sweets
pâtisseries sucrées recettes cookies aux kinders,Food & Drink - Candy & Sweets
pâtisseries sucrées recettes gâteau au kinder bueno,Food & Drink - Candy & Sweets
photo de tous les tatoos de malabar,Food & Drink - Candy & Sweets
poireau malabar,Food & Drink - Candy & Sweets
porte clé bonbon haribo fimo,Food & Drink - Candy & Sweets
porte cles confiserie moritz,Food & Drink - Candy & Sweets
porte ouverte chocolaterie d,Food & Drink - Candy & Sweets
pots a confiseries fiesta,Food & Drink - Candy & Sweets
pots a popcorn et confiseries pink,Food & Drink - Candy & Sweets
poudre de glucose à confiserie,Food & Drink - Candy & Sweets
Pourquoi on l'a appelé chewing-gum,Food & Drink - Candy & Sweets
que faire avec des bonbons acidulés,Food & Drink - Candy & Sweets
que faire avec des bonbons au caramel,Food & Drink - Candy & Sweets
que faire comme gateaux avec des pruneaux,Food & Drink - Candy & Sweets
quel bonbon a donner aux enfants,Food & Drink - Candy & Sweets
quel bonbon pour fondue chocolat,Food & Drink - Candy & Sweets
quel gateaux peut manger un sportif,Food & Drink - Candy & Sweets
rayon confiseries,Food & Drink - Candy & Sweets
recette avec bonbon haribo,Food & Drink - Candy & Sweets
recette creme avec ferrero rocher,Food & Drink - Candy & Sweets
recette de glases au malabar,Food & Drink - Candy & Sweets
recette gateau aux malabars,Food & Drink - Candy & Sweets
recette sucette chupa chups,Food & Drink - Candy & Sweets
recettes chupa chups,Food & Drink - Candy & Sweets
recettes creme aux malabar,Food & Drink - Candy & Sweets
recettes glace bubble gum malabar,Food & Drink - Candy & Sweets
restauration cremeux au chocolat,Food & Drink - Candy & Sweets
restauration mousse au chocolat,Food & Drink - Candy & Sweets
resultats basse normandie confiserie et chocolats,Food & Drink - Candy & Sweets
services generaux pause sucres lait confiserie,Food & Drink - Candy & Sweets
services generaux pause sucres lait confiserie amandines chocolat miko,Food & Drink - Candy & Sweets
services generaux pause sucres lait confiserie bonbons acidules,Food & Drink - Candy & Sweets
services generaux pause sucres lait confiserie chocolats napolitain monbana miko,Food & Drink - Candy & Sweets
services generaux pause sucres lait confiserie mini toblerone,Food & Drink - Candy & Sweets
services generaux pause sucres lait confiserie miniatures mix tubo kg,Food & Drink - Candy & Sweets
services generaux pause sucres lait confiserie sucre en morceaux miko,Food & Drink - Candy & Sweets
similaires chocolaterie artisanale gout forme,Food & Drink - Candy & Sweets
tag biscuits confiseries gourmandises,Food & Drink - Candy & Sweets
tag biscuits viennoiseries gateaux confiseries,Food & Drink - Candy & Sweets
tag bonbon confiserie recette,Food & Drink - Candy & Sweets
tag douceurs de chocolaterie,Food & Drink - Candy & Sweets
tag reuse kinder surprise egg,Food & Drink - Candy & Sweets
un bon kinder surprise,Food & Drink - Candy & Sweets
une confiserie,Food & Drink - Candy & Sweets
une marque de confiserie,Food & Drink - Candy & Sweets
ustensiles confiserie,Food & Drink - Candy & Sweets
10 Best Chocolate Truffle Recipes,Food & Drink - Chocolate
101 chocolats à découvrir,Food & Drink - Chocolate
2 chocolat blanc poudre,Food & Drink - Chocolate
3 principaux producteur de cacao,Food & Drink - Chocolate
750 grammes bounty maison,Food & Drink - Chocolate
a bol en chocolat noir et chocolat blanc,Food & Drink - Chocolate
a chocolats de production artisanale,Food & Drink - Chocolate
accueil chocolats assortiments chocolats noirs et lait,Food & Drink - Chocolate
accueil tamrah chocolat au lait,Food & Drink - Chocolate
achat arome alimentaire chocolat au lait ml,Food & Drink - Chocolate
achat beurre de cacao,Food & Drink - Chocolate
amiens offres chocolat,Food & Drink - Chocolate
amina recette gateau roule au chocolat,Food & Drink - Chocolate
anniversaire gateaux exotique avec chocolat,Food & Drink - Chocolate
annonce beau chocolat au lait a paris,Food & Drink - Chocolate
annonce chocolat au lait,Food & Drink - Chocolate
art de la table cuisine du monde le chocolat belge,Food & Drink - Chocolate
article aucamville paques chocolat grand cru est fete,Food & Drink - Chocolate
article bavarois chocolat fruits exotiques,Food & Drink - Chocolate
article biscuit aux amandes et au fruits exotique accompagner de coulis au chocolat,Food & Drink - Chocolate
article choux craquelin mousse chocolat au lait passion cremeux exotique,Food & Drink - Chocolate
article dans les coulisses de la fabrication de chocolat artisanal,Food & Drink - Chocolate
article entremet speculos chocolat blanc fruits exotiques,Food & Drink - Chocolate
article gateau chocolat fruits exotiques,Food & Drink - Chocolate
article histoires belges chocolat,Food & Drink - Chocolate
article le pain au chocolat cope sans beurre et au chocolat blanc,Food & Drink - Chocolate
article les blondes et le chocolat blanc ou comment il fond parfaitement,Food & Drink - Chocolate
article les cocktails au cacao a,Food & Drink - Chocolate
article les cookies americains au chocolat blanc et a la cerise,Food & Drink - Chocolate
article les cups cakes chocolat blanc de tiph,Food & Drink - Chocolate
article les mayas mais cacao tabac et haricots,Food & Drink - Chocolate
article les mendiants au chocolat noir et au chocolat blanc,Food & Drink - Chocolate
article liegeois chocolat au lait concentre sucre,Food & Drink - Chocolate
article macaron chocolat au lait et lavande,Food & Drink - Chocolate
article macaron chocolat au lait et mirabelle,Food & Drink - Chocolate
article macaron double saveur chocolat et confiture de lait,Food & Drink - Chocolate
article macarons au cacao et ganache a la compote de fraises,Food & Drink - Chocolate
article macarons au chocolat au lait et au praline,Food & Drink - Chocolate
article macarons cacao chocolat blanc et beurre de cacahuetes partenaire,Food & Drink - Chocolate
article macarons cacao chocolat blanc un premier essai,Food & Drink - Chocolate
article macarons chocolat au lait au caramel,Food & Drink - Chocolate
article pave chocolat et coco ou le bounty geant,Food & Drink - Chocolate
article petites douceurs a la noix de coco fa on bounty,Food & Drink - Chocolate
article recette de bounty maison,Food & Drink - Chocolate
au quotidien r balisto,Food & Drink - Chocolate
balisto fruits des bois,Food & Drink - Chocolate
barres au lait miel et amandes balisto p,Food & Drink - Chocolate
bien dans son assiette aliments sucre et produits sucres chocolat pas de pitie pour le nutella,Food & Drink - Chocolate
bien etre le chocolat fait il vraiment grossir,Food & Drink - Chocolate
bienfaits cacao,Food & Drink - Chocolate
bienfaits du beurre de cacao,Food & Drink - Chocolate
Biscuit chocolat blanc,Food & Drink - Chocolate
biscuit recette pate chocolat blanc,Food & Drink - Chocolate
biscuit sable a la noix de coco chocolat blanc,Food & Drink - Chocolate
boite de chocolats belges gaston,Food & Drink - Chocolate
boules a la noix de coco et au chocolat bounty mainson,Food & Drink - Chocolate
bouquet et chocolat duo exotique,Food & Drink - Chocolate
boutique chocolat equitable bio cacao grand cru,Food & Drink - Chocolate
buche exotique et chocolat,Food & Drink - Chocolate
c gateau au cacao sans levure chimique,Food & Drink - Chocolate
cake aux fruits de la passion et son glacage chocolat blanc exotique,Food & Drink - Chocolate
calories produits sucres balisto fruits des bois,Food & Drink - Chocolate
cheesecake facon bounty noix de coco et chocolat,Food & Drink - Chocolate
chocolat artisanal boite de chocolat de la loire,Food & Drink - Chocolate
chocolat au lait belge,Food & Drink - Chocolate
chocolat belge leonidas boutique en ligne bal tradi cfm,Food & Drink - Chocolate
chocolat belges pour pâques,Food & Drink - Chocolate
chocolat en ligne belge,Food & Drink - Chocolate
chocolats avril poisson exotique,Food & Drink - Chocolate
chocolats de paques poisson exotique,Food & Drink - Chocolate
chocolats suisses,Food & Drink - Chocolate
coffrets idees cadeaux coffret de pistoles chocolat noir grand cru au choix,Food & Drink - Chocolate
comme un grand cru le chocolat se travaille,Food & Drink - Chocolate
concour paques chocolat mika,Food & Drink - Chocolate
concours belgique gagnez lot de paquets de chocolats milka,Food & Drink - Chocolate
concours foret noire avec cacao,Food & Drink - Chocolate
condensed milk truffles cacao,Food & Drink - Chocolate
confiture de lait au chocolat etiquette cadeau et carte recette imprimables,Food & Drink - Chocolate
confiture de lait au chocolat noir,Food & Drink - Chocolate
congo brazzaville la cib olam s’intéresse à la filière cacao,Food & Drink - Chocolate
conservation des feves de cacao,Food & Drink - Chocolate
conservation du cacao en poudre,Food & Drink - Chocolate
contact la maison du cacao,Food & Drink - Chocolate
content madeleines au chocolat blanc,Food & Drink - Chocolate
cookie au chocolat blanc,Food & Drink - Chocolate
cookie aux chocolat blanc recette de cuisine,Food & Drink - Chocolate
createurs chocolat francais artisanal paris,Food & Drink - Chocolate
cuisson fondant au chocolat artisanal,Food & Drink - Chocolate
detail promotions barres biscuitees au chocolat,Food & Drink - Chocolate
detail promotions mini lapins or au chocolat au lait lindt,Food & Drink - Chocolate
diabète et chocolat noir,Food & Drink - Chocolate
en expos salon du chocolat chocolate show,Food & Drink - Chocolate
enseignes c comptoir du cacao,Food & Drink - Chocolate
entremet au chocolat blanc et pistache,Food & Drink - Chocolate
entremet au chocolat noir et au lait,Food & Drink - Chocolate
entremet chocolat noisette,Food & Drink - Chocolate
entreprises belgique cacao et chocolat,Food & Drink - Chocolate
flan au cacao,Food & Drink - Chocolate
flan au chocolat au lait,Food & Drink - Chocolate
flan au chocolat au lait et fruit de la passion sans pate et version individuelle,Food & Drink - Chocolate
flan au chocolat blanc,Food & Drink - Chocolate
flan magique coco facon bounty,Food & Drink - Chocolate
flan patissier au cacao,Food & Drink - Chocolate
flash actualite culture le cacao fevier maitre d oeuvre des grands crus du chocolat,Food & Drink - Chocolate
fleur de cacao b,Food & Drink - Chocolate
fournisseur de chocolat artisanal,Food & Drink - Chocolate
chocolat artisanal livraison,Food & Drink - Chocolate
chocolat couverture cacao big pf bo paillete feuilletine,Food & Drink - Chocolate
chocolat couverture cacao chd nmex mexique,Food & Drink - Chocolate
chocolat couverture cacao chd ofleu fleur de cao,Food & Drink - Chocolate
paques chocolat belge fr,Food & Drink - Chocolate
frproduits le meilleur chocolat chaud belge,Food & Drink - Chocolate
gateau au chocolat facon grand cru chocolat de conticini essai,Food & Drink - Chocolate
gateau chocolat facon grand cru,Food & Drink - Chocolate
gateau chocolat fruits exotiques,Food & Drink - Chocolate
gâteau exotique au chocolat,Food & Drink - Chocolate
gateaux fruits exotiques accompagne chocolat,Food & Drink - Chocolate
gourmandises tomme de savoie chocolat artisanal,Food & Drink - Chocolate
grands crus de chocolat nespresso,Food & Drink - Chocolate
haut femme chocolat,Food & Drink - Chocolate
hd mousse au chocolat blanc,Food & Drink - Chocolate
histoire du chocolat cacao et chocolat van houten le chocolat en poudre,Food & Drink - Chocolate
hummmm croissant et chocolat au lait,Food & Drink - Chocolate
index php nos chocolats nos chocolats petit dejeuner et dessert chocolat artisanal petit dejeuner a l agave fructose,Food & Drink - Chocolate
index php nos chocolats nos chocolats petit dejeuner et dessert chocolat artisanal petit dejeuner au sucre de canne,Food & Drink - Chocolate
j ai achete des feve de cacao comment les manger,Food & Drink - Chocolate
j ai inventé le framboisier royal au chocolat blanc,Food & Drink - Chocolate
jacre recette creme brulee au chocolat blanc,Food & Drink - Chocolate
le chocolat belge est le meilleur du monde,Food & Drink - Chocolate
le petit pain au chocolat,Food & Drink - Chocolate
le plus grand train au monde en chocolat est belge,Food & Drink - Chocolate
le poucentage en cacao,Food & Drink - Chocolate
les chambres blanc chocolat blanc chocolat,Food & Drink - Chocolate
les cookies au chocolat blanc,Food & Drink - Chocolate
livraison chocolat blanc belge,Food & Drink - Chocolate
livraison oeuf chocolats belge,Food & Drink - Chocolate
marbré au chocolat sans lait,Food & Drink - Chocolate
marbré chocolat blanc et lait,Food & Drink - Chocolate
meilleur chocolat belge,Food & Drink - Chocolate
merveilleux au chocolat belge,Food & Drink - Chocolate
montagne chocolat confitures artisanales gateaux f aspx,Food & Drink - Chocolate
nestle dessert plan cacao,Food & Drink - Chocolate
oeuf en chocolat belge,Food & Drink - Chocolate
parve chocolate mousse,Food & Drink - Chocolate
pas bon le chocolat pour la ligne,Food & Drink - Chocolate
pas de chocolat pour les chiens,Food & Drink - Chocolate
pate a tartiner au chocolat blanc,Food & Drink - Chocolate
pate a tartiner chocolat blanc jpg,Food & Drink - Chocolate
poids éclair au chocolat artisanal,Food & Drink - Chocolate
pot de crème au chocolat blanc,Food & Drink - Chocolate
pots de cheesecake au chocolat blanc,Food & Drink - Chocolate
poudre instantanee au chocolat blanc,Food & Drink - Chocolate
prix meilleur chocolat belge,Food & Drink - Chocolate
produits bretons produits bretons chocolat artisanal sardines chocolat lait zoom fr,Food & Drink - Chocolate
quantité de chocolat par jour,Food & Drink - Chocolate
quatite de beurre de cacao pour une recette,Food & Drink - Chocolate
que faire avec chocolat noir et blanc,Food & Drink - Chocolate
que faire avec du chocolat blanc,Food & Drink - Chocolate
quel cacao pour gateau,Food & Drink - Chocolate
quel chocolat choisir le plus riche en cacao t,Food & Drink - Chocolate
quel est le premier producteur de cacao au monde,Food & Drink - Chocolate
quel gateau l on peut faire avec du beurre de cacao,Food & Drink - Chocolate
quelle sont les composants du cacao,Food & Drink - Chocolate
questions reponses ou acheter des pepites chocolat blanc,Food & Drink - Chocolate
recette balisto maison,Food & Drink - Chocolate
recette barre bounty,Food & Drink - Chocolate
recette muffins balisto,Food & Drink - Chocolate
recettes bavarois chocolat blanc et fruit exotiques facile,Food & Drink - Chocolate
restauration creme d amandes au cacao,Food & Drink - Chocolate
restauration mousse au chocolat a la creme,Food & Drink - Chocolate
réussir ses blancs en neige pour la mousse au chocolat,Food & Drink - Chocolate
s fondant au chocolat blanc,Food & Drink - Chocolate
savoir manger chocolat balisto lait miel amande,Food & Drink - Chocolate
services recettes gateau au chocolat content,Food & Drink - Chocolate
services recettes macaron chocolat content,Food & Drink - Chocolate
shop chocolats de paques lindor cornet lindor blanc g,Food & Drink - Chocolate
tableau beige et chocolat,Food & Drink - Chocolate
tableau chocolat idéal,Food & Drink - Chocolate
tablette au chocolat blanc gourmand,Food & Drink - Chocolate
tablette chocolat industrielles ou artisanales,Food & Drink - Chocolate
tablette chocolat noir grand cru venezuela,Food & Drink - Chocolate
tablette de chocolat belge noir et myrtilles,Food & Drink - Chocolate
tablette de chocolat belge noir et pistache,Food & Drink - Chocolate
tablettes chocolat artisanal,Food & Drink - Chocolate
tablettes chocolat blanc,Food & Drink - Chocolate
tablettes chocolat grand cru sans sucres,Food & Drink - Chocolate
tablettes chocolat grand cru vietnam,Food & Drink - Chocolate
tag beurre de cacao blanc,Food & Drink - Chocolate
tempérage du chocolat belge,Food & Drink - Chocolate
tutoriels culture du cacao,Food & Drink - Chocolate
ustensiles cuisine epicerie chocolat praline pepites chocolat noir resistantes a la cuisson g cacao barry,Food & Drink - Chocolate
versailles chocolat chocolatier artisanal,Food & Drink - Chocolate
vitrine chocolat tournante,Food & Drink - Chocolate
vivani chocolat blanc au yahourt a la fraise x g,Food & Drink - Chocolate
vivre gastronomie les rois du cacao le meilleur du chocolat,Food & Drink - Chocolate
voici un joli bocal et sa houppette decore de friandises chocolatees pour un shampoing sec au cacao,Food & Drink - Chocolate
voir faire agenda exposition du cacao au chocolat,Food & Drink - Chocolate
4 façons de presque tout cuisiner,Food & Drink - Cooking & Recipes
5 manières de cuisiner des cuisses de grenouilles,Food & Drink - Cooking & Recipes
a collectif les meilleures recettes marmiton,Food & Drink - Cooking & Recipes
accès à mon carnet de recettes Marmiton,Food & Drink - Cooking & Recipes
actualites aliments sains a ne pas manger en exces fr,Food & Drink - Cooking & Recipes
actualites art cocktail selon jamie oliver article,Food & Drink - Cooking & Recipes
actualites evenements les meilleures recettes galettes rois,Food & Drink - Cooking & Recipes
actualites evenements nos meilleures recettes de courges pour halloween,Food & Drink - Cooking & Recipes
actualites majorite de francais prete a payer plus cher manger sain,Food & Drink - Cooking & Recipes
agneau cuisine de bernard,Food & Drink - Cooking & Recipes
amuse bouche crudités marmiton OS,Food & Drink - Cooking & Recipes
anglais francais cuisiner un nouveau plat,Food & Drink - Cooking & Recipes
anglais francais j'aime cuisiner pour les autres,Food & Drink - Cooking & Recipes
annonce aide menagere et cuisinere,Food & Drink - Cooking & Recipes
apple pie facon jamie oliver,Food & Drink - Cooking & Recipes
Apple Strudel Jamie Oliver,Food & Drink - Cooking & Recipes
article apprendre a faire du bon pain c est possible,Food & Drink - Cooking & Recipes
article concours chez la cuisine de bernard,Food & Drink - Cooking & Recipes
article faire du pain a l ancienne,Food & Drink - Cooking & Recipes
article les aliments de base pour cuisiner vite et bien,Food & Drink - Cooking & Recipes
article les fiches pratiques comment faire un bon riz,Food & Drink - Cooking & Recipes
article les jeunes apprennent a cuisiner en bourgogne,Food & Drink - Cooking & Recipes
article les ustensiles de base pour bien cuisiner,Food & Drink - Cooking & Recipes
article lindt a cuisiner le fondant,Food & Drink - Cooking & Recipes
article manger plus sain,Food & Drink - Cooking & Recipes
article manger sain et pas cher c est possible,Food & Drink - Cooking & Recipes
article mes meilleures recettes,Food & Drink - Cooking & Recipes
article morandini zap comment reconnaitre un bon confit de canard,Food & Drink - Cooking & Recipes
article pain de viande en cocotte de jamie oliver,Food & Drink - Cooking & Recipes
article pain perdu banane et fruits rouges a la jamie oliver,Food & Drink - Cooking & Recipes
article pancakes de jamie oliver,Food & Drink - Cooking & Recipes
Astuces pour cuisiner léger - recette des chips maison,Food & Drink - Cooking & Recipes
avec quoi peut on remplacer la levure boulangère pour faire du pain,Food & Drink - Cooking & Recipes
b jamie oliver barbecues au charbon de bois,Food & Drink - Cooking & Recipes
beignet de crevette cuisine de bernard,Food & Drink - Cooking & Recipes
bien cuisiner,Food & Drink - Cooking & Recipes
bien cuisiner la courgette les conseils du chef,Food & Drink - Cooking & Recipes
bien cuisiner le poisson,Food & Drink - Cooking & Recipes
bien cuisiner léger,Food & Drink - Cooking & Recipes
bien cuisiner les champignons,Food & Drink - Cooking & Recipes
biscuits cocotte la cuisine de bernard,Food & Drink - Cooking & Recipes
blanquette cuisine de bernard,Food & Drink - Cooking & Recipes
blog cuisine de bernard,Food & Drink - Cooking & Recipes
blog manger sain un hors serie de millions de consommateurs,Food & Drink - Cooking & Recipes
blog saint valentin fleurs a manger,Food & Drink - Cooking & Recipes
boeuf aux oignons cuisine de bernard,Food & Drink - Cooking & Recipes
boeuf bourguignon la cuisine de bernard,Food & Drink - Cooking & Recipes
boeuf carotte la cuisine de bernard,Food & Drink - Cooking & Recipes
bouchées tartelettes framboise cuisine de bernard,Food & Drink - Cooking & Recipes
boulettes fromage la cuisine de bernard,Food & Drink - Cooking & Recipes
bourguignon cuisine de bernard,Food & Drink - Cooking & Recipes
brochette poulet yakitori la cuisine de bernard,Food & Drink - Cooking & Recipes
brownies la cuisine de bernard,Food & Drink - Cooking & Recipes
burger maison cuisiner facile bon appetit,Food & Drink - Cooking & Recipes
cake a la puree de pommes de terre saveurs indiennes,Food & Drink - Cooking & Recipes
célébré le jour national du cheesburger avec cette recette de cheeseburger,Food & Drink - Cooking & Recipes
cheesecake deux chocolat cuisine de bernard,Food & Drink - Cooking & Recipes
cheesecake pavot la cuisine de bernard,Food & Drink - Cooking & Recipes
chef les cours de cuisine de bernard bach,Food & Drink - Cooking & Recipes
chic choc bar la cuisine de bernard,Food & Drink - Cooking & Recipes
clafoutis cuisine de bernard,Food & Drink - Cooking & Recipes
combien de temps faire cuire du pain au four,Food & Drink - Cooking & Recipes
coment faire du pain avec dela semoule facile,Food & Drink - Cooking & Recipes
comme faire du pain,Food & Drink - Cooking & Recipes
comment choisir sa farine pour faire du pain,Food & Drink - Cooking & Recipes
Comment cuisiner hamburger maison,Food & Drink - Cooking & Recipes
comment faire de la brioche ou du pain perdu,Food & Drink - Cooking & Recipes
comment manger de facon saine pour,Food & Drink - Cooking & Recipes
comment manger plus sain et naturel,Food & Drink - Cooking & Recipes
comment manger sain et equilibre,Food & Drink - Cooking & Recipes
concours gratuits concours maison plein de cadeaux pour cuisiner bio,Food & Drink - Cooking & Recipes
confiture agrumes marmiton,Food & Drink - Cooking & Recipes
confiture citrons marmiton,Food & Drink - Cooking & Recipes
conseil comment choisir le bon barbecue,Food & Drink - Cooking & Recipes
conseil comment realiser un bon cappuccino,Food & Drink - Cooking & Recipes
conseil pour cuisiner,Food & Drink - Cooking & Recipes
conseils culinaires nos meilleures recettes a base de poires,Food & Drink - Cooking & Recipes
conseils culinaires nos meilleures recettes de cakes sucres ou sales,Food & Drink - Cooking & Recipes
conseils culinaires nos meilleures recettes de pates des idees de recettes pour tous les gouts,Food & Drink - Cooking & Recipes
cookie cuisine de bernard,Food & Drink - Cooking & Recipes
cuisine comment faire du pain perdu,Food & Drink - Cooking & Recipes
cuisine cuisine minceur rapidement cuisiner legumes sujet,Food & Drink - Cooking & Recipes
cuisine de mercotte,Food & Drink - Cooking & Recipes
cuisine de mercotte gateau chocolat,Food & Drink - Cooking & Recipes
cuisine de mercotte tarte au citron,Food & Drink - Cooking & Recipes
cuisine japonaise recette japonaise sans balance recette végétarienne recette bio cuisine bio recette minceur cuisine minceur cuisine,Food & Drink - Cooking & Recipes
cuisine video la recette du gateau de mercotte,Food & Drink - Cooking & Recipes
cuisiner a la maison et vendre ses plats,Food & Drink - Cooking & Recipes
cuisiner a la maison ou manger en ville a,Food & Drink - Cooking & Recipes
cuisiner faites vos churros maison,Food & Drink - Cooking & Recipes
details cuisiner au feu de bois,Food & Drink - Cooking & Recipes
diaporama photo de nouvelles facons de cuisiner le croque monsieur la poubelle revolutionnaire qui deshydrate les aliments,Food & Drink - Cooking & Recipes
diaporamas astuces cuisiner a la vapeur interne aspx,Food & Drink - Cooking & Recipes
diaporamas astuces pour cuisiner sans matieres grasses interne aspx,Food & Drink - Cooking & Recipes
dietetique manger sain,Food & Drink - Cooking & Recipes
différentes recettes de cuisses de poulet marmiton,Food & Drink - Cooking & Recipes
emission le meilleur patissier recettes de cuisine abricot l alcazar de mercotte,Food & Drink - Cooking & Recipes
emission le meilleur patissier recettes de cuisine abricot la recette inedite de mercotte le chausson aux abricots,Food & Drink - Cooking & Recipes
emission le meilleur patissier recettes de cuisine amande le voyageur de mercotte,Food & Drink - Cooking & Recipes
emission le meilleur patissier recettes de cuisine brioche la brioche a huit tresses de mercotte,Food & Drink - Cooking & Recipes
emission le meilleur patissier recettes de cuisine chocolat l opera de mercotte,Food & Drink - Cooking & Recipes
emission le meilleur patissier recettes de cuisine farine la brioche polonaise de mercotte,Food & Drink - Cooking & Recipes
emission le meilleur patissier recettes de cuisine farine le guillaume tell de mercotte,Food & Drink - Cooking & Recipes
emission le meilleur patissier recettes de cuisine farine le pithiviers de mercotte,Food & Drink - Cooking & Recipes
emission le meilleur patissier recettes de cuisine fraise le fraisier de mercotte,Food & Drink - Cooking & Recipes
emission le meilleur patissier recettes de cuisine framboise la charlotte royale de mercotte,Food & Drink - Cooking & Recipes
emission le meilleur patissier recettes de cuisine riz le riz imperatrice de mercotte,Food & Drink - Cooking & Recipes
emissions la cuisine de mercotte,Food & Drink - Cooking & Recipes
faire cuire du pain dans son four,Food & Drink - Cooking & Recipes
faire cuire du pain en cocotte,Food & Drink - Cooking & Recipes
faire de la baguette (du pain français),Food & Drink - Cooking & Recipes
fish and chips de jamie oliver,Food & Drink - Cooking & Recipes
fish and chips la cuisine de bernard,Food & Drink - Cooking & Recipes
fish pie comme un parmentier de poisson trop trop bon,Food & Drink - Cooking & Recipes
flan a la parisienne marmiton,Food & Drink - Cooking & Recipes
