0 blue jeans,Shopping - Apparel
cgos avantages cheques cadeaux,Shopping - Coupons
chapeau de paille bon marché,Shopping - Coupons
cherbourg evenement la carte fidelite,Shopping - Coupons
concours argent gagnez des cartes cadeaux cdiscount,Shopping - Coupons
concours migrol gagnez un coupon de mazout,Shopping - Coupons
conditions coupons reduction cderemb,Shopping - Coupons
conditions generales d utilisation coupons shopping,Shopping - Coupons
configurer velo tout terrain vtt occasion discount,Shopping - Coupons
conforama carte de fidélité,Shopping - Coupons
connexioncompte msg carte de fidelite,Shopping - Coupons
devenez testeur de jeux videos pour ubisoft et recevez des cheques cadeaux,Shopping - Coupons
dhtml cheque cadeau,Shopping - Coupons
différence rabais remise,Shopping - Coupons
dijon bon plan carte fidelite toison d or fiche € chez carrefour dijon toison d'or !,Shopping - Coupons
dimanche lundi bonus exceptionnel bonus carte fidelite,Shopping - Coupons
discount codes bon marche,Shopping - Coupons
dossiers cartes cadeau virtuel,Shopping - Coupons
en offrir designerbox carte cadeau,Shopping - Coupons
en ou acheter une carte cadeau xbox live,Shopping - Coupons
enfant chaussures n promos~ n promos~,Shopping - Coupons
engagements et services carte de fidelite,Shopping - Coupons
enregistre cheque cadeau,Shopping - Coupons
enregistrement carte fidelité,Shopping - Coupons
enregistrement comptable carte de fidelite,Shopping - Coupons
enregistrer une facture avec rabais,Shopping - Coupons
Enseignes partenaires du chèque cadeau Cadhoc,Shopping - Coupons
ensemble cadeau boite carte,Shopping - Coupons
entrees froides bon marché,Shopping - Coupons
entreprises billetterie cadeaux billetterie cartes kine,Shopping - Coupons
entreprises pages cartes cadeaux aspx,Shopping - Coupons
equipe paris psg cristiano ronaldo vendu au rabais cet ete,Shopping - Coupons
flash rc cheque cadeau flash rc,Shopping - Coupons
flers encore plus dextras cora carte cadeau,Shopping - Coupons
flunch carte fidélité,Shopping - Coupons
flux boutique ma carte cadeau carte cadeau,Shopping - Coupons
football articles dembele vendu au rabais,Shopping - Coupons
formulaire carte de fidelite,Shopping - Coupons
fr fr bons de reduc,Shopping - Coupons
fr fr boutique en ligne catid promotions et destockage,Shopping - Coupons
fr fr cadeauxdaffaires promotions,Shopping - Coupons
fr fr calendrier fr promotions et offres bernina,Shopping - Coupons
fr fr carte cadeau,Shopping - Coupons
fr fr carte cadeau noël,Shopping - Coupons
fr fr enfants carte cadeau c,Shopping - Coupons
fr frbijoux fantaisies promotions,Shopping - Coupons
fr infos pratiques carte de fidelite,Shopping - Coupons
fr le five fc carte de fidelite,Shopping - Coupons
haute savoie promo bons plans,Shopping - Coupons
hautmont promo bons plans index,Shopping - Coupons
hc fr articles activation d une carte cadeau,Shopping - Coupons
hc fr articles activation d une carte cadeau j ai une carte cadeau je veux en bénéficier,Shopping - Coupons
hc fr articles bons de réduction,Shopping - Coupons
hc fr articles comment utiliser un code promo,Shopping - Coupons
hc fr articles nos cartes cadeaux,Shopping - Coupons
hc fr articles utilisateur de pass code promo en france,Shopping - Coupons
hc fr sections utilisation des cartes cadeaux,Shopping - Coupons
http carrefour fr carte fidelite,Shopping - Coupons
https carte fidélité auchan fr,Shopping - Coupons
itm pinceaux maquillage cosmetique pieces makeup brush set prof prix discount,Shopping - Coupons
ivry sur seine carte de fidelite,Shopping - Coupons
j'ai un chèque cadeau wonderbox,Shopping - Coupons
le rabais descartes,Shopping - Coupons
le retour du petrole bon marche fr art,Shopping - Coupons
leptopril lot de deux promo,Shopping - Coupons
leroy merlin carte de fidélité,Shopping - Coupons
les 3 brasseurs carte fidélité,Shopping - Coupons
les carte de fidélité,Shopping - Coupons
les cartes cadeaux,Shopping - Coupons
les cheques cadeaux amazon fr,Shopping - Coupons
les coupons bons cadeaux,Shopping - Coupons
les coupons cadeaux,Shopping - Coupons
Maison poupée promo,Shopping - Coupons
maison s chauffage en promotion,Shopping - Coupons
maisonnette en bois en promotion,Shopping - Coupons
maisonnette enfant bois prix promo,Shopping - Coupons
maisons enfants bois prix discount,Shopping - Coupons
makari de suisse coupon,Shopping - Coupons
makIt coupon Codes,Shopping - Coupons
manger bon marche ce est pas complique,Shopping - Coupons
maquillage rabais,Shopping - Coupons
marche au affaire carte de fidelite,Shopping - Coupons
nanalulus linens coupon code,Shopping - Coupons
nantes discount,Shopping - Coupons
napa auto parts coupons 2016,Shopping - Coupons
nesle a compte carte de fidelite,Shopping - Coupons
news haut carte de fidelite,Shopping - Coupons
Pas cher et discount,Shopping - Coupons
pas chers promotion dubai,Shopping - Coupons
passione coupons,Shopping - Coupons
pasta house coupons,Shopping - Coupons
payer avec ma carte de fidélité,Shopping - Coupons
penser a offrir une carte cadeau pour noel,Shopping - Coupons
perdu code carte fidelite carrefour,Shopping - Coupons
personnalisez votre carte de fidélité,Shopping - Coupons
quarouble promo bons plans index,Shopping - Coupons
quebec promotions,Shopping - Coupons
quelle compagnie on une carte de fidélité,Shopping - Coupons
quelle est la meilleure periode pour acheter ses skis en promotion,Shopping - Coupons
recevez des chèques cadeaux en participant aux études opiniorama,Shopping - Coupons
resto bon marché,Shopping - Coupons
resultats recherche trouvez des coupons rabais et des codes de coupon,Shopping - Coupons
rôle du chèque cadeau,Shopping - Coupons
services obtenir carte fidelite,Shopping - Coupons
shop carte cadeaux,Shopping - Coupons
sites de coupons rabais a imprimer ou commander,Shopping - Coupons
t une video promo pour prd,Shopping - Coupons
table a induction discount,Shopping - Coupons
table a manger en promotion a rallonge rectangulaire,Shopping - Coupons
table a manger en promotion ronde,Shopping - Coupons
table appoint en promotion,Shopping - Coupons
tableau moderne à prix discount,Shopping - Coupons
tableau prix discount,Shopping - Coupons
tag carte cadeau chaussures,Shopping - Coupons
tag carte cadeau esprit,Shopping - Coupons
tag coupon reduc,Shopping - Coupons
tulle promotions,Shopping - Coupons
tulsa zoo coupons,Shopping - Coupons
tuniques femmes promotion,Shopping - Coupons
une carte cadeau photo pour noel,Shopping - Coupons
unicap peugeot cheque cadeau,Shopping - Coupons
viva voyage discount code,Shopping - Coupons
vous possedez carte fidelite,Shopping - Coupons
voyage a rabais guadeloupe,Shopping - Coupons
voyage a rabais pour republique dominicaine,Shopping - Coupons
voyage a rabais tulum,Shopping - Coupons
voyages à rabais,Shopping - Coupons
0 bloquer publicité dailymotion,Shopping - Entertainment Media
0 Publicité sur le web,Shopping - Entertainment Media
10 agences de castings pour la publicité,Shopping - Entertainment Media
10 jeux flash gratuit sans pub,Shopping - Entertainment Media
11 publicités de mauvais,Shopping - Entertainment Media
120 min de bonheur pub des chaînes concurrentes,Shopping - Entertainment Media
abonnement magazines loisirs abonnement magazines jeux divertissement,Shopping - Entertainment Media
amiens journal presse et magazines le courrier picard service abonnements,Shopping - Entertainment Media
analyse campagne publicité extreme glaces,Shopping - Entertainment Media
analyse de la publicité le bain de jean paul gaultier,Shopping - Entertainment Media
analyse de la publicite pour le parfum j adore de christian dior,Shopping - Entertainment Media
ancien balance alger el madania algerie loisirs divertissements d,Shopping - Entertainment Media
ancien presentateur du grand journal canal plus,Shopping - Entertainment Media
article l enfant prodige bande annonce,Shopping - Entertainment Media
article la verite sur la viande quand les medias de masse revelent enfin la verite,Shopping - Entertainment Media
article le noel de julia bande annonce vo e,Shopping - Entertainment Media
article le nouveau magazine la redoute printemps ete,Shopping - Entertainment Media
article le nouvel orgue de radio france,Shopping - Entertainment Media
article le o de dublin spectacles sur les docks,Shopping - Entertainment Media
article le petit musee de la pub qui veut devenir grand,Shopping - Entertainment Media
article le plus vieux pub de new york le mac sorley s,Shopping - Entertainment Media
article le pmu une publicite de tres mauvais gout,Shopping - Entertainment Media
article le pop up dans la pub,Shopping - Entertainment Media
article le prix d un spot de pub secondes dans tous les programmes us modern family et new girl en tete,Shopping - Entertainment Media
article le prix des spots pubs dans les programmes us glee serie la plus chere desperate housewives et f,Shopping - Entertainment Media
article le theme du divertissement dans la litterature,Shopping - Entertainment Media
article les annee publicite et robe de soiree,Shopping - Entertainment Media
article les femmes et la publicite,Shopping - Entertainment Media
article les medias de masse sont ils libres,Shopping - Entertainment Media
article medias de masse individuels leur impact sur la democratie,Shopping - Entertainment Media
article video l ecole poubelle l abrutissement des masses par la television et les medias,Shopping - Entertainment Media
bien choisir chaine hifi,Shopping - Entertainment Media
bien choisir son home cinema cp w,Shopping - Entertainment Media
bien etre magazine beaute,Shopping - Entertainment Media
bien etre magazine beaute astuces pour avoir bonne mine du matin au soir,Shopping - Entertainment Media
bien etre magazine beaute bientot une creme contre les cheveux blancs,Shopping - Entertainment Media
bien etre magazine beaute des dents blanches a tout prix,Shopping - Entertainment Media
bien fait offrir un spectacle aux residants,Shopping - Entertainment Media
bientot des publicites commerciales sur radio france,Shopping - Entertainment Media
bientot des pubs sur tele geante dans la rue,Shopping - Entertainment Media
bientot un spectacle,Shopping - Entertainment Media
bienvenue a bord divertissements,Shopping - Entertainment Media
bienvenue billetterie spectacles,Shopping - Entertainment Media
bienvenue billetterie spectacles fnac fnac derniere mise a jour,Shopping - Entertainment Media
bieres verres a biere et publicite brassicole belge fr cfm,Shopping - Entertainment Media
big mac publicité,Shopping - Entertainment Media
biocoop publicite cosmetique bio,Shopping - Entertainment Media
blog divertissement date,Shopping - Entertainment Media
ce fr product albrecht dr radio de coffre lampe de poche noir,Shopping - Entertainment Media
ce fr product lot daffiches de publicite h busch,Shopping - Entertainment Media
ce soir a la tele habille e s pour lhiver sur canal plus,Shopping - Entertainment Media
ceinture promotion ceinture lacee et baleinee,Shopping - Entertainment Media
céline dion en spectacle,Shopping - Entertainment Media
centre oceane recherche (text) divertissement enfants,Shopping - Entertainment Media
char téléguidé alger centre algerie loisirs divertissements d,Shopping - Entertainment Media
complot des attentats parisiens les medias enfument ils les cerveaux des masses,Shopping - Entertainment Media
conclusion de la publicite j adore d ior,Shopping - Entertainment Media
concours bharati places de spectacle a gagner,Shopping - Entertainment Media
concours concerts et spectacles billets pour le spectacle de celine dion,Shopping - Entertainment Media
concours coop gagnez x tickets pour le spectacle fabrikk,Shopping - Entertainment Media
concours generation pub la liberte d expression,Shopping - Entertainment Media
concours generation pub les meilleures campagnes sur le gaspillage alimentaire,Shopping - Entertainment Media
concours gratuits concours culturels canal plus des milliers de places de cine a gagner,Shopping - Entertainment Media
concours pubs anti jeux resultats,Shopping - Entertainment Media
conférence l'impact de la pub sur notre alimentation,Shopping - Entertainment Media
confiance à frigeavia publicité femmes,Shopping - Entertainment Media
connecter canal plus a un autre televiseur,Shopping - Entertainment Media
consommation telephonie television resilier l abonnement tv payante canal plus canalsat ab sat orange avant date anniversaire,Shopping - Entertainment Media
des medias de masse a la revolution numerique,Shopping - Entertainment Media
differents themes sur l divertissement,Shopping - Entertainment Media
documentaire medias de masse desinformation corruption et manipulation du peuple,Shopping - Entertainment Media
en israel une publicite montre sarkozy en laveur de vitres,Shopping - Entertainment Media
enfant nouvelle bande annonce,Shopping - Entertainment Media
enfant utilisé en pub,Shopping - Entertainment Media
enfants et ados divertissements,Shopping - Entertainment Media
enfants pub kia sportage,Shopping - Entertainment Media
f jeux et divertissements,Shopping - Entertainment Media
f le dispositif canal plus en villeneuve et febreau au micro des directs fin de la pub pendant les gp,Shopping - Entertainment Media
fisher price jeu electronique TV Radio,Shopping - Entertainment Media
fit découvrir au public le grandiose spèctacle d'un eratére en colère,Shopping - Entertainment Media
five bande annonce finale du film v,Shopping - Entertainment Media
fkokiye liste des chaines canal plus,Shopping - Entertainment Media
flash actualite culture au web ce soir ursule un cyber spectacle pour web spectateurs,Shopping - Entertainment Media
flash actualite economie leader price condamne pour slogans trompeurs dans une publicite comparative,Shopping - Entertainment Media
fr fr bons plans article en promotion,Shopping - Entertainment Media
fr fr conseils beaute le magazine,Shopping - Entertainment Media
fr fr conseils beaute le magazine blush orchidee,Shopping - Entertainment Media
fr fr conseils beaute le magazine choisir mascara,Shopping - Entertainment Media
fr fr conseils beaute le magazine comment choisir son soin solaire,Shopping - Entertainment Media
fr france strasbourg spectacles,Shopping - Entertainment Media
fr frederic francois tour spectacle anniversaire,Shopping - Entertainment Media
hauts de seine l arbre qui cachait la pub menace d abattage,Shopping - Entertainment Media
hd sur tv recois canal plus pas les autres chaines,Shopping - Entertainment Media
hda 3eme impact de la publicite sur la consommation,Shopping - Entertainment Media
itm modele platre unique porto cintra bar pub st clement bar pub ashtray collector,Shopping - Entertainment Media
itm monaco enveloppe er jour leonard de vinci pac pub,Shopping - Entertainment Media
itm n c semeuse rose bande verticale de carnet pubs neuve ref maury b,Shopping - Entertainment Media
la diffusion de masse de l'information par les médias,Shopping - Entertainment Media
le petit coup de pub,Shopping - Entertainment Media
le peuple français manipulé par les media,Shopping - Entertainment Media
le plus gros coup de pub au monde,Shopping - Entertainment Media
le point magazine abonnement pour l'etranger,Shopping - Entertainment Media
le pouvoir normatif des federations sportives article publicite des normes sportives,Shopping - Entertainment Media
le printemps des pubs,Shopping - Entertainment Media
le prix de secondes de pub en finale,Shopping - Entertainment Media
le roman comme divertissement,Shopping - Entertainment Media
les artifices de divertissement r,Shopping - Entertainment Media
les choses a voir et faire divertissement inverness nairn,Shopping - Entertainment Media
les dix strategies de la manipulation des masses a travers les medias,Shopping - Entertainment Media
les roles des masses medias,Shopping - Entertainment Media
ma life les publicites de jeux video qui m ont marque,Shopping - Entertainment Media
magazine tf en crise la mort des medias de masse est en marche,Shopping - Entertainment Media
maisons closes et divertissements a chanteclair fjt a,Shopping - Entertainment Media
maitre de la pub sur mon site,Shopping - Entertainment Media
maître gims spot macon durée du spectacle,Shopping - Entertainment Media
maman vie de famille droits de la famille enregistrement et la publicite du pacs,Shopping - Entertainment Media
marche de noel divertissements pub s t v niger,Shopping - Entertainment Media
medias de masse et audiovisuel,Shopping - Entertainment Media
nantes divertissements,Shopping - Entertainment Media
nantes guide salle de spectacle salle bonnaire,Shopping - Entertainment Media
nantes notre dame des landes une pub pour l aeroport fait polemique,Shopping - Entertainment Media
naouri page tarifs medias publications,Shopping - Entertainment Media
naouri page tarifs medias publications tarifs tarifs indicatifs,Shopping - Entertainment Media
napolitain detente napolitain publicite laissez vous aller gourmandise,Shopping - Entertainment Media
napster itunes et la publicite pour le pp actualite,Shopping - Entertainment Media
nav art collection affiches f publicite parfum,Shopping - Entertainment Media
pas d'autres spectacles prévus,Shopping - Entertainment Media
pas de calais mont bernanchon agenda culturel spectacle danse traditionnelle monde n l,Shopping - Entertainment Media
Pas de Pub Internet Explorer,Shopping - Entertainment Media
pas de pub merci,Shopping - Entertainment Media
pascal obispo nouveau spectacle,Shopping - Entertainment Media
pascale dans les medias,Shopping - Entertainment Media
passer a la tv pour une publicite,Shopping - Entertainment Media
petites annonces chaines hifi chaine pionner annonce,Shopping - Entertainment Media
portail conseil bons gestes publicite voiture,Shopping - Entertainment Media
portrait satirique d'une personne victime de la publicité,Shopping - Entertainment Media
portugal campagne publicite mcdonalds produits locaux,Shopping - Entertainment Media
quand une pub est intelligente et feministe,Shopping - Entertainment Media
quatre chiffres qui montrent la descente aux enfers de la classe moyenne americaine the anti media,Shopping - Entertainment Media
que dit la loi ce que dit la loi en matiere de tabac tabac et publicite index,Shopping - Entertainment Media
que faire avec des enceintes de chaine hifi,Shopping - Entertainment Media
quel but pour la publicité Evian,Shopping - Entertainment Media
quel est la comédienne qui joue dans la publicité opel corsa play,Shopping - Entertainment Media
Quel sont les sorte de jeux et de divertissements,Shopping - Entertainment Media
quelle chaine hifi acheter en 2016,Shopping - Entertainment Media
quelle est meilleure chaine hifi,Shopping - Entertainment Media
restauration plv publicite produit friterie restauration,Shopping - Entertainment Media
resultat annonces,Shopping - Entertainment Media
rigolus le meilleur du divertissement,Shopping - Entertainment Media
rocamadour sortir divertissement sorties,Shopping - Entertainment Media
services en ligne agenda spectacle accueil de jour,Shopping - Entertainment Media
services en ligne mes demarches pre reservation spectacles,Shopping - Entertainment Media
services en ligne mes demarches pre reservation spectacles pre reservations avril,Shopping - Entertainment Media
services pub free aspx,Shopping - Entertainment Media
shopping chaines hifi mcr bleu turquoise,Shopping - Entertainment Media
shopping star hifi numerique chaines hifi chaine avec lecteur cd de star,Shopping - Entertainment Media
soldes chaines hifi,Shopping - Entertainment Media
t un bon film a suggerer pour une soiree cinema a la maison,Shopping - Entertainment Media
tablature mai lan easy musique de la pub sfr,Shopping - Entertainment Media
tablature publicite decathlon,Shopping - Entertainment Media
tablature publicite groupama,Shopping - Entertainment Media
tablature publicite schweppes,Shopping - Entertainment Media
tablature tv cinema pub dueling banjosb o du film delivrance,Shopping - Entertainment Media
tablature tv cinema pub musclor et les maitres de lunivers,Shopping - Entertainment Media
tablature tv cinema pub un homme et une femme francis lai,Shopping - Entertainment Media
tablatures categorie tv cinema pub artistes artistes en b,Shopping - Entertainment Media
tableau acrylique mix media poupee au printemps,Shopping - Entertainment Media
tableau boite et ardoise deco ancienne pub pour du chocolat,Shopping - Entertainment Media
tableau de bord annonce tarifs,Shopping - Entertainment Media
tableau hypnotique pub perrier,Shopping - Entertainment Media
tableau mix media autre modele,Shopping - Entertainment Media
tag canal plus gratuit,Shopping - Entertainment Media
tunisie medias top de lemission andi mankolek,Shopping - Entertainment Media
tutoriels comment photographier les concerts et spectacles,Shopping - Entertainment Media
v la haye fouassiere c pense fute services c information medias c radio,Shopping - Entertainment Media
v le cannet c pense fute services c information medias c radio c radio locale kiss fm fm cannes fm nice,Shopping - Entertainment Media
vivre au pays se divertir les lieux de diffusion culturelle les salles de spectacle,Shopping - Entertainment Media
vivre mieux sans croissance propositions fr pub,Shopping - Entertainment Media
viz media announces viz productions,Shopping - Entertainment Media
vlc ecouter radios francaisies,Shopping - Entertainment Media
voir canal plus a la demande avec free,Shopping - Entertainment Media
voir canal plus en direct gratuit,Shopping - Entertainment Media
28 coffret cadeaux de naissance fille,Shopping - Freebies
3 mois offerts sur l abonnement homelive,Shopping - Freebies
9 mois frais d envoi offert,Shopping - Freebies
abonnement internet bbox mois offerts,Shopping - Freebies
accessoires de pin ups coffrets cadeaux,Shopping - Freebies
accessoires pour le vin coffrets cadeaux,Shopping - Freebies
accueil bons cadeaux,Shopping - Freebies
amiens bieres paniers cadeaux,Shopping - Freebies
amis avantage tarifs,Shopping - Freebies
ampar les avantages lies ladhesion,Shopping - Freebies
animations a la commanderie via les coffrets cadeaux smartbox,Shopping - Freebies
annonce j achete cheque cadeau ticket restaurant cheques v,Shopping - Freebies
annonce parfum femme lot d echantillon de parfums,Shopping - Freebies
archives bon plan brandt mois de tablettes offerts,Shopping - Freebies
archives bon plan vedette mois de lessive offerts,Shopping - Freebies
article les coffrets cadeaux sur beautyshop,Shopping - Freebies
article les echantillons et produits gratuit de ce mois ci,Shopping - Freebies
article les echantillons et produits gratuits du mois de juillet,Shopping - Freebies
article livre d or original et interactif grace aux qr codes code promo,Shopping - Freebies
article mini kit de rouge et de creme en freebie,Shopping - Freebies
article mon kit fabulous en freebie,Shopping - Freebies
article noel et fetes idees cadeaux cheques bons cadeau peche en bretagne,Shopping - Freebies
article nouveau code promo,Shopping - Freebies
article pensez au cheque cadeau partylite,Shopping - Freebies
assurance 3 mois offert,Shopping - Freebies
assurance auto 2 mois offert,Shopping - Freebies
bienvenue coffret cadeau wonderbox smartbox bon,Shopping - Freebies
bijoux fournisseur emballage cadeau,Shopping - Freebies
bijoux offert échantillon,Shopping - Freebies
bijouxboutik lot au choix i,Shopping - Freebies
billet cheque cadeau,Shopping - Freebies
bnp 3 mois assurance habitation offerts,Shopping - Freebies
bon cadeau idee cadeau original accepter cheques cadeau cadhoc,Shopping - Freebies
bon plan mois offerts sur forfaits sosh pour euro groupon,Shopping - Freebies
bon plan sosh mois offert,Shopping - Freebies
bon plans un jeu xbox one achete un jeu offert pendant mois,Shopping - Freebies
c e les produits au choix,Shopping - Freebies
c enfant coffret cadeau enfant,Shopping - Freebies
c fetes cadeaux coffrets de naissance,Shopping - Freebies
c'est quoi le cheque cadeau smartbox,Shopping - Freebies
center parc code promo,Shopping - Freebies
ces cartes pour accompagner des bons cadeaux,Shopping - Freebies
cest quoi un code promo,Shopping - Freebies
cf cheque cadeau euros,Shopping - Freebies
champagne alain david coffret cadeaux,Shopping - Freebies
chanaz bons cadeaux,Shopping - Freebies
chassez discount code promo,Shopping - Freebies
chaussure online code promo,Shopping - Freebies
cheque bon cadeau,Shopping - Freebies
cheque bon cadeau voucher golf,Shopping - Freebies
code promo coyote code promo coyote mois abonnement offert cadeau,Shopping - Freebies
concours gagner cheque cadeau marionnaud,Shopping - Freebies
concours gagnez de bons cadeaux avec athleticum,Shopping - Freebies
concours gagnez un coffret cadeau bongo sejour nature,Shopping - Freebies
concours grand jeu gratuit norauto a gagner cartes de carburant total jubileo de euros,Shopping - Freebies
concours gratuits carrefour participez au grand jeu,Shopping - Freebies
concours gratuits cheques cadeaux de e chez guy degrenne a gagner,Shopping - Freebies
concours gratuits coffret cadeau mms a gagner chaque mois,Shopping - Freebies
concours gratuits coffrets cadeaux smartbox bien etre a gagner,Shopping - Freebies
concours gratuits concours alimentation des packs kinder surprise et des jeux collector a gagner,Shopping - Freebies
concours gratuits concours alimentation grand jeu concours lesieur,Shopping - Freebies
concours gratuits concours alimentation jeu croustilles box de belin,Shopping - Freebies
concours gratuits concours argent des cheques cadeau de e a gagner sur amazon,Shopping - Freebies
concours gratuits concours argent e de cheques cadeaux vos achats de bricolage a gagner,Shopping - Freebies
concours gratuits concours beaute concours sephora coffrets cadeaux a gagner,Shopping - Freebies
concours gratuits concours beaute e de cheque cadeau marionnaud a gagner,Shopping - Freebies
