0 blue jeans,Shopping - Apparel
details grossiste destockmarques,Shopping - Mass Merchants & Department Stores
details grossiste fk tex sarl destockmode,Shopping - Mass Merchants & Department Stores
details grossiste grandes tailles neslay paris,Shopping - Mass Merchants & Department Stores
details le centre commercial de lyon confluence,Shopping - Mass Merchants & Department Stores
details remise en peinture de la facade bardage du centre commercial carrefour market a riorges,Shopping - Mass Merchants & Department Stores
details restaurant asiatique avec buffet a volonte centre commercial la valentine,Shopping - Mass Merchants & Department Stores
devener testeur de grande surfaces alimentaire,Shopping - Mass Merchants & Department Stores
diego suarez antsiranana produits gourmands vins grande surface generaliste supermarche score,Shopping - Mass Merchants & Department Stores
directeur / directrice de magasin à grande surface,Shopping - Mass Merchants & Department Stores
directeur de magasin à grande surface,Shopping - Mass Merchants & Department Stores
directeur de magasin grande distribution,Shopping - Mass Merchants & Department Stores
directrice de magasin a grande surface,Shopping - Mass Merchants & Department Stores
discussion achat vetements en gros bangkok d,Shopping - Mass Merchants & Department Stores
enquête centre commercial,Shopping - Mass Merchants & Department Stores
enseignes centre commercial val d yerres,Shopping - Mass Merchants & Department Stores
entre centre ville et zone commerciale,Shopping - Mass Merchants & Department Stores
entreprise grande surface,Shopping - Mass Merchants & Department Stores
entreprise grandes surfaces leclerc reste lenseigne moins chere,Shopping - Mass Merchants & Department Stores
entreprise grossiste boisson chai cotentin,Shopping - Mass Merchants & Department Stores
entreprises allemagne grossiste fourniture fleuristes,Shopping - Mass Merchants & Department Stores
entreprises fruits vente en gros,Shopping - Mass Merchants & Department Stores
entreprises italie florence et toscane détaillant grande distribution,Shopping - Mass Merchants & Department Stores
flash actu filwww bali un incendie ravage un centre commercial,Shopping - Mass Merchants & Department Stores
flash actualite economie jouets magasins specialises grande distribution internet le consommateur a le choix,Shopping - Mass Merchants & Department Stores
flash actualite monde bresil le malaise social s invite au centre commercial,Shopping - Mass Merchants & Department Stores
flers fabricant et grossiste de parfumerie et cosmetiques page,Shopping - Mass Merchants & Department Stores
fleurs plantes grossiste malville,Shopping - Mass Merchants & Department Stores
foire au vins en grandes surfaces,Shopping - Mass Merchants & Department Stores
fr fr grossiste informatique c,Shopping - Mass Merchants & Department Stores
fr fr pour la salle de bains collections grandes surfaces de bricolage,Shopping - Mass Merchants & Department Stores
fr fr sols pour les particuliers trouver un grossiste,Shopping - Mass Merchants & Department Stores
fr galerie commerciale noumé centre,Shopping - Mass Merchants & Department Stores
fr game centre commercial de tir,Shopping - Mass Merchants & Department Stores
fr grandes tailles grossiste vetement femme,Shopping - Mass Merchants & Department Stores
fr grossiste accessoires,Shopping - Mass Merchants & Department Stores
fr grossiste accessoires cheveux,Shopping - Mass Merchants & Department Stores
fr s negoce grande distribution detaillants v de panne be,Shopping - Mass Merchants & Department Stores
haut rhin grossistes en fleurs et plantes,Shopping - Mass Merchants & Department Stores
haute savoie ils avaient incendie le centre commercial le warens,Shopping - Mass Merchants & Department Stores
haute savoie le futur centre commercial attaque en refere,Shopping - Mass Merchants & Department Stores
haute savoie nouveau centre commercial,Shopping - Mass Merchants & Department Stores
havaianas grossiste a marseille,Shopping - Mass Merchants & Department Stores
hendaye hypermarche grandes surfaces supermarche hard discount page,Shopping - Mass Merchants & Department Stores
herault centre commerciaux et grand magasin,Shopping - Mass Merchants & Department Stores
herault grossistes en produits menagers,Shopping - Mass Merchants & Department Stores
herault vie pratique grossiste,Shopping - Mass Merchants & Department Stores
histoire grand magasin de Nancy,Shopping - Mass Merchants & Department Stores
ile maurice vente de tissus unis en gros,Shopping - Mass Merchants & Department Stores
itm rare boite louvre bebe pour poupee jumeau des grands magasins du louvre,Shopping - Mass Merchants & Department Stores
itm remarquable cpa lyon les grands magasins de nouveautes,Shopping - Mass Merchants & Department Stores
ivry centre commercial,Shopping - Mass Merchants & Department Stores
j ai emmene mon pere au centre commercial l autre jour,Shopping - Mass Merchants & Department Stores
jambon espagnol et grossiste livraison suisse,Shopping - Mass Merchants & Department Stores
je cherche deg grossiste de chaussures a petit prix,Shopping - Mass Merchants & Department Stores
le plus grand centre commercial au,Shopping - Mass Merchants & Department Stores
le plus grand centre commercial de france,Shopping - Mass Merchants & Department Stores
le plus important grossiste de mercerie en FRANCE,Shopping - Mass Merchants & Department Stores
le sdr dans la grande surface,Shopping - Mass Merchants & Department Stores
les annonces liste des annonces grande surface n,Shopping - Mass Merchants & Department Stores
les baumes biofloral grossiste,Shopping - Mass Merchants & Department Stores
les bijoux de sac pompon grossiste bijoux,Shopping - Mass Merchants & Department Stores
les chaussures grossiste chaussures lyon,Shopping - Mass Merchants & Department Stores
les dragees colchiques grossiste de dragees cacher toutes couleurs marseille,Shopping - Mass Merchants & Department Stores
les produits vente en gros,Shopping - Mass Merchants & Department Stores
maison rouge feu vert pour le futur centre commercial,Shopping - Mass Merchants & Department Stores
maisons laffitte le centre commercial vert ouvre ce matin,Shopping - Mass Merchants & Department Stores
majoration heures dimanche grande surface,Shopping - Mass Merchants & Department Stores
mall of istanbul un nouveau centre commercial,Shopping - Mass Merchants & Department Stores
management dossiers noel distribution grands magasins shtml,Shopping - Mass Merchants & Department Stores
manger dans grande surface,Shopping - Mass Merchants & Department Stores
marseille centre commerciaux et grand magasin,Shopping - Mass Merchants & Department Stores
materiauxconstruction detaillant grand laviers,Shopping - Mass Merchants & Department Stores
maurepas centre commercial grand magasin tati,Shopping - Mass Merchants & Department Stores
mbolo le plus grand magasin,Shopping - Mass Merchants & Department Stores
nancy emplois pour un nouveau gros centre commercial a lexy,Shopping - Mass Merchants & Department Stores
nancy le centre commercial saint sebastien de nancy va etre renove,Shopping - Mass Merchants & Department Stores
nancy sephora centre commercial saint sebastien,Shopping - Mass Merchants & Department Stores
nantes centre commerciaux et grand magasin passage pommeraye,Shopping - Mass Merchants & Department Stores
nature decouvertes ouvre son plus grand magasin a paris,Shopping - Mass Merchants & Department Stores
news le plus grand magasin bio du grand geneve,Shopping - Mass Merchants & Department Stores
p detail cougar meilleures ventes sac de golf chine gros,Shopping - Mass Merchants & Department Stores
p ouzbekistan c produits gourmands vins c grande surface generaliste c grand magasin,Shopping - Mass Merchants & Department Stores
pas de calais grossistes en fleurs et plantes,Shopping - Mass Merchants & Department Stores
pastis comparateur de prix grands magasins,Shopping - Mass Merchants & Department Stores
patrimoine savoir faire grand centre commercial rue des poilus chalon sur saone,Shopping - Mass Merchants & Department Stores
pau centre commercial pau bosquet cours bosquet,Shopping - Mass Merchants & Department Stores
peinture grossiste chambery,Shopping - Mass Merchants & Department Stores
portal ventes privees petits dfauts grandes affaires tablettes prod microsoft surface go,Shopping - Mass Merchants & Department Stores
porte de pantin centre commercial,Shopping - Mass Merchants & Department Stores
portfolio grandes surfaces,Shopping - Mass Merchants & Department Stores
portfolio le nouveau centre commercial de la part dieu de mvrdv a lyon,Shopping - Mass Merchants & Department Stores
pour plus grandes surfaces c,Shopping - Mass Merchants & Department Stores
prix de gros achat en ligne jambon superieur par tranches,Shopping - Mass Merchants & Department Stores
professionnels production fromage achat vente en gros fromagerie,Shopping - Mass Merchants & Department Stores
quartz centre commercial,Shopping - Mass Merchants & Department Stores
quartz villeneuve la garenne centre commercial,Shopping - Mass Merchants & Department Stores
que choisir compare les prix des grandes surfaces du val de marne,Shopping - Mass Merchants & Department Stores
que deviennent les produits perimes des grandes surfaces,Shopping - Mass Merchants & Department Stores
quel est la plus grande surface du magasin Caroll à paris,Shopping - Mass Merchants & Department Stores
quel est plus grand centre commercial toulouse,Shopping - Mass Merchants & Department Stores
quelle grande surface a puilacher,Shopping - Mass Merchants & Department Stores
r hawai c produits gourmands vins c grande surface generaliste,Shopping - Mass Merchants & Department Stores
resultat prix tabac presse centre commercial champagne,Shopping - Mass Merchants & Department Stores
resultats pmu prix centre commercial champagne,Shopping - Mass Merchants & Department Stores
reze hypermarche grandes surfaces supermarche hard discount lidl,Shopping - Mass Merchants & Department Stores
rideau vente en gros,Shopping - Mass Merchants & Department Stores
rideaux tonelle en grande surface,Shopping - Mass Merchants & Department Stores
rike paroles les oiseaux dans les grands magasins,Shopping - Mass Merchants & Department Stores
risque d'attentat grands magasins samedi 12 mars,Shopping - Mass Merchants & Department Stores
s negoce grande distribution detaillants,Shopping - Mass Merchants & Department Stores
s negoce grande distribution detaillants d charente fr,Shopping - Mass Merchants & Department Stores
s negoce grande distribution detaillants v capdenac gare fr,Shopping - Mass Merchants & Department Stores
sac de couchage achat en gros,Shopping - Mass Merchants & Department Stores
search achat vaisselle en gros,Shopping - Mass Merchants & Department Stores
services entretien de magasins grandes surfaces usines,Shopping - Mass Merchants & Department Stores
setif grande surface,Shopping - Mass Merchants & Department Stores
seville centre commercial,Shopping - Mass Merchants & Department Stores
sevran sevran c etait la fete au centre commercial,Shopping - Mass Merchants & Department Stores
shampoing bleu grande surface,Shopping - Mass Merchants & Department Stores
shds vente gros pour paque,Shopping - Mass Merchants & Department Stores
shopping grands magasins et centres commerciaux,Shopping - Mass Merchants & Department Stores
shopping grands magasins et centres commerciaux galeries lafayette bron,Shopping - Mass Merchants & Department Stores
t achat munition lr en gros a petit prix,Shopping - Mass Merchants & Department Stores
tag achat bonbon en gros paris,Shopping - Mass Merchants & Department Stores
tag centre commercial beaugrenelle,Shopping - Mass Merchants & Department Stores
tag grandes surfaces,Shopping - Mass Merchants & Department Stores
tag liste des commerces centre commercial barentin,Shopping - Mass Merchants & Department Stores
tags supermarches,Shopping - Mass Merchants & Department Stores
tarif parking centre commercial beaulieu nantes,Shopping - Mass Merchants & Department Stores
tarif sucre de canne bio achat en gros,Shopping - Mass Merchants & Department Stores
tf vente en gros nike chaussures pas cher,Shopping - Mass Merchants & Department Stores
thematique hypermarches et grands magasins,Shopping - Mass Merchants & Department Stores
turbosieste au fast food et au centre commercial,Shopping - Mass Merchants & Department Stores
u centre commercial le grau du roi,Shopping - Mass Merchants & Department Stores
ULTIM centre commercial Géant Casino,Shopping - Mass Merchants & Department Stores
un journaliste teste dentrer avec une arme dans les grands magasins parisiens,Shopping - Mass Merchants & Department Stores
une aucune malveillance se defendent les grandes surfaces,Shopping - Mass Merchants & Department Stores
v kinshasa c produits gourmands vins c grande surface generaliste c grand magasin,Shopping - Mass Merchants & Department Stores
v la valette du var c centre commercial et grand magasin,Shopping - Mass Merchants & Department Stores
wholesale vente en gros bijoux perle pas cher,Shopping - Mass Merchants & Department Stores
wholesale vente en gros boule japonaise blanche,Shopping - Mass Merchants & Department Stores
1 biberon avent classic,Shopping - Parenting Products
1 biberon avent natural,Shopping - Parenting Products
1 biberon bec doseur,Shopping - Parenting Products
10 égoute biberon,Shopping - Parenting Products
10 preparateur de biberon,Shopping - Parenting Products
2 Babyphone vidéo,Shopping - Parenting Products
achat emetteur recepteur de surveillance bebe babyphone babytalker,Shopping - Parenting Products
achat surveillance babyphone ecoute bebe philips sbc sc un bijou de technologie,Shopping - Parenting Products
acheter c babyphone bleu rose camera ecran,Shopping - Parenting Products
acheter c couches bebe en vrac,Shopping - Parenting Products
acheter c couches bebe pampers grossiste,Shopping - Parenting Products
acheter c couches et lingettes bebe,Shopping - Parenting Products
acheter c couches huggies bebe,Shopping - Parenting Products
af babyphone avec camera,Shopping - Parenting Products
animalerie anneau balancoire en bois p,Shopping - Parenting Products
animalerie balancoire bois p,Shopping - Parenting Products
animalerie balancoire en bois pour oiseaux p,Shopping - Parenting Products
animalerie balancoire perchoir sablee p,Shopping - Parenting Products
animalerie balancoire trapeze en bois trixie f tri,Shopping - Parenting Products
animalerie biberon avec remplissage par le dessus rouge p,Shopping - Parenting Products
animalerie biberon en verre pour petits animaux p,Shopping - Parenting Products
animalerie biberon pour rongeurs p,Shopping - Parenting Products
annonce ancienne chaise haute enfant en bois,Shopping - Parenting Products
annonce au bon coin chaise haute,Shopping - Parenting Products
annonce baignoire bebe,Shopping - Parenting Products
annonce puericulture ales baignoire siege bebe de bain mariejoele,Shopping - Parenting Products
annonce puericulture avesnes sur helpe baignoire bebe aubert concept delfw,Shopping - Parenting Products
annonce puericulture lille baignoire table a langer bebe sur roulettes urgenthellemmes,Shopping - Parenting Products
annonce puericulture neauphle le chateau baignoire bebe blanche okbaby julie,Shopping - Parenting Products
annonces enfants bebes baignoire et anneau de bain pour bebe ales akbebac,Shopping - Parenting Products
annonces enfants bebes grande baignoire bebe saint martin d uriage akbebac,Shopping - Parenting Products
annonces pour l enfant couches bebe pampers original,Shopping - Parenting Products
annonces tout pour bebe c couches bebe a prix d usine q,Shopping - Parenting Products
article l equipement du jour le chauffe biberon,Shopping - Parenting Products
article les biberons paris paris en vitrine,Shopping - Parenting Products
avis babyphone dect scd avent philips,Shopping - Parenting Products
avis babyphone digital et tapis detecteur de mouvement tomy,Shopping - Parenting Products
avis babyphone sans onde,Shopping - Parenting Products
avis consommateur babymoov babyphone visio care,Shopping - Parenting Products
avis des maman babyphone alcatel link 100 comment oter la fonction vox,Shopping - Parenting Products
bio bebe materiel puericulture bio bio couches lavables jetables,Shopping - Parenting Products
bio bebes enfants mamans couches jetables ecologiques,Shopping - Parenting Products
bio bebes enfants mamans petits pots sucres,Shopping - Parenting Products
biscuits et cereales petit pot bio pomme vanille g,Shopping - Parenting Products
bledina mon 1er petit pot,Shopping - Parenting Products
bons plans babyphone numrique motorola,Shopping - Parenting Products
bons plans offre remboursement babyphones vtech,Shopping - Parenting Products
books livre sur l'education des enfants,Shopping - Parenting Products
boutique fr babyphone premium care babymoov a,Shopping - Parenting Products
boutique produits categorie enfants education,Shopping - Parenting Products
camera babyphone fleur,Shopping - Parenting Products
camera et emetteur additionnel pour babyphone,Shopping - Parenting Products
camera supplementaire pour babyphone babycam scd aav,Shopping - Parenting Products
ce fr product camera embarquee oregon scientific camera pour enfants gecko hd etanche,Shopping - Parenting Products
ce fr product fil de cblage liy conrad sh x mm rouge m;jsessionid=bebeea astpcen,Shopping - Parenting Products
ce fr product miroir sur pince bebe herbert richter,Shopping - Parenting Products
Ceinture securite chaise haute,Shopping - Parenting Products
chaise balançoire bébé,Shopping - Parenting Products
chaise balancoire suspendue,Shopping - Parenting Products
chaise suspendu balancoire,Shopping - Parenting Products
chambre et deco rangements pour enfant of pots a crayons avec petit support velcro wesco,Shopping - Parenting Products
deco maison pratique feng shui optimiser une chambre parentale,Shopping - Parenting Products
enfant 15 kg poussette,Shopping - Parenting Products
enfant poussette promenade terrain blancs dp bnwkkv ref=pd sim sbs,Shopping - Parenting Products
enfant puericulture ile de france q poussette,Shopping - Parenting Products
Equipement bébé baignoire sur pieds,Shopping - Parenting Products
Equipement bébé couches ecologique,Shopping - Parenting Products
Equipement bébé couches pampers,Shopping - Parenting Products
Equipement bébé reducteur de baignoire,Shopping - Parenting Products
f lotions cremes et petits pots,Shopping - Parenting Products
forum bebes f bebes quel babyphone choisir,Shopping - Parenting Products
fr fr poussettes,Shopping - Parenting Products
fr fr poussettes accessoires aspx,Shopping - Parenting Products
fr guide bebe mon bebe developpement psychologie de bebe eduquer bebe education comment poser des limites aux enfants,Shopping - Parenting Products
itm babyphone motorola mbp video numerique ecran lcd couleur pouce nouveau,Shopping - Parenting Products
itm babyphone video lcd pouces surveillance distance bebe babycam vision nocturne,Shopping - Parenting Products
itm babyphone video surveillance vision nocturne sans fil,Shopping - Parenting Products
itm playmobil chambre a coucher parents theme boite fermee,Shopping - Parenting Products
itm playmobil maison chambre enfant et chambre parent avec boite neuf,Shopping - Parenting Products
le prix d'une poussette vélo,Shopping - Parenting Products
Le prix de poussette à l'oculaire un illuminent,Shopping - Parenting Products
Le prix des poussette à lauclair un HI mean,Shopping - Parenting Products
le prix des poussette de bébé a carrefour en photo,Shopping - Parenting Products
leroy merlin balancoire,Shopping - Parenting Products
leroy merlin produits balancoire,Shopping - Parenting Products
les balançoires à bascule,Shopping - Parenting Products
les couches lavables ca change tout ! bebe produit couche lavable,Shopping - Parenting Products
les couches lavables les couches lavables bebes les accesoires,Shopping - Parenting Products
les couches pour bebe,Shopping - Parenting Products
les meilleurs babyphone video,Shopping - Parenting Products
les meilleurs babyphones camera,Shopping - Parenting Products
les meilleurs couches pour bébé,Shopping - Parenting Products
liste produit idx mot babyphone longue portee liste produit,Shopping - Parenting Products
livre cahier de vacances de la e la e,Shopping - Parenting Products
livre cahier de vacances de la gs au cp,Shopping - Parenting Products
livres cahier de vacances du ce au cm,Shopping - Parenting Products
maison jardin plein air balancelle balancoire fauteuil acier ressine rotin f hom,Shopping - Parenting Products
maison jardin plein air balancelle balancoire hamac f hom,Shopping - Parenting Products
maison meubles mobilier petit pot minni mouse f dis,Shopping - Parenting Products
maison r petit pot en plastique,Shopping - Parenting Products
maison rangement cabas et poussettes l,Shopping - Parenting Products
meilleur babyphone 2015 AS,Shopping - Parenting Products
meilleur babyphone video 2015 SC,Shopping - Parenting Products
meilleure baignoire bebe,Shopping - Parenting Products
meilleure baignoire sur pied bebe,Shopping - Parenting Products
n scolaire et soutien scolaire cahiers de vacances chouette primaire,Shopping - Parenting Products
n scolaire et soutien scolaire cahiers de vacances passeport,Shopping - Parenting Products
nav achat jeux loisirs poussette marque chicco chicco,Shopping - Parenting Products
nav achat mp petit electromenager puericulture biberonnerie chauffe biberons babymoov chauffe biberon autonome de voyage mk,Shopping - Parenting Products
nav achat mp petit electromenager puericulture biberonnerie chauffe biberons babysun nursery chauffe biberon nomade autonome mk,Shopping - Parenting Products
nav achat mp petit electromenager puericulture biberonnerie chauffe biberons iiamo cartouches chauffantes iiamo warm mk,Shopping - Parenting Products
nav achat mp petit electromenager puericulture sommeil ecoute bebe babymoov babyphone premium care mk,Shopping - Parenting Products
nav achat mp petit electromenager puericulture sommeil ecoute bebe beurer babyphone babyphone video couleur by mk,Shopping - Parenting Products
nav achat mp petit electromenager puericulture sommeil ecoute bebe elro babyphone interphone sens elro elr ib mk,Shopping - Parenting Products
nav achat mp petit electromenager puericulture sommeil ecoute bebe sanitas babyphone video sby mk,Shopping - Parenting Products
nav achat mp puericulture biberon et accessoires egouttoir biberon badabulle seche biberons biberons rouge et vert mk,Shopping - Parenting Products
nav achat petit electromenager puericulture bebe mange chauffe biberons beaba bib expresso rouge,Shopping - Parenting Products
nav achat petit electromenager puericulture bebe mange chauffe biberons beaba bib second control,Shopping - Parenting Products
nav achat petit electromenager puericulture bebe mange chauffe biberons beaba bibcar,Shopping - Parenting Products
nav achat petit electromenager puericulture bebe mange chauffe biberons philips scf,Shopping - Parenting Products
nav achat petit electromenager puericulture biberonnerie chauffe biberons beaba bib bain marie gipsy,Shopping - Parenting Products
nav achat petit electromenager puericulture biberonnerie chauffe biberons beaba bib secondes gipsy,Shopping - Parenting Products
pas cher poussettes accessoires,Shopping - Parenting Products
passeport cahier de vacances,Shopping - Parenting Products
petite annonce jouets jeux occasion achat vente babyphone baby foot ref,Shopping - Parenting Products
petite annonce jouets jeux occasion achat vente babyphone babyfoot bonzini veritable ref,Shopping - Parenting Products
petite annonce jouets jeux occasion achat vente babyphone babyfoot de cafe bonzini b occasion ref,Shopping - Parenting Products
porte bebe poussette,Shopping - Parenting Products
porte gobelet pour poussette stokke,Shopping - Parenting Products
porte parapluie pour poussette decathlon,Shopping - Parenting Products
porte parapluie poussette universel,Shopping - Parenting Products
portet accessoires poussette hiver,Shopping - Parenting Products
pot 60 cm petit prix,Shopping - Parenting Products
pret a porter bebe puericulture angelcare poubelle a couches f ang,Shopping - Parenting Products
pret a porter bebe puericulture enfants dessin jouet multifonctionnel education f mp,Shopping - Parenting Products
quel controle parental pour mobile android,Shopping - Parenting Products
quel gonfleur pour baignoire bebe,Shopping - Parenting Products
Quelle baignoire pour bebe,Shopping - Parenting Products
rangement couches bebe s,Shopping - Parenting Products
restaurant spectacle enfant val de marne,Shopping - Parenting Products
restaurants parents choice baby food,Shopping - Parenting Products
restaurants pour enfants a paris,Shopping - Parenting Products
rondin de bois pour balancoire,Shopping - Parenting Products
services enfance offre bebe bus,Shopping - Parenting Products
shopping deco chaise de bar hauteur cm,Shopping - Parenting Products
shopping deco chaise haute tripp trapp page,Shopping - Parenting Products
shopping produit bambikid chaise haute fixe sixties parme,Shopping - Parenting Products
shopping produit bambikid chaise haute telescopique leon emilie,Shopping - Parenting Products
shopping produit bambikid chaise haute telescopique pomme rouge,Shopping - Parenting Products
shopping produit bebe jou support de bain pour baignoire bleu hauteur cm,Shopping - Parenting Products
shopping produit bebe style pivotant chaise haute multi hauteur enfant,Shopping - Parenting Products
shopping produit beurer babyphone portee bracelet pratique pour parents m,Shopping - Parenting Products
shopping produit beurer ecoute bebe by babyphone numerique de surveillance video gris blanc,Shopping - Parenting Products
