Pirmasenser Zeitung,News - Local News
Karikaturen Haitzinger Rhein-Zeitung,News - Local News
Rhein-Zeitung haitzinger,News - Local News
afd rheinische post,News - Local News
analysen artikel rheinische post juengere verlangen mehr unterstuetzung rentendebatte,News - Local News
arnstadt thüringer allgemeine,News - Local News
bekanntschaften thüringer allgemeine,News - Local News
nachrichten laufende fusionskontrollverfahren medien holding nord mittelb erwerb wes vermoegensteile uetersener nachrichten u a,News - Local News
sub Lokale Nachrichten aus dem Landkreis Coburg,News - Local News
sub Lokale Nachrichten aus dem Landkreis Kronach,News - Local News
news pressestimme frankfurter neue presse zu bahn,News - Local News
osterbrunnen 2016 gewinner neue presse coburg,News - Local News
redaktion neue presse kronach.de,News - Local News
sub Neue Presse Coburg,News - Local News
sub neue presse haßberge,News - Local News
verzeichnis neue ruhr zeitung neue rhein zeitung,News - Local News
nürnberger nachrichten 18.05.1966,News - Local News
nürnberger nachrichten django asül in feucht,News - Local News
kreuzworträtsel rhein-zeitung,News - Local News
rhein-zeitung archiv hells angels,News - Local News
artikel konstantin wecker in der rheinischen post,News - Local News
barmer gek rheinische post,News - Local News
der ungarische botschafter laesst im interview mit der rheinischen post einen blick,News - Local News
epaper rheinische post duesseldorf,News - Local News
kleinanzeigen bilder poster rheinische woerter a,News - Local News
kleinanzeigen gemaelde kunstblaetter der rheinischen post a,News - Local News
sanktionen rheinische post Linke 2016,News - Local News
Traueranzeigen rheinische post,News - Local News
verzeichnis rheinische post,News - Local News
archiv thüringer allgemeine 2008,News - Local News
danksagungen trauer zeitung heilbronner Stimme,News - Local News
die heilbronner stimme,News - Local News
lisette keller heilbronner stimme,News - Local News
afd bild zeitung kampagne n,News - National News
aktuelle bild zeitung titelseite,News - National News
angela merkel bild zeitung,News - National News
arbeitsvertrag befristet schwanger bild zeitung,News - National News
ashley graham Bild Zeitung,News - National News
atze schröder foto ohne perücke in bild zeitung,News - National News
atze schröder ohne perücke bild zeitung,News - National News
aufbau der bild zeitung,News - National News
bachelor 2016 bild zeitung noch zusammen,News - National News
bartels bild zeitung,News - National News
berichte bild zeitung top,News - National News
bild des tages bild zeitung,News - National News
bilder rosenmontagszug Düsseldorf 13.03.2016 zeitung,News - National News
bildzeitung von heute bild zeitung von heute,News - National News
busenblitzer bild zeitung gntm,News - National News
busenblitzer germany next topmodel Bild Zeitung,News - National News
caren christiansen bild zeitung,News - National News
daniela katzenberger nackt bild zeitung,News - National News
der spiegel ist die bild-zeitung der intellektuellen,News - National News
Die Bild Zeitung,News - National News
die bild zeitung busenblitzer gntm,News - National News
die bild zeitung heute,News - National News
Erdogan-Satire bild zeitung,News - National News
falsche angaben hier stellt die bild zeitung klar dass sie bei kay one etwas falsch gemacht haben,News - National News
familie kinder debatte um rechtschreibung man kann auch mit der bild zeitung das lesen beibringen,News - National News
farid bang bild zeitung,News - National News
fatih alkan bild zeitung,News - National News
fc st pauli boykottiert die fluchtlingsaktion der bild zeitung n,News - National News
film fernsehen erledigt bild zeitung,News - National News
fotografen der bild zeitung,News - National News
frage ich suche eine gute deutsches zeitung zum lesen kein bild oae allgemeinwissen nachrichten,News - National News
frage ist die bild zeitung eher rechts oder links,News - National News
frage ist die bild zeitung serioes,News - National News
frage stimmt das ueber die bild zeitung,News - National News
frage suche archiv mit den titelbildern der bild zeitung,News - National News
frage suche einen artikel der bild zeitung aus dem jahre,News - National News
frage unterschied zwischen bild zeitung und nrz,News - National News
frage warum hat die bild zeitung einen so schlechten ruf,News - National News
frage wie gefaellt euch die bild zeitung,News - National News
frage wo kann ich aeltere ausgaben der bild zeitung kaufen,News - National News
germanwings opfer bild zeitung,News - National News
germany next topmodel kim 2016 bild zeitung,News - National News
germanys next topmodel bild zeitung busen blitzer,News - National News
Girl Des Tages Bild Zeitung,News - National News
heutige bild zeitung lesen,News - National News
jahreshoroskop wassermann aus der bild zeitung,News - National News
kann man die bild zeitung abonnieren,News - National News
kultur gesellschaft bild zeitung druckt vergewaltigungswitz a,News - National News
newspapers bild zeitung august,News - National News
rhein zeitung historische bilder,News - National News
schlagzeilen bild zeitung was ist mit steffan raab passiert,News - National News
Thüringer Zeitung Bilder Merkers,News - National News
titelbild bild zeitung heute,News - National News
unterschied zwischen zeitung und bild,News - National News
wormser zeitung bilder flugplatzbrand,News - National News
zeitung bild,News - National News
zeitung bild am sonntag,News - National News
aufbau zeitung die zeit,News - National News
die zeit zeitung bewertung,News - National News
redaktionsschluss die zeit nach zeitung dp,News - National News
Zeitung Die Zeit,News - National News
Focus Online,News - National News
focus online flüchtlinge,News - National News
frage ist focus online ein serioese nachricht anbieter,News - National News
politik deutschland spiegel online focus online und faznet nicht erreichbar a,News - National News
schlagwoerter organisationen f focus online,News - National News
technik internet focus online platz google news,News - National News
www landeszeitung de blog nachrichten sport belgiens nationalelf sagt auch training am mittwoch ab,News - National News
aktuelles omnibus news touristik nachrichten man schmiergeldaffaere weitet sich aus spiegel online berichtet bereits von me,News - National News
app spiegel online kostenlos AS,News - National News
bruessel spiegel online,News - National News
de spiegel online kommentare,News - National News
der faktencheck von spiegel online,News - National News
forum schnittmengendiagramm spiegel online,News - National News
Heimerziehung in der DDR in der Spiegel Online,News - National News
herrschinger spiegel online,News - National News
kultur musik spiegel online zeigt michael kiwanuka konzert im livestream a,News - National News
nachrichten spiegel online und focus online nicht erreichbar,News - National News
nachrichten spiegel online vw vorstände wollen trotz krise boni finance,News - National News
panorama gesellschaft die besten gruseligen kindersprueche von spiegel online lesern a,News - National News
panorama gesellschaft leser von spiegel online beantworten die frage was heimat ist a,News - National News
politik debatte spiegel online debatte der unvermeidliche krieg a,News - National News
politik deutschland themen spiegel online,News - National News
pressemeldungen ueber mazda modelle cx test bei spiegel online,News - National News
recht spiegel online wal mart droht,News - National News
reise aktuell reise weltkarte auf spiegel online die besten tipps der leser a,News - National News
reise aktuell spiegel online startet interaktive weltkarte mit hunderten reisetipps a,News - National News
reise fernweh reise geheimtipps auf der spiegel online weltkarte a,News - National News
reise fernweh spiegel online leserfotos mit instagram um die welt a,News - National News
spam satire spiegel online erdogan boehmermann zdf a,News - National News
spam satire spiegel online frauenrechte saudi arabien fahrverbot a,News - National News
spam satire spiegel online genscher mauerfall prager botschaft a,News - National News
spam satire spiegel online landtagswahlen afd kretschmann a,News - National News
spam satire spiegel online landtagswahlen merkel fluechtlinge a,News - National News
technik spiegel online jeder dritte whatsapp nutzer erwaegt anbieter wechsel,News - National News
technik spiegel online smartphone abgabe droht,News - National News
view panama papers weltrangliste der steueroasen spiegel online jpg,News - National News
a rammstein special report by suddeutsche zeitung magazin,News - National News
abfindung fünftelregelung rechner süddeutsche,News - National News
Apostel Paulus süddeutsche Zeitung,News - National News
article suddeutsche zeitung masten im akkord,News - National News
artist emil rau lot vergangenheit gemälde suddeutsche landschaft mit wallfahrtskirche,News - National News
beate wild süddeutsche zeitung,News - National News
board opel adam forum board test presseberichte adam rocks der unrasierte freigeist in der süddeutschen zeitung,News - National News
boerse nachrichten pressestimme suddeutsche zeitung zu briefkastenfirmen,News - National News
boerse nachrichten pressestimme suddeutsche zeitung zu rucktritt des pfarrers von zorneding,News - National News
boerse nachrichten pressestimme suddeutsche zeitung zu volkswagen,News - National News
Burkhard Müller süddeutsche Zeitung,News - National News
i suddeutsche zeitung notruf bnl sueddeutschezeitung,News - National News
i suddeutsche zeitung wie geht s ihm bnl sueddeutschezeitung,News - National News
lisa klose süddeutsche,News - National News
mädchen süddeutsche meisterschaft fußball C juniorinnen,News - National News
mahjong süddeutsche zeitung,News - National News
panama papers süddeutsche zeitung,News - National News
PanamaPapers -Affäre Putins Sprecher entschuldigt sich bei Süddeutscher Zeitung,News - National News
peter haacke süddeutsche,News - National News
Pressestimmen stern süddeutsche Belgien anschlag,News - National News
Putin-Sprecher entschuldigt sich bei der Süddeutschen,News - National News
russland putin und seine freunde bahnchef jakunin verklagt suddeutsche zeitung n,News - National News
soziale ungleichheit süddeutsche zeitung 2016,News - National News
stefan hilscher süddeutsche zeitung,News - National News
suddeutsche kv test,News - National News
suddeutsche zeitung allemand revues internationales,News - National News
thema suddeutsche zeitung,News - National News
frage wie ist die aktuelle cannabis politik in deutschland was gibt es neues,News - National News
a syrien konflikt kronen zeitung bilder,News - National News
Angebot Flüge Städte Bild-Zeitung,News - National News
babette döge bild zeitung,News - National News
bild am sonntag zeitung,News - National News
cihan rocker bild zeitung,News - National News
cronauer bild zeitung,News - National News
daphne joy bild zeitung,News - National News
frage natuerlich liest niemand die bild zeitung aber wer kauft dann die ganzen ausgaben,News - National News
frage wo kann ich aeltere bild zeitungen kaufen ausgabe januar,News - National News
frage wo kann man alte bild zeitung titelthemen sehen,News - National News
germanys next topmodel bild zeitung,News - National News
günter arkenau bild zeitung,News - National News
gzsz Bild Zeitung,News - National News
heute bild zeitung top,News - National News
item bild zeitung lesen mit bushido video,News - National News
kay one bild zeitung,News - National News
kim blitzer germanys bild zeitung,News - National News
kim busenblitzer bild Zeitung,News - National News
langer natalie Bild Zeitung,News - National News
lefloid bild zeitung,News - National News
marie bild zeitung 2002,News - National News
max kruse bild zeitung,News - National News
nachgefragt bild zeitung hat bei lorielle london nach bushidos line erkundigt video,News - National News
nachrichten allg zeitung mainz schraeges bild kommentar zum bildungsbarometer von alexandra eisen,News - National News
nachrichten bild zeitung,News - National News
nippelblitzer bild zeitung kim gntm,News - National News
paparazzi deutsch topmodel bild zeitung nackt foto von kim,News - National News
peter maffay bild zeitung,News - National News
petition gegen putin bild zeitung will panzer am sowjetischen ehrenmal in berlin entfernen,News - National News
politik bundeswehr wirbt nun auch in der bild zeitung,News - National News
politik deutschland einstweilige verfuegung gegen bild zeitung wegen verletzung der persoenlichkeitsrechte a,News - National News
s antonia wagners bild zeitung,News - National News
s bernd hörburger bild zeitung,News - National News
schöneberger silbereisen bild zeitung,News - National News
schumacher bild zeitung,News - National News
search bild zeitung aktuell von heute,News - National News
titelbild bild zeitung,News - National News
verkaufszahlen der bild zeitung,News - National News
warum ist bild keine zeitung,News - National News
warum wir gegen die bild zeitung kaempfen,News - National News
was kostet bild zeitung 2016,News - National News
was kostet die bild zeitung heute,News - National News
wirtschaft news bild zeitung probleme beim am transportflugzeug,News - National News
wohnmobil bild zeitung,News - National News
zeitung bild am sonntag kurzbewertung,News - National News
zeitung bild am sonntag testbericht,News - National News
Der Text stellt die Bedeutung von Zeitungen in unserer Zeit infrage.,News - National News
die zeit zeitung aufbau,News - National News
frage an welchem wochentag kommt zeitung die zeit wenn ich sie abonniert habe,News - National News
frage wann erscheint die zeitung die zeit,News - National News
nachrichten aachener zeitung kommentar gewaehlt und jetzt die zeit der wackelkurse sollte nun zu ende sein bernd mathieu,News - National News
zeitung die zeit testberichte,News - National News
wie kann ich der bild zeitung schreiben,News - National News
wirtschaft news nach bild boykott von chemnitzer edeka markt mpv liefert keine zeitungen mehr,News - National News
wirtschaft studie bild ist gar keine zeitung,News - National News
zaman Zeitung bild,News - National News
bushido exklusiv bei focus online ueber hintergruende des brandes,News - National News
panorama stern crime muenchen anti terror einsatz nachrichtenportal focus online widerspricht einsatzbericht der polizei,News - National News
panorama videos vom riesling bis zum grauburgunder sommelier verkostet die neuen aldi weine fuer focus online vid,News - National News
politik ausland focus online vor ort im fluechtlingscamp taeglicher kampf gegen hunger kaelte dreck das zeigt der blick in indomenis zelte id,News - National News
politik deutschland frueherer afd politiker im focus online interview henkel warnt vor der afd die leute haben keine ahnung wen sie da gewaehlt haben id,News - National News
politik deutschland umfrage von focus online merkel laesst strafverfilgung gegen boehmermann zu die richtige entscheidung id,News - National News
regional muenchen freizeit focus online muenchen top liste dachterrassen in muenchen le buffet id,News - National News
weinwelt rotwein kaufen mit focus online wie finde ich den richtigen rotwein id,News - National News
aufdieliebe spiegel online social media redakteurin gelingt gefuehlvolle antwort auf den terror in bruessel,News - National News
blog mohammed und das studentenportal spiegel online entdeckt die tu ilmenau,News - National News
bmwsyndikatforum topic kritische kommentare auf spiegel online unerwuensch geplaudere,News - National News
dienste besser surfen auf spiegel online anleitungen und hilfen,News - National News
focus online schlaegt erneut spiegel online n,News - National News
iphone apps nachrichten spiegel online,News - National News
Nadine gordimer spiegel online,News - National News
news spiegel online behaelt sicherheitsluecken ueber monate bei update,News - National News
1 augsburger allgemeine,News - Newspapers
1 augsburger allgemeine immobilien,News - Newspapers
1 Augsburger Allgemeine stellenngebote,News - Newspapers
anzeige augsburger allgemeine,News - Newspapers
anzeigenannahme augsburger allgemeine,News - Newspapers
Augsburg Hochzoll augsburger allgemeine,News - Newspapers
augsburger allgemeine - falscher feueralarm,News - Newspapers
Augsburger Allgemeine Anzeigen,News - Newspapers
augsburger allgemeine anzeigen aufgeben,News - Newspapers
augsburger allgemeine ausbildungsboerse,News - Newspapers
zeitung rheinische post,News - Newspapers
Sächsische Zeitung,News - Newspapers
sächsische zeitung 1976,News - Newspapers
erfahrungsberichte suddeutsche zeitung,News - Newspapers
Nachrichten aktuell süddeutsche Zeitung,News - Newspapers
suddeutsche zeitung wikileaks,News - Newspapers
aktuell tageszeitung,News - Newspapers
alte tageszeitung ruhrgebiet,News - Newspapers
Auflage Tageszeitungen Deutschland,News - Newspapers
Berlin ist der bedeutendste Verlagsstandort Deutschlands. Dort hat der größte europäische Medienkonzern der regionale Berliner Verlag seinen Sitz. In keiner anderen deutschen Stadt erscheinen mehr Tageszeitungen wie die Bild,News - Newspapers
beste tageszeitung,News - Newspapers
bremer tageszeitung,News - Newspapers
britische tageszeitungen,News - Newspapers
bruchsal tageszeitung,News - Newspapers
deutsche tageszeitungen auflagenstärkste,News - Newspapers
deutsche tageszeitungen die meistgelesen,News - Newspapers
Deutsche Tageszeitungen Im Internet,News - Newspapers
dortmund tageszeitungen,News - Newspapers
england tageszeitung,News - Newspapers
essener tageszeitung,News - Newspapers
frage anspruchsvolle tageszeitung,News - Newspapers
frage gibt es in deutschland eine rechte tageszeitung,News - Newspapers
Friedrichshain tageszeitung,News - Newspapers
grassauer tageszeitung,News - Newspapers
greiz tageszeitung,News - Newspapers
gute tageszeitung in Deutschland,News - Newspapers
Herforder Tageszeitung,News - Newspapers
hofer tageszeitung,News - Newspapers
hohenloher tageszeitung,News - Newspapers
ilmenauer tageszeitung,News - Newspapers
internationale tageszeitungen,News - Newspapers
karlsruhe tageszeitung,News - Newspapers
kassel tageszeitung,News - Newspapers
kontakt tageszeitung österreich,News - Newspapers
kostenlose tageszeitungen,News - Newspapers
kronacher tageszeitung,News - Newspapers
lichtenfels tageszeitung,News - Newspapers
lüdenscheider tageszeitung,News - Newspapers
metzinger tageszeitung autismus,News - Newspapers
mitteldeutsche tageszeitung freiheit,News - Newspapers
Morbacher Tageszeitung,News - Newspapers
mosbach tageszeitung,News - Newspapers
münchen tageszeitungen,News - Newspapers
mv tageszeitung,News - Newspapers
nachrichten nur journalisten fuer europas beste tageszeitung,News - Newspapers
nd tageszeitung,News - Newspapers
neckarquelle tageszeitung,News - Newspapers
norderney tageszeitung,News - Newspapers
oesterreichische tageszeitunge,News - Newspapers
oldenburg tageszeitung immobilien,News - Newspapers
persische tageszeitung,News - Newspapers
pforzheimer kurier tageszeitung,News - Newspapers
presse miesbach tageszeitung,News - Newspapers
presse solingen tageszeitung,News - Newspapers
produkte tageszeitungen,News - Newspapers
Reichweiten Bayern Tageszeitungen,News - Newspapers
rosenheim tageszeitung,News - Newspapers
schmalkalder tageszeitung,News - Newspapers
schweden nachrichten schwedische tageszeitung t,News - Newspapers
schweizer tageszeitung blick,News - Newspapers
Schweizer Tageszeitung über anschlag in Brussels,News - Newspapers
search tageszeitung hanau,News - Newspapers
Seesen Tageszeitung online,News - Newspapers
Seesener Beobachter Tageszeitung,News - Newspapers
spanische tageszeitung auf deutsch,News - Newspapers
spanische tageszeitungen,News - Newspapers
suche tageszeitung solingen,News - Newspapers
suche tageszeitung weiden redaktion,News - Newspapers
suedtiroler tageszeitung,News - Newspapers
thema die tageszeitung,News - Newspapers
thread konservative amerikanische tageszeitung gesucht,News - Newspapers
zeitung oesterreich tageszeitung,News - Newspapers
zeitung tageszeitung junge welt,News - Newspapers
zukunft printmedien tageszeitung,News - Newspapers
tz online,News - Newspapers
Deutschland überregionale Zeitungen,News - Newspapers
Überregionale Zeitungen,News - Newspapers
überregionale zeitungen regionale ausgaben,News - Newspapers
nachrichten pressestimme westdeutsche allgemeine zeitung zu nrw wahl,News - Newspapers
verzeichnis westdeutsche allgemeine zeitung,News - Newspapers
zeitung westdeutsche allgemeine,News - Newspapers
Auferstehung Artikel in Wochenzeitung Die Zeit,News - Newspapers
kostenlose wochenzeitungen görlitz,News - Newspapers
langenhagen wochenzeitung,News - Newspapers
linke wochenzeitung deutschland,News - Newspapers
ostbevern wochenzeitung,News - Newspapers
produkte wochenzeitungen,News - Newspapers
thread welche gute linke tages bzw wochenzeitung koennt ihr empfehlen,News - Newspapers
tipps wohnungssuche frankfurt wochenzeitung,News - Newspapers
verkaufszahlen deutscher wochenzeitungen,News - Newspapers
verlag ravensburg suedfinder wochenzeitung ohg m,News - Newspapers
wirtschaft news wochenzeitung die woche wird eingestellt,News - Newspapers
wochenzeitung braunlage,News - Newspapers
wochenzeitung Deutschland,News - Newspapers
wochenzeitung heidenheim,News - Newspapers
wochenzeitung pforzheim,News - Newspapers
berufe augsburg Augsburger Allgemeine,News - Newspapers
epaper augsburger allgemeine,News - Newspapers
immo augsburger allgemeine,News - Newspapers
immobörse augsburger allgemeine,News - Newspapers
oettingen stellenangebote augsburger allgemeine,News - Newspapers
bild-zeitung 06.03.16,News - Newspapers
Die Bild-Zeitung Von Heute,News - Newspapers
Heute in der BILD-Zeitung,News - Newspapers
nachrichten deutschland bild-zeitung,News - Newspapers
stasi liste bild-zeitung 1992,News - Newspapers
auflagenzahlen deutsche zeitungen,News - Newspapers
deutsche zeitungen in florida,News - Newspapers
deutsche zeitungen politische ausrichtung,News - Newspapers
frage besitzer der verlaege deutscher zeitungen,News - Newspapers
frage deutsche zeitschriften zeitungen die sehr gutes deutsch benutzen,News - Newspapers
grosse deutsche zeitungen,News - Newspapers
meistgelesene deutsche zeitungen,News - Newspapers
nachrichten über jnu in deutsche zeitungen,News - Newspapers
uebersicht politisch meinungsbildende zeitungen und zeitschriften in deutscher sprache,News - Newspapers
wie vielde deutscher zeitungen kommen aus hamburg,News - Newspapers
die rheinpfalz am sonntag bekanntschaften,News - Newspapers
Die Rheinpfalz Bad DürkheimTodesanzeigen,News - Newspapers
Die Rheinpfalz Inserat Autoverkauf,News - Newspapers
die rheinpfalz kusel traueranzeigen,News - Newspapers
die rheinpfalz tiermarkt,News - Newspapers
die rheinpfalz todesanzeige,News - Newspapers
ivw die rheinpfalz 2016,News - Newspapers
baugrundstücke in mildenau freie presse,News - Newspapers
chemnitz freie presse,News - Newspapers
Freie Presse Augustusburg,News - Newspapers
freie presse chemnitz,News - Newspapers
grundstücke oelsnitz freie presse,News - Newspapers
stellenangebote chemnitz freie presse,News - Newspapers
straßenbeleuchtung ilmenau presse freies wort,News - Newspapers
zeitung freie presse,News - Newspapers
frage wie ist die politische ausrichtung von dem hamburger abendblatt der mopo taz und radio hh,News - Newspapers
hamburger abendblatt 1936,News - Newspapers
hamburger abendblatt automarkt,News - Newspapers
hamburger abendblatt biografie,News - Newspapers
kleinanzeigen hamburger abendblatt,News - Newspapers
s hamburger abendblatt,News - Newspapers
stellensuche hamburger abendblatt,News - Newspapers
hannoversche allgemeine zeitung,News - Newspapers
nachricht pressestimme hannoversche allgemeine zeitung landtagswahlen,News - Newspapers
nachrichten pressestimme hannoversche allgemeine zeitung zur bahn bilanz,News - Newspapers
kölner stadt-anzeiger,News - Newspapers
Kölner Stadt-Anzeiger Leverkusener Anzeiger top,News - Newspapers
2 todesanzeigen kärnten kronen zeitung,News - Newspapers
frage kronen zeitung politisch gefaerbt,News - Newspapers
kommentar kronen zeitung n,News - Newspapers
kronen zeitung,News - Newspapers
kronen zeitung merkel kri n,News - Newspapers
leipziger volkszeitung 1936,News - Newspapers
leipziger volkszeitung archiv,News - Newspapers
Leipziger Volkszeitung in Eilenburg,News - Newspapers
leipziger volkszeitung wegen unister,News - Newspapers
die drei Lokalzeitungen a b c haben Marktanteile,News - Newspapers
frage welche themen in lokalzeitung,News - Newspapers
lokalzeitung großburgwedel,News - Newspapers
lokalzeitung leverkusen,News - Newspapers
lokalzeitung münster,News - Newspapers
lokalzeitung themen,News - Newspapers
lokalzeitung von wunsiedel,News - Newspapers
lokalzeitungen,News - Newspapers
nachrichten verband deutscher lokalzeitungen e v vdl branchentreff der deutschen lokalpresse,News - Newspapers
Verband deutscher lokalzeitungen,News - Newspapers
zeitung lokalzeitungen,News - Newspapers
artikel mitteldeutsche zeitung zu den linken,News - Newspapers
artikel mitteldeutsche zeitung zu edathy,News - Newspapers
mitteldeutsche zeitung anhalt,News - Newspapers
verzeichnis mitteldeutsche zeitung,News - Newspapers
Bergische Morgenpost Remscheid,News - Newspapers
berlin morgenpost,News - Newspapers
Berliner Morgenpost,News - Newspapers
chemnitzer morgenpost vom 8.4.16 Randale in Plauen,News - Newspapers
Einbecker Morgenpost Aktuell,News - Newspapers
einbecker morgenpost Zeitung,News - Newspapers
Jobs Berliner Morgenpost,News - Newspapers
morgenpost chemnitz,News - Newspapers
norderneier morgenpost,News - Newspapers
politik deutschland themen berliner morgenpost,News - Newspapers
solinger morgenpost,News - Newspapers
zeitung bergische morgenpost,News - Newspapers
zeitung einbecker morgenpost,News - Newspapers
zeitung solinger morgenpost,News - Newspapers
münchener merkur,News - Newspapers
