brust kleiner trainieren,Beauty & Fitness - Fitness
brust rücken zusammen trainieren,Beauty & Fitness - Fitness
brust trainieren ohne geräte,Beauty & Fitness - Fitness
brust trainieren zuhause,Beauty & Fitness - Fitness
brust und bauchmuskeln trainieren zuhause,Beauty & Fitness - Fitness
brust und bizeps zusammen trainieren,Beauty & Fitness - Fitness
Brust und rücken trainieren mit kurzhanteln,Beauty & Fitness - Fitness
brüste trainieren hautüberschuss,Beauty & Fitness - Fitness
Effizient brust trainieren,Beauty & Fitness - Fitness
frage bauch beine po und brust trainieren,Beauty & Fitness - Fitness
frage bauch ruecken arme und brust trainieren welche uebungen,Beauty & Fitness - Fitness
frage bei muskelkater in der brust den ruecken trainieren,Beauty & Fitness - Fitness
frage brust flach was soll ich machen trainieren,Beauty & Fitness - Fitness
frage brust mal die woche trainieren waechst nicht muskelaufbau,Beauty & Fitness - Fitness
frage brust ohne fitnessgeraete trainieren,Beauty & Fitness - Fitness
frage brust trainieren damit es nicht schwabbelig ist,Beauty & Fitness - Fitness
frage brust trainieren trotz leichtem trizeps muskelkater,Beauty & Fitness - Fitness
frage brust und sixpack gleichzeitig trainieren,Beauty & Fitness - Fitness
frage brust von obenunten durch trainieren aber welche uebungen,Beauty & Fitness - Fitness
frage brustmuskeln innere und untere brust trainieren,Beauty & Fitness - Fitness
frage darf man bauch und brust muskeln am gleichen tag trainieren,Beauty & Fitness - Fitness
frage ein tag nach brust training trizeps trainieren,Beauty & Fitness - Fitness
frage ich moechte abnehmen und bauch beine po und brust trainieren wie,Beauty & Fitness - Fitness
frage in monaten leicht sichtbar brust trainieren,Beauty & Fitness - Fitness
frage kann man i wie den muskel zwischen der schulter und der brust trainieren,Beauty & Fitness - Fitness
frage kann man mit kg kurzhanteln die brust trainieren,Beauty & Fitness - Fitness
frage kann man muskeln trainieren die die brust groesser und strammer macht,Beauty & Fitness - Fitness
frage mien sohn ist und will seinen koerper trainieren vor allem die brust,Beauty & Fitness - Fitness
frage mit brust zucken koennen latissimus zeigen wie lange muss ich da trainieren,Beauty & Fitness - Fitness
frage mit sz stange gut brust und bauch trainieren,Beauty & Fitness - Fitness
frage mittlere obere brust richtig mehr trainieren,Beauty & Fitness - Fitness
frage oberarme und brust trainieren sixpack wie gehts am schnellsten,Beauty & Fitness - Fitness
frage oberkoerper trainieren brust bauch nacken,Beauty & Fitness - Fitness
frage reichen liegestuetzen am tag aus um die brust zu trainieren,Beauty & Fitness - Fitness
frage schmerzen in der brust vom trainieren,Beauty & Fitness - Fitness
frage soll ich die griffe waagerecht oder senkrecht halten um an der brustpresse die brust effektiver zu trainieren,Beauty & Fitness - Fitness
frage wie kann man brust muskeln trainieren auch wenn man nicht ins fitnessstudio geht,Beauty & Fitness - Fitness
frage wie oft sollte man in der woche brust ruecken bizepstrizeps schultern trainieren,Beauty & Fitness - Fitness
gymnastikseil brüste trainieren,Beauty & Fitness - Fitness
hängende Brüste trainieren,Beauty & Fitness - Fitness
kann man trainieren ohne brust zu verlieren,Beauty & Fitness - Fitness
reaktiv Hantel Brust Oberarme trainieren,Beauty & Fitness - Fitness
richtig die brust trainieren ohne geräte,Beauty & Fitness - Fitness
trizeps muskelkater brust trainieren,Beauty & Fitness - Fitness
wie kann man am besten die brust trainieren,Beauty & Fitness - Fitness
zuhause trainieren muskelaufbau oberarm und brust,Beauty & Fitness - Fitness
bodybuilding kraftsport definitionsphase makro verteilung,Beauty & Fitness - Fitness
bodybuilding kraftsport definitionsphase mal ausprobieren,Beauty & Fitness - Fitness
bodybuilding kraftsport muskelabbau definitionsphase verhindern,Beauty & Fitness - Fitness
definitionsphase eiweiss snacks,Beauty & Fitness - Fitness
definitionsphase ernährungsplan,Beauty & Fitness - Fitness
definitionsphase frühstück,Beauty & Fitness - Fitness
definitionsphase keine milchprodukte,Beauty & Fitness - Fitness
definitionsphase kh eiweiß und fett,Beauty & Fitness - Fitness
definitionsphase makronährstoffverteilung,Beauty & Fitness - Fitness
definitionsphase makroverteilung,Beauty & Fitness - Fitness
definitionsphase rührei mit haferflocken,Beauty & Fitness - Fitness
definitionsphase vorher nachher,Beauty & Fitness - Fitness
definitionsphase was abends essen pdf,Beauty & Fitness - Fitness
definitionsphase wie viele kohlenhydrate,Beauty & Fitness - Fitness
wie oft kann man seine brust trainieren in der woche,Beauty & Fitness - Fitness
zu viel brust trainieren,Beauty & Fitness - Fitness
ernährung definitionsphase frauen,Beauty & Fitness - Fitness
frage definitionsphase ernaehrung,Beauty & Fitness - Fitness
frage definitionsphase joggen,Beauty & Fitness - Fitness
frage definitionsphase muskeln behalten fett abbauen,Beauty & Fitness - Fitness
frage definitionsphase nachts bei hunger noch kleine eiweiss mahlzeit,Beauty & Fitness - Fitness
frage definitionsphase nuesse gesund,Beauty & Fitness - Fitness
frage definitionsphase oder massephase,Beauty & Fitness - Fitness
frage eiweissreiche fettarme lebensmittel definitionsphase,Beauty & Fitness - Fitness
frage ernaehrung in der definitionsphase bodybuilding,Beauty & Fitness - Fitness
frage ich nehme nicht mehr ab in der definitionsphase warum,Beauty & Fitness - Fitness
frage kann man in der definitionsphase bauchmuskeln aufbauen,Beauty & Fitness - Fitness
frage magerquark vor dem schlafen gehen waehrend der diaet bzw definitionsphase,Beauty & Fitness - Fitness
frage massephase oder definitionsphase was zuerst,Beauty & Fitness - Fitness
frage wann sollte ich in die definitionsphase gehen,Beauty & Fitness - Fitness
frage wann und wie viel cardio bei definitionsphase,Beauty & Fitness - Fitness
frage was essen und was beachten in der definitionsphase,Beauty & Fitness - Fitness
frage wie viel gewichtsverlust in der definitionsphase ist gut,Beauty & Fitness - Fitness
frage zu starkes kaloriendefizit und hilfe bei definitionsphase,Beauty & Fitness - Fitness
ganzkörpertraining definitionsphase,Beauty & Fitness - Fitness
kalorienberechnung definitionsphase,Beauty & Fitness - Fitness
makronährstoffverteilung definitionsphase,Beauty & Fitness - Fitness
makros berechnen definitionsphase,Beauty & Fitness - Fitness
wie kalorienbedarf nach joggen definitionsphase,Beauty & Fitness - Fitness
wie viel gramm fett bei definitionsphase,Beauty & Fitness - Fitness
wieviel fett eiweiss in der definitionsphase,Beauty & Fitness - Fitness
wieviel gramm fett in der definitionsphase,Beauty & Fitness - Fitness
fitness video videos bauch beine po uebungen video n,Beauty & Fitness - Fitness
fitness video videos beine trainieren video n,Beauty & Fitness - Fitness
Fitness Videos,Beauty & Fitness - Fitness
fitness videos bauch story knieheben gegen den bauch,Beauty & Fitness - Fitness
fitness videos bauch story nehmen sie sich drei minuten fuer ihren bauch,Beauty & Fitness - Fitness
fitness videos frauen view tipps po bauch ubung,Beauty & Fitness - Fitness
gesundheit fitness videos,Beauty & Fitness - Fitness
gesundheit fitness videos so staerken sie ihre wirbelsaeule,Beauty & Fitness - Fitness
gesundheit fitness videos stern fitness schule muskeln im sitzen trainieren,Beauty & Fitness - Fitness
gesundheit fitness videos stern fitness schule teil trainieren ohne schweiss,Beauty & Fitness - Fitness
karl ess abnehmen und muskelaufbau,Beauty & Fitness - Fitness
karl ess ernährungsplan,Beauty & Fitness - Fitness
mister universum 2015,Beauty & Fitness - Fitness
frage breite schultern trainieren,Beauty & Fitness - Fitness
bester berlin friseur für damen undercut,Beauty & Fitness - Hair Care
bester friseur berlin,Beauty & Fitness - Hair Care
bester friseur deutschland 2016,Beauty & Fitness - Hair Care
bester friseur färben münchen,Beauty & Fitness - Hair Care
bester friseur türkisch in gelsenkirchen innenstadt,Beauty & Fitness - Hair Care
bester friseur wuppertal türken,Beauty & Fitness - Hair Care
friseur baesweiler elke besters frisoersalon m,Beauty & Fitness - Hair Care
Die neuesten Haartrends,Beauty & Fitness - Hair Care
die richtige haarpflege,Beauty & Fitness - Hair Care
Die richtige Haarpflege gegen Schuppen wählen,Beauty & Fitness - Hair Care
haar haarpflege die richtige pflege fuer strapaziertes haar,Beauty & Fitness - Hair Care
haar haarpflege welche haarbuerste ist die richtige fuer sie,Beauty & Fitness - Hair Care
hair die richtige haarpflege,Beauty & Fitness - Hair Care
wellness und beauty schoenheit item die richtige haarpflege das muss man beachten,Beauty & Fitness - Hair Care
a guten friseur finden sauberkeit,Beauty & Fitness - Hair Care
beauty haare guten friseur finden,Beauty & Fitness - Hair Care
der richtige friseur so finden sie ihn,Beauty & Fitness - Hair Care
einen türkischen friseur und barbier in berlin finden,Beauty & Fitness - Hair Care
frage wo modelle fuer pruefung finden friseur,Beauty & Fitness - Hair Care
friseur finden bewertung,Beauty & Fitness - Hair Care
guten friseur finden,Beauty & Fitness - Hair Care
so finden sie einen guten friseur,Beauty & Fitness - Hair Care
beauty bob frisuren der stars zum nachstylen al,Beauty & Fitness - Hair Care
beauty frisuren galerie die er jahre frisuren der stars,Beauty & Fitness - Hair Care
beauty haessliche frisuren der stars bl,Beauty & Fitness - Hair Care
bob frisuren der stars,Beauty & Fitness - Hair Care
die bob frisuren der stars bob frisuren zum verlieben,Beauty & Fitness - Hair Care
die frisuren der stars stars rocken locken,Beauty & Fitness - Hair Care
hairstyle der stars die frisuren der emmys,Beauty & Fitness - Hair Care
hairstyle der stars die frisuren der golden globes,Beauty & Fitness - Hair Care
hairstyle der stars jennifer aniston die frisuren trendsetterin,Beauty & Fitness - Hair Care
kurzhaarfrisuren damen kurzhaarfrisuren der stars kurze frisuren sind,Beauty & Fitness - Hair Care
lifestyle mode silvester frisuren wie in hollywood so gelingt ihnen der look der stars,Beauty & Fitness - Hair Care
so stylen die stars frisuren mittellang frisuren mittellang styles der stars,Beauty & Fitness - Hair Care
sport die frisuren der fussball stars,Beauty & Fitness - Hair Care
starfrisuren die frisuren der stars,Beauty & Fitness - Hair Care
a frisurentrends fruehjahr wellen,Beauty & Fitness - Hair Care
aktuelle Frisurentrends Frühjahr 2016,Beauty & Fitness - Hair Care
beauty flechten knoten und spangen das sind die frisurentrends,Beauty & Fitness - Hair Care
beauty frisuren haartrends frisurentrends die kurzhaarfrisuren der stars,Beauty & Fitness - Hair Care
beauty frisuren haartrends frisurentrends haarbaender fuer alle,Beauty & Fitness - Hair Care
beauty frisuren haartrends frisurentrends haariger allrounder,Beauty & Fitness - Hair Care
beauty frisuren haartrends frisurentrends klammern erlaubt,Beauty & Fitness - Hair Care
beauty frisuren haartrends frisurentrends tiefer pferdeschwanz,Beauty & Fitness - Hair Care
beauty frisuren haartrends frisurentrends zopfsache,Beauty & Fitness - Hair Care
beauty frisurentrends die looks vom laufsteg bl,Beauty & Fitness - Hair Care
beauty frisurentrends herbst winter kurzhaarschnitte bl,Beauty & Fitness - Hair Care
beauty frisurentrends so verspielt wird der fruehling al,Beauty & Fitness - Hair Care
beauty haare frisuren kurzhaar frisurentrends fuer frauen,Beauty & Fitness - Hair Care
bob haarschnitt mit pony frisurentrends damen undercut,Beauty & Fitness - Hair Care
frisuren berlin fashion week die frisurentrends der berlin fashion week,Beauty & Fitness - Hair Care
frisurentrends 2015 rundes gesicht,Beauty & Fitness - Hair Care
Frisurentrends 2016 Damen Kurz,Beauty & Fitness - Hair Care
Frisurentrends 2016 Damen Mittellang,Beauty & Fitness - Hair Care
frisurentrends 2016 dunkle haare kurz,Beauty & Fitness - Hair Care
frisurentrends 2016 eckigen Gesicht,Beauty & Fitness - Hair Care
frisurentrends 2016 für frauen ab 50,Beauty & Fitness - Hair Care
frisurentrends 2016 für graue haare,Beauty & Fitness - Hair Care
frisurentrends 2016 für Männer,Beauty & Fitness - Hair Care
frisurentrends 2016 für mollige,Beauty & Fitness - Hair Care
frisurentrends 2016 halblanges haar,Beauty & Fitness - Hair Care
frisurentrends 2016 herren jugendliche,Beauty & Fitness - Hair Care
frisurentrends 2016 kinder Mädchen kurz,Beauty & Fitness - Hair Care
frisurentrends 2016 kurz damen,Beauty & Fitness - Hair Care
frisurentrends 2016 kurz frauen,Beauty & Fitness - Hair Care
Frisurentrends 2016 kurzhaar,Beauty & Fitness - Hair Care
frisurentrends 2016 kurzhaar männer,Beauty & Fitness - Hair Care
frisurentrends 2016 locken mittellang,Beauty & Fitness - Hair Care
frisurentrends 2016 männer geheimratsecken,Beauty & Fitness - Hair Care
frisurentrends 2016 schmales gesicht,Beauty & Fitness - Hair Care
frisurentrends 2016 schulterlang,Beauty & Fitness - Hair Care
frisurentrends 2016 selber machen,Beauty & Fitness - Hair Care
Frisurentrends Damen Über 40,Beauty & Fitness - Hair Care
Frisurentrends dünnes Haar 2016,Beauty & Fitness - Hair Care
Frisurentrends eckige Gesichter,Beauty & Fitness - Hair Care
frisurentrends fs die neuen looks fuer langes haar,Beauty & Fitness - Hair Care
frisurentrends fs sommerliche locken trends fuer alle,Beauty & Fitness - Hair Care
Frisurentrends für männer mit bart,Beauty & Fitness - Hair Care
frisurentrends für mittellanges haar 2016,Beauty & Fitness - Hair Care
frisurentrends haarfarbe 2016,Beauty & Fitness - Hair Care
frisurentrends herbst winter 2015 16,Beauty & Fitness - Hair Care
frisurentrends hinterkopf,Beauty & Fitness - Hair Care
frisurentrends lange haare schnitt,Beauty & Fitness - Hair Care
frisurentrends lange kurze haare frisurentrends ob kurz oder lang,Beauty & Fitness - Hair Care
frisurentrends pferdeschwanz pferdeschwanz die schoensten star frisuren,Beauty & Fitness - Hair Care
frisurentrends strähnchen,Beauty & Fitness - Hair Care
frisurentrends welliges haar,Beauty & Fitness - Hair Care
Gestufter Bob Frisurentrends,Beauty & Fitness - Hair Care
magazine unterhaltung lifestyle frisuren frisurentrends bob frisuren lang kurz,Beauty & Fitness - Hair Care
neue frisurentrends für männer,Beauty & Fitness - Hair Care
Neue Frisurentrends Kurzhaar,Beauty & Fitness - Hair Care
ratgeber frisurentrends undercut fuer maenner,Beauty & Fitness - Hair Care
video frisurentrends fuer maenner mit bart,Beauty & Fitness - Hair Care
2x am tag haare färben,Beauty & Fitness - Hair Care
7 tage nach haare färben allergische Reaktion,Beauty & Fitness - Hair Care
ab wann graue haare färben,Beauty & Fitness - Hair Care
allergische reaktion haare färben was tun,Beauty & Fitness - Hair Care
angst vorm haare färben,Beauty & Fitness - Hair Care
ausschlag haare färben,Beauty & Fitness - Hair Care
blond haare färben l,Beauty & Fitness - Hair Care
blondierte Haare abgebrochen wie jetzt weiter färben,Beauty & Fitness - Hair Care
blondierte haare braun färben,Beauty & Fitness - Hair Care
blondierte haare dunkelblond färben ohne grünstich,Beauty & Fitness - Hair Care
blondierte haare dunkler färben,Beauty & Fitness - Hair Care
blondierte haare färben oder tönen,Beauty & Fitness - Hair Care
blondierte haare goldblond färben,Beauty & Fitness - Hair Care
blondierte haare mahagoni färben,Beauty & Fitness - Hair Care
braune haare wie färben,Beauty & Fitness - Hair Care
dunkle haare heller färben,Beauty & Fitness - Hair Care
einzelne graue haare mit 27 wie färben,Beauty & Fitness - Hair Care
farbtabelle haare färben,Beauty & Fitness - Hair Care
farbtöne haare färben,Beauty & Fitness - Hair Care
fettige haare färben,Beauty & Fitness - Hair Care
frühlingstyp haare färben,Beauty & Fitness - Hair Care
gefärbte haare heller färben,Beauty & Fitness - Hair Care
goldblonde haare aschblond färben,Beauty & Fitness - Hair Care
Graue Haare Blond färben,Beauty & Fitness - Hair Care
graue haare blondieren oder färben,Beauty & Fitness - Hair Care
graue haare färben mit kaffee schwarztee,Beauty & Fitness - Hair Care
graue haare färben ohne chemie,Beauty & Fitness - Hair Care
graue haare mit kaffee färben,Beauty & Fitness - Hair Care
graue haare mit kurkuma färben,Beauty & Fitness - Hair Care
Graue Haare strähnchen färben,Beauty & Fitness - Hair Care
haare beim färben lila geworden,Beauty & Fitness - Hair Care
haare direkt vorm färben waschen,Beauty & Fitness - Hair Care
haare färben auf dunklen haaren,Beauty & Fitness - Hair Care
haare färben bei läusebefall,Beauty & Fitness - Hair Care
haare färben fettige haare,Beauty & Fitness - Hair Care
haare färben friseur oder selbst,Beauty & Fitness - Hair Care
haare färben krepppapier gesundheit,Beauty & Fitness - Hair Care
haare färben mit henna trotz extensions,Beauty & Fitness - Hair Care
haare färben mit kamille und zitrone,Beauty & Fitness - Hair Care
haare färben mit krepppapier,Beauty & Fitness - Hair Care
haare färben mit pflanzenfarbe,Beauty & Fitness - Hair Care
haare färben mit sauberen haaren,Beauty & Fitness - Hair Care
haare färben mit schwarzen kaffee,Beauty & Fitness - Hair Care
haare färben natürliche mittel,Beauty & Fitness - Hair Care
haare färben neurodermitis,Beauty & Fitness - Hair Care
haare färben ohne grünstich,Beauty & Fitness - Hair Care
haare färben ohne rotstich,Beauty & Fitness - Hair Care
haare färben orange geworden,Beauty & Fitness - Hair Care
haare färben rot nicht gelungen,Beauty & Fitness - Hair Care
haare färben von blond auf braun,Beauty & Fitness - Hair Care
haare färben zuerst spitzen,Beauty & Fitness - Hair Care
haare heller färben hausmittel,Beauty & Fitness - Hair Care
haare lila färben,Beauty & Fitness - Hair Care
haare nach färben orange statt blond,Beauty & Fitness - Hair Care
haare rosa färben,Beauty & Fitness - Hair Care
haare rötlich färben rooibis tee,Beauty & Fitness - Hair Care
haare silber färben produkte,Beauty & Fitness - Hair Care
haare tonen oder farben was ist der unterschied,Beauty & Fitness - Hair Care
haare von schwarz auf grau färben,Beauty & Fitness - Hair Care
haare weiß färben,Beauty & Fitness - Hair Care
handschuhe haare färben,Beauty & Fitness - Hair Care
haushaltsmittel graue haare färben,Beauty & Fitness - Hair Care
hellblonde haare dunkler färben,Beauty & Fitness - Hair Care
henna haare chemisch färben,Beauty & Fitness - Hair Care
henna haare färben,Beauty & Fitness - Hair Care
himmelsgucker haare farben lila x mit farbtonpinsel p,Beauty & Fitness - Hair Care
ich möchte meine grauen haare nicht mehr färben,Beauty & Fitness - Hair Care
ist haare färben schädlich,Beauty & Fitness - Hair Care
kann man blonde haare schwarz färben,Beauty & Fitness - Hair Care
kopf geschwollen nach haare färben,Beauty & Fitness - Hair Care
kupfer haare caramel färben,Beauty & Fitness - Hair Care
läuse haare färben,Beauty & Fitness - Hair Care
loreal Haare färben Video,Beauty & Fitness - Hair Care
mit naturfarben haare färben,Beauty & Fitness - Hair Care
nach haare färben fettige haare,Beauty & Fitness - Hair Care
natürliche mittel um haare zu färben,Beauty & Fitness - Hair Care
ombre haare färben,Beauty & Fitness - Hair Care
pickel auf stirn nach haare färben,Beauty & Fitness - Hair Care
platinblonde haare dunkler färben,Beauty & Fitness - Hair Care
ränder vom haare färben entfernen,Beauty & Fitness - Hair Care
rot gefärbte haare hellbraun färben,Beauty & Fitness - Hair Care
rotbraune haare aschblond färben,Beauty & Fitness - Hair Care
rote gefärbte haare braun färben,Beauty & Fitness - Hair Care
Rotstich nach Haare färben,Beauty & Fitness - Hair Care
stars haare färben,Beauty & Fitness - Hair Care
überleben läuse haare färben,Beauty & Fitness - Hair Care
vorbereitung haare färben,Beauty & Fitness - Hair Care
warum brechen haare nach dem färben ab,Beauty & Fitness - Hair Care
warum färben sich frauen die haare rot,Beauty & Fitness - Hair Care
warum soll man vor dem haare färben nicht die haare waschen?,Beauty & Fitness - Hair Care
was brauche ich zum haare färben,Beauty & Fitness - Hair Care
welche farben passen zu grauen haaren,Beauty & Fitness - Hair Care
wie bekomme ich meine haare heller ohne sie zu färben,Beauty & Fitness - Hair Care
wie oft kann man haare hintereinander färben,Beauty & Fitness - Hair Care
zwiebeln um haare zu färben,Beauty & Fitness - Hair Care
archiv forum th haare schneiden nach dem mond hat jemand erfahrung,Beauty & Fitness - Hair Care
archiv forum th haare schneiden oder wachsen lassen,Beauty & Fitness - Hair Care
archiv forum th haare stumpf schneiden,Beauty & Fitness - Hair Care
archiv forum th tricks damit das haare schneiden klappt,Beauty & Fitness - Hair Care
archiv forum th wann das erste mal haare schneiden,Beauty & Fitness - Hair Care
archiv forum th wie oft lasst ihr eure haare schneiden,Beauty & Fitness - Hair Care
archiv forum th womit die haare selbst schneiden junge,Beauty & Fitness - Hair Care
beauty beauty tipp deshalb sollten sie ihre haare trocken schneiden lassen,Beauty & Fitness - Hair Care
beauty haare mondkalender haare schneiden,Beauty & Fitness - Hair Care
beauty haare pony schneiden,Beauty & Fitness - Hair Care
bei läuse haare schneiden,Beauty & Fitness - Hair Care
ayurveda ausbildung,Beauty & Fitness - Spas & Beauty Services
Ayurveda Ausbildung Heilpraktiker,Beauty & Fitness - Spas & Beauty Services
ayurveda ayurveda behandlung oelziehen und oelmassage,Beauty & Fitness - Spas & Beauty Services
ayurveda ayurveda ernaehrung agni trunk foerdert die verdauung,Beauty & Fitness - Spas & Beauty Services
ayurveda ayurveda ernaehrung die geschmacksrichtungen,Beauty & Fitness - Spas & Beauty Services
ayurveda ayurveda indische heilkunst,Beauty & Fitness - Spas & Beauty Services
ayurveda ayurveda indische heilkunst die pflanze die muedigkeit bluthochdruck und stress bekaempft,Beauty & Fitness - Spas & Beauty Services
ayurveda ayurveda indische heilkunst indische heilkunst gewuerze helfen heilen,Beauty & Fitness - Spas & Beauty Services
ayurveda ayurveda indische heilkunst indische heilkunst heilen ohne nebenwirkungen,Beauty & Fitness - Spas & Beauty Services
ayurveda behandlung Nebenwirkungen,Beauty & Fitness - Spas & Beauty Services
ayurveda entschlackungskur für zu hause,Beauty & Fitness - Spas & Beauty Services
Ayurveda gegen Schuppige Kopfhaut,Beauty & Fitness - Spas & Beauty Services
ayurveda gesundheitsberater ausbildung,Beauty & Fitness - Spas & Beauty Services
Ayurveda gesundheitsrezepte,Beauty & Fitness - Spas & Beauty Services
ayurveda ghee kaufen,Beauty & Fitness - Spas & Beauty Services
ayurveda hotel wellness massage dehner,Beauty & Fitness - Spas & Beauty Services
Ayurveda Kontitutionsbestimmung,Beauty & Fitness - Spas & Beauty Services
ayurveda kur indien empfehlung,Beauty & Fitness - Spas & Beauty Services
ayurveda kur urlaub indien,Beauty & Fitness - Spas & Beauty Services
ayurveda kuren in deutschland,Beauty & Fitness - Spas & Beauty Services
Ayurveda Kuren In Deutschland Entgiften,Beauty & Fitness - Spas & Beauty Services
ayurveda marmapunkt angst,Beauty & Fitness - Spas & Beauty Services
ayurveda massage massage indien,Beauty & Fitness - Spas & Beauty Services
Ayurveda Medizin Ausbildung,Beauty & Fitness - Spas & Beauty Services
ayurveda smaragd steine kaufen,Beauty & Fitness - Spas & Beauty Services
ayurveda zubehoerset,Beauty & Fitness - Spas & Beauty Services
bedeutung stirnguss ayurveda,Beauty & Fitness - Spas & Beauty Services
de gesundheit ayurveda yoga karolina burbach,Beauty & Fitness - Spas & Beauty Services
dunkle augenschatten ayurveda,Beauty & Fitness - Spas & Beauty Services
figur yoga balance wellness relax asien entspannung ayurveda uebersicht,Beauty & Fitness - Spas & Beauty Services
fitness yoga artikel mehr energie mit ayurveda,Beauty & Fitness - Spas & Beauty Services
frage ich suche eine schoene ayurveda klinik auf sri lanka,Beauty & Fitness - Spas & Beauty Services
frage lomi lomi und ayurveda massage ausbildung erfahrung mit schulen,Beauty & Fitness - Spas & Beauty Services
geo heftreihen geo magazin ayurveda die erstaunliche heilkraft einer unterschaetzten medizin,Beauty & Fitness - Spas & Beauty Services
gesund natuerlich heilen ayurveda gesundheit,Beauty & Fitness - Spas & Beauty Services
gesundheit kinderkrankheiten alternative therapien ayurveda oel loescht den stress,Beauty & Fitness - Spas & Beauty Services
gesundheit wellness anleitung ayurveda kopfmassage,Beauty & Fitness - Spas & Beauty Services
gesundheit wellness trendthema ayurveda kur die schoensten orte von den alpen bis nach brandenburg,Beauty & Fitness - Spas & Beauty Services
koerper seele anis nutzen sie dieses heilmittel im ayurveda,Beauty & Fitness - Spas & Beauty Services
koerper seele welches ayurvedahotel bietet gutes und serioeses ayurveda,Beauty & Fitness - Spas & Beauty Services
koerper seele wo gibt es gute ayurveda behandlungen,Beauty & Fitness - Spas & Beauty Services
lifestyle wellness ayurveda massage abhyanga die massage zum entspannen,Beauty & Fitness - Spas & Beauty Services
naturheilverfahren ayurveda,Beauty & Fitness - Spas & Beauty Services
reise fernreisen ratgeber indien wellness auf indische art die ayurveda glueckspille namens dr lalitha,Beauty & Fitness - Spas & Beauty Services
reise genuss europa welt ayurveda kur sri lanka,Beauty & Fitness - Spas & Beauty Services
solingen klingenstadt massagen wellness massagen ayurveda hot stone klassische massagen,Beauty & Fitness - Spas & Beauty Services
stuttgart massagen ayurveda massagen bei anvital eine insel zum wohlfuehlen ,Beauty & Fitness - Spas & Beauty Services
wellness und entspannung wellnesstherapien ayurveda tipps fuer jeden tag den stoffwechsel ankurbeln,Beauty & Fitness - Spas & Beauty Services
wellness und entspannung wellnesstherapien ayurveda tipps fuer jeden tag gesichtspflege,Beauty & Fitness - Spas & Beauty Services
