2015 miss universe winner AS,Beauty & Fitness - Beauty Pageants
a falsche miss universe gekuert,Beauty & Fitness - Beauty Pageants
a kathrin miss world wahl vize miss austria marina schneider,Beauty & Fitness - Beauty Pageants
a miami miss universe wahl vorschau,Beauty & Fitness - Beauty Pageants
a miss universe colombia gutierrez wahre siegerin,Beauty & Fitness - Beauty Pageants
a miss universe kolumbianerin siegerin,Beauty & Fitness - Beauty Pageants
a miss world schoenste frau welt,Beauty & Fitness - Beauty Pageants
a viertplatzierte miss germany mit guten chancen auf miss world euro auf deutsche teilnehmerin irischer wettanbieter paddy power korrigiert die quote fuer edita orascanin nach oben,Beauty & Fitness - Beauty Pageants
Adult Miss World Pageant,Beauty & Fitness - Beauty Pageants
aktuelles interview miss universe germany josefin donat die modelnde krankenschwester,Beauty & Fitness - Beauty Pageants
an miss wahlen teilnehmen,Beauty & Fitness - Beauty Pageants
anmelden zu miss germany HS,Beauty & Fitness - Beauty Pageants
anna hofbauer auftritt miss germany,Beauty & Fitness - Beauty Pageants
anna hofbauer miss germanys 2016,Beauty & Fitness - Beauty Pageants
apasra hongsakula miss universe aus thailand ist keinen tag gealtert,Beauty & Fitness - Beauty Pageants
article kinder schonheitswettbewerbe,Beauty & Fitness - Beauty Pageants
articles miss universe pia wurtzbach,Beauty & Fitness - Beauty Pageants
asian miss universe winners,Beauty & Fitness - Beauty Pageants
ausland schweiz miss earth kommt aus den philippinen;art,Beauty & Fitness - Beauty Pageants
bachelor mister germany oliver sanne,Beauty & Fitness - Beauty Pageants
beauty fragen wie wird man miss germany,Beauty & Fitness - Beauty Pageants
beauty miss germany sie ist die schoenste,Beauty & Fitness - Beauty Pageants
beauty miss universe unglaublich,Beauty & Fitness - Beauty Pageants
Bianca Jagger Miss World,Beauty & Fitness - Beauty Pageants
bikni miss universe,Beauty & Fitness - Beauty Pageants
bilder schnheitswettbewerb miss world siegerinnen,Beauty & Fitness - Beauty Pageants
bilder schonheitswettbewerb miss irak,Beauty & Fitness - Beauty Pageants
bilder schonheitswettbewerb moskau festival,Beauty & Fitness - Beauty Pageants
bilder tuning world bodensee martina ivezaj ist die neue miss tuning,Beauty & Fitness - Beauty Pageants
chloe moretz miss universe,Beauty & Fitness - Beauty Pageants
chloe moretz miss universe wahl nicht aussehen gehen,Beauty & Fitness - Beauty Pageants
christine reiler miss world austria,Beauty & Fitness - Beauty Pageants
 jährige lehrerin miss germany : lena bröder ist die schönste im land,Beauty & Fitness - Beauty Pageants
schönheitswettberwerb miss germany diese mädchen kämpfen um den titel,Beauty & Fitness - Beauty Pageants
das ist unser mister germany,Beauty & Fitness - Beauty Pageants
deutsch englisch schönheitskönigin,Beauty & Fitness - Beauty Pageants
deutsche schönheitskönigin 2016,Beauty & Fitness - Beauty Pageants
Deutschland schönheitswettbewerb kinder,Beauty & Fitness - Beauty Pageants
die schonheitskonigin ivonne menzel nahm an der miss deutschland wahl teil,Beauty & Fitness - Beauty Pageants
dossier miss earth schweiz,Beauty & Fitness - Beauty Pageants
dr mike miss universe,Beauty & Fitness - Beauty Pageants
en miss grand international,Beauty & Fitness - Beauty Pageants
enissa amani schönheitswettbewerb,Beauty & Fitness - Beauty Pageants
erdogan schönheitskönigin,Beauty & Fitness - Beauty Pageants
event miss germany miss germany finalteilnehmerinnen,Beauty & Fitness - Beauty Pageants
event miss germany miss germany finalteilnehmerinnen miss schleswig holstein,Beauty & Fitness - Beauty Pageants
event miss germany miss germany siegerseite,Beauty & Fitness - Beauty Pageants
f jennifer hawkins miss universe a,Beauty & Fitness - Beauty Pageants
fotostrecke chinesin zur miss world gekuert fotostrecke,Beauty & Fitness - Beauty Pageants
fotostrecke fotostrecke miss germany alle siegerinnen seit fotostrecke,Beauty & Fitness - Beauty Pageants
fotostrecke miss germany lehrerin lena broeder gewinnt schoenheitstitel fotostrecke,Beauty & Fitness - Beauty Pageants
fotostrecke miss wahlen damals fleischbeschau beim fraeuleinwunder fotostrecke,Beauty & Fitness - Beauty Pageants
fotostrecke transsexuelle jenna talackova verliert bei miss universe fotostrecke,Beauty & Fitness - Beauty Pageants
frage ist es bei miss wahlen normal bzw regelfall dass die siegerin geld gewinnt,Beauty & Fitness - Beauty Pageants
frage was ist der unterschied zwischen der miss world und der miss universe,Beauty & Fitness - Beauty Pageants
frage was ist der unterschied zwischen miss world und miss universe,Beauty & Fitness - Beauty Pageants
frage wie kommt man zu einer miss wahl und muss mam deutsche sein um miss germany zu werden oder reicht es wenn man hier lebt,Beauty & Fitness - Beauty Pageants
gabriela markus miss universe,Beauty & Fitness - Beauty Pageants
gabriella brum miss world,Beauty & Fitness - Beauty Pageants
gambar bikini miss universe,Beauty & Fitness - Beauty Pageants
germanys next topmodel gewinnerin sara nuru in der schweiz miss schweiz,Beauty & Fitness - Beauty Pageants
girl miss universe das ist die schoenste frau des universums,Beauty & Fitness - Beauty Pageants
image miss universe,Beauty & Fitness - Beauty Pageants
in photos korina sanchez interviews miss universe pia wurtzbach,Beauty & Fitness - Beauty Pageants
jane hansen miss international,Beauty & Fitness - Beauty Pageants
Jelena Ristic Miss World,Beauty & Fitness - Beauty Pageants
karen baldwin Miss Universe,Beauty & Fitness - Beauty Pageants
katzen schönheitswettbewerb SC,Beauty & Fitness - Beauty Pageants
kinder schönheitswettbewerb folgen,Beauty & Fitness - Beauty Pageants
kirschblütenkönigin hamburg auswahlverfahren,Beauty & Fitness - Beauty Pageants
leben frag ein klischee mister germany bist du der schoenste mann deutschlands,Beauty & Fitness - Beauty Pageants
leute oesterreich miss world julia furdea in den startloechern,Beauty & Fitness - Beauty Pageants
leute vip events miss wahlen beauty mania in oesterreich,Beauty & Fitness - Beauty Pageants
lifestyle das ist das kleid fuer die wahl zur miss world,Beauty & Fitness - Beauty Pageants
lifestyle junge frauen wollen miss germany werden,Beauty & Fitness - Beauty Pageants
lifestyle leute lena broeder ist die neue miss germany,Beauty & Fitness - Beauty Pageants
lifestyle leute miss germany lehrerin lena broeder gewinnt schoenheitswettbewerb,Beauty & Fitness - Beauty Pageants
lifestyle leute miss germany wahl babett ist die schoenste frau deutschlands,Beauty & Fitness - Beauty Pageants
lifestyle leute mister germany kandidaten wer ist deutschlands schoenster mann aefcca,Beauty & Fitness - Beauty Pageants
lifestyle leute schoenheit miss germany kommt aus berlin,Beauty & Fitness - Beauty Pageants
lifestyle leute schoenheitswettbewerb koelnerin claudia hein ist die neue miss germany,Beauty & Fitness - Beauty Pageants
lifestyle miss germany junge frauen kaempfen beim schoenheitswettberb,Beauty & Fitness - Beauty Pageants
lifestyle miss germany wer wird deutschlands schoenste,Beauty & Fitness - Beauty Pageants
lifestyle miss styria geht fuer uns zur miss world wahl,Beauty & Fitness - Beauty Pageants
lifestyle miss world amina aus jena will die schoenste werden,Beauty & Fitness - Beauty Pageants
lifestyle miss world wahl die schoenste frau der welt kommt aus suedafrika,Beauty & Fitness - Beauty Pageants
lifestyle so stimmten oe user ueber miss world ab,Beauty & Fitness - Beauty Pageants
lihatlah wajah miss universe,Beauty & Fitness - Beauty Pageants
magazin news detail site annekathrin kosch ist miss germany,Beauty & Fitness - Beauty Pageants
magazin news detail site christine wache ist miss plus germany,Beauty & Fitness - Beauty Pageants
magazin news detail site die finalistinnen der miss germany wahl,Beauty & Fitness - Beauty Pageants
magazin news detail site isabelle knispel ist die neue miss germany,Beauty & Fitness - Beauty Pageants
magazin news detail site kimvalerie voigt ist miss germany,Beauty & Fitness - Beauty Pageants
maxim model angeline suppiger an miss schweiz wahlen,Beauty & Fitness - Beauty Pageants
meldungen leute robin wolfinger zum mister germany gekuert,Beauty & Fitness - Beauty Pageants
Miss Germany,Beauty & Fitness - Beauty Pageants
miss Germany 2016 lehrerin,Beauty & Fitness - Beauty Pageants
miss germany aus Heddesheim,Beauty & Fitness - Beauty Pageants
miss germany kritisiert schonheits ops bei kandidatinnen n,Beauty & Fitness - Beauty Pageants
miss germany lena bröder fb,Beauty & Fitness - Beauty Pageants
Miss Germany Wahlen,Beauty & Fitness - Beauty Pageants
miss march germany estella keller,Beauty & Fitness - Beauty Pageants
miss march germany sissi,Beauty & Fitness - Beauty Pageants
miss october germany denise cotte,Beauty & Fitness - Beauty Pageants
miss october germany jessica kuhne,Beauty & Fitness - Beauty Pageants
miss october germany nina brucker,Beauty & Fitness - Beauty Pageants
Miss universe,Beauty & Fitness - Beauty Pageants
Miss Universe 2014 2015,Beauty & Fitness - Beauty Pageants
Miss Universe 2015,Beauty & Fitness - Beauty Pageants
Miss Universe 2016,Beauty & Fitness - Beauty Pageants
Miss universe bikini,Beauty & Fitness - Beauty Pageants
miss universe bikni,Beauty & Fitness - Beauty Pageants
miss universe czech republic is,Beauty & Fitness - Beauty Pageants
miss universe falsche miss gewonnen,Beauty & Fitness - Beauty Pageants
miss universe germany kristiana,Beauty & Fitness - Beauty Pageants
Miss Universe Philippines 2015,Beauty & Fitness - Beauty Pageants
miss universe pia wurtzbach,Beauty & Fitness - Beauty Pageants
miss universe ungeschminkt die beauty queens koennen auch ohne make up,Beauty & Fitness - Beauty Pageants
Miss wahlen,Beauty & Fitness - Beauty Pageants
miss wahlen nina banduhn,Beauty & Fitness - Beauty Pageants
miss wahlen voraussetzungen,Beauty & Fitness - Beauty Pageants
MISS WORLD 1972,Beauty & Fitness - Beauty Pageants
miss world 2015 ungeschminkt,Beauty & Fitness - Beauty Pageants
miss world czech republic,Beauty & Fitness - Beauty Pageants
miss world denise perrier,Beauty & Fitness - Beauty Pageants
miss world gabriella brum,Beauty & Fitness - Beauty Pageants
miss world kleider,Beauty & Fitness - Beauty Pageants
miss world und weitere konkurrentinnen,Beauty & Fitness - Beauty Pageants
mister germany,Beauty & Fitness - Beauty Pageants
mister germany 2015,Beauty & Fitness - Beauty Pageants
nackte miss wahlen,Beauty & Fitness - Beauty Pageants
news artikel st gallerin corinne schaedler ist miss earth schweiz,Beauty & Fitness - Beauty Pageants
norwegischer schönheitskönigin,Beauty & Fitness - Beauty Pageants
panorama geschichten des lebens miss germany wer ist die schoenste im ganzen land,Beauty & Fitness - Beauty Pageants
panorama leute chinesin zur miss world gekuert a,Beauty & Fitness - Beauty Pageants
panorama leute miss germany olga hoffmann ist die neue schoenheitskoenigin a,Beauty & Fitness - Beauty Pageants
panorama leute miss universe kolumbianerin paulina vega schoenste frau der welt a,Beauty & Fitness - Beauty Pageants
panorama leute mister germany joern kamphuis ist schoenster mann deutschlands a,Beauty & Fitness - Beauty Pageants
panorama little miss world kommt aus brasilien,Beauty & Fitness - Beauty Pageants
panorama skandal bei miss universe wettbewerb,Beauty & Fitness - Beauty Pageants
people peinlicher schoenheitsfehler moderator kuert die falsche miss universe id,Beauty & Fitness - Beauty Pageants
people schweiz story waeren doch miss wahlen immer so sexy,Beauty & Fitness - Beauty Pageants
petra schurmann miss world winner,Beauty & Fitness - Beauty Pageants
pia wurtzbach miss universe,Beauty & Fitness - Beauty Pageants
polnische miss world,Beauty & Fitness - Beauty Pageants
pressinfo deutsche xxl miss pendant zur miss germany gewaehlt,Beauty & Fitness - Beauty Pageants
promis rolene strauss suedafrikanerin rolene strauss ist die neue miss world,Beauty & Fitness - Beauty Pageants
ratgeber miss germany spezial,Beauty & Fitness - Beauty Pageants
rolene strauss miss world,Beauty & Fitness - Beauty Pageants
schönheitskönigin lena,Beauty & Fitness - Beauty Pageants
schönheitskönigin mongolei,Beauty & Fitness - Beauty Pageants
schönheitswettbewerb kind,Beauty & Fitness - Beauty Pageants
schönheitswettbewerb kind deutschland,Beauty & Fitness - Beauty Pageants
stadtleben mister world germany,Beauty & Fitness - Beauty Pageants
stars schweiz interview das verdirbt der miss earth die laune,Beauty & Fitness - Beauty Pageants
thema miss wahlen es ist wie ein wettbewerb der beauty operationen,Beauty & Fitness - Beauty Pageants
transgender miss universe 2016,Beauty & Fitness - Beauty Pageants
vagina schonheitswettbewerb,Beauty & Fitness - Beauty Pageants
vagina schönheitswettbewerb,Beauty & Fitness - Beauty Pageants
verona feldbusch Schönheitskönigin,Beauty & Fitness - Beauty Pageants
was braucht man fur miss Germany,Beauty & Fitness - Beauty Pageants
was ist besser miss world oder miss universe,Beauty & Fitness - Beauty Pageants
wer ist die schoenste miss auf dieser earth,Beauty & Fitness - Beauty Pageants
Wie kann ich mich für miss Germany bewerben,Beauty & Fitness - Beauty Pageants
wie kann ich miss germany werden,Beauty & Fitness - Beauty Pageants
wie kann man miss germany werden,Beauty & Fitness - Beauty Pageants
wie werde ich miss germany,Beauty & Fitness - Beauty Pageants
wie wird man miss germany,Beauty & Fitness - Beauty Pageants
wie wird man mister germany,Beauty & Fitness - Beauty Pageants
a miss world gibraltar dunkelhaarige schoenheit slide,Beauty & Fitness - Beauty Pageants
achtung miss germany caroline,Beauty & Fitness - Beauty Pageants
anita buri laesst ihre miss schweiz zeit hinter sich anja mueller fiebert dagegen bei den aktuellen wahlen mit,Beauty & Fitness - Beauty Pageants
anita buri laesst ihre miss schweiz zeit hinter sich anja mueller fiebert dagegen bei den aktuellen wahlen mit img,Beauty & Fitness - Beauty Pageants
artikel miss germany,Beauty & Fitness - Beauty Pageants
diskussion beitraege die wahl zur miss germany,Beauty & Fitness - Beauty Pageants
diskussion beitraege miss germany,Beauty & Fitness - Beauty Pageants
diskussion beitraege miss world kommt aus der tuerkei,Beauty & Fitness - Beauty Pageants
f miss universe,Beauty & Fitness - Beauty Pageants
frage miss germany aufgabe,Beauty & Fitness - Beauty Pageants
leute falsche miss universe wird schauspielerin article,Beauty & Fitness - Beauty Pageants
lifestyle leute miss germany der makel der missen,Beauty & Fitness - Beauty Pageants
lifestyle leute miss germany ein ganz normaler schoenheitswahn,Beauty & Fitness - Beauty Pageants
lifestyle leute miss world die schoenste kommt aus island,Beauty & Fitness - Beauty Pageants
lifestyle leute miss world groesse setzt sich durch,Beauty & Fitness - Beauty Pageants
lifestyle leute neue miss germany berlinerin will deutschland ein gesicht geben,Beauty & Fitness - Beauty Pageants
magazin news detail site miss mr germany gesucht jetzt bewerben,Beauty & Fitness - Beauty Pageants
magazin news detail site mister germany das finale,Beauty & Fitness - Beauty Pageants
china miss world wettbewerb ohne miss kanada warum anastasia lin nicht nach china einreisen darf a,Beauty & Fitness - Beauty Pageants
die schonsten frauen deutschlands auf dem cebit stand von pearl alle drei miss germanys von bis kommen am marz nach hannover bild,Beauty & Fitness - Beauty Pageants
dr mika dan miss universe,Beauty & Fitness - Beauty Pageants
erlebnis sport miss germany wahl,Beauty & Fitness - Beauty Pageants
frankfurterin erfolgreich bei miss model of the world schonheitswettbewerb in china geli kamaci holt sensationellen platz bild,Beauty & Fitness - Beauty Pageants
gesellschaft halbjapanerin ariana miyamoto miss universe wahl,Beauty & Fitness - Beauty Pageants
leute ex miss world petra schuermann ist tot,Beauty & Fitness - Beauty Pageants
lifestyle leute miss germany jury warum entscheiden diese maenner wer die schoenste ist,Beauty & Fitness - Beauty Pageants
lifestyle leute miss universe gastgeber kuert falsche kandidatin zur schoensten frau des universums,Beauty & Fitness - Beauty Pageants
lifestyle leute miss world wahl auch die zweitschoenste faellt aus,Beauty & Fitness - Beauty Pageants
ab wann darf man sich ein bauchnabelpiercing stechen lassen,Beauty & Fitness - Body Art
bauchnabelpiercing nochmal stechen lassen,Beauty & Fitness - Body Art
bauchnabelpiercing stechen lassen,Beauty & Fitness - Body Art
bauchnabelpiercing stechen lassen nach blinddarm op,Beauty & Fitness - Body Art
frage ab wann kann ich mir ohne erlaubnis der eltern einen bauchnabelpiercing stechen lassen,Beauty & Fitness - Body Art
frage ab wie viel jahren darf man sich in oesterreich ein bauchnabelpiercing stechen lassen,Beauty & Fitness - Body Art
frage bauchnabelpiercing ausgeleiert trotzdem neuen schmuck oder neu stechen lassen,Beauty & Fitness - Body Art
frage bauchnabelpiercing beim arzt stechen lassen,Beauty & Fitness - Body Art
frage ich wuerde mir ein bauchnabelpiercing stechen lassen wie viel kostet es ungefaehr und ist der scherz sehr stark,Beauty & Fitness - Body Art
frage wieviel kostet es ein bauchnabelpiercing stechen zu lassen,Beauty & Fitness - Body Art
wann bauchnabelpiercing stechen lassen,Beauty & Fitness - Body Art
wie teuer ist bauchnabelpiercing stechen lassen,Beauty & Fitness - Body Art
bester realistic tätowierer deutschlands,Beauty & Fitness - Body Art
bester tätowierer deutschlands,Beauty & Fitness - Body Art
a bodypainting festival menschliche leinwaende,Beauty & Fitness - Body Art
BODYPAINTING,Beauty & Fitness - Body Art
bodypainting erfahrungsbericht,Beauty & Fitness - Body Art
bodypainting farbe selber machen,Beauty & Fitness - Body Art
bodypainting für schwangere selber machen,Beauty & Fitness - Body Art
erfahrungsberichte bodypainting tipps tricks,Beauty & Fitness - Body Art
frage bodypainting farben kaufen,Beauty & Fitness - Body Art
frage bodypainting mit wasserfarben,Beauty & Fitness - Body Art
frage wo bekommt man bodypainting farbe,Beauty & Fitness - Body Art
kostenlose bilder von bodypainting frauen,Beauty & Fitness - Body Art
models weiblich für bodypainting gesucht,Beauty & Fitness - Body Art
bodypainting model gesucht münchen,Beauty & Fitness - Body Art
bodypainting unzensiert,Beauty & Fitness - Body Art
frage wo kann man brandings machen lassen,Beauty & Fitness - Body Art
archiv dienstleistungen painful steel tattoo piercingstudio berlin,Beauty & Fitness - Body Art
gutes piercingstudio berlin billig,Beauty & Fitness - Body Art
blut und eisen piercingstudio berlin,Beauty & Fitness - Body Art
erfahrungsberichte blut und eisen piercingstudio berlin,Beauty & Fitness - Body Art
3 tattoo bilder blummen selbst gemald,Beauty & Fitness - Body Art
agyptische schriftzeichen als tattoos bilder,Beauty & Fitness - Body Art
bauch tattoo frau bilder,Beauty & Fitness - Body Art
beeindruckende tattoos die narben abdecken beruhrende bilder,Beauty & Fitness - Body Art
bilder sehr geniale tattoos,Beauty & Fitness - Body Art
bilder sexy frauen tattoo,Beauty & Fitness - Body Art
bilder tattoo sprüche unterarm,Beauty & Fitness - Body Art
bilder von selbstgemalten tattoos,Beauty & Fitness - Body Art
die schönsten haut tattoos bilder,Beauty & Fitness - Body Art
drachen tattoos bilder,Beauty & Fitness - Body Art
Eheringe Tattoo Bilder,Beauty & Fitness - Body Art
fußgelenk tattoo bilder,Beauty & Fitness - Body Art
henna tattoo bilder am Arsch,Beauty & Fitness - Body Art
intim tattoo bilder für männer,Beauty & Fitness - Body Art
Japan Tattoo bilder Oberarm,Beauty & Fitness - Body Art
japanese tattoos japanische schriftzeichen tattoo bilder tattoovorlage,Beauty & Fitness - Body Art
kelten tattoos bilder,Beauty & Fitness - Body Art
keltische zeichen symbole tattoos und tattoo bilder towierungen,Beauty & Fitness - Body Art
löwen tattoos bilder,Beauty & Fitness - Body Art
maori tattoo bedeutung vorlagen zeichen tribal motive bilder,Beauty & Fitness - Body Art
pages bilder von frauen und mannern mit tattoos,Beauty & Fitness - Body Art
Partner Tattoos Bilder,Beauty & Fitness - Body Art
rücken tattoos bilder,Beauty & Fitness - Body Art
schmetterling tattoos bilder,Beauty & Fitness - Body Art
schonen text für brust tattoo frau bilder,Beauty & Fitness - Body Art
schriftzug tattoo bilder,Beauty & Fitness - Body Art
Schulter Tattoo Bilder,Beauty & Fitness - Body Art
sternzeichen tattoo vorlagen bilder,Beauty & Fitness - Body Art
style die heftigsten bilder von der tattoo expo,Beauty & Fitness - Body Art
tattoo bilder engel,Beauty & Fitness - Body Art
tattoo bilder frauen oberschenkel,Beauty & Fitness - Body Art
tattoo bilder im rücken klein,Beauty & Fitness - Body Art
Tattoo Bilder Oberarm Männer,Beauty & Fitness - Body Art
Tattoo Elfen Bilder,Beauty & Fitness - Body Art
traumfänger tattoos bilder,Beauty & Fitness - Body Art
tribal tattoo mit anderen bildern einbauen,Beauty & Fitness - Body Art
verbotene tattoos bilder,Beauty & Fitness - Body Art
verrückte tattoo bilder,Beauty & Fitness - Body Art
vorher nachher tattoos bilder steißbein,Beauty & Fitness - Body Art
wikinger tattoo bilder krieger motive vorlagen,Beauty & Fitness - Body Art
zeichen drachen tattoos bedeutung tattoo bilder vorlagen on picture,Beauty & Fitness - Body Art
a bilder des jahres tattoo,Beauty & Fitness - Body Art
berglöwe tattoos bilder,Beauty & Fitness - Body Art
bilder etwas andere tattoos,Beauty & Fitness - Body Art
bilder gecko tattoo,Beauty & Fitness - Body Art
bilder geniale tattoos von jesse smith,Beauty & Fitness - Body Art
bilder schweinische tattoos,Beauty & Fitness - Body Art
bilder serie horror tattoo lachender buddha,Beauty & Fitness - Body Art
bilder tattoo Ägypten scarabeus,Beauty & Fitness - Body Art
bilder tattoo oberschenkel,Beauty & Fitness - Body Art
bilder tattoo silberhaut,Beauty & Fitness - Body Art
bilder tattoos fledermäuse,Beauty & Fitness - Body Art
bilder tattoos mit superhelden,Beauty & Fitness - Body Art
bilder total verrueckte und grauenhafte tattoos,Beauty & Fitness - Body Art
bilder verrueckte affen tattoos,Beauty & Fitness - Body Art
bilder versaute tattoos,Beauty & Fitness - Body Art
bilder von kleinen tattoos,Beauty & Fitness - Body Art
bilder von tattoos hinterm Ohr,Beauty & Fitness - Body Art
Bilder von Tattoos mit Engeln,Beauty & Fitness - Body Art
bilder zu heiße tattoo girls und bikes,Beauty & Fitness - Body Art
blumen und pflanze tattoo bilder,Beauty & Fitness - Body Art
böhse onkelz tattoo bilder,Beauty & Fitness - Body Art
Buchstaben Tattoo Handgelenk Bilder,Beauty & Fitness - Body Art
ein paar tattoo bilder,Beauty & Fitness - Body Art
Elfen Bilder Tattoo,Beauty & Fitness - Body Art
entzündung tattoo bilder,Beauty & Fitness - Body Art
frage tattoo kosten mit bildern,Beauty & Fitness - Body Art
fußballer tattoos bilder,Beauty & Fitness - Body Art
handgelenk tattoo bilder für frauen,Beauty & Fitness - Body Art
kelten tattoos bilder frauen im intimbereich,Beauty & Fitness - Body Art
liegende acht tattoo bilder,Beauty & Fitness - Body Art
lustige bilder alte leute und tattoos,Beauty & Fitness - Body Art
lustige bilder smirnoff tattoo,Beauty & Fitness - Body Art
partnerschafts tattoos bilder,Beauty & Fitness - Body Art
tattoo bilder asien karte,Beauty & Fitness - Body Art
tattoo bilder blumen fuß,Beauty & Fitness - Body Art
tattoo bilder elfen feen,Beauty & Fitness - Body Art
tattoo bilder fisch karpfen,Beauty & Fitness - Body Art
Tattoo Bilder Fusskette,Beauty & Fitness - Body Art
tattoo bilder mit schuhe oder herzen,Beauty & Fitness - Body Art
tattoo bilder schlange,Beauty & Fitness - Body Art
tattoo bilder sterne blumen,Beauty & Fitness - Body Art
tattoo für frauen bilder,Beauty & Fitness - Body Art
tattoos bilder männer,Beauty & Fitness - Body Art
tattoos bilder Stern,Beauty & Fitness - Body Art
tattoos im nacken bilder,Beauty & Fitness - Body Art
tattoos oberarm männer bilder,Beauty & Fitness - Body Art
tattoos von fussballern Bilder,Beauty & Fitness - Body Art
tattoos zur geburt bilder,Beauty & Fitness - Body Art
beauty und wellness piercing tattoo tattoo richtig pflegen id,Beauty & Fitness - Body Art
frage frisches tattoo wie pflegen,Beauty & Fitness - Body Art
frage neues gestochenes tattoo richtig pflegen,Beauty & Fitness - Body Art
frage tattoo am schluesselbein wie pflegen und tuts sehr weh,Beauty & Fitness - Body Art
frage tattoo richtig pflegen,Beauty & Fitness - Body Art
frage wie lange muss man ein tattoo pflegen,Beauty & Fitness - Body Art
frische tattoos pflegen,Beauty & Fitness - Body Art
vaseline für tattoo pflegen,Beauty & Fitness - Body Art
wie tattoo richtig pflegen,Beauty & Fitness - Body Art
frage wochen altes tattoo mit babyoel pflegen,Beauty & Fitness - Body Art
frage wwas ist die beste art ein frisches tattoo zu pflegen,Beauty & Fitness - Body Art
frische tattoos richtig pflegen,Beauty & Fitness - Body Art
tattoo pflegen neu,Beauty & Fitness - Body Art
wie kommen die tattoobilder auf die haut,Beauty & Fitness - Body Art
tattoobilder für Familie,Beauty & Fitness - Body Art
15.000 kostenlose Tattoovorlagen,Beauty & Fitness - Body Art
archiv forum th tattoovorlagen auch selbst gezeichnet,Beauty & Fitness - Body Art
einfache tattoovorlagen blumen,Beauty & Fitness - Body Art
einfache tattoovorlagen liebezum selbermachen,Beauty & Fitness - Body Art
Elfen Tattoovorlagen,Beauty & Fitness - Body Art
frage auf welcher internetseite kann ich mir kostenlos tattoovorlagen ansehen,Beauty & Fitness - Body Art
hebräische tattoovorlagen,Beauty & Fitness - Body Art
leichte tattoovorlagen,Beauty & Fitness - Body Art
maori tattoovorlagen und bedeutung,Beauty & Fitness - Body Art
nacken tattoovorlagen,Beauty & Fitness - Body Art
tattoovorlagen handgelenk sprüche,Beauty & Fitness - Body Art
tattoovorlagen herz mit buchstaben,Beauty & Fitness - Body Art
tattoovorlagen ideen Vater und Sohn,Beauty & Fitness - Body Art
Tattoovorlagen indianer schwarz weiß,Beauty & Fitness - Body Art
