hennsler parodiert,Arts & Entertainment - Humor
Hitler Satire Bilder,Arts & Entertainment - Humor
hitler und blondie satire,Arts & Entertainment - Humor
hochzeit sketch,Arts & Entertainment - Humor
Huckleberry Finn~ Satire,Arts & Entertainment - Humor
hunger games parodie,Arts & Entertainment - Humor
instagram reichtum parodie n,Arts & Entertainment - Humor
ITV Sketch Series,Arts & Entertainment - Humor
jacobi and mckellen sitcom,Arts & Entertainment - Humor
jan böhmermann fler parodie,Arts & Entertainment - Humor
juliensblog schmink boss diss oder parodie video,Arts & Entertainment - Humor
justin bieber eenie meenie parodie,Arts & Entertainment - Humor
kinder parodie,Arts & Entertainment - Humor
kleinanzeigen sonstiges in gemeinschaft silvestergala feuerwerk der travestie a,Arts & Entertainment - Humor
krasicki satiren,Arts & Entertainment - Humor
kultur buecher parodie des bestsellers erschienen bridget jones im altersheim,Arts & Entertainment - Humor
kultur buecher prozesse parodie auf vom winde verweht darf verlegt werden,Arts & Entertainment - Humor
kultur buecher rezas ihre version des spiels boese persiflage auf den erbarmungslosen literaturbetrieb,Arts & Entertainment - Humor
kultur buecher verarschung parodie auf die millennium trilogie,Arts & Entertainment - Humor
kultur film star aus king of queens kevin james bekommt neue sitcom,Arts & Entertainment - Humor
kultur film zimmer kueche sarg eine parodie auf den vampirfilm,Arts & Entertainment - Humor
kultur musik adele lustige parodien zu hello von den muppets und matthew mcconaughey,Arts & Entertainment - Humor
kultur tv cougar town us sitcom schmiert auch bei prosieben ab,Arts & Entertainment - Humor
längste sitcom,Arts & Entertainment - Humor
lieder parodien deutsch,Arts & Entertainment - Humor
life first kiss parodie jetzt machens auch die playmates id,Arts & Entertainment - Humor
life frivole parodie aufs knutsch video nach first kiss gibts first handjob id,Arts & Entertainment - Humor
lifestyle leute carolin kebekus video wie bloed du bist danke fuer diese grossartige parodie,Arts & Entertainment - Humor
lifestyle leute helene fischer fans sind sauer auf carolin kebekus wegen parodie beim comedy preis,Arts & Entertainment - Humor
lifestyle leute justin bieber parodie auf seine calvin klein werbung,Arts & Entertainment - Humor
lifestyle leute kim kardashian so parodiert das netz ihr nacktfoto,Arts & Entertainment - Humor
lifestyle unterhaltung deutscher comedy preis heute abend im live streamfree tv online oder als wiederholungen in der mediathek rtl now schauen a,Arts & Entertainment - Humor
männer im supermarkt satire,Arts & Entertainment - Humor
mediathek video sendungen comedy video der grosse karnevalszug live aus duesseldorf,Arts & Entertainment - Humor
medien bor is baecker ist auch die parodie auf boris beckers buch inszeniert,Arts & Entertainment - Humor
medien manonthemoon weihnachts werbespot von john lewis internet parodien ueber adolf hitler auf dem mond,Arts & Entertainment - Humor
medien parodie accounts twitter diese tweets strapazieren die lachmuskeln,Arts & Entertainment - Humor
medien steffen lukas helene fischer wirbel um atemlos parodie,Arts & Entertainment - Humor
meldungen adam levine er beweist humor bei musik parodie,Arts & Entertainment - Humor
meldungen angela merkel selfie mit nationalmannschaft vom zdf parodiert,Arts & Entertainment - Humor
meldungen ellen degeneres das bombshell deutschland parodie mir sofia vergara,Arts & Entertainment - Humor
nachrichten live hoersaal comedy zum lachen in die uni gehen,Arts & Entertainment - Humor
nachrichten radio comedy wdr lachen live die ganze wahrheit geht wieder auf tour,Arts & Entertainment - Humor
Oscar Wilde satire,Arts & Entertainment - Humor
papst benedikt satire,Arts & Entertainment - Humor
Parodie auf Donald Trump Johnny Depp,Arts & Entertainment - Humor
Parodie auf Erdogan von dieter halervorden,Arts & Entertainment - Humor
parodie auf pikachu,Arts & Entertainment - Humor
Persiflage Schiller,Arts & Entertainment - Humor
quatsch comedy club - die live show - mit david anschütz gymmick jacqueline feldmann und matthias jung moderation: ole lehmann 24. märz,Arts & Entertainment - Humor
satire alte menschen,Arts & Entertainment - Humor
Schichtleiter satire,Arts & Entertainment - Humor
schmäh satire,Arts & Entertainment - Humor
schwarzerhumor satire,Arts & Entertainment - Humor
schweizer minister satire,Arts & Entertainment - Humor
seinfeld sitcom,Arts & Entertainment - Humor
Shrek Satire,Arts & Entertainment - Humor
t eine nette persiflage,Arts & Entertainment - Humor
Travestie in Hamburg,Arts & Entertainment - Humor
tv der deutsche comedy preis tv live stream rtl now mediathek raab gewinner nominierungen carolin kebekus wiederholung online,Arts & Entertainment - Humor
tv der rtl comedy grand prix uhr im tv online geissen live stream wiederholung mirja boes kaya yanar paul panzer oliver,Arts & Entertainment - Humor
tv heute show zdf mediathek live stream wiederholung sendetermine start neue folgen oliver welke comedy nachrichten,Arts & Entertainment - Humor
tv stern tv rtl der wixxer edgar wallace persiflage kommt in die kinos,Arts & Entertainment - Humor
unicorn sketch,Arts & Entertainment - Humor
video babewatch allysin chaynes blonde im freien offentlichen gesichts parodie,Arts & Entertainment - Humor
video brady bunch parodie erwirbt aus,Arts & Entertainment - Humor
video ich bin so schwanger iggy azalea fancy parodie mit schwangeren frauen v,Arts & Entertainment - Humor
videos carolin kebekus co live beste deutsche comedy mitternachtsspitzen extrem lustig tmiexwkgmk,Arts & Entertainment - Humor
wdr kebekus parodiert petri,Arts & Entertainment - Humor
weihnachtslieder parodie text,Arts & Entertainment - Humor
werbung parodiert,Arts & Entertainment - Humor
wiener dog sketch,Arts & Entertainment - Humor
Witze Satire,Arts & Entertainment - Humor
Zdf neo royal satire Gedicht,Arts & Entertainment - Humor
zdf satire böhmermann,Arts & Entertainment - Humor
zuhair murad sketches,Arts & Entertainment - Humor
2 Minions 2015 Film Online Schauen,Arts & Entertainment - Movies
3 Transformers legend,Arts & Entertainment - Movies
ab welchem alter kann man fluch der karibik sehen,Arts & Entertainment - Movies
ähnliche filme wie herr der ringe,Arts & Entertainment - Movies
alle fluch der karibik teile,Arts & Entertainment - Movies
allgemeine foren musik filme literatur und kunst die james bond debatte bond reihe,Arts & Entertainment - Movies
alte filme in berliner kinos,Arts & Entertainment - Movies
altersfreigabe fluch der karibik,Arts & Entertainment - Movies
angebot buch zum film minions,Arts & Entertainment - Movies
arnold schwarzenegger terminator 2,Arts & Entertainment - Movies
Avatar - Aufbruch Nach Pandora,Arts & Entertainment - Movies
avatar aufbruch nach pandora drehbuch kostenlos downloaden,Arts & Entertainment - Movies
Avatar Aufbruch nach Pandora heute im kino in berlin,Arts & Entertainment - Movies
beliebtheitsskala james bond,Arts & Entertainment - Movies
bern aktuell weltpremiere james bond,Arts & Entertainment - Movies
beste buchverfilmung herr der ringe,Arts & Entertainment - Movies
bildergalerie die coolsten james bond gadgets aller filme galerie,Arts & Entertainment - Movies
bildergalerie james bond casino royale deutschlandpremiere,Arts & Entertainment - Movies
blackbeard fluch der karibik,Arts & Entertainment - Movies
blog the dark knight rises online im stream ansehen heute auf rtl im tv,Arts & Entertainment - Movies
christoph waltz james bond 25,Arts & Entertainment - Movies
cool neuer trailer zu fluch der karibik,Arts & Entertainment - Movies
Der beliebteste Film in dem Johnny Depp mitspielt ist Fluch der Karibik.,Arts & Entertainment - Movies
Der Fluch der Karibik,Arts & Entertainment - Movies
der Fluch der Karibik fremde gezeiten stream,Arts & Entertainment - Movies
die letzte nacht der titanic dvd test,Arts & Entertainment - Movies
dokumentarfilm james cameron praesentiert die bismarck geheimnisvolle expedition zur deutschen titanic dvd,Arts & Entertainment - Movies
dvd cover james bond man lebt nur zweimal,Arts & Entertainment - Movies
dvd covers avatar aufbruch nach pandora german disc,Arts & Entertainment - Movies
dvd covers untergang der titanic german disc,Arts & Entertainment - Movies
dvd filme james bond der mann mit dem goldenen colt,Arts & Entertainment - Movies
dvd filme james bond der spion der mich liebte,Arts & Entertainment - Movies
dvd filme james bond die welt ist nicht genug,Arts & Entertainment - Movies
dvd filme james bond im geheimdienst ihrer majestaet,Arts & Entertainment - Movies
DVD MINIONS,Arts & Entertainment - Movies
DVD TITANIC,Arts & Entertainment - Movies
enya herr der ringe,Arts & Entertainment - Movies
erfahrungsberichte fluch der karibik dvd,Arts & Entertainment - Movies
erscheinung james bond spectre dvd,Arts & Entertainment - Movies
erscheinungsdatum james bond spectre bluray,Arts & Entertainment - Movies
fakten herr der ringe n,Arts & Entertainment - Movies
fernsehen live stream com james bond spectre deutsch online anschauen kostenlos,Arts & Entertainment - Movies
film die minions film kritik inhalt charaktere alle fakten zum minions kinofilm namen sprache trailer,Arts & Entertainment - Movies
film ich einfach unverbesserlich gewinnspiel fanpakete mit minions zu gewinnen,Arts & Entertainment - Movies
film im cast fluch der karibik paul mccartney ist mit an bord,Arts & Entertainment - Movies
film javier bardem dreharbeiten zu fluch der karibik haben begonnen,Arts & Entertainment - Movies
filme in berliner kinos,Arts & Entertainment - Movies
frage ab wie viel jahren ist avatar aufbruch nach pandora,Arts & Entertainment - Movies
frage altersbeschraenkung batman the dark knight rises,Arts & Entertainment - Movies
frage avatar aufbruch nach pandora fsk,Arts & Entertainment - Movies
frage batman the dark knight rises ende unklar,Arts & Entertainment - Movies
frage batman the dark knight rises frage zum film,Arts & Entertainment - Movies
frage batman the dark knight rises schauen,Arts & Entertainment - Movies
frage filme wie avatar aufbruch nach pandora,Arts & Entertainment - Movies
frage filme wie james bond batman usw nur mit killer frauen,Arts & Entertainment - Movies
frage fluch der karibik altersbeschraenkung,Arts & Entertainment - Movies
frage fluch der karibik am ende der welt,Arts & Entertainment - Movies
frage fortsetzung von avatar aufbruch nach pandora,Arts & Entertainment - Movies
frage fortsetzung von the dark knight rises batman,Arts & Entertainment - Movies
frage frage zu einer szene bei avatar aufbruch nach pandora,Arts & Entertainment - Movies
frage frage zum film avatar aufbruch nach pandora,Arts & Entertainment - Movies
frage fragen zu james bond spectre,Arts & Entertainment - Movies
frage in welchem caffee wurde the dark knight rises gedreht,Arts & Entertainment - Movies
frage kann man den neuen minions film auch ohne gute deutschkenntnisse schauen und verstehen,Arts & Entertainment - Movies
frage kann man der hobbit guckenohne herr der ringe gesehen zu haben,Arts & Entertainment - Movies
frage kann man die gelben minions von ich einfach unverbesserlich der film kaufen,Arts & Entertainment - Movies
frage kann man im internet legal der herr der ringe die gefaehrten anschauen,Arts & Entertainment - Movies
frage kennt ihr aehnliche filme wie fluch der karibik,Arts & Entertainment - Movies
frage kennt jemand aehnliche filme wie avatar aufbruch nach pandora,Arts & Entertainment - Movies
frage muss man die anderen james bond filme gesehen haben um skyfall sehen zu koennen,Arts & Entertainment - Movies
frage muss man fuer den spectre film von james bond die alten teile gesehen haben,Arts & Entertainment - Movies
frage muss man skyfall gesehen haben um die handlung des neuen james bond spectre zu verstehen,Arts & Entertainment - Movies
frage serie wie hobbit oder herr der ringe,Arts & Entertainment - Movies
frage sind die fluch der karibik filme gut,Arts & Entertainment - Movies
frage sollte ich fluch der karibik sehen,Arts & Entertainment - Movies
frage solltet man bevor man den hobbit schaut herr der ringe sehen,Arts & Entertainment - Movies
frage stunts von fluch der karibik kaptain jack sparrow,Arts & Entertainment - Movies
frage the dark knight rises bane deutsche synchronstimme,Arts & Entertainment - Movies
frage was sind die minions ich einfach unverbesserlich,Arts & Entertainment - Movies
frage wie fandet ihr den neuen james bond film spectre,Arts & Entertainment - Movies
frage wie findet ihr den film avatar aufbruch nach pandora besser als titanik,Arts & Entertainment - Movies
frage wie findet ihr den film avatar aufbruch nach pandora von james cameron,Arts & Entertainment - Movies
frage wie findet ihr es dass im fluch der karibik penelope cruz mitmacht,Arts & Entertainment - Movies
frage wie heisst der neue james bond film,Arts & Entertainment - Movies
frage wie heisst der schottische james bond,Arts & Entertainment - Movies
frage wie heisst dieser neue minions film der jetzt im kino laeuft,Arts & Entertainment - Movies
frage wie viel dollar euro brachte der film avatar aufbruch nach pandora jetzt genau ein,Arts & Entertainment - Movies
frage wie viele oscars hat der film avatar aufbruch nach pandora bekommen,Arts & Entertainment - Movies
frage wird es einen neuen batman teil nach the dark knight rises geben,Arts & Entertainment - Movies
frage wo kann ich gucken was ist los mit bobmega stream nicht zu finden aber auch kein kinoto,Arts & Entertainment - Movies
frage wo kann man den film avatar aufbruch nach pandora gratis online sehen,Arts & Entertainment - Movies
frage wo kann man the dark knight rises kostenlos ansehen abgesehen von kinoxto moviek und kinokiste,Arts & Entertainment - Movies
fsk fluch der karibik,Arts & Entertainment - Movies
Gute filme im Stil von Herr der ringe,Arts & Entertainment - Movies
Harry Potter und die heiligtümer des todes harry,Arts & Entertainment - Movies
harry potter und die heiligtümer des todes nicht verwendete szenen,Arts & Entertainment - Movies
Harry Potter und die heiligtumer des Todes Teil 2 deutsch Stream,Arts & Entertainment - Movies
hebt die titanic dvd test,Arts & Entertainment - Movies
Herr der Der Ringe,Arts & Entertainment - Movies
Herr der Ringe - Der Krieg im Norden,Arts & Entertainment - Movies
herr der ringe 1 ganzer film stream,Arts & Entertainment - Movies
im auftrag ihrer majestat james bond und der eurospy film peter osteried,Arts & Entertainment - Movies
Iron Man 3 Film Ansehen,Arts & Entertainment - Movies
iron man 3 ganzer film deutsch youtube,Arts & Entertainment - Movies
Iron man 3 kickass,Arts & Entertainment - Movies
James Bond - Daniel Craig 4-Pack DVD,Arts & Entertainment - Movies
James Bond - Live and Let Die Ultimate Edition 2 Disc Set DVD,Arts & Entertainment - Movies
James Bond - Moonraker Ultimate Edition 2 Disc Set DVD,Arts & Entertainment - Movies
James Bond - Thunderball Ultimate Edition 2 Disc Set DVD 1965,Arts & Entertainment - Movies
JAMES BOND 007,Arts & Entertainment - Movies
James Bond 007 - Alles oder nichts,Arts & Entertainment - Movies
johnny depp beendet dreharbeiten fluch der karibik,Arts & Entertainment - Movies
johnny depp fluch der karibik,Arts & Entertainment - Movies
johnny depp fluch der karibik planung,Arts & Entertainment - Movies
kino avatar aufbruch nach pandora,Arts & Entertainment - Movies
kino film avatar day aufbruch nach pandora ausschn,Arts & Entertainment - Movies
kino film janoschs komm wir finden einen schatz,Arts & Entertainment - Movies
kino fluch der karibik es wird gedreht,Arts & Entertainment - Movies
kino fluch der karibik fremde gezeiten on stranger tides das sind die tollen neuen plakate,Arts & Entertainment - Movies
kino fluch der karibik mit paul mccartney,Arts & Entertainment - Movies
kino fluch der karibik wer spielt mit depp,Arts & Entertainment - Movies
kino in der herr der ringe die gefaehrten,Arts & Entertainment - Movies
kino in der herr der ringe die zwei tuerme,Arts & Entertainment - Movies
kino neuerscheinungen märz 2016,Arts & Entertainment - Movies
kinoprogramm für kinder hamburg,Arts & Entertainment - Movies
Kinoprogramm Hamburg Kinderfilme,Arts & Entertainment - Movies
Kinos in berlin,Arts & Entertainment - Movies
kleine kinos in berlin,Arts & Entertainment - Movies
kommentare zu testbericht james bond casino royale,Arts & Entertainment - Movies
kommt ein fluch der karibik 5 raus,Arts & Entertainment - Movies
kultur film christian bale in the dark knight rises batman verzweifelte an seinem kostuem,Arts & Entertainment - Movies
kultur film dreharbeiten zu the dark knight rises anne hathaway macht sich ueber batman lustig,Arts & Entertainment - Movies
kultur film kinostart von the dark knight rises abschied eines helden,Arts & Entertainment - Movies
Martin Freeman herr der ringe,Arts & Entertainment - Movies
media poster der herr der ringe die gefaehrten,Arts & Entertainment - Movies
media poster der herr der ringe die rueckkehr des koenigs,Arts & Entertainment - Movies
media poster der herr der ringe die zwei tuerme,Arts & Entertainment - Movies
michael dorn in transformers 3,Arts & Entertainment - Movies
motive welt des films fluch der karibik,Arts & Entertainment - Movies
Movie 4k Minions,Arts & Entertainment - Movies
Movie4k harry potter und die heiligtumer des todes,Arts & Entertainment - Movies
nachrichten das ist die neue uhr von james bond im film spectre,Arts & Entertainment - Movies
nachrichten die james bond woche bei rtl daniel craig feiert mit skyfall rtl premiere,Arts & Entertainment - Movies
nachrichten die minions sind los super rtl zeigt zum kinostart des sommerblockbusters ein grosses special zum film sendedatum sonntag juni um uhr,Arts & Entertainment - Movies
Nächster James Bond Film,Arts & Entertainment - Movies
namen von herr der ringe gondorrim,Arts & Entertainment - Movies
news bilder der harry potter komplettbox und der harry potter und die heiligtumer des todes teil steelbook blu ray disc,Arts & Entertainment - Movies
news harry potter und die heiligtumer des todes als ultimate editions auf blu ray disc,Arts & Entertainment - Movies
news minions als steelbook dreier box auf blu ray disc,Arts & Entertainment - Movies
news minions und weitere blu ray neuheiten reduziert bei amazon,Arts & Entertainment - Movies
news the dark knight rises knackt die milliarden grenze,Arts & Entertainment - Movies
news warner harry potter und die heiligtumer des todes teil ab auf blu ray disc dvd,Arts & Entertainment - Movies
orlando bloom fluch der karibik,Arts & Entertainment - Movies
paul mccartney gastrolle fluch der karibik,Arts & Entertainment - Movies
Pirates Of The Caribbean - Fluch Der Karibik,Arts & Entertainment - Movies
s james bond der mann mit dem goldenen colt stream,Arts & Entertainment - Movies
sätze aus fluch der karibik 3,Arts & Entertainment - Movies
Schauspieler Fluch der Karibik,Arts & Entertainment - Movies
schauspieler john connor terminator 2,Arts & Entertainment - Movies
serien der herr der ringe,Arts & Entertainment - Movies
serien fluch der karibik staffel,Arts & Entertainment - Movies
skyfall daniel craig james bond neue bilder,Arts & Entertainment - Movies
sp james bond in toedlicher mission englisch poster i,Arts & Entertainment - Movies
SPECTRE JAMES BOND,Arts & Entertainment - Movies
spectre james bond craig gegen waltz,Arts & Entertainment - Movies
sub Die Top 25 Kinofilme in den Kinos in Berlin,Arts & Entertainment - Movies
sub kinos in berlin,Arts & Entertainment - Movies
tag damien walters james bond sky fall,Arts & Entertainment - Movies
Terminator 2 - Tag Der Abrechnung,Arts & Entertainment - Movies
terminator 2 film deutsch,Arts & Entertainment - Movies
terminator 2 ganzer film deutsch,Arts & Entertainment - Movies
the dark knight rises deutsch ganzer film movie2k,Arts & Entertainment - Movies
The Dark Knight Rises movie4k deutsch,Arts & Entertainment - Movies
The James Bond Collection Alle 23 Filme inkl. Leerplatz für Spectre 24 Discs Blu-ray,Arts & Entertainment - Movies
Transformers 3 - Die Dunkle Seite Des Mondes,Arts & Entertainment - Movies
Transformers 3 Darsteller,Arts & Entertainment - Movies
Transformers 3 kostenlos schauen,Arts & Entertainment - Movies
tv sendungen fluch der karibik,Arts & Entertainment - Movies
tv sendungen the dark knight rises,Arts & Entertainment - Movies
untergang der titanic dvd test,Arts & Entertainment - Movies
unterhaltung kino id tid rl lightbox sid si foto show die groessten momente aus jahren james bond,Arts & Entertainment - Movies
unterhaltung kino id tid rl single lightbox poid james bond das sind die geheimnisse hinter spectre,Arts & Entertainment - Movies
unterhaltung kino id tid rl single lightbox poid james bond spectre dieser deutsche tritt gegen an,Arts & Entertainment - Movies
unterhaltung kino id tid rl single lightbox poid james bonds pistolen geheimnis sean connerys waffe war nicht echt,Arts & Entertainment - Movies
unterhaltung kino paul mccartney bekommt rolle in fluch der karibik bildmobile,Arts & Entertainment - Movies
unterschied herr der ringe dvd bluray,Arts & Entertainment - Movies
unterschied zwischen herr der ringe und hobbit,Arts & Entertainment - Movies
vanessa hudgens ashley tisdale fluch der karibik weltpremiere,Arts & Entertainment - Movies
vermischtes johnny depp drehbuch zu fluch der karibik aufgetaucht,Arts & Entertainment - Movies
video film der herr der ringe die gefaehrten,Arts & Entertainment - Movies
video minions deutsch,Arts & Entertainment - Movies
wann kommt terminator 2 im tv,Arts & Entertainment - Movies
was passiert in fluch der karibik 5,Arts & Entertainment - Movies
Wie kann ich Minions kostenlos schauen,Arts & Entertainment - Movies
wie viele teile herr der ringe gibt es,Arts & Entertainment - Movies
wp james bond im angesicht des todes,Arts & Entertainment - Movies
Wurde der James Bond Film auf Pilatus gedreht.,Arts & Entertainment - Movies
www filme stream net fluch der karibik am ende der welt,Arts & Entertainment - Movies
zitate fluch der karibik,Arts & Entertainment - Movies
1live annenmaykantereit,Arts & Entertainment - Music & Audio
2005 das Album Chris brown,Arts & Entertainment - Music & Audio
a musiklegende bill wyman rolling stones krebs,Arts & Entertainment - Music & Audio
ab wie vielen jahren ist das konzert von chris brown,Arts & Entertainment - Music & Audio
absolute kostenlose musik zum runterladen,Arts & Entertainment - Music & Audio
AFTERMATH ROLLING STONES,Arts & Entertainment - Music & Audio
aktuelle Musik legal kostenlos downloaden,Arts & Entertainment - Music & Audio
Aktuelle Top 100 Charts Deutschland,Arts & Entertainment - Music & Audio
aktuelles chris brown gesteht seine liebe zu rihanna video al,Arts & Entertainment - Music & Audio
album annenmaykantereit alles nix konkretes,Arts & Entertainment - Music & Audio
alles moegliche biete kostenlos ca musik schallplatten,Arts & Entertainment - Music & Audio
Alvin und die chipmunks musik kostenloser download,Arts & Entertainment - Music & Audio
amazon musik auf stereoanlage streamen,Arts & Entertainment - Music & Audio
app kostenlos musik hören ohne internet,Arts & Entertainment - Music & Audio
arena oberhausen revolverheld,Arts & Entertainment - Music & Audio
article kostenlose musik bei itunes eure tipps,Arts & Entertainment - Music & Audio
bands karten beatsteaks,Arts & Entertainment - Music & Audio
bands karten revolverheld,Arts & Entertainment - Music & Audio
beatsteaks konzert,Arts & Entertainment - Music & Audio
beatsteaks online hören,Arts & Entertainment - Music & Audio
beatsteaks ueber annenmaykantereit im interview,Arts & Entertainment - Music & Audio
beliebtesten musik apps offline hoeren kostenlos,Arts & Entertainment - Music & Audio
Benny Benassi & Chris Brown - Paradise,Arts & Entertainment - Music & Audio
benny benassi chris brown,Arts & Entertainment - Music & Audio
beste kostenlose musik app für windows,Arts & Entertainment - Music & Audio
Brown Chris Kiss Kiss,Arts & Entertainment - Music & Audio
charts 2016 deutschland zum herunterladen kaufen,Arts & Entertainment - Music & Audio
charts deutschland 2016,Arts & Entertainment - Music & Audio
charts deutschland orientalischer sound,Arts & Entertainment - Music & Audio
charts deutschland single,Arts & Entertainment - Music & Audio
christliche musik kostenlos runterladen,Arts & Entertainment - Music & Audio
community threads aussetzer beim streamen von musik vom macbook mit airplay,Arts & Entertainment - Music & Audio
computer wege um musik kostenlos zu streamen oder herunterzuladen,Arts & Entertainment - Music & Audio
Country Musik kostenlos herunterladen,Arts & Entertainment - Music & Audio
darf ich bei ps4 mit musik streamen,Arts & Entertainment - Music & Audio
ddr schallplatten von rolling stones,Arts & Entertainment - Music & Audio
descargar musica chris brown ft justin bieber,Arts & Entertainment - Music & Audio
descargar musica chris brown ft nicky mija,Arts & Entertainment - Music & Audio
deutsche musik download kostenlos,Arts & Entertainment - Music & Audio
die 100 größten rolling stones Songs,Arts & Entertainment - Music & Audio
downlaud kostenlos persisch musik,Arts & Entertainment - Music & Audio
download musik alben kostenlos,Arts & Entertainment - Music & Audio
eigene musik streamen,Arts & Entertainment - Music & Audio
eigene musik von handy streamen,Arts & Entertainment - Music & Audio
elektronische musik kostenlos downloaden,Arts & Entertainment - Music & Audio
empfehlungen für kostenlose musik downloader,Arts & Entertainment - Music & Audio
en annenmaykantereit barfuß am klavier lyrics,Arts & Entertainment - Music & Audio
en annenmaykantereit bitte bleib lyrics,Arts & Entertainment - Music & Audio
en annenmaykantereit das krokodil lyrics,Arts & Entertainment - Music & Audio
en annenmaykantereit es geht mir gut lyrics,Arts & Entertainment - Music & Audio
en annenmaykantereit jeden morgen lyrics,Arts & Entertainment - Music & Audio
