ACHAT POMPE KSB FILTRA N24-E,Arts & Entertainment - Broadcast & Network News
aktie dividendenriese rtl group wachstumstreiber deutschland gewinn verdoppelt,Arts & Entertainment - Broadcast & Network News
aktie medienkonzerne im analysten check prosiebensat media vs rtl group,Arts & Entertainment - Broadcast & Network News
aktie prosiebensat media ag die ziele sind erhoeht boersenwelt presseschau iv,Arts & Entertainment - Broadcast & Network News
aktie prosiebensat media aktie dreht nach analystenstimme auf allzeithoch im blick,Arts & Entertainment - Broadcast & Network News
aktie rtl group schlechte zahlen aktie unter druck,Arts & Entertainment - Broadcast & Network News
aktie rtl group ueberrascht positiv hoeheres kursziel,Arts & Entertainment - Broadcast & Network News
aktien prosiebensat media se wkn psm h,Arts & Entertainment - Broadcast & Network News
aktien und aktienhandel dax prosieben sat aktie prosiebensat media investiert in die zukunft fuer stetiges kurswachstum,Arts & Entertainment - Broadcast & Network News
analysen artikel boerse frankfurt news prosiebensat media se dax aufgenommen auswahlindizes,Arts & Entertainment - Broadcast & Network News
analysen artikel rtl group aktie marktbewertungen gesunken barclays reduziert kursziel aktienanalyse,Arts & Entertainment - Broadcast & Network News
ANDREJ GRABOWSKI – TV-Journalist und Talkshow-Experte Andrej Grabowski ist TV-Journalist und Experte für Talkshows. Er arbeitet für N24 und die Deutsche Welle. Andrej Grabowski leitete die Redaktion der Talkshow Absolute Mehrheit,Arts & Entertainment - Broadcast & Network News
artikel über nachrichtenagenturen,Arts & Entertainment - Broadcast & Network News
artikel zur bedeutung von nachrichtenagenturen,Arts & Entertainment - Broadcast & Network News
atlantiktunnel n24,Arts & Entertainment - Broadcast & Network News
bayern gymnasium fos deutsch klasse stegreifaufgabe kurzarbeit extemporalie nachrichtenagenturen boulevardzeitung feuilleton,Arts & Entertainment - Broadcast & Network News
bekomme kein n24 über Satellit rein,Arts & Entertainment - Broadcast & Network News
bereiche rtl group,Arts & Entertainment - Broadcast & Network News
Berlin ist der Sitz mehrerer regional und bundesweit sendender Rundfunkanstalten. Neben Fernsehsendern wie MTV Nickelodeon VIVA und Comedy Central N24 oder TV Berlin gibt es in Berlin eine große Anzahl von Privatradios darunter der erste deutsch-t,Arts & Entertainment - Broadcast & Network News
bilder woche fotos nachrichtenagenturen,Arts & Entertainment - Broadcast & Network News
branchen werbung marketing pr nachrichtensender al jazeera stellen,Arts & Entertainment - Broadcast & Network News
broder interview n24,Arts & Entertainment - Broadcast & Network News
content rai news nachrichtensender startet uncodiert astra,Arts & Entertainment - Broadcast & Network News
Der Erfolg der Tea Party lässt sich nicht nur durch die finanzielle Unterstützung erklären sondern auch durch die Unterstützung mancher Medien allen voran Fox News. Der konservative Nachrichtensender gilt als das Sprachrohr der Bewegung.,Arts & Entertainment - Broadcast & Network News
detail prosiebensat media neue nachrichten,Arts & Entertainment - Broadcast & Network News
die schlacht um moskau n24,Arts & Entertainment - Broadcast & Network News
dienste der nachrichtenagenturen,Arts & Entertainment - Broadcast & Network News
digital tv algerischer nachrichtensender dzair news neu auf hot bird ost,Arts & Entertainment - Broadcast & Network News
digital tv ard nachrichtenkanal tagesschau ndert programmschema am wochenende,Arts & Entertainment - Broadcast & Network News
digital tv astra ost nachrichtensender channels nigeria auf neuer frequenz,Arts & Entertainment - Broadcast & Network News
digital tv dvb t hd auch prosiebensat full hd auf k nftiger tv plattform von media broadcast,Arts & Entertainment - Broadcast & Network News
digital tv franz sischer nachrichtensender bfm tv startet hd ableger auf astra ost im free tv,Arts & Entertainment - Broadcast & Network News
digital tv franz sischer nachrichtensender i t l hd neu auf satellit astra ost free tv,Arts & Entertainment - Broadcast & Network News
digital tv frequenzwechsel des panafrikanischen nachrichtensender tvc news auf astraeutelsat,Arts & Entertainment - Broadcast & Network News
diskussion beitraege weltwirtschaftskrise chronik der nachrichtensendungen,Arts & Entertainment - Broadcast & Network News
diskussion dschungelcamp tv oder wie weit kann die rtl group von dem hype profitieren,Arts & Entertainment - Broadcast & Network News
dpa dgap dd prosiebensat media se deutsch,Arts & Entertainment - Broadcast & Network News
dtv n24,Arts & Entertainment - Broadcast & Network News
eineiige zwillinge mit verschiedenen väter n24,Arts & Entertainment - Broadcast & Network News
entertainment prosiebensat media se beruft jan frouman den vorstand,Arts & Entertainment - Broadcast & Network News
Epische Musik N24,Arts & Entertainment - Broadcast & Network News
exklusiv artikel commerzbank rtl group aktie anzeigenmarkt frankreich und fremantlemedia als schwachstellen abstufung aktienanalyse,Arts & Entertainment - Broadcast & Network News
exklusiv artikel dz bank rtl group aktie solide er zahlen hochstufung kursrueckgaengen aktienanalyse,Arts & Entertainment - Broadcast & Network News
exklusiv artikel goldman sachs rtl group aktie prognosen gesenkt reduziert kursziel aktienanalyse,Arts & Entertainment - Broadcast & Network News
exklusiv artikel hsbc rtl group aktie starkes werbegeschaeft deutschland raet zum kauf aktienanalyse,Arts & Entertainment - Broadcast & Network News
exklusiv artikel nord lb rtl group aktie geschaeftsjahreszahlen moderat positiv analyst bestaetigt anlagevotum aktienanalyse,Arts & Entertainment - Broadcast & Network News
exklusiv artikel prosiebensat media riskantes unterfangen,Arts & Entertainment - Broadcast & Network News
exklusiv artikel prosiebensat media steigt dax auf,Arts & Entertainment - Broadcast & Network News
exklusiv artikel rtl group aktie hat noch eine menge luft oben kaufen kursziel euro,Arts & Entertainment - Broadcast & Network News
exklusiv dax prosiebensat media aktie uebernahme von weg de und ferien de,Arts & Entertainment - Broadcast & Network News
fernsehen n24,Arts & Entertainment - Broadcast & Network News
fernsehprogramm bei n24 top,Arts & Entertainment - Broadcast & Network News
Fernsehsender n24 top,Arts & Entertainment - Broadcast & Network News
forum rtl group hohe dividende reicht das all t,Arts & Entertainment - Broadcast & Network News
forum sonstige nintendo konsolen wii nachrichtenkanal wie löschen,Arts & Entertainment - Broadcast & Network News
frage der beste deutsche nachrichtensender,Arts & Entertainment - Broadcast & Network News
frage englische nachrichtensendungen wie die tagesschau,Arts & Entertainment - Broadcast & Network News
frage franzoesischer nachrichtensender gesucht,Arts & Entertainment - Broadcast & Network News
frage gehoert tele zur prosiebensat media ag,Arts & Entertainment - Broadcast & Network News
frage ich suche nachrichtenagenturen die nur wahre also unmanipulierte artikelinformationen anbieten,Arts & Entertainment - Broadcast & Network News
frage kann man die nachrichtensender oder zeitungen wegen falsche information anzeigen,Arts & Entertainment - Broadcast & Network News
frage kein dvb t empfang bei den prosiebensat media sendern,Arts & Entertainment - Broadcast & Network News
frage merkmale nachrichtensendung,Arts & Entertainment - Broadcast & Network News
frage nachrichtensendung fake video als scherz,Arts & Entertainment - Broadcast & Network News
frage schuelerpraktikum bei einem nachrichtensender,Arts & Entertainment - Broadcast & Network News
frage sollten nachrichtensendungen atombombenaprilscherze machen,Arts & Entertainment - Broadcast & Network News
frage stimmt es dass deutsche nachrichtensender ntv nur das zeigen was die amis erlauben,Arts & Entertainment - Broadcast & Network News
frage unterschied nachrichtensendung bei privatsendern und oe rechtlichen,Arts & Entertainment - Broadcast & Network News
frage welcher nachrichtensender ist informativer bzw berichtet interessanterbesser ntv oder n,Arts & Entertainment - Broadcast & Network News
frage wie kann man englische nachrichtensendungen anschauen,Arts & Entertainment - Broadcast & Network News
gebrarene aubergine mit walnusscreme N24,Arts & Entertainment - Broadcast & Network News
geschichte der rtl-group,Arts & Entertainment - Broadcast & Network News
Heizungsliegen für katzen mit krone,Arts & Entertainment - Broadcast & Network News
ist n24 zu trauen,Arts & Entertainment - Broadcast & Network News
Kabel und Einstellungen für N24,Arts & Entertainment - Broadcast & Network News
kanal n24 nicht mehr auffindbar top,Arts & Entertainment - Broadcast & Network News
kathbl nachrichtenkanal,Arts & Entertainment - Broadcast & Network News
kein n24 über kabel,Arts & Entertainment - Broadcast & Network News
kleine welt n24,Arts & Entertainment - Broadcast & Network News
kommunikation unternehmenskommunikation pressearbeit nachrichtenagenturen rohstofflieferanten fuer die medien,Arts & Entertainment - Broadcast & Network News
konkurrenten der rtl-group,Arts & Entertainment - Broadcast & Network News
krieg im frieden n24,Arts & Entertainment - Broadcast & Network News
kultur film tv geschichte die mutter aller nachrichtensendungen,Arts & Entertainment - Broadcast & Network News
kultur medien nachrichtenagenturen eine meldung geht um die welt,Arts & Entertainment - Broadcast & Network News
kultur tv am tag des terrors nachrichtensendungen waren gefragt,Arts & Entertainment - Broadcast & Network News
kultur tv themen nachrichtenkanal,Arts & Entertainment - Broadcast & Network News
ligue nachrichtenkanal,Arts & Entertainment - Broadcast & Network News
Live N24 Fernsehn,Arts & Entertainment - Broadcast & Network News
mediengruppe n24 springer,Arts & Entertainment - Broadcast & Network News
merkel böhmermann n24,Arts & Entertainment - Broadcast & Network News
miriam prede n24 schwanger anruf,Arts & Entertainment - Broadcast & Network News
Moderator von n-tv und N24 Michael Mross,Arts & Entertainment - Broadcast & Network News
moderatorinnen n24 feet,Arts & Entertainment - Broadcast & Network News
movies walk of shame meghan in ihrer nachrichtensendung german,Arts & Entertainment - Broadcast & Network News
N24 .NEWS 18.03.2016 um 23.05 Stephen Hawking,Arts & Entertainment - Broadcast & Network News
n24 06.03.2016,Arts & Entertainment - Broadcast & Network News
n24 blaulicht schwalmstadt 5.3.2016,Arts & Entertainment - Broadcast & Network News
n24 bs,Arts & Entertainment - Broadcast & Network News
nachricht aktienanalyse prosiebensat media riskantes unterfangen,Arts & Entertainment - Broadcast & Network News
nachricht auswahlindizes prosiebensat media se dax aufgenommen,Arts & Entertainment - Broadcast & Network News
nachricht bankhaus lampe stuft rtl group verkaufen,Arts & Entertainment - Broadcast & Network News
nachricht business updates unternehmensperformance kostenlose research berichte bechtle fielmann kuka norma group rtl group,Arts & Entertainment - Broadcast & Network News
nachricht commerzbank stuft rtl group hold,Arts & Entertainment - Broadcast & Network News
nachricht dax neuling prosiebensat media geschichte gegenwart zukunft,Arts & Entertainment - Broadcast & Network News
nachricht dgap dd prosiebensat media se deutsch,Arts & Entertainment - Broadcast & Network News
nachricht dgap stimmrechte prosiebensat media se deutsch,Arts & Entertainment - Broadcast & Network News
nachricht equinet belaesst rtl group reduce,Arts & Entertainment - Broadcast & Network News
nachricht expansionsstrategien liegen fokus berichte sap sartorius axel springer mlp prosiebensat media,Arts & Entertainment - Broadcast & Network News
nachricht goldman sachs belaesst rtl group neutral,Arts & Entertainment - Broadcast & Network News
nachricht hsbc belaesst rtl group buy,Arts & Entertainment - Broadcast & Network News
nachricht prosiebensat media ag bereitet umwandlung europaeische aktiengesellschaft se,Arts & Entertainment - Broadcast & Network News
nachricht prosiebensat media ag dr dieter hahn zum vorsitzenden des aufsichtsrats gewaehlt claus larass wird vorstandsmitglied,Arts & Entertainment - Broadcast & Network News
nachricht prosiebensat media ag kandidaten fuer wahl aufsichtsrat,Arts & Entertainment - Broadcast & Network News
nachricht prosiebensat media dax,Arts & Entertainment - Broadcast & Network News
nachricht prosiebensat media ereignis historischer bedeutung,Arts & Entertainment - Broadcast & Network News
nachricht prosiebensat media se umwandlung europaeische aktiengesellschaft vollzogen,Arts & Entertainment - Broadcast & Network News
nachricht rtl group blaest angriff,Arts & Entertainment - Broadcast & Network News
nachricht rtl group dreieck dividende,Arts & Entertainment - Broadcast & Network News
nachricht rtl group dreieck verteidigt dividende stuetzt,Arts & Entertainment - Broadcast & Network News
nachricht ubs belaesst rtl group neutral,Arts & Entertainment - Broadcast & Network News
nachricht warburg research belaesst rtl group hold,Arts & Entertainment - Broadcast & Network News
nachrichten afd ist social media champion soziale netzwerke wie facebook sind wichtige hilfsmittel zur waehlermobilisierung,Arts & Entertainment - Broadcast & Network News
nachrichten aktien des tages rtl group aktie solide er zahlen hochstufung kursrueckgaengen aktienanalyse n,Arts & Entertainment - Broadcast & Network News
nachrichten arkoon und netasq bringen neue generation von schutzloesungen fuer it netzwerke auf den markt,Arts & Entertainment - Broadcast & Network News
nachrichten ascom und ranplan gehen partnerschaft fuer netzwerk loesungen ein,Arts & Entertainment - Broadcast & Network News
nachrichten bloomberg television erzielt an werktagen hoechste einschaltquote unter allen internationalen nachrichtensendern europas,Arts & Entertainment - Broadcast & Network News
nachrichten der tv markt n tv mit prozent nachrichtensender punktet mit news am morgen wirtschaft und eigenproduktionen,Arts & Entertainment - Broadcast & Network News
nachrichten n erreicht erstmals prozent marktanteil in der zielgruppe nachrichtensender mit rekordwert im mai taegliche reichweite bei ueber sechs million,Arts & Entertainment - Broadcast & Network News
nachrichten n strukturiert chefredaktion um peter limbourg wird alleiniger chefredakteur des nachrichtensenders joerg harzem verlasst n,Arts & Entertainment - Broadcast & Network News
nachrichten pokertoday com startet die erste taegliche webtv nachrichtensendung aus der welt des pokersports,Arts & Entertainment - Broadcast & Network News
nachrichtensender ohne werbung,Arts & Entertainment - Broadcast & Network News
nachrichtensendung selber machen zum Geburtstag,Arts & Entertainment - Broadcast & Network News
nachrichtensendung wetterkarte,Arts & Entertainment - Broadcast & Network News
news archiv griechischer auslandskanal ert world startet nachrichtensendung newsu englisch,Arts & Entertainment - Broadcast & Network News
news archiv kurdischer nachrichtenkanal med n e neu im free tv auf satellit hot bird ost,Arts & Entertainment - Broadcast & Network News
news live tv programm ueber eine app sehen tv app der prosiebensat media ag geht an den start,Arts & Entertainment - Broadcast & Network News
news medien aktien unsere favoriten sind prosiebensat und rtl group,Arts & Entertainment - Broadcast & Network News
news nachrichtensender n wird umbenannt aus n wird welt,Arts & Entertainment - Broadcast & Network News
news ots prosiebensat media se prosiebensat media se steigt in den dax auf,Arts & Entertainment - Broadcast & Network News
news rtl group glaenzt mit rekordzahlen,Arts & Entertainment - Broadcast & Network News
news rtl group wachstumsimpulse aus dem internet und deutschland,Arts & Entertainment - Broadcast & Network News
news tv giganten prosieben sat media ag und rtl group,Arts & Entertainment - Broadcast & Network News
Newsticker N24,Arts & Entertainment - Broadcast & Network News
nordrhein westfalen gymnasium fos deutsch klasse arbeitsblatt zeitung medien nachrichtenagenturen,Arts & Entertainment - Broadcast & Network News
nordrhein westfalen gymnasium fos deutsch klasse unterrichtsentwurf lehrprobe medien nachrichtenagenturen boulevardzeitung,Arts & Entertainment - Broadcast & Network News
onlinemarketing prosiebensat prosiebensat beteiligt an min com eversport media,Arts & Entertainment - Broadcast & Network News
outlook nachrichtensendung stoppen,Arts & Entertainment - Broadcast & Network News
panorama reaktion auf hitzlsperger radiomoderator outet sich live in nachrichtensendung,Arts & Entertainment - Broadcast & Network News
PiD 651 n24,Arts & Entertainment - Broadcast & Network News
Polnische Nachrichtensender,Arts & Entertainment - Broadcast & Network News
presse jan frouman wird in den vorstand der prosiebensat media se berufen,Arts & Entertainment - Broadcast & Network News
pressinfo prosiebensat media se steigt in den dax auf,Arts & Entertainment - Broadcast & Network News
prosiebensat media ag arbeitgeber,Arts & Entertainment - Broadcast & Network News
prosiebensat media ag gehalt,Arts & Entertainment - Broadcast & Network News
prosiebensat media ag news prosiebensat media ag fur die gro e liebe ist man nie zu alt die u spezialwoche bei messer g,Arts & Entertainment - Broadcast & Network News
prosiebensat media ag news prosiebensat media ag personalie sevenventures baut fuhrungsspitze aus,Arts & Entertainment - Broadcast & Network News
r russischer nachrichtensender,Arts & Entertainment - Broadcast & Network News
rai news nachrichtensender startet uncodiert astra,Arts & Entertainment - Broadcast & Network News
ratgeber finanzen steuern versicherung anlagen und investitionen bloomberg eine internationale nachrichtensender gruppe,Arts & Entertainment - Broadcast & Network News
reker die hat sie nicht mehr alle n24,Arts & Entertainment - Broadcast & Network News
rossija n24 nachrichten,Arts & Entertainment - Broadcast & Network News
rtl group aktie hauptversammlung,Arts & Entertainment - Broadcast & Network News
rtl group analystenerwartungen,Arts & Entertainment - Broadcast & Network News
rtl group news kolner rtl mediengruppe kauft mehrheit an onlinewerbungsunternehmen,Arts & Entertainment - Broadcast & Network News
rtl group news milliarde erreicht bertelsmann vermeldet gewinn sprung,Arts & Entertainment - Broadcast & Network News
rtl group news rtl will gegen einstweilige verfugung gegen wallraff sendung vorgehen,Arts & Entertainment - Broadcast & Network News
rtl group unternehmen,Arts & Entertainment - Broadcast & Network News
rubrik n mobil nachrichtensender startet mobilfunktarif mit all net flat,Arts & Entertainment - Broadcast & Network News
Satelliten Wetter n24,Arts & Entertainment - Broadcast & Network News
sub Kein Pro7 N24 usw,Arts & Entertainment - Broadcast & Network News
sub N24 Internet Stick,Arts & Entertainment - Broadcast & Network News
thread hollaendischer nachrichtensender mit live stream gesucht,Arts & Entertainment - Broadcast & Network News
thread nachrichtensender mit unzensierten videos im internet,Arts & Entertainment - Broadcast & Network News
threads kabel deutschland sky rtl group hd,Arts & Entertainment - Broadcast & Network News
threads nachrichtensendungen,Arts & Entertainment - Broadcast & Network News
threads online zeitungen bzw nachrichtenagenturen,Arts & Entertainment - Broadcast & Network News
threads taegliche us nachrichtensendung gesucht,Arts & Entertainment - Broadcast & Network News
tuerkischer nachrichtensender imc tv !,Arts & Entertainment - Broadcast & Network News
tv peinlicher ausrutscher porno in schwedischer nachrichtensendung,Arts & Entertainment - Broadcast & Network News
ufo akten n24,Arts & Entertainment - Broadcast & Network News
vodafone germany internet issue N24,Arts & Entertainment - Broadcast & Network News
warum kann ich die RTL group programme mit störung schauen,Arts & Entertainment - Broadcast & Network News
welche nachrichtensendung guckt ihr,Arts & Entertainment - Broadcast & Network News
welt der wunder auf n24 am 20.04.2016,Arts & Entertainment - Broadcast & Network News
wem gehört rtl group,Arts & Entertainment - Broadcast & Network News
wetter duisburg n24,Arts & Entertainment - Broadcast & Network News
wetter n24,Arts & Entertainment - Broadcast & Network News
Wetter N24 Moderatorin roth,Arts & Entertainment - Broadcast & Network News
wetter nachrichten bei n24 zu welcher uhrzeit,Arts & Entertainment - Broadcast & Network News
wetterfee n24,Arts & Entertainment - Broadcast & Network News
Wie Funktionieren NAchrichtenagenturen,Arts & Entertainment - Broadcast & Network News
wie heißt die mysteri melodie n24,Arts & Entertainment - Broadcast & Network News
wiiconnect abgeschaltet wetter und nachrichtenkanal loschen,Arts & Entertainment - Broadcast & Network News
wirtschaft news medien rtl group kauft n tv anteile von holtzbrinck,Arts & Entertainment - Broadcast & Network News
wirtschaft news nachrichtenagenturen protest zeitungen erscheinen ohne dpa meldungen,Arts & Entertainment - Broadcast & Network News
wirtschaft news ueberraschender wechsel gerhard zeiler verlaesst rtl group,Arts & Entertainment - Broadcast & Network News
wirtschaft unternehmen prosiebensat media steigt in den dax auf a,Arts & Entertainment - Broadcast & Network News
www.n-tv. Nachrichtensender Konstantin Schreiber Mahaba.de,Arts & Entertainment - Broadcast & Network News
www.N24 Fernsehprogramm,Arts & Entertainment - Broadcast & Network News
ähnliche seiten wie promiflash,Arts & Entertainment - Celebrities & Entertainment News
awz vorschau promiflash,Arts & Entertainment - Celebrities & Entertainment News
blog anna netrebkos hochzeit fuer mich ist das leben jetzt strahlend weiss promihochzeit,Arts & Entertainment - Celebrities & Entertainment News
content unterhaltung dschungelcamp promi bild des tages content,Arts & Entertainment - Celebrities & Entertainment News
content unterhaltung people people news david beckham näht für seine tochter promi bild des tages content,Arts & Entertainment - Celebrities & Entertainment News
f news lewis hamilton fuehle mich nicht als teil der high society,Arts & Entertainment - Celebrities & Entertainment News
frage promiflash kommentar abgeben kostenlos,Arts & Entertainment - Celebrities & Entertainment News
kultur vermischtes coco austin promi bild des tages id,Arts & Entertainment - Celebrities & Entertainment News
nachrichten abba mania bei super rtl lassen barbara schoeneberger dirk bach und viele promis die musik des kult quartetts wieder aufleben sendedatum samstag,Arts & Entertainment - Celebrities & Entertainment News
nachrichten aida cruises mit promi shopping queen verena kerth die bekanntesten einkaufstempel europas erobern,Arts & Entertainment - Celebrities & Entertainment News
nachrichten aleksandra bechtel kocht um die ehre das perfekte promi dinner mit aleksandra bechtel dustin semmelrogge frank fussbroich und jean marie pfaff am,Arts & Entertainment - Celebrities & Entertainment News
nachrichten bettina cramer kann auf promi rummel verzichten,Arts & Entertainment - Celebrities & Entertainment News
nachrichten bis auf das essen war alles toll das erste dschungel spezial von das perfekte promi dinner mit ricky harris juergen milski sophia wollersheim un,Arts & Entertainment - Celebrities & Entertainment News
nachrichten blind date bei der promi shopping queen vox zeigt eine neue ausgabe der styling doku am februar um uhr,Arts & Entertainment - Celebrities & Entertainment News
nachrichten computer bild peinliche datenpanne bei zahlungsdienst novalnet ermoeglichte einblick in shopping gewohnheiten von promis,Arts & Entertainment - Celebrities & Entertainment News
nachrichten das dschungel special des perfekten promi dinners mit giulia siegel gundis z aacute mbo peter bond und nico schwanz am maerz um uhr bei,Arts & Entertainment - Celebrities & Entertainment News
nachrichten das perfekte promi dinner karneval spezial mit henning krautmacher oliver niesen frank reudenbach und bastian campmann am februar um uh,Arts & Entertainment - Celebrities & Entertainment News
nachrichten das perfekte promi dinner mit sarah und pietro lombardi den rappern der ers guildo horn und schandmaul bassist matthias richter am juni u,Arts & Entertainment - Celebrities & Entertainment News
nachrichten das sind die zwoelf promi big brother bewohner,Arts & Entertainment - Celebrities & Entertainment News
nachrichten detlef gegen claus hobbygaertner streit beim promi dinner das ab ins beet spezial vom perfekten promi dinner am um uhr bei vox,Arts & Entertainment - Celebrities & Entertainment News
nachrichten die andere camper runde hat bei mir hausverbot das perfekte promi dinner dschungel spezial mit menderes bagci helena fuerst david ortega und n,Arts & Entertainment - Celebrities & Entertainment News
nachrichten die serienstars bitten zu tisch und zum tanz das alles was zaehlt spezial vom perfekten promi dinner mit jenny bach carlo degen kaja schmidt tyc,Arts & Entertainment - Celebrities & Entertainment News
nachrichten eine flasche ouzo zur vorspeise yamas das feucht froehliche promi dinner mit anastasia zampounidis jochen senf dagmar frederic und judith doeker,Arts & Entertainment - Celebrities & Entertainment News
nachrichten engel am herd das perfekte promi dinner mit no angels saengerin jessica wahls am sonntag mai um uhr bei vox,Arts & Entertainment - Celebrities & Entertainment News
nachrichten heisser sonntag beschert den vox formaten promi shopping queen und prominent starke quoten am abend,Arts & Entertainment - Celebrities & Entertainment News
nachrichten hollywood stars und fussballprofis diese promis haben die teuersten versicherungen knip studie ermittelt die top,Arts & Entertainment - Celebrities & Entertainment News
