ausbildung kosmetikerin nrw,Beauty & Fitness - Cosmetology & Beauty Professionals
ausbildung kosmetikerin nürnberg,Beauty & Fitness - Cosmetology & Beauty Professionals
ausbildung kosmetikerin nürnberg ausbildung,Beauty & Fitness - Cosmetology & Beauty Professionals
ausbildung kosmetikerin rostock mai 2016,Beauty & Fitness - Cosmetology & Beauty Professionals
ausbildung kosmetikerin worms,Beauty & Fitness - Cosmetology & Beauty Professionals
ausbildung rottweil beauty galerie kosmetikfachinstitut inh sabine gaiselmann kosmetiker in,Beauty & Fitness - Cosmetology & Beauty Professionals
ausbildung schmallenberg romantik und wellnesshotel deimann gmbh co kg kosmetiker in,Beauty & Fitness - Cosmetology & Beauty Professionals
ausbildung zur kosmetikerin,Beauty & Fitness - Cosmetology & Beauty Professionals
ausbildung zur kosmetikerin 2016,Beauty & Fitness - Cosmetology & Beauty Professionals
ausbildung zur kosmetikerin berlin 2016,Beauty & Fitness - Cosmetology & Beauty Professionals
ausbildung zur kosmetikerin dresden,Beauty & Fitness - Cosmetology & Beauty Professionals
ausbildung zur kosmetikerin pforzheim,Beauty & Fitness - Cosmetology & Beauty Professionals
beauty boris entrup gibt schminktipps al,Beauty & Fitness - Cosmetology & Beauty Professionals
beauty boris entrup gibt schminktipps fuer brillentraegerinnen bl,Beauty & Fitness - Cosmetology & Beauty Professionals
beauty boris entrup tipps fuer einen perfekten teint al,Beauty & Fitness - Cosmetology & Beauty Professionals
beauty fruehlings schminktipps von boris entrup bl,Beauty & Fitness - Cosmetology & Beauty Professionals
beauty kosmetiktipp der woche styling die freundin schminkschule,Beauty & Fitness - Cosmetology & Beauty Professionals
beauty make up grosse schminkschule,Beauty & Fitness - Cosmetology & Beauty Professionals
beauty make up schminkschule krebs,Beauty & Fitness - Cosmetology & Beauty Professionals
beauty make up schminkschule krebspatientinnen augen,Beauty & Fitness - Cosmetology & Beauty Professionals
beauty make up schminkschule krebspatientinnen peruecke,Beauty & Fitness - Cosmetology & Beauty Professionals
beauty make up schminkschule krebspatientinnenn teint,Beauty & Fitness - Cosmetology & Beauty Professionals
beauty make up schminkschule lippen fragen,Beauty & Fitness - Cosmetology & Beauty Professionals
beauty make up schminkschule profitricks make up grundierung,Beauty & Fitness - Cosmetology & Beauty Professionals
beauty make up schminkschule teil seite,Beauty & Fitness - Cosmetology & Beauty Professionals
beauty make up sommer schminkschule,Beauty & Fitness - Cosmetology & Beauty Professionals
beauty rachel zoe mit boho frisur so tragen sie den xl pony,Beauty & Fitness - Cosmetology & Beauty Professionals
beauty schminkschule lippenstift schminken,Beauty & Fitness - Cosmetology & Beauty Professionals
beauty schminkschule matte lippen,Beauty & Fitness - Cosmetology & Beauty Professionals
beauty schminkschule serioes schminken,Beauty & Fitness - Cosmetology & Beauty Professionals
beauty schminktipps schminkschule mit jenna menard augen make up teil dimensional drama,Beauty & Fitness - Cosmetology & Beauty Professionals
beauty schminktipps schminkschule mit jenna menard augen make up teil sanft definiet,Beauty & Fitness - Cosmetology & Beauty Professionals
beauty schminktipps schminkschule mit jenna menard drei einfache augen make ups,Beauty & Fitness - Cosmetology & Beauty Professionals
beauty und style schoenheit schminkschule,Beauty & Fitness - Cosmetology & Beauty Professionals
beispiele bei boris entrup für ein make up,Beauty & Fitness - Cosmetology & Beauty Professionals
berufsbegleitende Ausbildung Kosmetikerin wolfsburg,Beauty & Fitness - Cosmetology & Beauty Professionals
boris entrup auf der fashion week make up macht alt,Beauty & Fitness - Cosmetology & Beauty Professionals
boris entrup schminktipp,Beauty & Fitness - Cosmetology & Beauty Professionals
boris entrup schminktipps schminktipps von boris entrup die das leben leichter machen,Beauty & Fitness - Cosmetology & Beauty Professionals
boris entrup schnauzbart,Beauty & Fitness - Cosmetology & Beauty Professionals
Brigitte Schminkschule,Beauty & Fitness - Cosmetology & Beauty Professionals
brigitte schminkschule schlupflider,Beauty & Fitness - Cosmetology & Beauty Professionals
christina ehrlich,Beauty & Fitness - Cosmetology & Beauty Professionals
cover stars mit babybauch rachel zoe rachel zoe stilvoll schwanger,Beauty & Fitness - Cosmetology & Beauty Professionals
die freundin schminkschule augen multi color,Beauty & Fitness - Cosmetology & Beauty Professionals
die freundin schminkschule lippen knallig,Beauty & Fitness - Cosmetology & Beauty Professionals
die freundin schminkschule lippen nude farben,Beauty & Fitness - Cosmetology & Beauty Professionals
douglas schminkschule,Beauty & Fitness - Cosmetology & Beauty Professionals
duale ausbildung kosmetikerin chemnitz,Beauty & Fitness - Cosmetology & Beauty Professionals
elizabeth stewart,Beauty & Fitness - Cosmetology & Beauty Professionals
frage ausbildung in rostock oder brandenburg zur kosmetikerin,Beauty & Fitness - Cosmetology & Beauty Professionals
frage ausbildung kosmetikerin make up artist,Beauty & Fitness - Cosmetology & Beauty Professionals
frage ausbildung zur kosmetikerin fhr fragen,Beauty & Fitness - Cosmetology & Beauty Professionals
frage ausbildung zur kosmetikerin in der steuererklaerung,Beauty & Fitness - Cosmetology & Beauty Professionals
frage bewerbungsanschreiben ausbildung kosmetikerin,Beauty & Fitness - Cosmetology & Beauty Professionals
frage bewerbungsgespraech ausbildung zur kosmetikerin,Beauty & Fitness - Cosmetology & Beauty Professionals
frage braucht man eine kosmetiker ausbildung um bei douglas arbeiten zu koennen,Beauty & Fitness - Cosmetology & Beauty Professionals
frage darf man als kosmetikerin arbeiten wenn man dafuer keine ausbildung hat,Beauty & Fitness - Cosmetology & Beauty Professionals
frage kann ich durch ausbildung zur kosmetikerin visum verlaengern,Beauty & Fitness - Cosmetology & Beauty Professionals
frage kosmetikerin ausbildung,Beauty & Fitness - Cosmetology & Beauty Professionals
frage kosmetikerin schulische ausbildung,Beauty & Fitness - Cosmetology & Beauty Professionals
frage schulische ausbildung als kosmetikerin bafoeg,Beauty & Fitness - Cosmetology & Beauty Professionals
frage schulische ausbildung zur kosmetikerin anfallende kosten,Beauty & Fitness - Cosmetology & Beauty Professionals
frage wie viel geld verdient man in der ausbildung zur kosmetikerin,Beauty & Fitness - Cosmetology & Beauty Professionals
frage wie zufrieden seid ihr mit den workshops der schminkschule von princess for a day,Beauty & Fitness - Cosmetology & Beauty Professionals
frage wird eine jaehrige ausbildung zur kosmetikerin vom arbeitsamt bezahltfinanziert,Beauty & Fitness - Cosmetology & Beauty Professionals
freundin tv schminkschule der perfekte teint,Beauty & Fitness - Cosmetology & Beauty Professionals
freundin tv schminkschule so setzen sie ihre augen in szene,Beauty & Fitness - Cosmetology & Beauty Professionals
friseur winnenden carolyn florio schminkschule face academy m,Beauty & Fitness - Cosmetology & Beauty Professionals
gesund gesundheit schminkschule krebs,Beauty & Fitness - Cosmetology & Beauty Professionals
gesundheitszeugnis beantragen für Ausbildung zur kosmetikerin,Beauty & Fitness - Cosmetology & Beauty Professionals
gesundheitszeugnis für ausbildung zur kosmetikerin,Beauty & Fitness - Cosmetology & Beauty Professionals
girl schminkschule mascara macht mehr aus deinen wimpern teaser,Beauty & Fitness - Cosmetology & Beauty Professionals
girl schminkschule mit concealer abdecken was stoert teaser,Beauty & Fitness - Cosmetology & Beauty Professionals
girl schminkschule so formt rouge dein gesicht uebersicht,Beauty & Fitness - Cosmetology & Beauty Professionals
girl schminkschule tolle haut durch foundation uebersicht,Beauty & Fitness - Cosmetology & Beauty Professionals
girl schminkschule zauber mit puder einen matten teint,Beauty & Fitness - Cosmetology & Beauty Professionals
klar dass wir bei der maybelline make up night natuerlich auch boris entrupp getroffen,Beauty & Fitness - Cosmetology & Beauty Professionals
kleinanzeigen make up die neue schminkschule a,Beauty & Fitness - Cosmetology & Beauty Professionals
kosmetik rosenheim lombagine cosmetics fachberatung dr frank u astrid peter m bewertungen,Beauty & Fitness - Cosmetology & Beauty Professionals
kosmetikerin ausbildung bremen,Beauty & Fitness - Cosmetology & Beauty Professionals
kosmetikerin ausbildung dinslaken,Beauty & Fitness - Cosmetology & Beauty Professionals
kosmetikerin ausbildung erfahrung,Beauty & Fitness - Cosmetology & Beauty Professionals
kosmetikerin ausbildung gutefrage.net,Beauty & Fitness - Cosmetology & Beauty Professionals
Kosmetikerin Ausbildung Halle top,Beauty & Fitness - Cosmetology & Beauty Professionals
kosmetikerin ausbildung kosten,Beauty & Fitness - Cosmetology & Beauty Professionals
kosmetikerin ausbildung kosten fernschule,Beauty & Fitness - Cosmetology & Beauty Professionals
kosmetikerin ausbildung lübeck,Beauty & Fitness - Cosmetology & Beauty Professionals
kosmetikerin ausbildung nrw,Beauty & Fitness - Cosmetology & Beauty Professionals
kosmetikerin ausbildung nürnberg,Beauty & Fitness - Cosmetology & Beauty Professionals
kosmetikerin ausbildung schule,Beauty & Fitness - Cosmetology & Beauty Professionals
kosmetikerin ausbildung solingen,Beauty & Fitness - Cosmetology & Beauty Professionals
kosmetikerin ausbildung trier,Beauty & Fitness - Cosmetology & Beauty Professionals
kosmetikerin ausbildung über das amt,Beauty & Fitness - Cosmetology & Beauty Professionals
kosmetikerin duale ausbildung karlsruhe,Beauty & Fitness - Cosmetology & Beauty Professionals
kosmetikerin ohne ausbildung,Beauty & Fitness - Cosmetology & Beauty Professionals
kosmetikerin stralsund Ausbildung,Beauty & Fitness - Cosmetology & Beauty Professionals
kosten 3 Jahre Ausbildung zur Kosmetikerin,Beauty & Fitness - Cosmetology & Beauty Professionals
medizinische kosmetikerin ausbildung landkreis Braunschweig,Beauty & Fitness - Cosmetology & Beauty Professionals
rachel zoé,Beauty & Fitness - Cosmetology & Beauty Professionals
rachel zoe 2016,Beauty & Fitness - Cosmetology & Beauty Professionals
ratgeber gesellschaft schule und ausbildung die staatlich gepruefte kosmetikerin hat hohen anspruch,Beauty & Fitness - Cosmetology & Beauty Professionals
schminken boris entrup,Beauty & Fitness - Cosmetology & Beauty Professionals
schminkschule für reifeHaut,Beauty & Fitness - Cosmetology & Beauty Professionals
schminkschule köln,Beauty & Fitness - Cosmetology & Beauty Professionals
schminkschule münchen,Beauty & Fitness - Cosmetology & Beauty Professionals
schminkschule schritt für schritt,Beauty & Fitness - Cosmetology & Beauty Professionals
schminkschulen nach chemo top,Beauty & Fitness - Cosmetology & Beauty Professionals
schminktipps von boris entrup,Beauty & Fitness - Cosmetology & Beauty Professionals
sie ist in der Ausbildung zur Kosmetikerin,Beauty & Fitness - Cosmetology & Beauty Professionals
staatlich geprüfte kosmetikerin ausbildung münchen,Beauty & Fitness - Cosmetology & Beauty Professionals
style kosmetik schminkschule,Beauty & Fitness - Cosmetology & Beauty Professionals
teilzeit ausbildung zur kosmetikerin t,Beauty & Fitness - Cosmetology & Beauty Professionals
www. ausbildung onkologische kosmetikerin.de,Beauty & Fitness - Cosmetology & Beauty Professionals
ausbildung kosmetikerin,Beauty & Fitness - Cosmetology & Beauty Professionals
ausbildung kosmetikerin leip,Beauty & Fitness - Cosmetology & Beauty Professionals
beauty anti aging galerie anti age schminkschule augen lippen page,Beauty & Fitness - Cosmetology & Beauty Professionals
beauty kosmetiktipp der woche buchtipp schoen mit boris entrup schmink tipps im ersten buch des starvisagisten,Beauty & Fitness - Cosmetology & Beauty Professionals
beauty schminkschule schminktipps gesicht,Beauty & Fitness - Cosmetology & Beauty Professionals
beauty und style schoenheit schminkschule html page,Beauty & Fitness - Cosmetology & Beauty Professionals
bewerbungsvordruck ausbildung kosmetikerin,Beauty & Fitness - Cosmetology & Beauty Professionals
de dienstleistungen ausbildung weiterbildung ausbildung zur nagel kosmetikerin nail designerin mit diplom aspx,Beauty & Fitness - Cosmetology & Beauty Professionals
douglas schminkschule AS,Beauty & Fitness - Cosmetology & Beauty Professionals
erin walsh,Beauty & Fitness - Cosmetology & Beauty Professionals
frage vor ausbildung zur kosmetikerin lieber noch einzelhandelskauffrau lernen,Beauty & Fitness - Cosmetology & Beauty Professionals
kosmetikerin ausbildung,Beauty & Fitness - Cosmetology & Beauty Professionals
schminkschule,Beauty & Fitness - Cosmetology & Beauty Professionals
schminkschule-krebs,Beauty & Fitness - Cosmetology & Beauty Professionals
thema autsch nun feuert auch anne hathaway die top stylistin rachel zoe,Beauty & Fitness - Cosmetology & Beauty Professionals
ugg boots star stylistin rachel zoe zeigt wie man ugg boots richtig cool stylt,Beauty & Fitness - Cosmetology & Beauty Professionals
2 Tagescreme,Beauty & Fitness - Face & Body Care
3 monate altes baby trockene gesichtshaut,Beauty & Fitness - Face & Body Care
aloive straffende nachtcreme,Beauty & Fitness - Face & Body Care
alterra intensiv nachtcreme test,Beauty & Fitness - Face & Body Care
alterra nachtcreme bio aloe vera gletscherwasser,Beauty & Fitness - Face & Body Care
alterra naturkosmetik getonte tagescreme pfirsich test,Beauty & Fitness - Face & Body Care
alterra tagescreme trockene haut,Beauty & Fitness - Face & Body Care
alverde bachblüten nachtcreme,Beauty & Fitness - Face & Body Care
alverde getonte tagescreme mandel goldbeige,Beauty & Fitness - Face & Body Care
alverde nachtcreme wildrose,Beauty & Fitness - Face & Body Care
alverde tagescreme wildrose,Beauty & Fitness - Face & Body Care
alverde vital plus nachtcreme goldschimmer amaranth,Beauty & Fitness - Face & Body Care
angebot alterra getoente tagescreme pfirsich,Beauty & Fitness - Face & Body Care
angebot anti stress tages und nachtcreme,Beauty & Fitness - Face & Body Care
angebot biocura age vital tages nachtcreme,Beauty & Fitness - Face & Body Care
angebot diadermine n tages oder nachtcreme,Beauty & Fitness - Face & Body Care
angebot rival de loop natural beruhigende tagescreme,Beauty & Fitness - Face & Body Care
angebot shisara tages oder nachtcreme,Beauty & Fitness - Face & Body Care
annemarie boerlind gesichtspflege aquanature,Beauty & Fitness - Face & Body Care
annemarie boerlind gesichtspflege beauty pearls,Beauty & Fitness - Face & Body Care
annemarie boerlind gesichtspflege ll regeneration,Beauty & Fitness - Face & Body Care
annemarie boerlind gesichtspflege mischhaut,Beauty & Fitness - Face & Body Care
annemarie boerlind gesichtspflege naturoyale biolifting,Beauty & Fitness - Face & Body Care
annemarie boerlind gesichtspflege purifying care,Beauty & Fitness - Face & Body Care
annemarie boerlind gesichtspflege rosentau,Beauty & Fitness - Face & Body Care
annemarie boerlind gesichtspflege system absolute,Beauty & Fitness - Face & Body Care
annemarie boerlind gesichtspflege z zz serien,Beauty & Fitness - Face & Body Care
Annemarie Börlind absolute Nachtcreme,Beauty & Fitness - Face & Body Care
annemarie borlind mischhaut nachtcreme,Beauty & Fitness - Face & Body Care
Antifalten nachtcreme Babor,Beauty & Fitness - Face & Body Care
apotheker scheller beruhigende tagescreme mit grunem tee meeresalgen test,Beauty & Fitness - Face & Body Care
apotheker scheller hautentspannende tagescreme mandelol sanddorn test,Beauty & Fitness - Face & Body Care
archiv forum th guten tip gesucht trockene schuppige gesichtshaut,Beauty & Fitness - Face & Body Care
asam tag und nachtcreme,Beauty & Fitness - Face & Body Care
avene serenage nachtcreme,Beauty & Fitness - Face & Body Care
avon anew reversalist regenerierende tagescreme,Beauty & Fitness - Face & Body Care
avon anew ultimate aufbauende nachtcreme,Beauty & Fitness - Face & Body Care
Babies nachtcreme,Beauty & Fitness - Face & Body Care
babor gesichtspflege ampoule concentrates fp,Beauty & Fitness - Face & Body Care
babor gesichtspflege cleansing cp,Beauty & Fitness - Face & Body Care
babor gesichtspflege doctor babor,Beauty & Fitness - Face & Body Care
babor gesichtspflege essential care,Beauty & Fitness - Face & Body Care
babor gesichtspflege reversive,Beauty & Fitness - Face & Body Care
babor gesichtspflege skinovage px,Beauty & Fitness - Face & Body Care
Babor nachtcreme,Beauty & Fitness - Face & Body Care
balea abendruhe nachtcreme test,Beauty & Fitness - Face & Body Care
balea feuchtigkeitsspendende tagescreme mit lotusbluten extrakt,Beauty & Fitness - Face & Body Care
balea morgenfrische tagescreme,Beauty & Fitness - Face & Body Care
balea teint perfektion tagescreme,Beauty & Fitness - Face & Body Care
Balea Vital Nachtcreme,Beauty & Fitness - Face & Body Care
balea vital regenerienden nachtcreme fur reife haut,Beauty & Fitness - Face & Body Care
basische nachtcreme lubana,Beauty & Fitness - Face & Body Care
beauty fragen kann man eine nachtcreme auch tags ueber verwenden,Beauty & Fitness - Face & Body Care
bebe getönte tagescreme neu,Beauty & Fitness - Face & Body Care
bebe more getönte tagescreme,Beauty & Fitness - Face & Body Care
benefiance nachtcreme,Beauty & Fitness - Face & Body Care
beste nachtcreme feuchtigkeit,Beauty & Fitness - Face & Body Care
beste tagescreme ab 50,Beauty & Fitness - Face & Body Care
biocura getönte tagescreme inhaltsstoffe,Beauty & Fitness - Face & Body Care
biocura tagescreme gesichtspflege test,Beauty & Fitness - Face & Body Care
biologische Hausmittel trockene Gesichtshaut,Beauty & Fitness - Face & Body Care
biotherm gesichtspflege aquasource biosensitive,Beauty & Fitness - Face & Body Care
biotherm gesichtspflege aquasource nutrition,Beauty & Fitness - Face & Body Care
biotherm gesichtspflege blue therapy,Beauty & Fitness - Face & Body Care
biotherm gesichtspflege pure fect skin,Beauty & Fitness - Face & Body Care
biotherm gesichtspflege skin best,Beauty & Fitness - Face & Body Care
börlind ll nachtcreme,Beauty & Fitness - Face & Body Care
chanel tagescreme für die reife haut,Beauty & Fitness - Face & Body Care
cid hautpflege lacura nachtcreme bewertungen,Beauty & Fitness - Face & Body Care
clarins nachtcreme,Beauty & Fitness - Face & Body Care
creme gegen trockene schuppende gesichtshaut,Beauty & Fitness - Face & Body Care
de wohlfuehlwelt pflege gesichtspflege,Beauty & Fitness - Face & Body Care
detox nachtcreme,Beauty & Fitness - Face & Body Care
elkos Tagescreme Test,Beauty & Fitness - Face & Body Care
erfahrungen speick thermal nachtcreme,Beauty & Fitness - Face & Body Care
erfahrungsberichte alva sanddorn nachtcreme,Beauty & Fitness - Face & Body Care
erfahrungsberichte alverde anti aging vitam nachtcreme gojibeere,Beauty & Fitness - Face & Body Care
erfahrungsberichte alverde tagescreme olive sonnenblume,Beauty & Fitness - Face & Body Care
erfahrungsberichte alverde tagescreme wildrose trockene haut,Beauty & Fitness - Face & Body Care
erfahrungsberichte annemarie borlind mischhaut nachtcreme,Beauty & Fitness - Face & Body Care
erfahrungsberichte aok first beauty getonte tagescreme,Beauty & Fitness - Face & Body Care
erfahrungsberichte balea anti falten tagescreme mit coenzym q,Beauty & Fitness - Face & Body Care
erfahrungsberichte balea entspannende nachtcreme mit reisol,Beauty & Fitness - Face & Body Care
erfahrungsberichte balea med ultra sensitive tagescreme,Beauty & Fitness - Face & Body Care
erfahrungsberichte balea men tagescreme selbstbrauner,Beauty & Fitness - Face & Body Care
erfahrungsberichte balea morgenfrische tagescreme,Beauty & Fitness - Face & Body Care
erfahrungsberichte oil of olaz complete feuchtigkeitsspendende tagescreme,Beauty & Fitness - Face & Body Care
erfahrungsberichte oil of olaz complete nachtcreme,Beauty & Fitness - Face & Body Care
erfahrungsberichte oil of olaz pro vital linie regenerierende nachtcreme,Beauty & Fitness - Face & Body Care
erfahrungsberichte rosense tagescreme,Beauty & Fitness - Face & Body Care
erfahrungsberichte today q tagescreme,Beauty & Fitness - Face & Body Care
erfahrungsberichte weleda wildrose nachtcreme,Beauty & Fitness - Face & Body Care
extrem trockene gesichtshaut,Beauty & Fitness - Face & Body Care
extrem trockene gesichtshaut welche creme,Beauty & Fitness - Face & Body Care
Frag mutti trockene Gesichtshaut,Beauty & Fitness - Face & Body Care
frage fettige trockene und total unebene kaputte gesichtshaut,Beauty & Fitness - Face & Body Care
frage getoente tagescreme fuer fettige haut,Beauty & Fitness - Face & Body Care
frage hilft honig gegen trockene gesichtshaut schuppen,Beauty & Fitness - Face & Body Care
frage ist tagescreme auch als nachtcreme verwendbar,Beauty & Fitness - Face & Body Care
frage nichts hilft gegen trockene haut im gesicht was tun,Beauty & Fitness - Face & Body Care
frage tagescreme gegen glaenzende haut,Beauty & Fitness - Face & Body Care
frage trockene gluehende gesichtshaut,Beauty & Fitness - Face & Body Care
frage trockene juckende spannende gesichtshaut,Beauty & Fitness - Face & Body Care
frage was kann ich tun gegen trockene gesichtsstellen und einer fettigen gesichtshaut,Beauty & Fitness - Face & Body Care
frage was kann man gegen juckende kopfhaut tun meine frau hat zu trockene haut,Beauty & Fitness - Face & Body Care
frage was tun gegen extrem trockene haut schienbeine,Beauty & Fitness - Face & Body Care
frage was tun gegen trockene haut am ohr,Beauty & Fitness - Face & Body Care
frage was tun gegen trockene haut ueberall,Beauty & Fitness - Face & Body Care
Hausmittel trockene Gesichtshaut,Beauty & Fitness - Face & Body Care
Haut ab 60 Jahren Nachtcreme Gute,Beauty & Fitness - Face & Body Care
lavera gesichtspflege faces karanjaoel weisser bio tee,Beauty & Fitness - Face & Body Care
lavera gesichtspflege faces masken,Beauty & Fitness - Face & Body Care
Leichte Tagescreme,Beauty & Fitness - Face & Body Care
ligne st barth pflege gesichtspflege,Beauty & Fitness - Face & Body Care
logona nachtcreme zaubernuss,Beauty & Fitness - Face & Body Care
marbert nachtcreme,Beauty & Fitness - Face & Body Care
maske gegen trockene gesichtshaut,Beauty & Fitness - Face & Body Care
masken zum selber machen bei sehr trockener gesichtshaut,Beauty & Fitness - Face & Body Care
medizinische koerperpflege dermasixt nachtcreme ml,Beauty & Fitness - Face & Body Care
medizinische koerperpflege diadermine falten expert d nachtpflege nachtcreme ml,Beauty & Fitness - Face & Body Care
medizinische koerperpflege elasten nachtcreme creme ml,Beauty & Fitness - Face & Body Care
medizinische koerperpflege gelee royale nachtcreme creme ml,Beauty & Fitness - Face & Body Care
medizinische koerperpflege hormocenta nachtcreme creme ml,Beauty & Fitness - Face & Body Care
medizinische koerperpflege mouson creme mit viel feuchtigkeit tagescreme ml,Beauty & Fitness - Face & Body Care
mildeen med nachtcreme,Beauty & Fitness - Face & Body Care
nach schwangerschaft trockene gesichtshaut,Beauty & Fitness - Face & Body Care
nachtcreme dior,Beauty & Fitness - Face & Body Care
Nachtcreme falten herren,Beauty & Fitness - Face & Body Care
nachtcreme für fettige haut,Beauty & Fitness - Face & Body Care
nachtcreme gegen rote äderchen im gesicht,Beauty & Fitness - Face & Body Care
nachtcreme mit vitamin c,Beauty & Fitness - Face & Body Care
nachtcreme ohne paraffin,Beauty & Fitness - Face & Body Care
nachtcreme shiseido,Beauty & Fitness - Face & Body Care
nivea visage feuchtigkeitsspendende tagescreme test,Beauty & Fitness - Face & Body Care
NOVEANE 3D Nachtcreme,Beauty & Fitness - Face & Body Care
nuxe gesichtspflege anti unreinheiten pflege,Beauty & Fitness - Face & Body Care
nuxe gesichtspflege augenkonturpflege,Beauty & Fitness - Face & Body Care
nuxe gesichtspflege erste mimikfalten,Beauty & Fitness - Face & Body Care
nuxe gesichtspflege gesichtsreinigung und make up entferner,Beauty & Fitness - Face & Body Care
nuxe gesichtspflege lippenpflege,Beauty & Fitness - Face & Body Care
nuxe gesichtspflege merveillance expert,Beauty & Fitness - Face & Body Care
nuxe gesichtspflege naehrende pflege,Beauty & Fitness - Face & Body Care
nuxe gesichtspflege spannkraft verleihende serie,Beauty & Fitness - Face & Body Care
oenolia belebende tagescreme mit trauben polyphenolen,Beauty & Fitness - Face & Body Care
oil of olaz aufbauende nachtcreme test,Beauty & Fitness - Face & Body Care
öl für trockene gesichtshaut hausmittel,Beauty & Fitness - Face & Body Care
Olaz Complete Nachtcreme,Beauty & Fitness - Face & Body Care
ölfreie tagescreme,Beauty & Fitness - Face & Body Care
olivenoel gesichtspflege creme ml,Beauty & Fitness - Face & Body Care
Optolind Nachtcreme,Beauty & Fitness - Face & Body Care
packung bei trockener gesichtshaut,Beauty & Fitness - Face & Body Care
peeling für trockene gesichtshaut,Beauty & Fitness - Face & Body Care
pflege für trockene schuppige gesichtshaut,Beauty & Fitness - Face & Body Care
pflege trockener gesichtshaut,Beauty & Fitness - Face & Body Care
philips gesichtspflege,Beauty & Fitness - Face & Body Care
produkte oil of olaz aufbauende nachtcreme,Beauty & Fitness - Face & Body Care
reichhaltige nachtcreme regenerieren wiederherstellen p,Beauty & Fitness - Face & Body Care
reinigung trockener gesichtshaut,Beauty & Fitness - Face & Body Care
ren nachtcreme,Beauty & Fitness - Face & Body Care
review cien nachtcreme,Beauty & Fitness - Face & Body Care
rilanja nachtcreme,Beauty & Fitness - Face & Body Care
rival de loop outdoor reichhaltige tagescreme,Beauty & Fitness - Face & Body Care
ROSENTAU Nachtcreme,Beauty & Fitness - Face & Body Care
rosenwasser gegen trockene gesichtshaut,Beauty & Fitness - Face & Body Care
rötungen und trockene Gesichtshaut,Beauty & Fitness - Face & Body Care
schnelle hilfe bei trockener gesichtshaut,Beauty & Fitness - Face & Body Care
