Al Jazeera Arabic Live Online,News - International News
Al Jazeera Arabic TV Live,News - International News
al jazeera bein sport live,News - International News
Al Jazeera bein sport TV Direct,News - International News
Al Jazeera channel 108 hd,News - International News
channel al jazeera,News - International News
channel al jazeera english,News - International News
Daesh news al jazeera,News - International News
de sputniknews com german ruvr ru news youtube kanal des russischen fernsehsenders rt uberholt nach popularitat seine konkurrenten cnn euronews und al jazeera,News - International News
digital tv al jazeera english auf neuer frequenz astra ost und ost,News - International News
English Al jazeera,News - International News
English Al jazeera Freeview TV channel,News - International News
freesat al jazeera channel,News - International News
jazeera satellite freesat wins al tech channel,News - International News
kath turner al jazeera,News - International News
Kora Live Al Jazeera,News - International News
Like Al Jazeera,News - International News
news al jazeera english sendet jetzt in hdtv,News - International News
news archiv al jazeera balkans ab november ber ost,News - International News
news archiv arabischer kinderkanal jeem tv ersetzt al jazeera children s channel,News - International News
news archiv arabischer nachrichtensender al jazeera hd neu im free tv auf satellit,News - International News
panorama klitschko menschenrechtsverletzungen donbass al jazeera,News - International News
politik ausland aegypten al jazeera reporter fahmy begnadigt a,News - International News
politik ausland al jazeera journalist in berlin festgenommen a,News - International News
politik deutschland al jazeera ahmed mansour bleibt vorerst im gewahrsam a,News - International News
politik interview in al jazeera wie ein journalist den saudischen un botschafter in erklaerungsnot bringt,News - International News
sub Al Jazeera Balkans Live,News - International News
sub Al Jazeera Children Atfal,News - International News
sub Al Jazeera TV Online,News - International News
topbusiness al jazeera streicht weltweit stellen,News - International News
ausland international cnn zeigt video mit verschleppten maedchen;art,News - International News
cnn international deutschland,News - International News
CNN NY Summer Intern CNN international,News - International News
digital tv cnn international europe auf neuer frequenz satellit auf ost,News - International News
digital tv cnn international hd bereitet start auf astra ost vor europaweiter empfang,News - International News
digital tv frequenzwechsel des us nachrichtensenders cnn international auf astra ost,News - International News
entertainment atika shubert wird neue berlin korrespondentin f r cnn international,News - International News
entertainment bal cnn international africa ratings al jazeera english erin burnett euronews,News - International News
fussball international cnn laesst ribery in kaeltekammer sterben,News - International News
channel cnn news,News - International News
channel cnn student news,News - International News
CNN Headline News Listen Live,News - International News
cnn news Becky Anderson,News - International News
Cnn news direct,News - International News
news archiv cnn international testet auf neuer frequenz satellit hot bird ost free tv,News - International News
news ausland cnn mann richard quest drogen und sex skandal id,News - International News
news ausland cnn meldet wegen liebesspiel im auto verhaftet sex skandal um ch diplomat in iran id,News - International News
news ausland er kam gerade aus der dusche nackter cnn reporter erschiesst raeuber id,News - International News
news ausland frauen mit nutella und kaetzchen zum is gelockt dschihadisten verhoehnen cnn id,News - International News
news ausland uswahlen britschgis tv kritik ueber die us wahlen geniales polit show biz das kann nur cnn id,News - International News
news hdtv cnn hd ab dienstag bei unitymediakabel bw,News - International News
news homosexuelle cnn kommentatorin ich will dass meine tochter lesbisch wird id,News - International News
news laut cnn tuerk sechs deutsche bei explosion in istanbul verletzt n,News - International News
news miley cyrus cnn heroes und miley ist die goettlichste,News - International News
news sheraton vs cnn gerichtsentscheid hotels muessen kuenftig tv gebuehren zahlen,News - International News
search cnn student news,News - International News
student cnn news,News - International News
tag cnn student news,News - International News
Water Damage Emergency Service news cnn news,News - International News
Angela Merkel Daily Mail,News - International News
Angela Neustatter Daily Mail,News - International News
arnold schwarzenegger daily mail,News - International News
ATLETICO MADRID 2-0 BARCELONA DAILY MAIL,News - International News
bayern munich daily mail,News - International News
BBC DAILY MAIL,News - International News
Beharie Fassbender Daily Mail,News - International News
ben affleck jennifer garner daily mail RI,News - International News
benenden murder daily mail,News - International News
BENFICA 2-2 BAYERN DAILY MAIL,News - International News
Bernie breakfast SHarpton DAILY MAIL,News - International News
DAILY MAIL 11 MARCH 2016,News - International News
DAILY MAIL 23 MFEB,News - International News
denise welch daily mail SC,News - International News
DERBY 1-0 NOTTINGAM FOREST DAILY MAIL,News - International News
DERBY 4-1 BOLTON DAILY MAIL,News - International News
digital computer daily mail bestaetigt interesse an yahoo uebernahme,News - International News
gisele bündchen daily mail,News - International News
grand national 2016 runners DAILY MAIL,News - International News
heidi klum and vito schnabel daily mail,News - International News
heidi klum daily mail,News - International News
HULL DAILY MAIL GRAND NATIONAL,News - International News
kardashian jenner 2011 daily mail,News - International News
Kristen stewart daily mail,News - International News
Kristen wiig daily mail,News - International News
kurt geiger daily mail,News - International News
LEIGH ANNE SABINE DAILY MAIL,News - International News
MGM GRAND DAILY MAIL,News - International News
nachricht wsj daily mail denkt gebot yahoo,News - International News
nachrichten auch daily mail mutter will yahoo,News - International News
nachrichten daily mail bestaetigt interesse an yahoo uebernahme,News - International News
nachrichten nebenwerte wsj daily mail denkt ueber gebot fuer yahoo nach n,News - International News
nachrichten wsj daily mail denkt ueber gebot fuer yahoo nach,News - International News
news wsj daily mail denkt ueber gebot fuer yahoo nach,News - International News
news zeitung daily mail denkt ueber gebot fuer yahoo nach n,News - International News
Nicole Scherzinger Daily Mail,News - International News
patrick schwarzenegger daily mail,News - International News
REAL MADRID 3-0 WOLFSBURG DAILY MAIL,News - International News
Schweinsteiger ivanovic daily mail,News - International News
SCOTTISH DAILY MAIL,News - International News
SHAKHTAR DONETSK 4-0 BRAGA DAILY MAIL,News - International News
SHEFF UNITED 0-1 BURTON DAILY MAIL,News - International News
Steven Spielberg daily mail,News - International News
süddeutsche daily mail trump,News - International News
UK DAILY MAIL,News - International News
WARREN GREEN DAILY MAIL MARK DUELL,News - International News
wirtschaft unternehmen yahoo daily mail will fuer krisenkonzern bieten a,News - International News
Wladimir klitschko Daily Mail,News - International News
zenit 1-2 benfica daily mail,News - International News
daily telegraph - Roger Bannister,News - International News
Daily Telegraph Ben Melzer,News - International News
Derby Daily Telegraph Derby bs,News - International News
Die Freie Welt Zeitung,News - International News
Die Welt. Zeitung,News - International News
frage gbt es bei der shell tankstelle die zeitung junge welt zu kaufen,News - International News
frage zeitung die welt nachbestellen,News - International News
ist die welt eine seriöse zeitung,News - International News
news esport artikel in den zeitungen die welt und die zeit,News - International News
premium article die abos der welt digital oder als zeitung,News - International News
warum sperrt die zeitung die welt die kommentare,News - International News
zeitung die welt politische ausrichtung,News - International News
international wirtschaft fazit nach stunden razzia bei mossack fonseca «es ist komplex es hat über server»,News - International News
people tv international gabby rinne zieht fazit das dschungelcamp hat mein leben zerstoert id,News - International News
16 Fox News Arkansas,News - International News
Addie Huntsman Fox News,News - International News
FOX 10 NEWS,News - International News
FOX 10 NEWS NOW,News - International News
Fox 11 News San Bernardino,News - International News
Fox 16 News in Little Rock Arkansas,News - International News
jamie foxx news jamie foxx denies dating katie holmes,News - International News
Jamie Gilt fox news,News - International News
John Brennan Muslim Fox News,News - International News
nachrichten ausland usa id fox news donald trump ist krankhaft von kelly besessen,News - International News
nachrichten ausland usa id fox news trump ist krankhaft von moderatorin kelly besessen,News - International News
nachrichten dgap news evotec erhaelt foerderung fuer parkinsonforschung von the michael j fox foundation deutsch,News - International News
panorama fox news moderator beschimpft imam als boesartigen hurensohn,News - International News
panorama stern crime us sender fox news uebertraegt selbstmord tod vor laufender kamera,News - International News
Pimm Fox Bloomberg News,News - International News
politik ausland fox news moderatorin jeanine pirro ruft zum massenmord an islamisten auf,News - International News
politik ausland fox news trump verlangte angeblich fuenf milllionen dollar fuer tv debatte,News - International News
promi news megan fox nackt geht gar nicht renews,News - International News
promi news megan fox sex ist ihr verkaufsargument gninews,News - International News
Watch Fox News Presidential Debate,News - International News
workers minium wage in michigan fox news,News - International News
aktuelles omnibus news touristik nachrichten aus der igs wird wilhelmsburger inselpark internationale gartenschau in hambur,News - International News
aktuelles omnibus news touristik nachrichten berlin tatto wieder in der o world internationale musik formationen spielen i,News - International News
aktuelles omnibus news touristik nachrichten busplaner verleiht internationalen nachhaltigkeitspreis auszeichnung wuer,News - International News
aktuelles omnibus news touristik nachrichten deutsche busfahrer erhalten internationale austzeichnung von iru fahrer muess,News - International News
aktuelles omnibus news touristik nachrichten incoming workshop am bodensee region laedt internationale reiseveranstalter ei,News - International News
aktuelles omnibus news touristik nachrichten internationale gebraucht omnibus messe ueber besucher kamen nach neu,News - International News
boerse nachrichten allianz worldwide care stellt services zur absicherung von risiken fur internationale unternehmen,News - International News
boerse nachrichten bdew bundesverband der energie und wasserwirtsc launch der internationalen zukunftsstudie delphi e,News - International News
boerse nachrichten creative artists agency stellt internationalen veteranen fur unternehmensstrategien matteo perale,News - International News
boerse nachrichten dubai outsource city gibt anlasslich des internationalen frauentages die pink parking initiative b,News - International News
boerse nachrichten internationales abkommen soll erstmals hochsee schutzen,News - International News
forum kommentare zu aktuellen nachrichten antworten dubai bleibt nummer eins im internationalen verkehr,News - International News
forum kommentare zu aktuellen nachrichten antworten polen baut internationalen flughafen im cia forst,News - International News
internationale nachrichten,News - International News
internationale nachrichten aktuell,News - International News
internationale politik nachrichten,News - International News
karriere nachrichten deutsche wirtschaftspruefer lernen ias oder machen sogar den us abschluss cpa old germany und internationale rechnungslegung seite,News - International News
magazin nachrichten internationale autoschau,News - International News
magazin nachrichten konferenz roman networks in the west mit internationalen gaesten,News - International News
nachrichten abkommen zu internationaler e commerce plattform von yiwubuy com in frankreich,News - International News
nachrichten accenture studie zum internationalen frauentag arbeitnehmer interessiert die work life balance,News - International News
nachrichten aguettant eroeffnet im rahmen seiner internationalen expansion eine niederlassung in deutschland,News - International News
Aktuelle Nachrichten aus aller Welt,News - International News
die neuesten nachrichten aus aller welt,News - International News
GUTE Nachrichten aus aller Welt,News - International News
Nachrichten aus aller Welt,News - International News
Nachrichten aus der Schweiz und aller Welt,News - International News
www landeszeitung de blog nachrichten aus aller welt auch bryan adams sagt konzert ab,News - International News
www landeszeitung de blog nachrichten aus aller welt bulle in supermarkt erschossen,News - International News
www landeszeitung de blog nachrichten aus aller welt durchwachsenes fruehlingswetter zu ostern,News - International News
www landeszeitung de blog nachrichten aus aller welt hallervorden besingt erdogan,News - International News
www landeszeitung de blog nachrichten aus aller welt patricia schlesinger wird die neue rbb intendantin,News - International News
www landeszeitung de blog nachrichten aus aller welt prinz harry besucht erdbebengebiete in nepal,News - International News
29 NBC NEWS,News - International News
f news tv deal in den usa formel wechselt zu nbc,News - International News
nbc 12 news richmond va.,News - International News
NBC 4 News TV Arkansas,News - International News
nbc 7 news san diego sub,News - International News
san diego nbc news,News - International News
terroranschlag twitter nbc news skript kiddies,News - International News
news drei junge deutsche beim children of the world camp,News - International News
news trucks of the world die vielen gesichter des lkw,News - International News
Men Behind The Sun,News - International News
panorama claudia bier und autos the sun veroeffentlich liebesbrief an deutschland,News - International News
panorama the sun britische boulevardzeitung holt oben ohne models zurueck auf seite,News - International News
people tv royals the sun veroeffentlicht schockierende bilder hier zeigt die queen den hitler gruss id,News - International News
ingwer the epoche times deutschland,News - International News
July 2014 Count von Stauffenberg The Times,News - International News
olatz schnabel julian schnabel the ny times,News - International News
politik deutschland eine zeitung unserer epoche the epoch times a,News - International News
politik the times krt putin zum menschen des jahres in der,News - International News
politik welt ueberfall auf den technischen leiter von the epoch times in usa a,News - International News
produkte schipper malen nach zahlen the new york times square,News - International News
The Times interview with Herr von Staffenberg,News - International News
The Times March 14 NHS disaster sub,News - International News
Dennis Cauchon USA Today Federal Salaries,News - International News
USA TODAY's 2016 Presidential Poll Tracker,News - International News
berliner volksblatt spandau,News - Local News
jobangebote Berliner volksblatt,News - Local News
Fuldaer zeitung,News - Local News
fuldaer zeitung archiv,News - Local News
Fuldaer Zeitung Ausgabe vom 19.04.2016,News - Local News
fuldaer zeitung autoanzeigen,News - Local News
fuldaer zeitung familiennachrichtekn,News - Local News
fuldaer zeitung lokales,News - Local News
Michael Koch Todesanzeige Fuldaer Zeitung,News - Local News
nachrichten fz der tragoedie naechster teil kommentar der fuldaer zeitung zum fall boehmermann,News - Local News
nachrichten fz wir brauchen endlich wieder mut zur wahrheit kommentar der fuldaer zeitung zu den uebergriffen auf frauen in koeln,News - Local News
news artikel fz geliebt und gehasst kommentar fuldaer zeitung zum tod von guido westerwelle,News - Local News
thomas schmitt fuldaer zeitung,News - Local News
Todesanzeigen Fuldaer Zeitung Lesen,News - Local News
dn hamburger abendblatt de,News - Local News
familie leben preis des hamburger abendblatts fuer beste fluechtlingshilfe stoesst auf kritik,News - Local News
frage sind nur am samstag stellenangebote im hamburger abendblatt oder auch in der woche,News - Local News
hamburger abendblatt ak barmbek,News - Local News
immobilienmarkt hamburger abendblatt,News - Local News
ipad apps reisen ausfluege hamburger abendblatt,News - Local News
ipad apps reisen zeitreise hd hamburger abendblatt,News - Local News
kai schiller hamburger abendblatt,News - Local News
kulinarisches hamburger abendblatt auswanderer kullig ilgenstein,News - Local News
marathon hamburg 2016 hamburger abendblatt bilder,News - Local News
panorama gesellschaft erfolgreiche spendenaktion vom hamburger abendblatt,News - Local News
panorama gesellschaft spendenaktion fuer fluechtlinge hamburger abendblatt mobilisiert tausende leser,News - Local News
politik deutschland themen hamburger abendblatt,News - Local News
roger cicero traueranzeige hamburger abendblatt,News - Local News
roger willemsen hamburger abendblatt traueranzeige,News - Local News
search kreuzwortraetsel hamburger abendblatt,News - Local News
tb a r arbeitssuche hamburger abendblatt stellenanzeigen blick,News - Local News
Todesanzeigen Hamburger Abendblatt Archiv,News - Local News
werbung hamburger abendblatt,News - Local News
firmenpresse hamburger morgenpost,News - Local News
Hamburger Morgenpost,News - Local News
Hamburger Morgenpost Aktuell,News - Local News
Hamburger Morgenpost Mopo,News - Local News
nachrichten app taxi deutschland testsieger im app vergleich der hamburger morgenpost,News - Local News
panorama gesellschaft brandanschlag auf hamburger morgenpost staatsschutz ermittelt,News - Local News
politik deutschland lutz bachmann will hamburger morgenpost fuer schandfleck titel verklagen,News - Local News
PresseInfo hamburger morgenpost,News - Local News
pressinfo kreuzfahrt hamburg neues magazin der hamburger morgenpost mit fernweh garantie,News - Local News
pressinfo uptone turnier der toene hamburger morgenpost konzeptioniert ihren bandcontest neu,News - Local News
sport fussball themen hamburger morgenpost,News - Local News
www.hamburger Morgenpost vom 23.03.2016,News - Local News
1 heilbronner stimme geburtsanzeigen,News - Local News
19.01.2016 Heilbronner Stimme,News - Local News
70 jahre heilbronner stimme gewinnspiel,News - Local News
70 tage 70 gewinne heilbronner stimme,News - Local News
andré daub heilbronner stimme,News - Local News
andreas strähle Heilbronner Stimme,News - Local News
Anzeige 45 Jubiläum Heilbronner Stimme,News - Local News
anzeige heilbronner stimme vom mittwoch,News - Local News
Artikel Lindenhof Heilbronner Stimme,News - Local News
asyl heilbronner stimme,News - Local News
audi neckarsulm heilbronner stimme,News - Local News
Auktion Heilbronner stimme 2016,News - Local News
bad wimpfen lidl heilbronner stimme,News - Local News
bauernhofcafe heilbronner stimme,News - Local News
bauplatze heilbronner stimme,News - Local News
Bericht heilbronner stimme fc möckmühl,News - Local News
bezirksschützentag lauffen am neckar 2016 heilbronner stimme,News - Local News
Bildergalerie Heilbronner Stimme,News - Local News
boerse nachrichten pressestimme heilbronner stimme zu terror in belgien und frankreich,News - Local News
danksagung trauer heilbronner stimme,News - Local News
Florian huber Heilbronner Stimme,News - Local News
geburten heilbronner stimme,News - Local News
gemeinschaftsanzeige danksagung kommunion heilbronner stimme,News - Local News
gewinnspiel heilbronner stimme,News - Local News
handelsregister heilbronner stimme,News - Local News
heilbronn heilbronner stimme uni für erwachsene,News - Local News
heilbronner stimme 02.04,News - Local News
heilbronner stimme 06.03.2016,News - Local News
heilbronner stimme 10 04 2016 zeitung,News - Local News
heilbronner stimme 20 april,News - Local News
Immobilienmarkt Heilbronner Stimme,News - Local News
inserat heilbronner stimme,News - Local News
jobbörse heilbronner stimme,News - Local News
karsten kammholz heilbronner stimme,News - Local News
kaufland heilbronner stimme,News - Local News
kofirmanden in der heilbronner stimme,News - Local News
konfirmanden 2016 heilbronner stimme,News - Local News
konzertbericht a ha heilbronner stimme,News - Local News
kretschmann heilbronner stimme,News - Local News
landtagswahl bw heilbronner stimme,News - Local News
Lokale Kultur heilbronner Stimme,News - Local News
Lokale Kultur Herr Sommer heilbronner Stimme,News - Local News
motorrad unfall 11.märz heilbronner stimme,News - Local News
musiknacht der autohäuser Heilbronner stimme bilder,News - Local News
nachricht pressestimme heilbronner stimme afd schiessbefehl,News - Local News
nachricht pressestimme heilbronner stimme terror belgien frankreich,News - Local News
nachrichten pressestimme heilbronner stimme zu terror in belgien und frankreich,News - Local News
neueröffnung kaufhof Heilbronner stimme,News - Local News
omnibus müller massenbachhausen heilbronner stimme,News - Local News
online Traueranzeigen der Heilbronner Stimme,News - Local News
partybilder heilbronner stimme,News - Local News
polizeibericht heilbronner stimme,News - Local News
polizeiticker heilbronn heilbronner stimme,News - Local News
sascha brodmann Heilbronner stimme,News - Local News
sterbeanzeigen heilbronner stimme,News - Local News
telefon heilbronner stimme,News - Local News
todesanzeige am 20.03.2016 in der heilbronner stimme,News - Local News
todesanzeige heilbronner stimme böhm,News - Local News
todesanzeigen heilbronner stimme ab 02.04.2016,News - Local News
todesanzeigen heilbronner stimme april 2015,News - Local News
todesfälle erlenbach binswangen heilbronner stimme,News - Local News
unfall heilbronner stimme möckmhl - züttlingen,News - Local News
verkaufsoffener sonntag heilbronner stimme,News - Local News
verkehrsmeldungen heilbronner stimme,News - Local News
wahlergebnisse heilbronn landtag heilbronner stimme,News - Local News
wahlergebnisse Heilbronner stimme,News - Local News
Wahlforum der Heilbronner Stimme zur Landtagswahl,News - Local News
wahllandkarte heilbronner stimme,News - Local News
wertwiesen feiern muss heilbronner stimme,News - Local News
wochenblatt heilbronner stimme,News - Local News
lingener tagespost anzeigen,News - Local News
lingener tagespost immobilien,News - Local News
Lingener Tagespost Online Lesen,News - Local News
lingener tagespost todesanzeigen,News - Local News
bramscher nachrichten lokales,News - Local News
lokale nachrichten aus schleiz,News - Local News
lokale nachrichten düsseldorf,News - Local News
lokale nachrichten oberhaching,News - Local News
lokale nachrichten von laer,News - Local News
lokales elmshorner nachrichten,News - Local News
nachrichten archiv lokales detailansicht che fordert neuordnung der studienfoerderung,News - Local News
westfalenpost hagen lokale nachrichten,News - Local News
Wormser Zeitung Lokale Nachrichten,News - Local News
wz lokale nachrichten,News - Local News
lübecker nachrichten,News - Local News
Lübecker Nachrichten Flughafen2016,News - Local News
lübecker nachrichten marinemusikkorps 5 konzert trappenkamp,News - Local News
aktuelle nachrichten kronach neue presse,News - Local News
aktuelles presse pressemitteilung detail neuer glanz fuer triste kellerwaende,News - Local News
Anzeige Neue Presse Kronach,News - Local News
Anzeige Neue Presse Kronach Kontakt,News - Local News
Coburg neue Presse,News - Local News
ebern neue presse,News - Local News
frankfurter neue presse in german,News - Local News
Kronacher Neue Presse sub,News - Local News
Landjugend mit neuer spitze Fechheim neue Presse Coburg,News - Local News
lokal coburg coburg neue presse kneipennacht;art,News - Local News
nachrichten presse blog koeln weiterer rueckschlag fuer neue luftrettungsstation,News - Local News
nachrichten presse einladung start des neuen online tv channels doppio tv in berlin,News - Local News
news presse neues sonntagsblatt wirbt um gunst der leser id,News - Local News
passauer neue presse mietwohnungen,News - Local News
Passauer Neue Presse Stellenmarkt,News - Local News
passauer neue presse wohnungsmarkt,News - Local News
schule 2000 ebern neue presse,News - Local News
Todesanzeigen Neue Presse,News - Local News
Todesanzeigen Neue Presse Kronach,News - Local News
wohnungen passauer neue presse,News - Local News
Nürnberger Nachrichten,News - Local News
Nürnberger Nachrichten Gottesdienstanzeiger,News - Local News
nürnberger nachrichten leoni 2016,News - Local News
lokales pinneberger tageblatt a in richtung hamburg zeitweise voll gesperrt id,News - Local News
lokales pinneberger tageblatt brandursache in elmshorn unklar jaehriger in hamburg niedergestochen bekommt tornesch ein neues rathaus id,News - Local News
lokales pinneberger tageblatt hallenbad elmshorn sanierung oder neubau gunter gabriel in wedel schenefeld meilenstein beim xfel bau id,News - Local News
lokales pinneberger tageblatt hamburg leiche in der alster entdeckt dienstreiseaffaere politik will aufklaeren fahrerflucht in wedel id,News - Local News
lokales pinneberger tageblatt jaehrige frau nach unfall in lebensgefahr id,News - Local News
