sehr trockene gesichtshaut hausmittel,Beauty & Fitness - Face & Body Care
shiseido gesichtspflege benefiance,Beauty & Fitness - Face & Body Care
shiseido gesichtspflege benefiance nutriperfect,Beauty & Fitness - Face & Body Care
shiseido gesichtspflege benefiance wrinkleresist,Beauty & Fitness - Face & Body Care
shiseido gesichtspflege bio performance,Beauty & Fitness - Face & Body Care
shiseido gesichtspflege eudermine,Beauty & Fitness - Face & Body Care
shiseido gesichtspflege future solution lx,Beauty & Fitness - Face & Body Care
shiseido gesichtspflege generic skincare,Beauty & Fitness - Face & Body Care
shiseido gesichtspflege pureness,Beauty & Fitness - Face & Body Care
shiseido gesichtspflege ultimune,Beauty & Fitness - Face & Body Care
susanne kaufmann tagescreme linie f,Beauty & Fitness - Face & Body Care
tagescreme besser und hygienischer dosieren a,Beauty & Fitness - Face & Body Care
tagescreme lichtschutzfaktor naturkosmetik,Beauty & Fitness - Face & Body Care
Tagescreme Lsf 30,Beauty & Fitness - Face & Body Care
themen trend herren gesichtspflege,Beauty & Fitness - Face & Body Care
today regenerierende nachtcreme test,Beauty & Fitness - Face & Body Care
trockene faltige gesichtshaut hals,Beauty & Fitness - Face & Body Care
trockene fettige gesichtshaut,Beauty & Fitness - Face & Body Care
trockene fleckige gesichtshaut,Beauty & Fitness - Face & Body Care
trockene gereizte gesichtshaut hausmittel,Beauty & Fitness - Face & Body Care
trockene gesichtshaut augenlider hausmittel,Beauty & Fitness - Face & Body Care
trockene gesichtshaut linola fett,Beauty & Fitness - Face & Body Care
Trockene gesichtshaut mit falten top,Beauty & Fitness - Face & Body Care
trockene gesichtshaut mit knötchen erfahrungen,Beauty & Fitness - Face & Body Care
trockene gesichtshaut quark,Beauty & Fitness - Face & Body Care
trockene gesichtshaut rote flecken,Beauty & Fitness - Face & Body Care
trockene gesichtshaut schüssler salze,Beauty & Fitness - Face & Body Care
trockene schuppige gesichtshaut creme,Beauty & Fitness - Face & Body Care
trockene und juckende gesichtshaut und kopfhaut,Beauty & Fitness - Face & Body Care
trockene und schuppige gesichtshaut ursachen,Beauty & Fitness - Face & Body Care
vitasens tages- und nachtcreme preise,Beauty & Fitness - Face & Body Care
was hilft bei trockener ung geroeteter gesichtshaut,Beauty & Fitness - Face & Body Care
Was hilft gegen extrem trockene Gesichtshaut,Beauty & Fitness - Face & Body Care
endlich fashionweek auch fuer xeniaoverdose ️ fwmaybelline berlin,Beauty & Fitness - Fashion & Style
mode und schmuck fruehling und sommer fashionweek berlin escada batikkleid,Beauty & Fitness - Fashion & Style
mode und schmuck fruehling und sommer fashionweek berlin escada tuerkisenes kleid,Beauty & Fitness - Fashion & Style
fashionblog für kleine frauen,Beauty & Fitness - Fashion & Style
mode stil fashionblog anders anziehen,Beauty & Fitness - Fashion & Style
whoismocca com fashion so kombiniert man eine bluse mit ausgestellten aermeln fashionblog,Beauty & Fitness - Fashion & Style
boyfriend jeans rollkragen bomberjacke drei fashiontrends die frauen von männern geklaut haben,Beauty & Fitness - Fashion & Style
mode fashiontrends in korallrot und azurblau aber bitte mit farbe,Beauty & Fitness - Fashion & Style
reisen und leben maenner drei fashiontrends die frauen von maennern geklaut haben,Beauty & Fitness - Fashion & Style
fashionweek live virtuell und spielerisch karriere in der modebranche machen als facebook app,Beauty & Fitness - Fashion & Style
frage wie kommt man auf eine fashionweek modeshow als fotograf,Beauty & Fitness - Fashion & Style
mein vlog von der fashionweek teil kommt um uhr auf,Beauty & Fitness - Fashion & Style
mode und schmuck fruehling und sommer fashionweek berlin escada,Beauty & Fitness - Fashion & Style
promis guido maria kretschmer mit fast ertrunken und gestorben neue kollektion auf berliner mercedes benz fashionweek,Beauty & Fitness - Fashion & Style
rebecca mir laeuft auf der new york fashionweek,Beauty & Fitness - Fashion & Style
stargalerie ariane sommer und jenny elvers elbertzhagen als gaeste auf der berliner winter fashion week attachment ariane sommer fashionweek,Beauty & Fitness - Fashion & Style
topmodels kommen nach zuerich sihlcity fashionweek,Beauty & Fitness - Fashion & Style
albrecht ollendiek haute couture,Beauty & Fitness - Fashion & Style
allgemein smokingblazer wunderschone haute couture vom deutschen modeprinzen,Beauty & Fitness - Fashion & Style
bilder japan modewoche haute couture,Beauty & Fitness - Fashion & Style
brautkleider die schoensten modelle von den haute couture schauen id index,Beauty & Fitness - Fashion & Style
chanel haute couture bilder die du von der chanel show gesehen haben musst,Beauty & Fitness - Fashion & Style
de haute couture kollektion blumen modern geschnittenen neues design kleid,Beauty & Fitness - Fashion & Style
de haute couture kollektion brokat schwarz drucken blase kleid,Beauty & Fitness - Fashion & Style
de haute couture kollektion dunkelblaues besonderes paillettenkleid,Beauty & Fitness - Fashion & Style
de haute couture kollektion edle perlende perle weisses schnursenkel kleid,Beauty & Fitness - Fashion & Style
de haute couture kollektion einfache weisse pailletten kleid,Beauty & Fitness - Fashion & Style
de haute couture kollektion jacquard kleid verschonert rosen,Beauty & Fitness - Fashion & Style
de haute couture kollektion metallic gold kleid,Beauty & Fitness - Fashion & Style
de haute couture kollektion moderne schlanke organza ruschen weisses kleid,Beauty & Fitness - Fashion & Style
de haute couture kollektion schlange drucken pencil kleid,Beauty & Fitness - Fashion & Style
de haute couture kollektion spitzen besticktes besonderes kleid,Beauty & Fitness - Fashion & Style
de haute couture kollektion v ausschnitt aus der schulter kleid,Beauty & Fitness - Fashion & Style
de haute couture kollektion weiss verziertes italienisches kleid,Beauty & Fitness - Fashion & Style
de haute couture kollektion weisses kleid romantischen blumen print,Beauty & Fitness - Fashion & Style
designermode in xxl der traum vom haute couture kleid n,Beauty & Fitness - Fashion & Style
DESSIN DE HAUTE COUTURE,Beauty & Fitness - Fashion & Style
deutsch italienisch haute couture,Beauty & Fitness - Fashion & Style
fliegeranzug haute couture,Beauty & Fitness - Fashion & Style
fotostrecke kevin costner besucht haute couture schau von versace fotostrecke,Beauty & Fitness - Fashion & Style
Georges Chakra Haute Couture,Beauty & Fitness - Fashion & Style
gisele bundchen in chanel haute couture by patrick demarchelier,Beauty & Fitness - Fashion & Style
haute couture in paris die braut traegt badekappe und mehr verrueckte trends,Beauty & Fitness - Fashion & Style
haute couture karl lagerfeld,Beauty & Fitness - Fashion & Style
haute couture kunststoff schmetterling,Beauty & Fitness - Fashion & Style
Haute Couture Lingerie Blogs,Beauty & Fitness - Fashion & Style
haute couture selber nähen,Beauty & Fitness - Fashion & Style
haute couture unterwäsche,Beauty & Fitness - Fashion & Style
kleider haute couture,Beauty & Fitness - Fashion & Style
life mode aus der schweiz fast so schoen wie haute couture id,Beauty & Fitness - Fashion & Style
lifestyle mode haute couture schauen exotische weiblichkeit fuer die kalte jahreszeit,Beauty & Fitness - Fashion & Style
lifestyle mode haute couture schauen in paris chanel dior und versace zeigen ihre entwuerfe fuer sommer,Beauty & Fitness - Fashion & Style
lifestyle mode schaeferhund schal haute couture aus hundefell,Beauty & Fitness - Fashion & Style
meldungen haute couture die anfaenge der hohen schneiderkunst,Beauty & Fitness - Fashion & Style
mode leckere kleider haute couture auf schokolade al,Beauty & Fitness - Fashion & Style
news schweiz ostschweiz nationale textilbranche in st gallen haute couture am kinderfest id,Beauty & Fitness - Fashion & Style
paris fashion week haute couture hw die schraegsten kleider aus paris,Beauty & Fitness - Fashion & Style
paris haute couture fs abendkleider die abendkleider von elie saab valentino und zuhair murad,Beauty & Fitness - Fashion & Style
rechteckig haute couture kunststoff,Beauty & Fitness - Fashion & Style
reisen und leben haute couture in paris galliano freie dior schau,Beauty & Fitness - Fashion & Style
reisen und leben tragbar ist anders haute couture aus japan,Beauty & Fitness - Fashion & Style
sonnenbrillen oval haute couture kunststoff,Beauty & Fitness - Fashion & Style
sonnenbrillen rechteckig haute couture metall,Beauty & Fitness - Fashion & Style
sonnenbrillen rund haute couture kunststoff,Beauty & Fitness - Fashion & Style
vermischtes karl lagerfeld glaubt die zukunft der haute couture,Beauty & Fitness - Fashion & Style
wirtschaft news nische sticken fuer die haute couture,Beauty & Fitness - Fashion & Style
wirtschaft schmuckhersteller wellendorff haute couture in gold a,Beauty & Fitness - Fashion & Style
wo kann man elie saab haute couture kaufen,Beauty & Fitness - Fashion & Style
angebot karl lagerfeld geldboerse light blue,Beauty & Fitness - Fashion & Style
chanel karl lagerfeld,Beauty & Fitness - Fashion & Style
chaussures femme karl lagerfeld,Beauty & Fitness - Fashion & Style
damen schmuck broschen karl lagerfeld,Beauty & Fitness - Fashion & Style
designer karl lagerfeld,Beauty & Fitness - Fashion & Style
femme karl lagerfeld jean,Beauty & Fitness - Fashion & Style
homme karl lagerfeld,Beauty & Fitness - Fashion & Style
Karl Lagerfeld bag,Beauty & Fitness - Fashion & Style
karl lagerfeld chanel grand palais,Beauty & Fitness - Fashion & Style
Karl Lagerfeld for H M,Beauty & Fitness - Fashion & Style
karl lagerfeld kleider,Beauty & Fitness - Fashion & Style
karl lagerfeld linge de maison,Beauty & Fitness - Fashion & Style
karl lagerfeld taschen,Beauty & Fitness - Fashion & Style
karl lagerfeld uhren,Beauty & Fitness - Fashion & Style
lifestyle mode karl lagerfeld kaiser karls billige kleider,Beauty & Fitness - Fashion & Style
lifestyle mode karl lagerfeld mode lebt von hysterie,Beauty & Fitness - Fashion & Style
linge de maison Karl Lagerfeld,Beauty & Fitness - Fashion & Style
lunettes karl lagerfeld,Beauty & Fitness - Fashion & Style
luxe femme karl lagerfeld,Beauty & Fitness - Fashion & Style
mode trends karl lagerfeld geburtstag,Beauty & Fitness - Fashion & Style
montre karl lagerfeld femme,Beauty & Fitness - Fashion & Style
montre karl lagerfeld homme,Beauty & Fitness - Fashion & Style
produkte karl lagerfeld sonnenbrille,Beauty & Fitness - Fashion & Style
sacs femme karl lagerfeld,Beauty & Fitness - Fashion & Style
sandales karl lagerfeld,Beauty & Fitness - Fashion & Style
women bags karl lagerfeld,Beauty & Fitness - Fashion & Style
fruehjahrsmode fakten warum der fruehling die beste mode saison von allen ist,Beauty & Fitness - Fashion & Style
mode die bagel tasche von chanel ist das must have der saison al,Beauty & Fitness - Fashion & Style
mode die neuen maentel liebling der saison,Beauty & Fitness - Fashion & Style
mode fragen zur neuen mode die tasche der saison,Beauty & Fitness - Fashion & Style
mode must have der saison eine muetze bl,Beauty & Fitness - Fashion & Style
mode stil charlize theron co weiss die trendfarbe der saison,Beauty & Fitness - Fashion & Style
mode stil die schuhmodelle der saison wer stil hat traegt sneaker,Beauty & Fitness - Fashion & Style
people tv schweiz aargauerin manuela frey ist das erfolgreichste model der saison ich shoppe am liebsten bei h m id,Beauty & Fitness - Fashion & Style
a gloeoekler harald modedesigner lampenkollektion eglo,Beauty & Fitness - Fashion & Style
Anette Modedesignerin Südafrika,Beauty & Fitness - Fashion & Style
artikel die ausbildung zum modedesigner,Beauty & Fitness - Fashion & Style
artikel traumberuf modedesigner,Beauty & Fitness - Fashion & Style
berliner modedesigner,Beauty & Fitness - Fashion & Style
berufsausbildungen modedesigner modedesignerin,Beauty & Fitness - Fashion & Style
berühmte modedesigner,Beauty & Fitness - Fashion & Style
blog die einflussreichsten modedesigner des jahrhunderts coco chanel,Beauty & Fitness - Fashion & Style
blog die einflussreichsten modedesigner des jahrhunderts gianfranco ferr,Beauty & Fitness - Fashion & Style
blog die einflussreichsten modedesigner des jahrhunderts karl lagerfeld,Beauty & Fitness - Fashion & Style
blog die einflussreichsten modedesigner des jahrhunderts wolfgang joop,Beauty & Fitness - Fashion & Style
blog die einflussreichsten modedesigner des jahrhunderts yves saint laurent,Beauty & Fitness - Fashion & Style
mode turnschuhe renner der saison al,Beauty & Fitness - Fashion & Style
brasilianischer modedesigner in berlin,Beauty & Fitness - Fashion & Style
dänische modedesigner,Beauty & Fitness - Fashion & Style
dehoff lette modedesignerin,Beauty & Fitness - Fashion & Style
design deutschlandweit modedesigner,Beauty & Fitness - Fashion & Style
deutsche junge modedesigner,Beauty & Fitness - Fashion & Style
duesseldorf materialien glasaugen fuer schmuck und modedesigner oder bastler recordid,Beauty & Fitness - Fashion & Style
einstiegsgehalt modedesigner zalando,Beauty & Fitness - Fashion & Style
erfolgreichste modedesigner,Beauty & Fitness - Fashion & Style
frage der weg zur modedesignerin,Beauty & Fitness - Fashion & Style
frage gehalt und chancen fuer modedesigner,Beauty & Fitness - Fashion & Style
frage prakikum bei beruehmten modedesignern,Beauty & Fitness - Fashion & Style
frage staatlichgepruefter modedesigner,Beauty & Fitness - Fashion & Style
junge modedesigner berlin,Beauty & Fitness - Fashion & Style
junge modedesigner münchen,Beauty & Fitness - Fashion & Style
kanadischer Modedesigner,Beauty & Fitness - Fashion & Style
kleinanzeigen kreatives nebenjob als modedesignerin schneiderin a,Beauty & Fitness - Fashion & Style
mastermind modedesigner,Beauty & Fitness - Fashion & Style
meldungen michael kors modedesigner ist jetzt milliardaer,Beauty & Fitness - Fashion & Style
Modedesigner aus Norddeutschland,Beauty & Fitness - Fashion & Style
modedesigner ausbildung,Beauty & Fitness - Fashion & Style
modedesigner basteln cover zauberhafte designer cover,Beauty & Fitness - Fashion & Style
Modedesigner Bekleidung Änderungsschneider Herrenausstatter,Beauty & Fitness - Fashion & Style
modedesigner glööckler,Beauty & Fitness - Fashion & Style
modedesigner judaschkin 2016,Beauty & Fitness - Fashion & Style
modedesigner skizzen lernen,Beauty & Fitness - Fashion & Style
modedesigner werde,Beauty & Fitness - Fashion & Style
modedesignerin anna scholz,Beauty & Fitness - Fashion & Style
Modedesignerin Fanny Karst,Beauty & Fitness - Fashion & Style
Modenäher Änderungsschneider Bekleidung Modedesigner Herrenausstatter,Beauty & Fitness - Fashion & Style
people international smalltalk mit guido maria kretschmer modedesigner viele schweizerinnen haben italienischen chic id,Beauty & Fitness - Fashion & Style
ranking der modedesigner,Beauty & Fitness - Fashion & Style
reichste modedesigner,Beauty & Fitness - Fashion & Style
stellenangebote job junior modedesigner (mw) balingen,Beauty & Fitness - Fashion & Style
top 10 der herren Modedesigner,Beauty & Fitness - Fashion & Style
türkische modedesigner,Beauty & Fitness - Fashion & Style
vermischtes anschubhilfe fuer deutsche modedesigner,Beauty & Fitness - Fashion & Style
vermischtes tommy hilfiger der modedesigner wird,Beauty & Fitness - Fashion & Style
vom sportler zum modedesigner fred perry,Beauty & Fitness - Fashion & Style
ablauf einer Modeschau,Beauty & Fitness - Fashion & Style
erotische modeschauen,Beauty & Fitness - Fashion & Style
eva stich Modeschau,Beauty & Fitness - Fashion & Style
exklusive modeschauen auf den muenchner trachtentagen,Beauty & Fitness - Fashion & Style
luminale 2016 Modeschau,Beauty & Fitness - Fashion & Style
Modeschau Mailand,Beauty & Fitness - Fashion & Style
trachten schaufenster trachten modeschau,Beauty & Fitness - Fashion & Style
mode modetrends galerie der trend stars in stripes der sommer wird gestreift,Beauty & Fitness - Fashion & Style
beauty new york fashion week wir essen die ganze zeit,Beauty & Fitness - Fashion & Style
familie leben model mit down syndrom laeuft auf der fashion week in new york,Beauty & Fitness - Fashion & Style
kendall jenner nackedei new york fashion week video,Beauty & Fitness - Fashion & Style
lifestyle mode new york fashion week nicole scherzinger zeigt mega dekollete,Beauty & Fitness - Fashion & Style
new york fashion week fs die traumkleider von zac posen,Beauty & Fitness - Fashion & Style
promis heidi klum in der kritik project runway models bei der new york fashion week zu mager,Beauty & Fitness - Fashion & Style
reisen und leben new york fashion week lena meyer landrut kein grundgefuehl fuer mode,Beauty & Fitness - Fashion & Style
article styleberatung fur manner teil kleidung,Beauty & Fitness - Fashion & Style
farb und styleberatung,Beauty & Fitness - Fashion & Style
welcher stil passt zu mir,Beauty & Fitness - Fashion & Style
fashionblog munich chic,Beauty & Fitness - Fashion & Style
elie saab der designer von der haute couture zum parfum,Beauty & Fitness - Fashion & Style
kendall jenner chanel haute couture runway paris kendalljenner,Beauty & Fitness - Fashion & Style
Kim Kardashian ist nicht nur für ihre Fashion-Outfits bekannt auf ihrem Instagram-Profil postete der Reality-TV-Star jetzt ein sehr privates Bild das sie beim Anziehen eines weißen Haute-Couture-Kleides zeigt.,Beauty & Fitness - Fashion & Style
lifestyle mode haute couture karl lagerfeld macht auf unschuld vom lande,Beauty & Fitness - Fashion & Style
schmetterling haute couture kunststoff,Beauty & Fitness - Fashion & Style
sonnenbrillen rechteckig haute couture kunststoff,Beauty & Fitness - Fashion & Style
zeit magazin haute couture paris neue kollektionen,Beauty & Fitness - Fashion & Style
karl lagerfeld ballerines black ka q,Beauty & Fitness - Fashion & Style
Karl lagerfeld clutch bag,Beauty & Fitness - Fashion & Style
karl lagerfeld glasses,Beauty & Fitness - Fashion & Style
mode stil karl lagerfeld ich verbrachte meine kindheit lederhosen,Beauty & Fitness - Fashion & Style
vermischtes toni garrn beherzigt tipps von karl lagerfeld,Beauty & Fitness - Fashion & Style
die wichtigsten trendteile im überblick der herbst kommt: die fünf must haves der saison,Beauty & Fitness - Fashion & Style
andreas gabalier gab sein debut als modedesigner,Beauty & Fitness - Fashion & Style
artikel looks der besten modedesigner,Beauty & Fitness - Fashion & Style
frage wie wird man modedesignerin,Beauty & Fitness - Fashion & Style
Karl Lagerfel ist einer der bekanntesten deutschen Modedesigner. Durch die klaren und einzigartigen Kreationen wurde er international in der Mode-und Designer-Szene.,Beauty & Fitness - Fashion & Style
lifestyle leute modedesigner jason wu hat geheiratet,Beauty & Fitness - Fashion & Style
modedesigner joel berlin,Beauty & Fitness - Fashion & Style
wie wird man modedesigner,Beauty & Fitness - Fashion & Style
lifestyle mode fashionweek michalsky demonstriert in berlin,Beauty & Fitness - Fashion & Style
clips dieses schwein hat seinen eigenen fashionblog,Beauty & Fitness - Fashion & Style
kleine Modeschau kosten,Beauty & Fitness - Fashion & Style
lifestyle nass und dreckig modeschau im schlamm,Beauty & Fitness - Fashion & Style
modeschau braunfels,Beauty & Fitness - Fashion & Style
Modeschau Delmenhorst,Beauty & Fitness - Fashion & Style
bodybuilding kraftsport aufbauphase lange,Beauty & Fitness - Fitness
bodybuilding kraftsport dickeres gesicht aufbauphase,Beauty & Fitness - Fitness
duka diät aufbauphase,Beauty & Fitness - Fitness
frage ich bin cm gross und wiege zurzeit kg sind kcal in der aufbauphase zu viel,Beauty & Fitness - Fitness
frage speck angefressen in der masse aufbauphase muskelaufbau,Beauty & Fitness - Fitness
frage wie beginnt man nach einem ermuedungsbruch mit der aufbauphase,Beauty & Fitness - Fitness
threads mein speiseplan fuer die aufbauphase,Beauty & Fitness - Fitness
wie lange aufbauphase,Beauty & Fitness - Fitness
frage bestes online fitnessprogramm,Beauty & Fitness - Fitness
aktuelles neuer trend muttermilch fuer bodybuilder a,Beauty & Fitness - Fitness
alfred krautgartner bodybuilder,Beauty & Fitness - Fitness
Andreas Ziegler Bodybuilder,Beauty & Fitness - Fitness
arnold schlesinger bodybuilder,Beauty & Fitness - Fitness
arnold schwarzenegger bodybuilder,Beauty & Fitness - Fitness
aufreger bodybuilder starb beim bankdruecken,Beauty & Fitness - Fitness
Bcaa für Bodybuilder,Beauty & Fitness - Fitness
Best Natural Bodybuilders,Beauty & Fitness - Fitness
BODYBUILDER,Beauty & Fitness - Fitness
bodybuilder abendessen,Beauty & Fitness - Fitness
bodybuilder anfänger ernährungsplan,Beauty & Fitness - Fitness
bodybuilder die rheuma haben,Beauty & Fitness - Fitness
bodybuilder joggen schlapp,Beauty & Fitness - Fitness
bodybuilder kraftsportler,Beauty & Fitness - Fitness
bodybuilder vegan ernährung,Beauty & Fitness - Fitness
bodybuilder vorher nachher bilder,Beauty & Fitness - Fitness
bodybuilder weisheiten,Beauty & Fitness - Fitness
bodybuilder zinkbedarf,Beauty & Fitness - Fitness
bodybuilding kraftsport vorurteil alle bodybuilder nehmen anabolika,Beauty & Fitness - Fitness
brot für bodybuilder,Beauty & Fitness - Fitness
Chris Bennett bodybuilder,Beauty & Fitness - Fitness
Desmond Miller Bodybuilder 2014,Beauty & Fitness - Fitness
deutsche bodybuilder frauen,Beauty & Fitness - Fitness
Duncan Garden Bodybuilder Facebook,Beauty & Fitness - Fitness
ernährungsplan bodybuilder der 80 er,Beauty & Fitness - Fitness
frage aggressionen eines bodybuilders von stoffen,Beauty & Fitness - Fitness
frage an alle bodybuilder grunduebungen wenn man fast jeden tag trainiert danke im voraus,Beauty & Fitness - Fitness
frage beispiel ernaehrungsplan fuer natural bodybuilder gesucht,Beauty & Fitness - Fitness
frage beissender koerpergeruch als bodybuilder,Beauty & Fitness - Fitness
frage bodybuilder koennen besser ueberleben,Beauty & Fitness - Fitness
frage bodybuilding wie hoch kann ein bodybuilder springen,Beauty & Fitness - Fitness
frage freund macht nach minuten im bett schlapp bodybuilder,Beauty & Fitness - Fitness
aufbauphase,Beauty & Fitness - Fitness
frage haben bodybuilder ueberhaupt echte muskeln,Beauty & Fitness - Fitness
frage ist der deutsche bodybuilder markus ruehl natural,Beauty & Fitness - Fitness
frage ist es rein theoretisch fuer jeden moeglich bodybuilder zu werden,Beauty & Fitness - Fitness
frage jugendliche bodybuilder,Beauty & Fitness - Fitness
frage kampfsportler gegen bodybuilder,Beauty & Fitness - Fitness
frage mit jahren bodybuilder anfangen,Beauty & Fitness - Fitness
frage muessen bodybuilder wirklich nachts eiweiss zufuehren,Beauty & Fitness - Fitness
frage sind bodybuilder so stark wie sie aussehen,Beauty & Fitness - Fitness
frage warum haben viele profi bodybuilder einen aufgeblaehten bauch und wie kann man es vermeiden,Beauty & Fitness - Fitness
frage warum sollte man als bodybuilder weizen als kohlenhydratquelle meiden,Beauty & Fitness - Fitness
frage weizenmehl gift fuer den maennlichen bodybuilder,Beauty & Fitness - Fitness
frage wie schaffen es die bodybuilder immer haarlos zu sein,Beauty & Fitness - Fitness
frage wie sieht ein cm oberarm umfang aus model bodybuilder,Beauty & Fitness - Fitness
frage wie viele eier soll man am tag essen als bodybuilder,Beauty & Fitness - Fitness
frage wie wird man profi bodybuilder und hollt sich sponsoren,Beauty & Fitness - Fitness
frage wieso haben bodybuilder immer so duenne beine,Beauty & Fitness - Fitness
frage wieso trinken bodybuilder ihre proteinshakes immer mit wasser anstelle von milch,Beauty & Fitness - Fitness
frage wird man als bodybuilder dumm,Beauty & Fitness - Fitness
frage wofuer nehmen bodybuilder vermehrt zink,Beauty & Fitness - Fitness
frage wozu dient dieser guertelden bodybuilder meistens tragenwenn sie schwere gewichte stemmen,Beauty & Fitness - Fitness
frauen bodybuilder,Beauty & Fitness - Fitness
Garrett Wiese Bodybuilder,Beauty & Fitness - Fitness
haben bodybuilder muskelkater,Beauty & Fitness - Fitness
kann sich ein 140 kg schwerer bodybuilder vegan ernähren,Beauty & Fitness - Fitness
kieran billen bodybuilder,Beauty & Fitness - Fitness
kleidung bodybuilder,Beauty & Fitness - Fitness
kuchen für bodybuilder,Beauty & Fitness - Fitness
martin schoeller female bodybuilders,Beauty & Fitness - Fitness
miguel Wichmann Bodybuilder,Beauty & Fitness - Fitness
Miguel Wichmann Teen Bodybuilder Youtube,Beauty & Fitness - Fitness
mike mentzer bodybuilder,Beauty & Fitness - Fitness
nachricht sportnahrung de staerkste kraft fuer sportler bodybuilder,Beauty & Fitness - Fitness
nick anderson edinburgh bodybuilder,Beauty & Fitness - Fitness
Rich Piana bodybuilder,Beauty & Fitness - Fitness
scott klein bodybuilder,Beauty & Fitness - Fitness
serge henri bodybuilder,Beauty & Fitness - Fitness
simon schulz bodybuilder,Beauty & Fitness - Fitness
speiseplan eines bodybuilders,Beauty & Fitness - Fitness
sponsoren gehälter bodybuilder,Beauty & Fitness - Fitness
sport unglaublich was dieser einarmige bodybuilder leistet,Beauty & Fitness - Fitness
vegane bodybuilder ernährung,Beauty & Fitness - Fitness
viktor kraus bodybuilder,Beauty & Fitness - Fitness
wie schwer sind bodybuilder,Beauty & Fitness - Fitness
zach derr bodybuilder,Beauty & Fitness - Fitness
arme und brust gleichzeitig trainieren,Beauty & Fitness - Fitness
artikel so trainieren sie brust schultern und arme,Beauty & Fitness - Fitness
beine brust zusammen trainieren,Beauty & Fitness - Fitness
beine vor brust trainieren,Beauty & Fitness - Fitness
bindegewebe brust trainieren,Beauty & Fitness - Fitness
breite brust trainieren,Beauty & Fitness - Fitness
brust effektiv trainieren,Beauty & Fitness - Fitness
brust effektiv zu hause trainieren,Beauty & Fitness - Fitness
brust flach trainieren,Beauty & Fitness - Fitness
brust gezielt trainieren,Beauty & Fitness - Fitness
brust gleichmäßig trainieren,Beauty & Fitness - Fitness
brust größer trainieren frau,Beauty & Fitness - Fitness
