Blue Movie Online Video,Arts & Entertainment - Online Media
breege auf rügen webcam,Arts & Entertainment - Online Media
breitenberg ostallgaeu webcams c,Arts & Entertainment - Online Media
bremen blockland webcams,Arts & Entertainment - Online Media
bremen buergerweide webcams,Arts & Entertainment - Online Media
brutale pornos zum online schauen video,Arts & Entertainment - Online Media
cro meine musik kostenlos herunterladen,Arts & Entertainment - Online Media
das boot musik herunterladen,Arts & Entertainment - Online Media
den haag webcam,Arts & Entertainment - Online Media
denver webcams,Arts & Entertainment - Online Media
Deutsche Pornos und Porno Videos Online,Arts & Entertainment - Online Media
deutsche sex videos online,Arts & Entertainment - Online Media
deutsche sprache online deutsch lernen videos und interaktive uebungen,Arts & Entertainment - Online Media
die besten internetportale,Arts & Entertainment - Online Media
dornoch webcam,Arts & Entertainment - Online Media
dortmund brackel webcams,Arts & Entertainment - Online Media
einrichten einer online webcam,Arts & Entertainment - Online Media
eischoll webcam,Arts & Entertainment - Online Media
eisenach webcam live,Arts & Entertainment - Online Media
eisenbahn romantik online videos neuzugaenge,Arts & Entertainment - Online Media
eisenhower tunnel webcam,Arts & Entertainment - Online Media
entjungferung online video live kostenlos ohne anmeldung,Arts & Entertainment - Online Media
erfrt stadion webcam,Arts & Entertainment - Online Media
erfurt bindersleben webcams,Arts & Entertainment - Online Media
erfurt webcam,Arts & Entertainment - Online Media
Erfurt wetter webcam,Arts & Entertainment - Online Media
erste hoerprobe zum neuen kay one album online video,Arts & Entertainment - Online Media
erste videos vom kollegah seyed videodreh online,Arts & Entertainment - Online Media
erster teil vom neuen kollegah film online video,Arts & Entertainment - Online Media
Fehmarn Webcam,Arts & Entertainment - Online Media
fehmarn webcams fehmarn webcam ostsee webcam lotsenhus,Arts & Entertainment - Online Media
Felberg webcam,Arts & Entertainment - Online Media
felbertauern webcam,Arts & Entertainment - Online Media
feldberg deutschland live webcam,Arts & Entertainment - Online Media
Fire Truck Videos Online,Arts & Entertainment - Online Media
forum multimedia online videos laufen nicht,Arts & Entertainment - Online Media
fotostrecke adele hello das neue video zum album ist online fotostrecke,Arts & Entertainment - Online Media
frage ab wann sind die videos bei rtl now online,Arts & Entertainment - Online Media
frage als minderjaehriger stockfotografie betreiben,Arts & Entertainment - Online Media
frage dsl k leitung twitch online zocken und videos gucken geht das gut,Arts & Entertainment - Online Media
frage fahren lernen max online version video clips von fragen speichernherunterladen,Arts & Entertainment - Online Media
frage filme online schauen videobb auf loads,Arts & Entertainment - Online Media
frage internetportale fuer einsame menschen,Arts & Entertainment - Online Media
frage kann man videos auf youtube um eine bestimmter uhrzeit online stellen lassen,Arts & Entertainment - Online Media
frage kostenlos online video erstellen,Arts & Entertainment - Online Media
frage kroatisch online lernen video,Arts & Entertainment - Online Media
frage video online stellen mit musik,Arts & Entertainment - Online Media
frage video von focus online herunterladen,Arts & Entertainment - Online Media
frage videos online bearbeitenmusic hinzufuegen,Arts & Entertainment - Online Media
frage welche kamera fuer stockfotografie kaufen,Arts & Entertainment - Online Media
frage wie kann ich bei simfy musik herunterladen,Arts & Entertainment - Online Media
frage wie kann ich ganz einfach musik auf meinem computer herunterladen,Arts & Entertainment - Online Media
frage wie kann ich itunes musik kostenlos herunterladen,Arts & Entertainment - Online Media
frage wo kann ich kostenlos online blog schreiben fotos videos hochladen etc,Arts & Entertainment - Online Media
frage wo kann ich online videos aus bildern erstellen,Arts & Entertainment - Online Media
frage wo kann man online musik hoeren ohne das dabei ein video laeuft,Arts & Entertainment - Online Media
frage wo lernt man online ohne video am besten zeichnen,Arts & Entertainment - Online Media
frage youtube videos ruckeln und stocken auf konsolen,Arts & Entertainment - Online Media
friedrichsthal webcam,Arts & Entertainment - Online Media
Friends webcam,Arts & Entertainment - Online Media
ganz legal musik herunterladen gratis,Arts & Entertainment - Online Media
gekaufte musik aus play store herunterladen,Arts & Entertainment - Online Media
gekaufte musik google play herunterladen,Arts & Entertainment - Online Media
gemafreie musik gratis herunterladen,Arts & Entertainment - Online Media
geo reisen reiseziele grad aufnahmen virtuelle panorama tour durch singapur,Arts & Entertainment - Online Media
Ghana Online Video,Arts & Entertainment - Online Media
google gekaufte musik herunterladen,Arts & Entertainment - Online Media
google play music gekaufte musik herunterladen,Arts & Entertainment - Online Media
gratis musik alben herunterladen,Arts & Entertainment - Online Media
gratis musik herunterladen,Arts & Entertainment - Online Media
gratis musik herunterladen blackberry,Arts & Entertainment - Online Media
gratis musik herunterladen ohne anmeldung,Arts & Entertainment - Online Media
grüße video online veschicken,Arts & Entertainment - Online Media
Günstige MP3 Downloads kaufen,Arts & Entertainment - Online Media
heilbronn webcam,Arts & Entertainment - Online Media
heiligenblut webcam,Arts & Entertainment - Online Media
hentei videos online,Arts & Entertainment - Online Media
herunterladen von musik,Arts & Entertainment - Online Media
hungerburg webcam feratel,Arts & Entertainment - Online Media
hunsrück erbeskopf webcam,Arts & Entertainment - Online Media
Huntington Beach WebCam,Arts & Entertainment - Online Media
hurtigruten bergen webcam,Arts & Entertainment - Online Media
internetportal für schwule Jugendliche,Arts & Entertainment - Online Media
internetportal krankenhaus,Arts & Entertainment - Online Media
jabel mecklenburg webcams,Arts & Entertainment - Online Media
Jeff Dunham Free Online Videos,Arts & Entertainment - Online Media
kempten heiligkreuz webcams,Arts & Entertainment - Online Media
kempten hirschdorf webcams,Arts & Entertainment - Online Media
kempten lenzfried webcams,Arts & Entertainment - Online Media
Klingeltoene MP3 Downloads,Arts & Entertainment - Online Media
koblenz am rhein metternich webcams,Arts & Entertainment - Online Media
kollektionen stockfotografie inspiration gesundheit,Arts & Entertainment - Online Media
kostenlos legal Musik herunterladen,Arts & Entertainment - Online Media
kostenlos musik album herunterladen,Arts & Entertainment - Online Media
kostenlos musik herunterladen auf handy,Arts & Entertainment - Online Media
kostenlos musik herunterladen download mp3 gratis,Arts & Entertainment - Online Media
kostenlos sex videos online ansehen,Arts & Entertainment - Online Media
lade videos online speicher hoch,Arts & Entertainment - Online Media
legal musik herunterladen,Arts & Entertainment - Online Media
legal nightcore musik herunterladen,Arts & Entertainment - Online Media
lenzerheide webcam,Arts & Entertainment - Online Media
lenzkirch webcam,Arts & Entertainment - Online Media
Leogang Webcam,Arts & Entertainment - Online Media
lesben sex videos kostenlos online gucken,Arts & Entertainment - Online Media
live-streaming über lan zum tv,Arts & Entertainment - Online Media
live-webcam marbella mit zeitraffer,Arts & Entertainment - Online Media
mannheim webcam,Arts & Entertainment - Online Media
mansfield webcam,Arts & Entertainment - Online Media
media online bildergalerien,Arts & Entertainment - Online Media
mobile video ad online video konsum via mobile nimmt zu,Arts & Entertainment - Online Media
mp3 schneiden more downloads,Arts & Entertainment - Online Media
nachricht software ermoeglicht virtuelle d tour in pyramide,Arts & Entertainment - Online Media
news click chick tour qvc praesentiert die erste eigene virtuelle umkleidekabine,Arts & Entertainment - Online Media
news virtuelle tour durch digitale haustechnik,Arts & Entertainment - Online Media
nurburgring webcam,Arts & Entertainment - Online Media
nuru massage online videos,Arts & Entertainment - Online Media
online dvd verleih video buster,Arts & Entertainment - Online Media
paris flughafen charles de gaulle frankreich webcams,Arts & Entertainment - Online Media
PARIS WEBCAM,Arts & Entertainment - Online Media
Peter Rabbit Video Online,Arts & Entertainment - Online Media
prenzlau webcam,Arts & Entertainment - Online Media
privat gedrehte online kostenlos ansehen videos,Arts & Entertainment - Online Media
privaten online server für musik und video,Arts & Entertainment - Online Media
Ramstein die ganze musik kostenlos herunterladen,Arts & Entertainment - Online Media
Red Wings Arena Webcam,Arts & Entertainment - Online Media
regensburg stadtamhof webcams,Arts & Entertainment - Online Media
regensburg webcam,Arts & Entertainment - Online Media
Rhythmische Sport-Musik kostenfrei herunterladen,Arts & Entertainment - Online Media
rorschacherberg webcam,Arts & Entertainment - Online Media
rosenheim westerwald webcams,Arts & Entertainment - Online Media
savona Hafen webcam,Arts & Entertainment - Online Media
See Winter Dolphin Webcam,Arts & Entertainment - Online Media
seebrücke sellin webcam,Arts & Entertainment - Online Media
seefeld gschwandtkopf webcams,Arts & Entertainment - Online Media
seehaus fichtelgebirge webcam,Arts & Entertainment - Online Media
Seekirchen AM Wallersee webcam,Arts & Entertainment - Online Media
seeland niederlande webcam,Arts & Entertainment - Online Media
Sonnenundergang webcam,Arts & Entertainment - Online Media
spotify premium auf dem pc musik herunterladen,Arts & Entertainment - Online Media
stockfotografie verdienst,Arts & Entertainment - Online Media
stubaital gletscher webcam live,Arts & Entertainment - Online Media
sub Download musik programme kostenlos herunterladen,Arts & Entertainment - Online Media
Tdal Musik herunterladen,Arts & Entertainment - Online Media
techno sets musik kostenlos herunterladen,Arts & Entertainment - Online Media
tipps soundcloud musik mp datei kostenlos herunterladenso gehts,Arts & Entertainment - Online Media
ulm webcam live münster,Arts & Entertainment - Online Media
ulmen webcams,Arts & Entertainment - Online Media
videos kind spielt auf der fensterbank im stock,Arts & Entertainment - Online Media
videos mit dem jeep ueber stock und stein,Arts & Entertainment - Online Media
virtuelle touren hochzeitshallen remseck am neckar kral dugun salonu,Arts & Entertainment - Online Media
WASHINGTON DC WEBCAM,Arts & Entertainment - Online Media
wassen webcam,Arts & Entertainment - Online Media
wie kann gekaufte musik alben von google play herunterladen,Arts & Entertainment - Online Media
wie kann ich musik dvds mit kopierschutz herunterladen,Arts & Entertainment - Online Media
wie kann man bei vkontakte musik herunterladen,Arts & Entertainment - Online Media
wie kann man musik von youtube herunterladen auf handy,Arts & Entertainment - Online Media
wie kostenlos mp3 musik auf pc herunterladen,Arts & Entertainment - Online Media
wo werden amazon mp3 downloads gespeichert,Arts & Entertainment - Online Media
wohnung fernüberwachung per webcam,Arts & Entertainment - Online Media
wolfsburg steimker berg webcams,Arts & Entertainment - Online Media
wolkenstein webcam,Arts & Entertainment - Online Media
WWE Videos Online,Arts & Entertainment - Online Media
yucatan engelberg webcam,Arts & Entertainment - Online Media
zandvoort webcam,Arts & Entertainment - Online Media
zumba videos online,Arts & Entertainment - Online Media
a raimund theater mamma mia premiere wien deutsch,Arts & Entertainment - Performing Arts
Ahrensbök Theater,Arts & Entertainment - Performing Arts
aida das musical deutsches theater munchen test,Arts & Entertainment - Performing Arts
Akademie für Darstellende Kunst Regensburg gGmbH,Arts & Entertainment - Performing Arts
Als begeisterter und viel gefragter Kammermusiker hat er auf Bühnen in vielen europäischen Ländern den USA und Afrika erschienen. Er ist auch Mitglied des Orbis Trio das zu den besten europäischen Ensembles rangiert. Stanislav Gallin absol,Arts & Entertainment - Performing Arts
Amelekeh Studio Orientalischer Tanz - Bauchtanz Abensberg Deutschland,Arts & Entertainment - Performing Arts
andreas fischer bühnen köln,Arts & Entertainment - Performing Arts
anzugsordnung oper leipzig,Arts & Entertainment - Performing Arts
archiv forum th erfahrungen kiwu an der oper muenchen,Arts & Entertainment - Performing Arts
argumente für tanzstunden,Arts & Entertainment - Performing Arts
art film deutsche oper berlin parsifal syberberg,Arts & Entertainment - Performing Arts
backstageführung phantom der oper,Arts & Entertainment - Performing Arts
bayern gymnasium fos deutsch klasse arbeitsblatt absurdes theater offenes drama dramentheorie,Arts & Entertainment - Performing Arts
bayern gymnasium fos deutsch klasse arbeitsblatt drama grundzuege der dramatik episches theater,Arts & Entertainment - Performing Arts
bayern gymnasium fos deutsch klasse arbeitsblatt dramentyp(en) episches drama episches theater,Arts & Entertainment - Performing Arts
bayern gymnasium fos deutsch klasse arbeitsblatt offenes drama zeitgenoessisches theater,Arts & Entertainment - Performing Arts
bekannte arien aus italienischen opern,Arts & Entertainment - Performing Arts
Belastungen durch Nebelfluide zur szenischen Gestaltung auf Bühnen,Arts & Entertainment - Performing Arts
berlin bühnen spielplan,Arts & Entertainment - Performing Arts
berlin programm bühnen,Arts & Entertainment - Performing Arts
Berliner Bühnen,Arts & Entertainment - Performing Arts
Besetzung deutsches theater münchen carmen cubana,Arts & Entertainment - Performing Arts
Bilder chicago München Deutsches Theater,Arts & Entertainment - Performing Arts
Brent Barrett Phantom der Oper,Arts & Entertainment - Performing Arts
Bühnen am Kurfürstendamm,Arts & Entertainment - Performing Arts
Das Musical Blutsbrüder aktuell auf deutschen Bühnen,Arts & Entertainment - Performing Arts
de deutsches theater muenchen event theater in muenchen landeshauptstadt oberbayern bayern deutschland le,Arts & Entertainment - Performing Arts
Den Norske Opera Ballet,Arts & Entertainment - Performing Arts
deutsch syrisches theater,Arts & Entertainment - Performing Arts
Deutsche Kulturpolitik im Besetzten Paris 1940-1944 film und theater,Arts & Entertainment - Performing Arts
deutsches theater berlin spielplan,Arts & Entertainment - Performing Arts
Die Oper im Wandel der Gesellschaft. Kulturtransfers und Netzwerke des Musiktheaters in Europa,Arts & Entertainment - Performing Arts
dieses Stück wird auf internationalen Bühnen gespielt.,Arts & Entertainment - Performing Arts
dream theater - in vorbereitung 8. märz,Arts & Entertainment - Performing Arts
Eisprinzessin Theater in München,Arts & Entertainment - Performing Arts
elektra - theater und philharmonie essen 23. märz,Arts & Entertainment - Performing Arts
elektra neuköllnische oper,Arts & Entertainment - Performing Arts
elektra oper in marseille 2016,Arts & Entertainment - Performing Arts
erfolge tänzer lets dance,Arts & Entertainment - Performing Arts
erfolgreichster tänzer von let's dance,Arts & Entertainment - Performing Arts
erfurt oper spielplan,Arts & Entertainment - Performing Arts
ernst deutsch theater hamburg test,Arts & Entertainment - Performing Arts
ernst deutsch theater volker lechtenbrink november 2016,Arts & Entertainment - Performing Arts
erste Besetzung des Phantom der Oper in Hamburg,Arts & Entertainment - Performing Arts
erste deutsche oper,Arts & Entertainment - Performing Arts
falco-musical münchen 2005 deutsches theater,Arts & Entertainment - Performing Arts
Flamenco Tänzer Bevor der Tanz losgeht und Gesang und Gitarre ertönen steht der/die TänzerIn (bailador/a) scheinbar gefühlslos auf der Bühne und starrt in die Leere. Dann plötzlich ergreift den Tänzer ein Gef�,Arts & Entertainment - Performing Arts
forum klatschbild darstellen indesign photoshop,Arts & Entertainment - Performing Arts
frage an welcher universitaet kann man gut schauspiel gesang und tanz studieren,Arts & Entertainment - Performing Arts
frage deutsch dramatischesepisches theater,Arts & Entertainment - Performing Arts
frage ein tanz gruppen name,Arts & Entertainment - Performing Arts
frage epische musik in farbe darstellen,Arts & Entertainment - Performing Arts
frage frage zum phantom der oper ii,Arts & Entertainment - Performing Arts
frage ist es schwer am broadway als schauspielerin zu arbeiten,Arts & Entertainment - Performing Arts
frage kann ich ballet tanzen auch wenn,Arts & Entertainment - Performing Arts
frage karten fuer die oper in sydney,Arts & Entertainment - Performing Arts
frage kennt jemand die oper aus dem neuen sherlock homes,Arts & Entertainment - Performing Arts
frage kennt jemand die oper aus hannibal,Arts & Entertainment - Performing Arts
frage kennt jemand ein liebeslied zu der oper carmen,Arts & Entertainment - Performing Arts
frage klassische literatur musik und oper empfehlungen fuer einsteiger,Arts & Entertainment - Performing Arts
frage musical am broadway erfahrungen,Arts & Entertainment - Performing Arts
frage solli ich musical karten fuer den broadway am besten schon vor der reise buchen,Arts & Entertainment - Performing Arts
frage sounds grafisch darstellen hilfe,Arts & Entertainment - Performing Arts
frage stimmfaecher in der oper carmen,Arts & Entertainment - Performing Arts
frage tanzstunden zu i cross my heart,Arts & Entertainment - Performing Arts
frage was bedeuten eigentlich diese zwei saetze off broadway and off off broadway,Arts & Entertainment - Performing Arts
frage wie heisst die oper aus der telekom werbung,Arts & Entertainment - Performing Arts
frage wie kann ich am bsten in bio mitochondrien darstellen,Arts & Entertainment - Performing Arts
frage wie kann ich bei vectorworks eine hecke darstellen,Arts & Entertainment - Performing Arts
frage wie kann ich das gewissen zeichnerisch darstellen,Arts & Entertainment - Performing Arts
frage wie kann ich den schiefen turm von pisa darstellen,Arts & Entertainment - Performing Arts
frau puppendoktor pille lebt berliner schauspielerin urte blankenstein aktiv auf vielen buhnen,Arts & Entertainment - Performing Arts
friedrichstadtpalast tanzen,Arts & Entertainment - Performing Arts
Frühlingskitzel Theater Fusion,Arts & Entertainment - Performing Arts
gesang tanz und schauspiel studieren,Arts & Entertainment - Performing Arts
geschichte broadway urlaubsziele,Arts & Entertainment - Performing Arts
gif darstellen telegram ds,Arts & Entertainment - Performing Arts
glasmenagerie kudamm bühnen,Arts & Entertainment - Performing Arts
Göteborg Oper,Arts & Entertainment - Performing Arts
Grease deutsches Theater München 2014,Arts & Entertainment - Performing Arts
gute plätze stage theater berlin,Arts & Entertainment - Performing Arts
hair deutsches theater münchen,Arts & Entertainment - Performing Arts
hairspray Musical München Broadway Darsteller,Arts & Entertainment - Performing Arts
Händel. Die Oper,Arts & Entertainment - Performing Arts
hänneschen theater tickets,Arts & Entertainment - Performing Arts
Hänsel und Gretel Theater Grimm,Arts & Entertainment - Performing Arts
Helsinki Oper Tickets,Arts & Entertainment - Performing Arts
highfield bühnen,Arts & Entertainment - Performing Arts
hiob deutsches theater,Arts & Entertainment - Performing Arts
hotel de residenz am deutschen theater fr,Arts & Entertainment - Performing Arts
Im Jahr 2008 spielte Grande am Broadway im Musical 13 die Rolle der Charlotte für die sie den National Youth Theatre Association Award gewann,Arts & Entertainment - Performing Arts
in zeiten abnehmenden lichts deutsches theater berlin,Arts & Entertainment - Performing Arts
jasbergler baiernrain Theater,Arts & Entertainment - Performing Arts
Jazzkonzert Theater Krefeld,Arts & Entertainment - Performing Arts
kleinanzeigen musical show atze schroeder tickets wuppertal a,Arts & Entertainment - Performing Arts
kleinanzeigen musical show blue man group berlin tickets fuer a,Arts & Entertainment - Performing Arts
kleinanzeigen musical show blue man group tickets uhr a,Arts & Entertainment - Performing Arts
kleinanzeigen musical show bzw tickets fuer das musical koenig a,Arts & Entertainment - Performing Arts
kleinanzeigen musical show eintrittskarten tickets fuer florian a,Arts & Entertainment - Performing Arts
kleinanzeigen musical show holiday on ice tickets zu verkaufen a,Arts & Entertainment - Performing Arts
kleinanzeigen vinyl broadway melodien a,Arts & Entertainment - Performing Arts
koblenz kinder theater,Arts & Entertainment - Performing Arts
koeln kultur oper koeln,Arts & Entertainment - Performing Arts
komische oper,Arts & Entertainment - Performing Arts
komische Oper Berlin,Arts & Entertainment - Performing Arts
kultur einen hauch von broadway erleben,Arts & Entertainment - Performing Arts
kultur film deutsche buehnen absurdes theater,Arts & Entertainment - Performing Arts
kultur gesellschaft deutschen theater berlin theaterthriller dosenfleisch a,Arts & Entertainment - Performing Arts
kultur gesellschaft im deutschen theater feiert gift von lot vekemans premiere a,Arts & Entertainment - Performing Arts
kultur gesellschaft sartre am deutschen theater berlin das spiel ist aus a,Arts & Entertainment - Performing Arts
kultur jaehriger muezzin erobert den new yorker broadway,Arts & Entertainment - Performing Arts
kultur scarlett johansson die woody allen muse wird zum gefeierten broadway star,Arts & Entertainment - Performing Arts
kultur tv auftritt am broadway cindy aus marzahn erobert new york,Arts & Entertainment - Performing Arts
kultur und freizeit veranstaltungstipps mit goetz alsmann zum broadway kirmes und theaterkrimi unsere veranstaltungstipps,Arts & Entertainment - Performing Arts
lange nacht der theater 2016 Hamburg,Arts & Entertainment - Performing Arts
lange nacht der theater hannover test,Arts & Entertainment - Performing Arts
lass uns heute Tito Mozart Oper,Arts & Entertainment - Performing Arts
Lensic Theater Schedule,Arts & Entertainment - Performing Arts
Let's Dance 2016 tänze,Arts & Entertainment - Performing Arts
liebe in zeiten der cholera theater,Arts & Entertainment - Performing Arts
Liecht. Vaterland theater,Arts & Entertainment - Performing Arts
lifestyle kultur news das original vom broadway jetzt in berlin im stage theater des westens,Arts & Entertainment - Performing Arts
lifestyle leute channing tatums lebensgeschichte magic mike soll als musical an den broadway,Arts & Entertainment - Performing Arts
magazin deutsches theater muenchen stellt spielplan vor,Arts & Entertainment - Performing Arts
Marinski theater geschichte,Arts & Entertainment - Performing Arts
marion kracht theater am kurfürstendamm,Arts & Entertainment - Performing Arts
medien broadway stueck von katie holmes wird wieder abgesetzt,Arts & Entertainment - Performing Arts
meldungen carl philip von schweden der prinz nimmt tanzstunden,Arts & Entertainment - Performing Arts
Mit wem bist du ins theater gegangen,Arts & Entertainment - Performing Arts
musical erfahrung broadway,Arts & Entertainment - Performing Arts
musicals shows das wunder von bern hamburg tickets,Arts & Entertainment - Performing Arts
musiktheater am volksgarten linz,Arts & Entertainment - Performing Arts
musiktheater gelsenkirchen rat pack,Arts & Entertainment - Performing Arts
musiktheater im revier alles andere als vertanzt de,Arts & Entertainment - Performing Arts
Muss ich wenn ich privat tanzstunden gebe ein Gewerbe anmelden,Arts & Entertainment - Performing Arts
nachrichten bankgebaeude wird zur aktionsflaeche fuer graffiti kunst und theater projekte,Arts & Entertainment - Performing Arts
nachthallen musiktheater kassel veranstaltungen,Arts & Entertainment - Performing Arts
news deutsche musical theater preis,Arts & Entertainment - Performing Arts
news deutsches theater wiedereroeffnet,Arts & Entertainment - Performing Arts
news frauenpower im raimund theater,Arts & Entertainment - Performing Arts
news freilichttheater basel macht schritt zu theater der region id,Arts & Entertainment - Performing Arts
news ghost schwebt an den broadway,Arts & Entertainment - Performing Arts
news heisse zeiten im deutschen theater,Arts & Entertainment - Performing Arts
news neues von broadway und west end,Arts & Entertainment - Performing Arts
news willemijn gibt ihr broadway debuet,Arts & Entertainment - Performing Arts
nur wer aufsteht kann sich widersetzen theater lindenhof tickets,Arts & Entertainment - Performing Arts
nürnberg 1984 theater,Arts & Entertainment - Performing Arts
Off broadway Köln der Imker Inhalt,Arts & Entertainment - Performing Arts
Off broadway Köln Vorschau,Arts & Entertainment - Performing Arts
offenbachs fantasio in der komischen oper endlich ein tenor de,Arts & Entertainment - Performing Arts
Papagei singt Oper,Arts & Entertainment - Performing Arts
Paradies Revue-Theater Nürnberg,Arts & Entertainment - Performing Arts
paroles original ensemble vom broadway musical im hamburger hafen jagd der lowinnen lyrics p,Arts & Entertainment - Performing Arts
people tv musik musical erfolgs musical cats kehrt nach jahren an den broadway zurueck id,Arts & Entertainment - Performing Arts
people tv schweiz schweizer musical star eveline suter zeigt ihr new york fotoalbum auf dem sprung zum broadway id,Arts & Entertainment - Performing Arts
poetry slam ernst deutsch theater 2016,Arts & Entertainment - Performing Arts
Premierenwünsche Theater,Arts & Entertainment - Performing Arts
prinz regent theater ludwigshafen,Arts & Entertainment - Performing Arts
